,id,videoId,authorVideoName,totalReplyCount,likeCount,authorDisplayName,textDisplay,publishedAt,isReply
2541,Ugz5jtQl_wdafpOzMlN4AaABAg,5My6jw7CBhw,Телеканал Дождь,3,190,Tasman,"Кто то обделался, а сабяшка с больной головы на здоровую переложит",2020-06-20T20:58:52Z,0
2542,Ugz5jtQl_wdafpOzMlN4AaABAg.9A8SyM18iXZ9A9KpJ7PcMl,5My6jw7CBhw,Телеканал Дождь,0,2,Ёжик В тумане,"Собянин скажет , жители виноваты пакетами ливневки закрыло",2020-06-21T05:06:58Z,1
2543,Ugz5jtQl_wdafpOzMlN4AaABAg.9A8SyM18iXZ9A97Pji4pdA,5My6jw7CBhw,Телеканал Дождь,0,7,Любовь Виденкина,"Наглядно и эффективно природа мать показала,насколько никчемные люди распоряжаются бюджетными средствами, в угоду себе, а не для народа!Вот нафига ещё и парад
устраивать?Да отдайте эти средства тем,кому они заслуженно принадлежат! не рассовывая по своим карманам!",2020-06-21T03:09:44Z,1
2544,Ugz5jtQl_wdafpOzMlN4AaABAg.9A8SyM18iXZ9A978VBL9dR,5My6jw7CBhw,Телеканал Дождь,0,5,Hawker,Щас просто сделают обнуление воды и всё и никакую канализацию не надо будет делать,2020-06-21T03:07:23Z,1
2545,UgzYuUGSKzMLxp6MWhh4AaABAg,5My6jw7CBhw,Телеканал Дождь,0,2,Oleg Samson,"как всегда Собакин выделяет из бюджета Москвы деньги в свой карман, а не на пользу городу!",2020-06-20T20:58:43Z,0
2546,Ugwf2ByhUxvZkBfPwR94AaABAg,5My6jw7CBhw,Телеканал Дождь,0,0,Адреналин Адреналин,Бог даёт намек часто во время карантина катаклизмов много  вы заметили,2020-06-20T20:58:37Z,0
2547,Ugzpczst7NEkBo8zhEh4AaABAg,5My6jw7CBhw,Телеканал Дождь,0,0,Виктор Сперанский,Вы не понимаете это защита от Американских солдат)))),2020-06-20T20:58:31Z,0
2548,Ugz6nywKMB0uD_VYCHV4AaABAg,5My6jw7CBhw,Телеканал Дождь,0,0,Sena Zava,"Ждём следующую кару небесную за грехи народные. Не зря ж храмов да церквей настроили, потом за это голосование прощение вымаливать где-то надо будет...",2020-06-20T20:58:15Z,0
2549,UgyKIyUt-syC0AHWDsh4AaABAg,5My6jw7CBhw,Телеканал Дождь,0,0,Али Магомедов,Собянин красавчик,2020-06-20T20:58:13Z,0
2550,UgxEtE2AAviImdrufCV4AaABAg,5My6jw7CBhw,Телеканал Дождь,0,0,Денис ка,Там только бабосы и власть совести вообще нет затопить потом сжечь напрочь.,2020-06-20T20:58:13Z,0
2551,UgyXlVB9eZ9DBzLFTxN4AaABAg,5My6jw7CBhw,Телеканал Дождь,0,0,Фединишинець федір Фединишинець,Ще треба поджечь,2020-06-20T20:58:13Z,0
2552,UgyciIYh7B8UaZrms8B4AaABAg,5My6jw7CBhw,Телеканал Дождь,0,0,владимир кошман,Это фиаско Великого Пу и Собянина,2020-06-20T20:57:54Z,0
2553,UgwSeYg1B2EH4Shmi9h4AaABAg,5My6jw7CBhw,Телеканал Дождь,1,0,DreamHacker,Москва на день стала Россией,2020-06-20T20:57:53Z,0
2554,UgwSeYg1B2EH4Shmi9h4AaABAg.9A8Sr7sxLEU9A8VxPlTZic,5My6jw7CBhw,Телеканал Дождь,0,0,Nika Seger,"Да ладно вам, Москва)) Москва в целом почти ничего не заметила, это ж пара районов на юге, а не весь город.",2020-06-20T21:24:57Z,1
2555,Ugw7CM4yadGC4amacit4AaABAg,5My6jw7CBhw,Телеканал Дождь,0,0,Людмила Бакарева,Земля хочет уничтожить Москву и Санкт-Петербург я это вижу в моих снах поверьте мне земля не успокоиться пока не стерет с лица земли Москву и Санкт-Петербург вместе с людьми у земли много способов уничтожения людей которые её достали,2020-06-20T20:57:46Z,0
2556,UgxjYbWiJPvf5pylA7F4AaABAg,5My6jw7CBhw,Телеканал Дождь,1,0,Магистр Йода,И кто же понесёт ответственность??? Снова стрелочника найдут???,2020-06-20T20:57:37Z,0
2557,UgxjYbWiJPvf5pylA7F4AaABAg.9A8SpF3cBgI9A8VzT4Udey,5My6jw7CBhw,Телеканал Дождь,0,0,Сумароков Эльстон,Синоптика.,2020-06-20T21:25:13Z,1
2558,UgxaA2yMN4rXpj9GlQ54AaABAg,5My6jw7CBhw,Телеканал Дождь,0,0,Денс Дьяк,Стоп кремлёвский кровосос! Раздавим тапком нашего клопа!,2020-06-20T20:57:25Z,0
2559,Ugxqk3pcSBoJCJBxssF4AaABAg,5My6jw7CBhw,Телеканал Дождь,0,16,Vitaly Kapustinsky,“Дождь” Москвабад замочил.,2020-06-20T20:57:04Z,0
2560,UgymPxE2ItpCIQRuptJ4AaABAg,5My6jw7CBhw,Телеканал Дождь,0,0,Ольга Миллер,"Предлагаю оленеводу премию, чтобы себе любимому осталось!",2020-06-20T20:57:04Z,0
2561,UgxMTFFgHuvCGEdqH8x4AaABAg,5My6jw7CBhw,Телеканал Дождь,0,16,Ичкерия 20,"Ну конечно форс мажор епта, лишь бы от себя ответственность убрать. Сделали бы все грамотно никаких проблем не было бы..",2020-06-20T20:57:02Z,0
2562,UgxHRnAbUDO7RI7qRR54AaABAg,5My6jw7CBhw,Телеканал Дождь,7,252,Alex D,"Покуда Бирюков у руля, нормального благоустройства не жди. Он как клещ сидит в мэрии и сосет бабло бюджетное.",2020-06-20T20:56:56Z,0
2563,Ugx0ANHdddi4oEVvB_t4AaABAg,5My6jw7CBhw,Телеканал Дождь,0,0,Ебать Копать,Это Ютуб канал Дождь всё затопил😄,2020-06-20T20:56:24Z,0
2564,UgwPncDC_kM5Grlcfqd4AaABAg,5My6jw7CBhw,Телеканал Дождь,0,0,виктор латюк,Странно что не сказали что только в России такое возможно.,2020-06-20T20:56:12Z,0
2565,Ugxmd7o0aK9rb1L2bYF4AaABAg,5My6jw7CBhw,Телеканал Дождь,2,15,Игорь Новоселов,"Эти подонки , только и умеют что распиливать деньги по своим карманам  ,",2020-06-20T20:56:12Z,0
2566,Ugxmd7o0aK9rb1L2bYF4AaABAg.9A8SeoGCL_u9A9Ak0ILvgS,5My6jw7CBhw,Телеканал Дождь,0,0,Лена Земцова,"Лучше кремль
Логава их з а",2020-06-21T03:38:51Z,1
2567,Ugxmd7o0aK9rb1L2bYF4AaABAg.9A8SeoGCL_u9A8V5qryiKC,5My6jw7CBhw,Телеканал Дождь,0,0,Ведьма из Блэр,"Работа падонков, ничего личного.",2020-06-20T21:17:30Z,1
2568,UgzYGMjZgvqD5w70nfB4AaABAg,5My6jw7CBhw,Телеканал Дождь,0,3,Денис ка,Плиткой заложил ливники 😂Тих пох хоть по уши.,2020-06-20T20:55:54Z,0
2569,UgxwrLe_1Lkjag6MqZh4AaABAg,5My6jw7CBhw,Телеканал Дождь,6,29,R S,На параде примут участие только подводные лодки и водолазы 🤔,2020-06-20T20:55:39Z,0
2570,UgxVLBI0vF7whIGJ7UZ4AaABAg,5My6jw7CBhw,Телеканал Дождь,0,0,Анатолий Гердт,Американцы виноваты кругом враги все рушится все тонет народ в нищете и наполеон  и печенеги и чингиз-хан до си пор разруха,2020-06-20T20:55:24Z,0
2571,UgyeAIiEMEelYI3dhaB4AaABAg,5My6jw7CBhw,Телеканал Дождь,0,0,CaptainB007,"Кака всегда через одно место!  Граждане, у которых пострадали авто, должны вместе подать в суд  class action на городские власти за ущерб!",2020-06-20T20:55:09Z,0
2572,UgwXNUPxnOmDSXTpBJB4AaABAg,5My6jw7CBhw,Телеканал Дождь,1,1,Никола Питерский,Ну шаман лютует !  Так и Москву к чертовой матери смоет в канализацию !,2020-06-20T20:54:50Z,0
2573,UgwXNUPxnOmDSXTpBJB4AaABAg.9A8SVr9VjOx9A8Y2ymEorK,5My6jw7CBhw,Телеканал Дождь,0,0,Ruslan Nesakysiu,"Хватит смешить, уже слезы из глаз катятся.Ну юмористы.",2020-06-20T21:43:19Z,1
2574,UgxVPpwWeaunEHd0pIN4AaABAg,5My6jw7CBhw,Телеканал Дождь,0,0,Иван Иванов,"Собякин ликует, опять плитку перекладывать",2020-06-20T20:54:49Z,0
2575,UgwQ97JJKwV6Kj835DN4AaABAg,5My6jw7CBhw,Телеканал Дождь,0,0,nina moiseeva,У них другая забота нас в намордники и наручнике заковать а что там ливнёвка Пусть люди страдают как всё страшно когда о нас не думают .,2020-06-20T20:54:47Z,0
2576,UgzHXvnYKFHTJcTq0MR4AaABAg,5My6jw7CBhw,Телеканал Дождь,0,0,Александр Голованов,После 1 июля всё в стране наладится .,2020-06-20T20:54:28Z,0
2577,UgxUR4Mg-engCqvD1V54AaABAg,5My6jw7CBhw,Телеканал Дождь,0,0,Павел Цой,Видать на ливневках много бабок не на моешь или правильней сказать не на пилишь.,2020-06-20T20:54:22Z,0
2578,UgwEaNN--gupPTsvXJJ4AaABAg,5My6jw7CBhw,Телеканал Дождь,0,0,Алекс Романов,"Смотрите СС за плитку вам ещё статью пришьет, святое трогаете, ПЛИТКУ ! 😁",2020-06-20T20:54:19Z,0
2579,UgwdtSZ4VIHH85P4x-p4AaABAg,5My6jw7CBhw,Телеканал Дождь,0,0,Веселый Роджер,"Ну веть и так все  ясно надо было плитку класть везде, прикупить заводик и впаривать маски всем кому попало ,  обязательный полив дорог в дождь не забыть. Фамилия известная всем знакомая.",2020-06-20T20:53:56Z,0
2580,Ugx2wR7Gn_wkdb2Hx094AaABAg,5My6jw7CBhw,Телеканал Дождь,0,0,Sergei,"Диаметр и уклон подбирается по расчету в зависимости от расхода стоков по многолетним наблюдениям и типу покрытия. Если сделать диаметр больше, а уклон меньше - канализация будет быстро заиливаться. Если делать уклон больше, а диаметр меньше оптимального - трубы будут быстрее изнашиваться. А вот чистить надо обязательно. Вы видели где-то в советском союзе, чтобы такие потопы были? Все потому, что каждый участок территории обслуживался ливневкой, которая постоянно чистилась. Не топило деревни, так как все водоотводные канавы прочищались от мусора - за каждой территорией закреплялись ""шефы"", которых просто регулярно выгоняли на субботник. А сегодня - зимой улицы засыпают тоннами песка, который потом смывается в ливневку и там год за годом спрессовывается в монолитную массу. Понятно, что воде просто некуда уходить. Поэтому и потопы.",2020-06-20T20:53:43Z,0
2581,UgymkFgBfBTGxil5W4F4AaABAg,5My6jw7CBhw,Телеканал Дождь,0,0,Elina Borodina,"А кто людям заплатит за убитые машины? А, нет! Их оштрафуют за неправильную парковку",2020-06-20T20:53:39Z,0
2582,UgzLn1k-xJFIRwPKO8N4AaABAg,5My6jw7CBhw,Телеканал Дождь,0,1,Alik Dag,Вот настоящий Прорыв,2020-06-20T20:53:39Z,0
2583,UgyfbtDfajgQp2KS2P54AaABAg,5My6jw7CBhw,Телеканал Дождь,0,0,SticuS,дайте мне пожалуйста хоть раз попробовать что они употребляют!),2020-06-20T20:53:38Z,0
2584,Ugzd4my6_-lYX399ps14AaABAg,5My6jw7CBhw,Телеканал Дождь,0,0,Svetlana Arkhypenko,"Ливневая канализация это трудозатратно,долго и дорого,а плитка- быстро,дорого  и пыль в глаза ...ни дать,ни взять Европа,ха- ха",2020-06-20T20:53:26Z,0
2585,Ugww3ywEx2G_joHQSWV4AaABAg,5My6jw7CBhw,Телеканал Дождь,0,0,Граф Гуськофф,Мужик за плитку Собянина раз 100 подколол,2020-06-20T20:53:19Z,0
2586,Ugwm9DMUNDDyvXVdu-54AaABAg,5My6jw7CBhw,Телеканал Дождь,5,131,Sonder ООН,"Ай-ай- ай!  То зима неожиданно, то дожди ! Чо делается! Пусть из военного нового Храма  бога просят дождей на столицу не насылать .))) Власти не в силах. Не умеют справляться.",2020-06-20T20:53:18Z,0
2587,Ugwm9DMUNDDyvXVdu-54AaABAg.9A8SKfejotJ9A9Qg74FaJW,5My6jw7CBhw,Телеканал Дождь,0,2,Екатерина Гусарова,Не пусть помахают фуражкой гитлера из храма она там на почетном месте,2020-06-21T05:58:08Z,1
2588,Ugwm9DMUNDDyvXVdu-54AaABAg.9A8SKfejotJ9A9GPv6rAoT,5My6jw7CBhw,Телеканал Дождь,0,2,Кир Булычёв,"Как всегда спешили со сроками сдачи, а полевых испытаний не провели. Вот теперь Оно по своим и пуляет!
 Может кресты не в ту сторону развернули?!😵😱",2020-06-21T04:28:24Z,1
2589,Ugwm9DMUNDDyvXVdu-54AaABAg.9A8SKfejotJ9A8ohXqNdUA,5My6jw7CBhw,Телеканал Дождь,0,5,Ильмира Газизуллина,"Никогда такого не было,  вот опять ...?!",2020-06-21T00:17:32Z,1
2590,Ugwm9DMUNDDyvXVdu-54AaABAg.9A8SKfejotJ9A8cL1OYjJ1,5My6jw7CBhw,Телеканал Дождь,0,5,Magoshe Meshe,Зато танки НАТО не проплывут! 😃,2020-06-20T22:29:28Z,1
2591,Ugwm9DMUNDDyvXVdu-54AaABAg.9A8SKfejotJ9A8WX00A1XR,5My6jw7CBhw,Телеканал Дождь,0,11,Maria Timohina,Sonder ООН надо было Гундяя на лодке с иконой послать 😂😂😂,2020-06-20T21:29:56Z,1
2592,Ugy8M3IqZAsKoy4hfJx4AaABAg,5My6jw7CBhw,Телеканал Дождь,0,3,Ира Швед,"Так вам наверно нравится все это?))).... Поговорили и забыли..... Ах, ах......",2020-06-20T20:53:00Z,0
2593,Ugz9YxVTyeH4d_DoCjd4AaABAg,5My6jw7CBhw,Телеканал Дождь,1,81,Че Гана,"Где же мэр? На какой улице он тонул вместе с горожанами, для которых он так старался?",2020-06-20T20:52:46Z,0
2594,Ugz9YxVTyeH4d_DoCjd4AaABAg.9A8SGl4PUbQ9A9SUfuJ0RK,5My6jw7CBhw,Телеканал Дождь,0,0,Светлана Гуренко,И не дотонул! 😂,2020-06-21T06:13:55Z,1
2595,UgwKBM_vw98lvl2cgUZ4AaABAg,5My6jw7CBhw,Телеканал Дождь,0,0,smol _ kos,"Европейский город и без канализации, исторического центра и троллейбуса. Заъбись европейский город. Когалым-2.",2020-06-20T20:52:46Z,0
2596,UgwOcH6749o3bbBlzsl4AaABAg,5My6jw7CBhw,Телеканал Дождь,1,8,Valery Makarov,Собякин утонул?!,2020-06-20T20:52:45Z,0
2597,UgwOcH6749o3bbBlzsl4AaABAg.9A8SGXuMzQx9A8V84fMt7d,5My6jw7CBhw,Телеканал Дождь,0,2,Maria Timohina,Valery Makarov оно не тонет😂😂😂,2020-06-20T21:17:48Z,1
2598,UgzcwGRqecNSMgGymA14AaABAg,5My6jw7CBhw,Телеканал Дождь,0,3,Тимофей Воронов,"Не хипстеры тут виноваты, а коррупция",2020-06-20T20:52:44Z,0
2599,UgxHk5L7kzO_KrPFdYJ4AaABAg,5My6jw7CBhw,Телеканал Дождь,3,32,Packie,Ливнёвки в конституцию!,2020-06-20T20:52:41Z,0
2600,UgxHk5L7kzO_KrPFdYJ4AaABAg.9A8SG2SZjXI9A8aS6G-3zi,5My6jw7CBhw,Телеканал Дождь,0,1,Волк А- сов,И унитазы. На всякий случай.,2020-06-20T22:12:58Z,1
2601,UgxHk5L7kzO_KrPFdYJ4AaABAg.9A8SG2SZjXI9A8V061DxbX,5My6jw7CBhw,Телеканал Дождь,0,3,Ведьма из Блэр,И прочей проституции.,2020-06-20T21:16:43Z,1
2602,UgxHk5L7kzO_KrPFdYJ4AaABAg.9A8SG2SZjXI9A8Uz01WkDE,5My6jw7CBhw,Телеканал Дождь,0,2,Ведьма из Блэр,Там и так достаточно коррупции.,2020-06-20T21:16:25Z,1
2603,UgxYgs_pUgYkkYgdqih4AaABAg,5My6jw7CBhw,Телеканал Дождь,0,0,rus22 Barnaul,"Красиво ,мало",2020-06-20T20:52:34Z,0
2604,Ugyog1niv00kn1sC0w54AaABAg,5My6jw7CBhw,Телеканал Дождь,0,0,Grommit Kupidman,Заливухин озвучивает Чичваркина . И при этом знатно заливает . Улицы .,2020-06-20T20:52:32Z,0
2605,UgxVJ6Fmi59xL_GdwdF4AaABAg,5My6jw7CBhw,Телеканал Дождь,0,0,xxxMethaNxxx MethaN,Подольские около варшавки всегда уплывали,2020-06-20T20:52:32Z,0
2606,UgyG6b-NWP5mXhqLg1h4AaABAg,5My6jw7CBhw,Телеканал Дождь,1,4,igor Petpov,Жалко дождь рано закончился.,2020-06-20T20:51:58Z,0
2607,UgyG6b-NWP5mXhqLg1h4AaABAg.9A8SAqrkAV_9A8lGh8uIRF,5My6jw7CBhw,Телеканал Дождь,0,1,Maria Timohina,igor Petpov 😂😂😂,2020-06-20T23:47:31Z,1
2608,UgyDZKbVzpWP9_VBSPx4AaABAg,5My6jw7CBhw,Телеканал Дождь,0,7,Саварбик Султыгов,"Водоканал читается как ""Псевдоканал""",2020-06-20T20:51:57Z,0
2609,Ugymvm_n_5DETo2mRWV4AaABAg,5My6jw7CBhw,Телеканал Дождь,0,4,Гаджиев Алимурад,Во всем виноват дождик!,2020-06-20T20:51:54Z,0
2610,Ugzemye7tcyNBlDzUWN4AaABAg,5My6jw7CBhw,Телеканал Дождь,2,40,Правда и Справедливость,"Собянин,придет время где тебя выдадут народу на расправу.",2020-06-20T20:51:39Z,0
2611,Ugzemye7tcyNBlDzUWN4AaABAg.9A8S8VLxHWl9A9BuAAZAnO,5My6jw7CBhw,Телеканал Дождь,0,0,jetro msk,Да он сдохнет раньше...,2020-06-21T03:48:59Z,1
2612,Ugzemye7tcyNBlDzUWN4AaABAg.9A8S8VLxHWl9A8chpIa5JL,5My6jw7CBhw,Телеканал Дождь,0,0,Никита Бекренев,К сожалению не придет,2020-06-20T22:32:43Z,1
2613,UgzbleWYrdI1FaS24Xd4AaABAg,5My6jw7CBhw,Телеканал Дождь,4,71,Sam Stone,"Путин, твой бог тебе знаки посылает.",2020-06-20T20:51:06Z,0
2614,UgzbleWYrdI1FaS24Xd4AaABAg.9A8S4ZZN5i79AFDwrdyS-e,5My6jw7CBhw,Телеканал Дождь,0,0,Людмила Елисеева,"@свет души моей Москва - столица. Без головы человек жить не может! Жалко, что мозги тухлые. А мозги - в кремле однозначно промывки требуют!",2020-06-23T12:02:16Z,1
2615,UgzbleWYrdI1FaS24Xd4AaABAg.9A8S4ZZN5i79A9U3MGwmZ2,5My6jw7CBhw,Телеканал Дождь,0,1,свет души моей,"@Ivan москва давно заработала все это и без шамана...это еще цветочки...каждому по деяниям его, а москва это раковая клетка на теле страны",2020-06-21T06:27:39Z,1
2616,UgzbleWYrdI1FaS24Xd4AaABAg.9A8S4ZZN5i79A92F1etZnK,5My6jw7CBhw,Телеканал Дождь,0,2,Ivan,Это шаман наслал 😁,2020-06-21T02:24:35Z,1
2617,UgzbleWYrdI1FaS24Xd4AaABAg.9A8S4ZZN5i79A8uUA-12B8,5My6jw7CBhw,Телеканал Дождь,0,0,свет души моей,👍👍👍,2020-06-21T01:08:00Z,1
2618,UgxEkmluXH8k4o4_5q94AaABAg,5My6jw7CBhw,Телеканал Дождь,0,0,Людмила Меренкова,"Это общий тренд строительства дорог на постсоветском пространстве. В Украине точно так же дороги сделали. Старые дренажные не чистили,просто закатали под асфальт, даже небольшой дождь вызывает потоп и катастрофу. Ничего не умеют,не хотят .",2020-06-20T20:50:45Z,0
2619,UgyfRyAbsuN5j2PSw3N4AaABAg,5My6jw7CBhw,Телеканал Дождь,1,0,Alexandr Ermolyev,Нужно подавать иски к SS Cобакину... чтоб он не чмырил людей масками и штрафами а занимался своим делом!! Или пусть валит к оленям!!,2020-06-20T20:50:32Z,0
2620,UgyfRyAbsuN5j2PSw3N4AaABAg.9A8S0JLAaI89A901sB9J7D,5My6jw7CBhw,Телеканал Дождь,0,0,LAMBDEATH,Что бы суд их не принял,2020-06-21T02:05:19Z,1
2621,UgxM6lRgeRce21_Ingp4AaABAg,5My6jw7CBhw,Телеканал Дождь,1,29,Александр Сабинин,"Ждём распродажу тачек ""утопленников""",2020-06-20T20:49:56Z,0
2622,UgxM6lRgeRce21_Ingp4AaABAg.9A8Rwxuc3A39A8apKEFaPl,5My6jw7CBhw,Телеканал Дождь,0,2,Евгений М,"Не бит, не крашен, любые проверки. АТЦ Москва.",2020-06-20T22:16:16Z,1
2623,UgwJSzZ-_zwaReEgDy14AaABAg,5My6jw7CBhw,Телеканал Дождь,1,38,Olga Novikova,"Уже никто не найдёт ту левнёвку, т.к дядя Вася умер, который знал, куда уходит вода, к сожалению.",2020-06-20T20:49:46Z,0
2624,UgwJSzZ-_zwaReEgDy14AaABAg.9A8RvgNDDBJ9A8_xQyr3If,5My6jw7CBhw,Телеканал Дождь,0,1,Волк А- сов,Завещание оставил. Через пол-года после поправок в Конституцию огласят. Наверное.,2020-06-20T22:08:38Z,1
2625,UgwD6jYyIGPn5sDnBs54AaABAg,5My6jw7CBhw,Телеканал Дождь,0,3,antipoff282rus,Собякинская технология,2020-06-20T20:49:43Z,0
2626,UgxU12mazjTzlGcsHR94AaABAg,5My6jw7CBhw,Телеканал Дождь,0,8,Анна Сысоева,Коменты ..одни юмористы,2020-06-20T20:49:41Z,0
2627,Ugx487N8Ts6Lzijp47h4AaABAg,5My6jw7CBhw,Телеканал Дождь,0,5,Алексей Сахаров,"Погода нас опять подвела!
А так нет,так нет,будет быть лучше, будет быть.",2020-06-20T20:49:38Z,0
2628,Ugx07JeHQ_XyW4MHwbV4AaABAg,5My6jw7CBhw,Телеканал Дождь,1,10,Vladimir L,После дождя Заливухин на Дожде о дожде.,2020-06-20T20:49:33Z,0
2629,Ugx07JeHQ_XyW4MHwbV4AaABAg.9A8Ru8dxDvQ9A8aTWrZzzf,5My6jw7CBhw,Телеканал Дождь,0,2,Maria Timohina,Vladimir L 😂😂🔥,2020-06-20T22:13:09Z,1
2630,UgyZ3NKYLcxQh20lnw94AaABAg,5My6jw7CBhw,Телеканал Дождь,3,134,Resident Evil,"ССовца в чёрный дельфин, бесит он всех Седая hyeta",2020-06-20T20:49:24Z,0
2631,UgyZ3NKYLcxQh20lnw94AaABAg.9A8Rt0bSv019A9JpIAretq,5My6jw7CBhw,Телеканал Дождь,0,1,Maтвей Фанбар80,чукча Бедыев,2020-06-21T04:58:13Z,1
2632,UgyZ3NKYLcxQh20lnw94AaABAg.9A8Rt0bSv019A9HBaH2blR,5My6jw7CBhw,Телеканал Дождь,0,2,Елена Клячина,Ему хоть стыдно ? Хоть чуть-чуть ?,2020-06-21T04:35:11Z,1
2633,UgyZ3NKYLcxQh20lnw94AaABAg.9A8Rt0bSv019A8eYx6lZGM,5My6jw7CBhw,Телеканал Дождь,0,6,бес фамильный,Золотые слова!,2020-06-20T22:48:51Z,1
2634,UgxtLy_-ZcynrNGambB4AaABAg,5My6jw7CBhw,Телеканал Дождь,0,2,Артем Усов,"Собяшке привет,что ещё сказать зз",2020-06-20T20:49:12Z,0
2635,UgzzDEJpp7WxHGIPjHJ4AaABAg,5My6jw7CBhw,Телеканал Дождь,0,0,Max Goldberg,Россия это жесть,2020-06-20T20:49:05Z,0
2636,Ugz1CkB-P_Lm1YsMdF94AaABAg,5My6jw7CBhw,Телеканал Дождь,0,0,ОРИ Ведерчи,"ничего они не забыли....просто если 2 раза в год перекладывать плитку и бардюры , то ливневки ( и это ЕСТЕСТВЕННО) будут ЗАСОРЯТЬСЯ МУСОРОМ от этих самых ""ремонтных работ"" ....Если ты хочешь ""строить красивый город"" , то пожалуйста !! чисти ливневки ПОСЛЕ СЕБЯ !!!!",2020-06-20T20:48:49Z,0
