,id,videoId,authorVideoName,totalReplyCount,likeCount,authorDisplayName,textDisplay,publishedAt,isReply
1688,UgwhkO63T7sz4dQA9Dd4AaABAg,5My6jw7CBhw,Телеканал Дождь,0,0,Алина Жукова,"Да, правильно говорит ведущий - городские чиновники ( собяниниские «орлы» ) любят наводить внешний лоск , а вот именно такие ситуации - ливень, снегопад, ураганные ветры- обнажают все скрытые недочеты городской структуры 🤥👍🏻 по ОТР выступал консультант по ЖКХ и сказала, что стричь газоны в городе так часто не следует , это противоречит сохранению экологического баланса. Газоны увлажняют городской воздух, спасают почву от эрозии и перегрева 🌿🌿🌿Газоны гасят городской шум, сорбируют пыль и выхлопные газы 🍀🌷Густой зелёный покров городской газонов благотворно влияет на психологическое состояние горожан и среди «каминных джунглей» они как выглядят как отдушина для утомленного суетой и скученностью горожанина мегаполиса. А их - газоны- косят и косят иногда по 2 -3 раза в месяц . Это ещё один способ «распила» городского бюджета , как и бесконечная замена плитки и бордюров ..,🤥👎🏽",2020-06-21T03:17:15Z,0
1689,UgwkD8siESgTt_qYjG14AaABAg,5My6jw7CBhw,Телеканал Дождь,0,0,Влад Владиславов,Собянин оленивод,2020-06-21T03:16:57Z,0
1690,Ugwisj3D099IZGsYNsJ4AaABAg,5My6jw7CBhw,Телеканал Дождь,0,1,Igor R,Когда парад будет,2020-06-21T03:16:50Z,0
1691,UgxEjkIFwZ15UrRIehV4AaABAg,5My6jw7CBhw,Телеканал Дождь,0,0,Мария Яяяя,Перенимайте опыт Древнего Рима- стройте Клоака Максимум.,2020-06-21T03:15:18Z,0
1692,UgxpAPzqMsDUjW-PLD14AaABAg,5My6jw7CBhw,Телеканал Дождь,0,0,Алексей Андреев,Что выбрали то и приходит .,2020-06-21T03:15:13Z,0
1693,UgwZ9FAUB_E4QJ0dTKR4AaABAg,5My6jw7CBhw,Телеканал Дождь,0,0,Alla Calin,Все через одно место!  Россия великая страна и как везде в бывшем СССР! Тоже самое недалеко от них ушли,2020-06-21T03:14:32Z,0
1694,Ugx-8Hzasr9FJVw-xTF4AaABAg,5My6jw7CBhw,Телеканал Дождь,0,0,Вован Кавилин,Заливухин специально фамилию подбирали?))),2020-06-21T03:14:18Z,0
1695,UgzqQsM3ZKA1inkaMqJ4AaABAg,5My6jw7CBhw,Телеканал Дождь,0,0,Oleg Dengin,"В Москве ураган,град, ливень, грозы , Москву залило , Парад победы сорван военная техника которая должна была участвовать в Москве ломается и глохнет! Тысячи молний долбят по Кремлю!",2020-06-21T03:13:47Z,0
1696,Ugw_y-0wNtt28fp8X5p4AaABAg,5My6jw7CBhw,Телеканал Дождь,0,0,Евгений Фролов,Собакина под суд с конфи кацией,2020-06-21T03:13:17Z,0
1697,UgwwC23zAPrViosOmsJ4AaABAg,5My6jw7CBhw,Телеканал Дождь,0,0,Денис С,Кто ж знал что ливень пойдёт.,2020-06-21T03:12:22Z,0
1698,UgzGRnRtHB-PKrF8seV4AaABAg,5My6jw7CBhw,Телеканал Дождь,0,2,Alla Calin,Люди виноваты!  Какие власти Москвы?  Они не при делах),2020-06-21T03:11:11Z,0
1699,Ugxn0fvlOwHvEzqvHs14AaABAg,5My6jw7CBhw,Телеканал Дождь,0,0,Алла Владимирова,"Давно все не так! Водоотведение не работает, ливннвок мало, в общем слов много, а дела по распилу денег! Везде прорывы дна(",2020-06-21T03:10:25Z,0
1700,UgyrqgNlOl5UNdkdrAl4AaABAg,5My6jw7CBhw,Телеканал Дождь,0,0,Oleg Dengin,Собянина судить с полной конфискацией!,2020-06-21T03:09:55Z,0
1701,Ugyn-HXKtP9OjBzunBt4AaABAg,5My6jw7CBhw,Телеканал Дождь,0,9,Елена Грибановская,"Это же отлично, можно снова списать деньги на ремонт дорог.",2020-06-21T03:09:55Z,0
1702,UgwazCCO7MdVa5Y9G6h4AaABAg,5My6jw7CBhw,Телеканал Дождь,0,0,Иван Иванов,вован чё там на лодке плавает в новеогореве?,2020-06-21T03:09:39Z,0
1703,UgyYj6f7OGzhWQahqXd4AaABAg,5My6jw7CBhw,Телеканал Дождь,0,0,КРИК,путинизм - Дно дна,2020-06-21T03:09:04Z,0
1704,UgxhxrT6ddSPHIRVOwh4AaABAg,5My6jw7CBhw,Телеканал Дождь,0,0,Dmitryi Vaysbrot,Мы народ за наши деньги восстановим.,2020-06-21T03:08:37Z,0
1705,UgxZEejCoeqZyOCTG3d4AaABAg,5My6jw7CBhw,Телеканал Дождь,0,0,Костя Черепанов,вот вам и власти сидя на жопе.,2020-06-21T03:08:09Z,0
1706,Ugx-JgcEr5GwjfrQI9l4AaABAg,5My6jw7CBhw,Телеканал Дождь,0,0,Сан Саныч,На ливневке бабла не заработаешь.,2020-06-21T03:06:50Z,0
1707,Ugw4YoONIr1iYjBNKVR4AaABAg,5My6jw7CBhw,Телеканал Дождь,0,0,Сергей Васильев,Плитку переложили- на ливнёвку забили,2020-06-21T03:06:46Z,0
1708,UgwnqwvFEXSQVOuTY8R4AaABAg,5My6jw7CBhw,Телеканал Дождь,0,0,Костя Черепанов,"А я думал что ж в самаре тратуары толком не ложат , а тут вон что в москве всё плиткой прокладывают .",2020-06-21T03:06:44Z,0
1709,Ugzlk4rRnLQnkgvC_zN4AaABAg,5My6jw7CBhw,Телеканал Дождь,0,10,Федор Берест,"ВСЕ НОРМ, ИДИТЕ ""ГОЛОСОВАТЬ"" ЗА САМООБНУЛЕННОГО!!!! ЧЕРЕЗ НЕСКОЛЬКО ЛЕТ В ГОВНЕ УТОНИТЕ!!!!",2020-06-21T03:06:30Z,0
1710,Ugyvu1fGeOMXmSNXvkJ4AaABAg,5My6jw7CBhw,Телеканал Дождь,0,0,Жаксылык Надирбеков,Надо в конституцию ввести поправку по дождью - все будут за.,2020-06-21T03:06:11Z,0
1711,UgzhXnWC_zWzbrMAOFd4AaABAg,5My6jw7CBhw,Телеканал Дождь,0,0,Евгений Ильичев,"И так по всей путинской россиянии,где у власти ""кухарки"",дороги делают ""кухарки"",на телевидении работают ""кухарки""...",2020-06-21T03:05:57Z,0
1712,Ugz2u_umYJeHYCmpLl94AaABAg,5My6jw7CBhw,Телеканал Дождь,0,0,Павел Холявко,01:10 Кто виноват?  Ясен пень дождь.,2020-06-21T03:04:48Z,0
1713,Ugz8_5jMZF90Ag9FZaJ4AaABAg,5My6jw7CBhw,Телеканал Дождь,0,15,Битл Джус,"Эээ́э Собянин это специально устроил , чтоб ээээ народ не смог попасть  аааа на обнуление Путина.",2020-06-21T03:04:47Z,0
1714,UgwZTmuyef4Wp8KtiRx4AaABAg,5My6jw7CBhw,Телеканал Дождь,0,0,Сан Саныч,Бункер Плешивца затопило????,2020-06-21T03:04:36Z,0
1715,UgxVDcKz-m0uGDuoYsp4AaABAg,5My6jw7CBhw,Телеканал Дождь,0,0,Mariha GeCo,"Ну так в мае и до сих пор, распоряжением Жилищников заваривали и заваривают сливы внутри водостоков. А то, что сказал приглашенец - это новые бюджеты осваивать будут таким образом.",2020-06-21T03:04:35Z,0
1716,UgzH5TRSeW7dA3IfVEp4AaABAg,5My6jw7CBhw,Телеканал Дождь,0,0,Жаксылык Надирбеков,Хоть бы дождь бункер затопил и утопил обнулёныша!,2020-06-21T03:02:08Z,0
1717,Ugz4OBjWkiqUCh0kuRV4AaABAg,5My6jw7CBhw,Телеканал Дождь,0,0,Дети подземелья,Ливневки - ничто! Бордюры - вот наше ВСЁ!,2020-06-21T03:02:00Z,0
1718,UgyQNVrZFO2vcv8SABt4AaABAg,5My6jw7CBhw,Телеканал Дождь,0,0,печкин Печкин,Трепло бла бла бла,2020-06-21T03:01:26Z,0
1719,UgyQB3F61BXyOCWRFz54AaABAg,5My6jw7CBhw,Телеканал Дождь,0,0,ghreGHUHG,в чем проблема сорвать плитку раздолбать асфальт  переделать ливневку   закатать по новому,2020-06-21T03:01:15Z,0
1720,UgyrQF62hUmPqP_eXxd4AaABAg,5My6jw7CBhw,Телеканал Дождь,0,0,Irina Nikolaeva,"Не виноват Собянин - он свою задачу распила бюджета выполняет. Во всем виноват господь бог и всемирное потепление. О чем постоянно говорит главный борец с потеплением Потанин, готовый внести миллиарды для борьбы с этой проблемой, чтобы только не говорили об экологической катастрофе в Норильске, устроенной им.",2020-06-21T03:01:13Z,0
1721,UgwFA9QUKZgj2Yb36DZ4AaABAg,5My6jw7CBhw,Телеканал Дождь,0,0,Миру Мир,Че  в Москву  спасательные  жилеты  завезли?Теперь  будет  трио?,2020-06-21T03:00:22Z,0
1722,UgyUVV8NdptRLgOzdq54AaABAg,5My6jw7CBhw,Телеканал Дождь,0,0,Maestro Sokolovsky,"Ооо, а я думаю куда градостроители уехали с Краснодара",2020-06-21T03:00:15Z,0
1723,UgxcJRyBGI9GNrSgrNh4AaABAg,5My6jw7CBhw,Телеканал Дождь,0,4,Zadolbalirod Fyhjkk,Собянин же молодец)))Осталось обнулиться.,2020-06-21T02:59:34Z,0
1724,UgwhZu1Bsnzkp32KpHx4AaABAg,5My6jw7CBhw,Телеканал Дождь,0,0,Раиса Иванова,Хотели как лучше а получилось как всегда,2020-06-21T02:59:14Z,0
1725,UgxfXxfU-z8HSnxjkbB4AaABAg,5My6jw7CBhw,Телеканал Дождь,0,0,Сергей Булатов,Опять плитку перекладывать?,2020-06-21T02:59:10Z,0
1726,UgzXL_9Uuc8NlRUxgQF4AaABAg,5My6jw7CBhw,Телеканал Дождь,0,0,искандер искандер,Нам нужен прорыв,2020-06-21T02:58:31Z,0
1727,UgwR8QC-LdR5_8txra94AaABAg,5My6jw7CBhw,Телеканал Дождь,0,0,Руся Б,салют! - морякам!=),2020-06-21T02:58:14Z,0
1728,Ugx4FAC9-nE_S88MNmR4AaABAg,5My6jw7CBhw,Телеканал Дождь,0,0,V. B.,"Слушайте хватит критиковать вашу власть во всём. Видемо осадков выпало на много больше чем обычно, и затопило пару районов. Я живу в Австралии и у нас, тоже такое случается и довольно часто.",2020-06-21T02:57:56Z,0
1729,UgwdOHZOWSReUOq8PVJ4AaABAg,5My6jw7CBhw,Телеканал Дождь,0,0,Инь Янь,"Это всё потому, что за попраВовочку ещё не проголосовали — потом сразу всё наладится, потерпеть немного нужно...",2020-06-21T02:56:08Z,0
1730,UgwHfEQywQOFZzqtq_l4AaABAg,5My6jw7CBhw,Телеканал Дождь,0,0,Александр Russia*****,"Нормально так, ну ничего вам пукин поможет",2020-06-21T02:55:43Z,0
1731,UgwiOCtkIJfngCxLtUd4AaABAg,5My6jw7CBhw,Телеканал Дождь,0,0,Vadim Zhikharev,Даже природа против сс,2020-06-21T02:55:24Z,0
1732,UgymqYfEvM_UhDpSxi94AaABAg,5My6jw7CBhw,Телеканал Дождь,2,18,Zara _,"Илья ЗАЛИВУХИН -- совпадение, не думаю!🧐... извините, мне пять лет",2020-06-21T02:53:23Z,0
1733,UgymqYfEvM_UhDpSxi94AaABAg.9A95XwVFcUu9AAk-6B-4mK,5My6jw7CBhw,Телеканал Дождь,0,0,Екатерина Маряшина,"Правильно сомневаешься, с Украины же тучи и грозу подогнали...",2020-06-21T18:14:52Z,1
1734,UgymqYfEvM_UhDpSxi94AaABAg.9A95XwVFcUu9AAHb_0LotC,5My6jw7CBhw,Телеканал Дождь,0,1,виолетта шварц,За что пять лет дали?,2020-06-21T13:58:07Z,1
1735,Ugyt-hsrB8DxQ2IB_HJ4AaABAg,5My6jw7CBhw,Телеканал Дождь,3,13,Идущий С Реки!!!,Оленевод оленевод )) хах а кто тогда олени?)) Отвечу масквичи)),2020-06-21T02:51:44Z,0
1736,Ugyt-hsrB8DxQ2IB_HJ4AaABAg.9A95Lt2kRzQ9AV5ig7pl2J,5My6jw7CBhw,Телеканал Дождь,0,0,Татьяна Михалыч,"@Идущий С Реки!!! Тогда почему злорадство? Жизнь в деревне делает человека мудрее, добрее...",2020-06-29T15:58:16Z,1
1737,Ugyt-hsrB8DxQ2IB_HJ4AaABAg.9A95Lt2kRzQ9AATjXketlQ,5My6jw7CBhw,Телеканал Дождь,0,0,Идущий С Реки!!!,@Татьяна Михалыч в деревнях намного лучше хоть тут и не осталось почти никого,2020-06-21T15:44:03Z,1
1738,Ugyt-hsrB8DxQ2IB_HJ4AaABAg.9A95Lt2kRzQ9AA3WMocjSP,5My6jw7CBhw,Телеканал Дождь,0,1,Татьяна Михалыч,"Поржал над москвичами, как будто где-то в других уголках страны лучше..",2020-06-21T11:54:56Z,1
1739,Ugxf-nigKwNEXjHaNZB4AaABAg,5My6jw7CBhw,Телеканал Дождь,0,1,Сергей Погорелов,Ужас 🤬,2020-06-21T02:51:26Z,0
1740,UgxAcjnLIOrZUoPwKP14AaABAg,5My6jw7CBhw,Телеканал Дождь,0,0,Ilya Zuyf,Вырубили Сибирь? Хотели тропики в России? Получите!,2020-06-21T02:49:53Z,0
1741,Ugz6gYa5uYE6cC-6-6p4AaABAg,5My6jw7CBhw,Телеканал Дождь,0,0,Etrury Ru,"Это называется - сверху шик, внутри пшик.",2020-06-21T02:49:33Z,0
1742,UgyqfNQDkoWJ_N30Xd94AaABAg,5My6jw7CBhw,Телеканал Дождь,0,0,Funny TiTO,"Да зачем им канализация, щас затопит, вся плитка снова похерится, снова бабло рекой пойдет)",2020-06-21T02:49:24Z,0
1743,Ugyai_XoNK9mkMskztl4AaABAg,5My6jw7CBhw,Телеканал Дождь,0,0,Ира Радченко,Это вторая волна,2020-06-21T02:49:01Z,0
1744,Ugxn5E3nMt-GEBX3I8Z4AaABAg,5My6jw7CBhw,Телеканал Дождь,0,0,галина сапунова,Шаман нашаманил!,2020-06-21T02:48:48Z,0
1745,Ugx5taTMZB6S3fPq7LF4AaABAg,5My6jw7CBhw,Телеканал Дождь,0,0,Гасиев Валерий,Обнулить лужу!! Подонок этот дождь,2020-06-21T02:47:44Z,0
1746,UgxtJeXY4SIeZHbQBzB4AaABAg,5My6jw7CBhw,Телеканал Дождь,0,0,Булат Галимов,"Пробки, эпидемия,наплыв мигрантов,потоп.сколько всего должно произойти в Москве,чтоб крыса белобрысая поняла что столицу нужно поменять,или их министерские головы слишком тупые?",2020-06-21T02:46:55Z,0
1747,UgwQnrtOFtMIrYpAWLl4AaABAg,5My6jw7CBhw,Телеканал Дождь,0,0,джон ванген,москва слезам не верит,2020-06-21T02:46:39Z,0
1748,UgzlGf4anzpiCNXm26l4AaABAg,5My6jw7CBhw,Телеканал Дождь,0,0,Андрей Балконский,Заливухин ),2020-06-21T02:45:40Z,0
1749,UgyJZiF7zii1MoJbqf94AaABAg,5My6jw7CBhw,Телеканал Дождь,0,0,Nataliy Nataliy,"У нас тоже при ремонте дорог ливневки,построенные еще при советах,закатали в асфальт и теперь каждый год делают ремонты. Хотя раньше по этим стокам вода уходила в реку и город всё лето и осень стоял сухой,весною малость подтапливало,но потом ливневки оттаивали и воды вообще не было. А сейчас маломальский дождик и Фсё,мы в Венеции,дороги как корыто набирают воду и всем очень «весело»,особенно пешеходам,которых окатывают водой с дорог автомобилисты. Терпеть не могу эту гнилую систему! Когда она уже рухнет!",2020-06-21T02:45:01Z,0
1750,UgwVGxmryTiZ0ezpbs14AaABAg,5My6jw7CBhw,Телеканал Дождь,0,1,Медуза Медуза,Да уж!,2020-06-21T02:44:44Z,0
1751,Ugyub3GFzcv3tbuJwwJ4AaABAg,5My6jw7CBhw,Телеканал Дождь,0,0,Евгений Пупкин,Нехуй леса вырубывать.,2020-06-21T02:44:14Z,0
1752,Ugwe7MhuBgVmZlzysIZ4AaABAg,5My6jw7CBhw,Телеканал Дождь,0,0,aleksandeR,Вы что забыли Короновирус виноват всё это фашистский режим долдонин Короновирус все из за него проклятого!,2020-06-21T02:44:08Z,0
1753,UgyHt93xDbYJv4nNHtd4AaABAg,5My6jw7CBhw,Телеканал Дождь,1,6,МАРИНА НОВИКОВА,Косоязычный архитектор жертва ЕГЭ. А может ли он сделать нормальный проект?  Выражать свои мысли он точно не умеет,2020-06-21T02:44:01Z,0
1754,UgyHt93xDbYJv4nNHtd4AaABAg.9A94TJJ3wnO9A9Rh0WDLiJ,5My6jw7CBhw,Телеканал Дождь,0,0,Александр Добренков,а Вы даже письменно не смогли. В первом же предложении ошибки. Не Ваше это - судить кто как свои мысли выражает.,2020-06-21T06:07:00Z,1
1755,Ugw7lbwKgz_Ts2iA-NR4AaABAg,5My6jw7CBhw,Телеканал Дождь,0,0,JeKSoN75,Кремль надо утопить и заибись будел всем,2020-06-21T02:43:02Z,0
1756,UgyX5ntm3CONG81WZ354AaABAg,5My6jw7CBhw,Телеканал Дождь,0,0,Владимир Ладо Ладо,Заявляю скаждым годом и с каждым сезоном суд в начале третьего будет усиливатся и сама природа будет помогать мне даже если здесь меня не будет и спасутся те кто познает Истену в Добре и будет прибывать в Истене многие познав Истину пройдут мимо спасения так как будут боятся говарить Истену и будут боятся быть осменными и осуждёнными перед такими же как они сами сперва падут лицемеры патом лукаые Cвет ведёт меня с детства и в яви показывал мне ролик и говарил когда васпаёт тебя Изабель то суд запущенный тобой ранние будет утверждён наберите ZAZ-WOULD TOUR 2019 ( teaser ) и в конце ролика услышете и увидете,2020-06-21T02:41:35Z,0
1757,Ugxr7fCHTHAIE8Bt9bN4AaABAg,5My6jw7CBhw,Телеканал Дождь,5,144,Вася Васин,"Ну что собакин бордюр плиткавич засрал весь город все тонем ,черт вали обратно в тундру упырь!",2020-06-21T02:39:43Z,0
1758,Ugxr7fCHTHAIE8Bt9bN4AaABAg.9A93yrZQ_FE9AAce_KPQw9,5My6jw7CBhw,Телеканал Дождь,0,0,Igor V.,"@Huawei Vj, там уже давно нет москвичей...живет собрание гондонов но всей РФ",2020-06-21T17:10:45Z,1
1759,Ugxr7fCHTHAIE8Bt9bN4AaABAg.9A93yrZQ_FE9AAIcsF8J2I,5My6jw7CBhw,Телеканал Дождь,0,0,Анна Бессмертная,@Huawei Vj супер,2020-06-21T14:07:02Z,1
1760,Ugxr7fCHTHAIE8Bt9bN4AaABAg.9A93yrZQ_FE9AA9QZTRaDt,5My6jw7CBhw,Телеканал Дождь,0,2,Giver Pow,Ему в монголию. Источник тиранов азиатов,2020-06-21T12:46:34Z,1
1761,Ugxr7fCHTHAIE8Bt9bN4AaABAg.9A93yrZQ_FE9A9qKdkA-X5,5My6jw7CBhw,Телеканал Дождь,0,3,Сергей С.,СабЯкин,2020-06-21T09:51:00Z,1
1762,Ugxr7fCHTHAIE8Bt9bN4AaABAg.9A93yrZQ_FE9A9n4esntAW,5My6jw7CBhw,Телеканал Дождь,0,9,Huawei Vj,"Москвичи, когда вы уже приведете всем миром к этому ВОДОПОЮ  вашего безумного «оленя» рога помочить? С бордюрным камнем на шее.",2020-06-21T09:22:36Z,1
1763,UgwB632cM1NtqnExgsJ4AaABAg,5My6jw7CBhw,Телеканал Дождь,0,0,Yuriy Blog,"Таджики виноваты, к бабке не ходи. А с ""канализацией"" давно проблемы, столько дерьма!!!!",2020-06-21T02:39:36Z,0
1764,UgxS_bDiZz50L3j16Rd4AaABAg,5My6jw7CBhw,Телеканал Дождь,0,0,Артур Рыбкин,надо было тучи разгонять над кремлем! ;),2020-06-21T02:38:32Z,0
1765,Ugw5lWqGHTbbwOkF9ZV4AaABAg,5My6jw7CBhw,Телеканал Дождь,0,0,Андрон Гиберт,...дело идет к параду...,2020-06-21T02:36:25Z,0
1766,Ugwj1NXfpjyR1SdaH1h4AaABAg,5My6jw7CBhw,Телеканал Дождь,0,0,saetgwrgwrg wafwegwe,Голосуйте за поправки!,2020-06-21T02:34:45Z,0
1767,Ugze6xECROgKRBg5Rop4AaABAg,5My6jw7CBhw,Телеканал Дождь,0,0,Tele Tu,"Виновен губернатор , много украл .",2020-06-21T02:34:34Z,0
1768,UgzLrVKJKrwF_-pG2Dh4AaABAg,5My6jw7CBhw,Телеканал Дождь,0,0,Колай Максимович,Бедняги,2020-06-21T02:32:31Z,0
1769,UgxkOtXzumJhrHWdrI94AaABAg,5My6jw7CBhw,Телеканал Дождь,0,0,Nataliy Nataliy,Враг дорог и плитки это вода. Строители сделали всё чтобы вернуться назад на следующий год.,2020-06-21T02:31:48Z,0
1770,UgzIhjVeo8_gunuKrQl4AaABAg,5My6jw7CBhw,Телеканал Дождь,0,1,Колай Максимович,Ну и что дождь он и в африке дождь,2020-06-21T02:31:18Z,0
1771,UgyOLtEfK3GvCtUgIdB4AaABAg,5My6jw7CBhw,Телеканал Дождь,0,0,Nataliy Nataliy,"Потому что строители сделали работу,денежки получили и свободны до следующего года и заказа! А если бы строители отвечали за свою работу лет десять или двадцать,то они бы работали так,чтобы потом не переделывать за свой счёт. А так,это как нефтяная жила,делай тяп-ляп и получай за это деньги.",2020-06-21T02:30:58Z,0
1772,UgwQwNxO66DHMXUAQkN4AaABAg,5My6jw7CBhw,Телеканал Дождь,1,76,Миша Пушкин,"Срочно молитесь на ,реликвию,ФУРАЖКУ ФЮРЕРА.",2020-06-21T02:29:11Z,0
1773,UgwQwNxO66DHMXUAQkN4AaABAg.9A92lj5YqY19A9ZZMmRMZn,5My6jw7CBhw,Телеканал Дождь,0,5,Alex Hammerschmidt,Миша Пушкин как завещал фашист лилитрупин,2020-06-21T07:15:43Z,1
1774,Ugy9S2fP61q3cdLULgF4AaABAg,5My6jw7CBhw,Телеканал Дождь,0,0,Фатима Максатбекова,"Дождик дождик уходи у нас вторая волна, не до тебя",2020-06-21T02:28:04Z,0
1775,UgwC5MFDNsj9dUW6qUp4AaABAg,5My6jw7CBhw,Телеканал Дождь,0,0,Lenanedilko Nedilko,"Специалисты. В АЭ при ливнях тоже город плавал. У них тоже мэр плохой? А
В Израиле города от ливней плавали. Инженеры у них тоже плохие? Блин, он же не повелитель погоды! Каждый из вас знает как управлять городом. А у себя в семьях бардак!",2020-06-21T02:27:37Z,0
1776,UgzHx71sWuWau0rMmxx4AaABAg,5My6jw7CBhw,Телеканал Дождь,0,0,Надин Ганс,"Вы не Дождь должны называться, а ""Канализационный сток"". Это будет точнее",2020-06-21T02:26:40Z,0
1777,UgwHhFRg7NhpOjSkTqt4AaABAg,5My6jw7CBhw,Телеканал Дождь,0,0,fi,"3:10 это связано с тем, что люди мусорят! Русский человек он же такой: будет стоять рядом с мусоркой, а бычок сигаретный обязательно мимо кинет. Нужно вводить программу «кинул ли мусор на дорогу, плюнул ли..- мети всю улицу‼️»",2020-06-21T02:26:28Z,0
