,id,videoId,authorVideoName,totalReplyCount,likeCount,authorDisplayName,textDisplay,publishedAt,isReply
849,UgxVgf9n6ElDSXW38PZ4AaABAg,5My6jw7CBhw,Телеканал Дождь,0,14,Татьяна Климашина,"Наконец то, одна приятная новость.",2020-06-21T09:25:35Z,0
850,UgyixlAs6ulp1FrZl1x4AaABAg,5My6jw7CBhw,Телеканал Дождь,0,0,Elena Alen,"В нашей стране чего ни коснись - всё ВНЕЗАПНОЕ!!!!!
И дожди, и снега, и холод, и жара, и морозы и оттепели...",2020-06-21T09:24:44Z,0
851,Ugyo9vOAEIMI-mSuOYZ4AaABAg,5My6jw7CBhw,Телеканал Дождь,0,0,Бек Жон,ВАРРЛАААМОООООВ ГДЕЕ ТЫЫЫ?,2020-06-21T09:23:14Z,0
852,UgwCJWtUmqI_CCBTRJt4AaABAg,5My6jw7CBhw,Телеканал Дождь,0,0,Нина Алексеевна,Каково людям это терпеть это такое напряжение,2020-06-21T09:22:16Z,0
853,Ugyo0P3f6lmppmpPX4J4AaABAg,5My6jw7CBhw,Телеканал Дождь,0,0,Нина Алексеевна,Нет хозяина в москве собянин приспособленец возле кормушки,2020-06-21T09:21:17Z,0
854,UgxsXna68GjE_Ci87hN4AaABAg,5My6jw7CBhw,Телеканал Дождь,0,0,Nikolai N,Ох уж эта кривизна земли 😂😂😂👍,2020-06-21T09:21:10Z,0
855,UgwddfP08mKZr-ZHkH14AaABAg,5My6jw7CBhw,Телеканал Дождь,0,0,Михаил Виноградов,"Когда личные машины негодяев  - чиновников будут тонуть вместе с нашими машинами. Когда подлецы - чиновники будут прыгать по лужам вместе с нами. Когда воров - чиновников уравняют в правах с обычными гражданами, а граждане получат контроль - возможность влиять на работу кувшинных путинских рыл. Только тогда всё заработает на благо народа.",2020-06-21T09:21:09Z,0
856,Ugx2VSeP9rMmPh3bfs54AaABAg,5My6jw7CBhw,Телеканал Дождь,0,1,Nikolai N,Технология 😂😂😂👍,2020-06-21T09:20:03Z,0
857,UgxMwDtrqC3oAbBKvNp4AaABAg,5My6jw7CBhw,Телеканал Дождь,0,0,Наталья Наталья,"Может, с.с надо ливвневками заняться, а не бардюрами...🙈",2020-06-21T09:19:17Z,0
858,Ugyroloh6mBvlLWN7-N4AaABAg,5My6jw7CBhw,Телеканал Дождь,0,0,Аксиния Славянская,"Один гастарбайтер из тундры, наверно, закатал  все ливневки в бордюры... Зачем они ему, эти ливневки? Их же чистить надо, следить, зачем ему такая морока, которая не сулит пользы его великому карману?",2020-06-21T09:19:12Z,0
859,UgxoeRppVwBTdmqatD14AaABAg,5My6jw7CBhw,Телеканал Дождь,0,2,Ynus Suleimanov,"Ещё одно доказательство от Всевышнего , чтоб люди не голосовали за это правительство ,  что они ничего не делают ради народа !!!",2020-06-21T09:19:02Z,0
860,UgwJ_8AjQL_DwEejqZR4AaABAg,5My6jw7CBhw,Телеканал Дождь,0,0,Быть Добру,не на инфраструктуру тратить деньги не рационально...это ж всё под землёй  и самодержцу очки втирать неудобно...толи дело бордюры и плитка... А потом что Собянин тут жить собирается?,2020-06-21T09:18:04Z,0
861,UgyEAWEv0OXBCvza6Ed4AaABAg,5My6jw7CBhw,Телеканал Дождь,0,0,Любовь Белашова,"Деньги отмыли,и смыли",2020-06-21T09:17:45Z,0
862,UgwSK4a3EhSFjuaZGep4AaABAg,5My6jw7CBhw,Телеканал Дождь,0,0,Наталья Голосовская,А что делает МЭР ГОРОДА?КТО ЗА ЭТО ДОЖЕН ОТВЕТИТЬ????,2020-06-21T09:17:45Z,0
863,UgyqPeSGyuaD6RjIYB94AaABAg,5My6jw7CBhw,Телеканал Дождь,0,0,Гражданин Эстонии,"Срачь в Москве полнейший,до Европы,как до Луны!",2020-06-21T09:17:44Z,0
864,UgyoqesgfvbXRfnJylV4AaABAg,5My6jw7CBhw,Телеканал Дождь,0,0,Владимир Щербаков,"Как участник ""программы его улица""... Проектные решения перекладки Ливневки Были Ущербными, если не сказать грубее - ХУЕВЫЕ!!!! Все предложения и замечания по данным Вопросам - к ""Заказчику"" --- Просто и Тупо ХЕРИЛИСЬ!!!! В результате: ИМЕЕМ то что ИМЕЕМ !!!!! Как в старой строительной Поговорке: Чтобы не Было Пиздежу - делай все по ЧЕРТЕЖУ!!!!!",2020-06-21T09:17:14Z,0
865,Ugzmw6TI0QOk2_vFJoF4AaABAg,5My6jw7CBhw,Телеканал Дождь,0,0,Надежда Пак,Регионы вам помогут,2020-06-21T09:15:30Z,0
866,UgwbFO8u6TIB7sUCCE94AaABAg,5My6jw7CBhw,Телеканал Дождь,0,0,Осипов Александр,"Чтоб спасти  СССР,нужно спалить  Москву слова Кутузова,а господь её затапливает.",2020-06-21T09:14:59Z,0
867,UgzVdVLZkpIqKrsf5x94AaABAg,5My6jw7CBhw,Телеканал Дождь,0,0,Марина Красильникова,Природа сама уничтожает Москву.может и регионы начнут жить самостоятельно,2020-06-21T09:13:06Z,0
868,Ugxx9hrcD12P_El-EVN4AaABAg,5My6jw7CBhw,Телеканал Дождь,0,0,Валентина Абдрахимова,Ужас....нет хозяина в городе...,2020-06-21T09:12:56Z,0
869,UgxGywy0CSBYnL8yVLJ4AaABAg,5My6jw7CBhw,Телеканал Дождь,0,0,Boby Fisher,"Илья Заливухин рассказывает про затопление на канале ""Дождь"".",2020-06-21T09:12:26Z,0
870,UgxPRFvjknUyuSi4E114AaABAg,5My6jw7CBhw,Телеканал Дождь,0,0,Igor R,"Нужны палицаи, чтобы отдубасить воду",2020-06-21T09:11:59Z,0
871,UgySkVqqtQ--nEFrRQl4AaABAg,5My6jw7CBhw,Телеканал Дождь,0,0,Юрий Немами,"ливневки еще с советов,забиты мусором и листвой.",2020-06-21T09:11:46Z,0
872,UgzifyCITQmb6eXTFAx4AaABAg,5My6jw7CBhw,Телеканал Дождь,0,0,Таис Макс,"В Марьино  подвалы домов все сырые ( Батайский11,Новочеркасский 4) от ливней ,т.к. трубы сливные ПРОРЖАВЕЛИ,жители на первых этажах ,в основном алкаши.  Я это вижу каждый день,а комунальщики туда и не заглядывают ,из-за  полчищ тараканов .Жбу ""жилищник"" только подьезды обрабатывать заставляет гастарбайтеров,они же не живут в этих домах и им по барабану ,что в подвалах сырость  от прогнивших сливных  водостоков...",2020-06-21T09:09:40Z,0
873,UgxPKswFWAKkiyQpv614AaABAg,5My6jw7CBhw,Телеканал Дождь,0,0,Егизбай Егизбаев,ПРОКЛАДКУ НАДО МЕНЯТЬ И ВСЁ БУДЕТ НОРМАЛЬНО,2020-06-21T09:09:12Z,0
874,Ugy3BZmHso2GV5wLJVh4AaABAg,5My6jw7CBhw,Телеканал Дождь,0,0,Iliya,"Всем советую есть Есть рис Говяжью печень, там все витамины б12 б6 д3 И спать ночью Для здоровья!)",2020-06-21T09:08:48Z,0
875,Ugz_KzXdJcDcd9hrq_B4AaABAg,5My6jw7CBhw,Телеканал Дождь,0,0,Dimkadeo,Заливухин отвечает про потопы,2020-06-21T09:07:11Z,0
876,UgwHFNUcpmjZ99EuuGZ4AaABAg,5My6jw7CBhw,Телеканал Дождь,0,0,сергей макаренко,Собакин ты гений плитки.,2020-06-21T09:06:29Z,0
877,UgwghUMiotG3PzR-rG54AaABAg,5My6jw7CBhw,Телеканал Дождь,0,0,Денис Дьяков,Заливухин на Дожде о потопе. Кккомбо!,2020-06-21T09:06:07Z,0
878,UgyghbdgnPdu5VzAgXd4AaABAg,5My6jw7CBhw,Телеканал Дождь,0,0,Байҕал долгуна,Свободу воину Александру Габышеву!,2020-06-21T09:05:48Z,0
879,Ugz8JZYmDpVHXXgmH8B4AaABAg,5My6jw7CBhw,Телеканал Дождь,0,1,Зоя Трескова,"ОБОЛДЕТЬ, СОБЯНИН ТЫ , ЧТО КАК ПОТАНИН УПЫРЬ, ЗАВАЛИЛ ПРИРОДУ ТАЙМЫРА И АРКТИКИ !!!!! ,КАКИЕ ВЫ БЕСТОЛОЧИ !!!!!! НИЧЕГО НЕ ВИЖУ, НИЧЕГО  НЕ ЗНАЮ, НИЧЕГО НЕ КОМУ НЕ СКАЖУ !!!!!!  РУКОВОДЯТ СТРАНОЙ ДВОЕШНИКИ, ТАКИЕЖЕ ЗАМЫ, ТАКИЕ ЖЕ ИСПОЛНИТЕЛИ !!!",2020-06-21T09:05:43Z,0
880,Ugz4plzfxFK2K74ywRl4AaABAg,5My6jw7CBhw,Телеканал Дождь,0,0,Viktoriya,Ну сейчас отмажется...не в первой...пипец...,2020-06-21T09:05:23Z,0
881,UgxNfinnWbYLNzdr5b14AaABAg,5My6jw7CBhw,Телеканал Дождь,0,0,Boby Fisher,"Это в Москве ливневку за с ра ло а в других городах ее просто НЕТ. Вы московской области отъедте и охренеете как вода дорогах в колеях стоит, как при строительстве дорог ливневка не закладывается, как крышки люков в асфальт проседают сразу после ремонта или их закатывают асфальтом сверху. Вы видели хоть одну крышку вровень с дорожным полотном? Если такая есть то ее закатали под дорожную одежду.",2020-06-21T09:04:55Z,0
882,UgzmeP7Te8LtCekry4p4AaABAg,5My6jw7CBhw,Телеканал Дождь,0,2,Виталий Наседкин,отлично. как бальзам на сердце. молчите - ешьте путинизм,2020-06-21T09:03:19Z,0
883,UgwZzhRJdJpw9xqtraV4AaABAg,5My6jw7CBhw,Телеканал Дождь,3,59,Аксиния Славянская,Вау! 🙄🙄🙄Неужели Госдеп  московским благоустройством занимался?,2020-06-21T09:02:43Z,0
884,UgwZzhRJdJpw9xqtraV4AaABAg.9A9ko0M51W49AC-oUiR-yw,5My6jw7CBhw,Телеканал Дождь,0,1,Никон Хасегава,"@Дэрсу Узала думаю что и к бункеру не  подпустят!  Ботоксный дед параноит по. Полной программе! И ради бога не обижайтесь крыс таким сравнением , жили у меня крысы - так они классные зверюги , жаль живут только мало.",2020-06-22T06:01:04Z,1
885,UgwZzhRJdJpw9xqtraV4AaABAg.9A9ko0M51W49AC-1SHXozV,5My6jw7CBhw,Телеканал Дождь,0,1,Дэрсу Узала,"@Никон Хасегава получится сплотиться только вокруг бункера, где плешивая крыса прячется, ближе фсо не подпустит 😀",2020-06-22T05:54:14Z,1
886,UgwZzhRJdJpw9xqtraV4AaABAg.9A9ko0M51W49ABik1ToGRq,5My6jw7CBhw,Телеканал Дождь,0,3,Никон Хасегава,"Обама и Трамп насрали в подьездах и закатали ливневку под плитку. Уууу вражины! Ну ништо ,вот мы щас как сплотимся вокруг  сильного лидера!!!",2020-06-22T03:23:10Z,1
887,UgxRRN0IMXyiDCs4sVV4AaABAg,5My6jw7CBhw,Телеканал Дождь,0,0,FOREST Forest1,Нужно выход канализации сделать в КРЕМЛЬ может там увидят в каком дерьме страна находится,2020-06-21T09:02:36Z,0
888,UgwLTIcTNrlCEiNsrad4AaABAg,5My6jw7CBhw,Телеканал Дождь,3,0,Евгений Полупанов,"Да только одно не так, мэр - ворюга. Нужна программа «Мэр не долбоёб».",2020-06-21T09:02:15Z,0
889,UgwLTIcTNrlCEiNsrad4AaABAg.9A9kkd-mHOT9ABlLMH22O_,5My6jw7CBhw,Телеканал Дождь,0,0,Никон Хасегава,@Евгений Полупанов в том то и беда!,2020-06-22T03:45:53Z,1
890,UgwLTIcTNrlCEiNsrad4AaABAg.9A9kkd-mHOT9ABl7H9OzyA,5My6jw7CBhw,Телеканал Дождь,0,0,Евгений Полупанов,Никон Хасегава тоже верно..,2020-06-22T03:43:57Z,1
891,UgwLTIcTNrlCEiNsrad4AaABAg.9A9kkd-mHOT9ABkl2YfIOs,5My6jw7CBhw,Телеканал Дождь,0,0,Никон Хасегава,Долбоебы те кто его избрал! Мэр красавец! Стрижёт баранов на ять!,2020-06-22T03:40:47Z,1
892,UgwUS67kqhn9yz1CfCx4AaABAg,5My6jw7CBhw,Телеканал Дождь,0,0,Честь Имею,Не надо выбрасывать мусор на улицах и не будет забиваться,2020-06-21T09:01:57Z,0
893,Ugx9LVDwO14T0f6GLD14AaABAg,5My6jw7CBhw,Телеканал Дождь,0,0,Руслан Ильясов,Наливкина на вас нет,2020-06-21T09:01:23Z,0
894,Ugy6sRYt1yAHLdQz5oN4AaABAg,5My6jw7CBhw,Телеканал Дождь,0,0,Анастасия Воснесен,"Это,Шаман помог Собянину!",2020-06-21T08:58:41Z,0
895,Ugz_R2QhUsw-UOwR4HN4AaABAg,5My6jw7CBhw,Телеканал Дождь,0,0,komarvorov,Это саботаж от чинуш.,2020-06-21T08:57:14Z,0
896,UgyDmIqrFgHQCaqSHVt4AaABAg,5My6jw7CBhw,Телеканал Дождь,0,0,Денис Касаткин,"В мск только гей-парады проводить, все показное, фейковое. Вот показатель Собакина и его деятельности!",2020-06-21T08:56:10Z,0
897,Ugxx54yd4GjIS8y8FBt4AaABAg,5My6jw7CBhw,Телеканал Дождь,0,0,Kino DE,"у ва почти каждый год топят города,  а вы никуя ничего не делаете",2020-06-21T08:56:09Z,0
898,UgxEsaVA_-qoH5_kvNl4AaABAg,5My6jw7CBhw,Телеканал Дождь,0,0,Dmitry Smithy,"В электричках пригородных вообще не возможно было находиться когда было жарко в Московском регионе, ты просто задыхаешься .",2020-06-21T08:55:14Z,0
899,UgyKPVGlDAKR61tOJLl4AaABAg,5My6jw7CBhw,Телеканал Дождь,0,0,Андрей Борджиа,Еще скажите что Путин виноват.,2020-06-21T08:54:52Z,0
900,UgxrNRdvfMs7LDi4neZ4AaABAg,5My6jw7CBhw,Телеканал Дождь,0,0,Николай Смирнов,Собянину вообще пох на вас,2020-06-21T08:53:45Z,0
901,UgxUXCOER6Godr8gd_V4AaABAg,5My6jw7CBhw,Телеканал Дождь,0,2,Александр Лапшин,Точно. Ливневку прежде всего прочистить. И слить в них Дождь. Можно вместе с Эхом.,2020-06-21T08:53:38Z,0
902,Ugyl-HylSTDb28k_ZYl4AaABAg,5My6jw7CBhw,Телеканал Дождь,0,3,ВОСТОЧНЫЙ,"Москвичи вы можете гордиться, такое ощущение, что Москва сейчас  Современная оленья....",2020-06-21T08:52:15Z,0
903,Ugx_8vbJd9tNq6YtBoV4AaABAg,5My6jw7CBhw,Телеканал Дождь,0,0,Кирилл Колбин,Во всем виноват до///дь,2020-06-21T08:51:58Z,0
904,UgyB_5Pc96DS4Pek7V14AaABAg,5My6jw7CBhw,Телеканал Дождь,0,0,Акива Перово,Может наконец Москва утонет или провалится.,2020-06-21T08:50:40Z,0
905,UgyD-xVAcQuP3SvFzHV4AaABAg,5My6jw7CBhw,Телеканал Дождь,0,0,aizhan sabitova,Природа наказывает бестолковых строителей,2020-06-21T08:50:34Z,0
906,UgyLupa309IAf5c7Yt54AaABAg,5My6jw7CBhw,Телеканал Дождь,0,1,kinder tsoi,(o´罒`o),2020-06-21T08:45:51Z,0
907,UgyNIYz75Trt0j_WeUZ4AaABAg,5My6jw7CBhw,Телеканал Дождь,0,0,Марат Мукашев,"Заливухин сам и виноват. Фамилия за себя говорит. Нет чтоб на 5 минут раньше предупредить нас.... Суки. Мы запаслись бы дровами, сахаром, солью и конечно же водой с хлебом.",2020-06-21T08:45:38Z,0
908,Ugwx3O6GFgevjnWkg-x4AaABAg,5My6jw7CBhw,Телеканал Дождь,11,453,С В,"Как у Фаины Раневской:""Что толку делать пластическую операцию? Фасад обновишь, а канализация всё равно старая!""",2020-06-21T08:44:52Z,0
909,UgwjdJa0RGyqLL6T3zN4AaABAg,5My6jw7CBhw,Телеканал Дождь,0,0,Yuliya Soschnicova,"Сплошные прихвостни в правительстве Москвы, профессионалов, способных отстаивать свое мнение просто выжили...",2020-06-21T08:44:21Z,0
910,Ugy3Bgx2Kx_B7vmccr14AaABAg,5My6jw7CBhw,Телеканал Дождь,4,389,Евгений Русский,Вся Страна в таком состоянии. Износ СССР-ого наследия - результат 30-ти летнего рывка,2020-06-21T08:44:16Z,0
911,Ugy3Bgx2Kx_B7vmccr14AaABAg.9A9igtRLlhN9AFNexdVkEH,5My6jw7CBhw,Телеканал Дождь,0,0,Рыбина кересть,"А хозяина у ливневки нет , выгоду получать не кому ,появится сразу начнут работать по ливневке , будет выгодно ,и страховаться будут .",2020-06-23T13:27:12Z,1
912,Ugy3Bgx2Kx_B7vmccr14AaABAg.9A9igtRLlhN9ABN0w4olAg,5My6jw7CBhw,Телеканал Дождь,0,3,Наталья Яковлева,"@Prosto Chelovek У нас есть.Вначале химтрейлеры,потом дождь.И так не одно лето.Д В",2020-06-22T00:04:38Z,1
913,Ugy3Bgx2Kx_B7vmccr14AaABAg.9A9igtRLlhN9ABBelUxp3p,5My6jw7CBhw,Телеканал Дождь,0,0,Prosto Chelovek,"Кажется по моему во всей стране нет ливня и вследствие потопа, может я слепой, но не видел за последние 10 лет настолько сильного потопа...",2020-06-21T22:25:21Z,1
914,Ugy3Bgx2Kx_B7vmccr14AaABAg.9A9igtRLlhN9AB91NdCga0,5My6jw7CBhw,Телеканал Дождь,0,4,YnepTbIi,Это Ленин заложил атомную бомбу!!! Вот все и затопило!,2020-06-21T22:02:22Z,1
915,UgzzPPIgOVgVK_vsUA94AaABAg,5My6jw7CBhw,Телеканал Дождь,0,0,дмитрии логинов,жалко что не сгорела как раньше может что то в стране поменялось бы,2020-06-21T08:42:51Z,0
916,UgzOFYML8GB2Qb8gkZp4AaABAg,5My6jw7CBhw,Телеканал Дождь,0,0,Дионис Купянский,Бла Бла Бла и ничего толкового,2020-06-21T08:42:38Z,0
917,UgxgVXg2UxrVZ24S6YR4AaABAg,5My6jw7CBhw,Телеканал Дождь,0,0,Sou Ant,Теперь у мэра Москвы есть все шансы стать почётным гражданином города.,2020-06-21T08:42:36Z,0
918,Ugy6a6hZ0VAg5ZB_Zx94AaABAg,5My6jw7CBhw,Телеканал Дождь,0,0,Садко,"Ливневки делать не выгодно, нужно копать траншеи, трубы укладывать, колодцы делать! Когда строят новые дома, то вокруг них про ливневки забывают!  Говорит, что вода должна уходить в газоны,  те газоны что в новостройках, на это не способны! Под этими газонами даже грунта толком нету! Сколько раз видел, насыпят чернозема, как кот наплакал, разбросают семена газонной травы и вот весь газон!",2020-06-21T08:41:25Z,0
919,Ugw0Bry5gxHX9aZgaJx4AaABAg,5My6jw7CBhw,Телеканал Дождь,0,0,Дамир Кутдусов,"Позор и глупость смоет дождь,  в сухом остатке лучше бы деньги людям отдали (теперь что, на ремонт плитки опять в карман полезуь да?Нет , теперь народ даст жесткую критику и не дай бог еще хуже)",2020-06-21T08:40:48Z,0
920,Ugya2_QCUbCIJjqsHYt4AaABAg,5My6jw7CBhw,Телеканал Дождь,0,0,Сергей Коршунов,"Бла-бла-бла а виноватых сново нет.Так и хочется крикнуть....А ЦАРЬ ТО НЕ НАСТОЯЩИЙ!!!Не кто уже его не понимает и не уважает,движемся в направлении ни кому не известном.Даже спиздить по умному не могут,позорники!!!!!",2020-06-21T08:40:30Z,0
921,Ugwn4O8uE0Vd7DJrP6J4AaABAg,5My6jw7CBhw,Телеканал Дождь,0,0,Александр Царев,Сабянин бес ливневый,2020-06-21T08:39:30Z,0
922,UgyZ4GgXcWLtk1uqzfJ4AaABAg,5My6jw7CBhw,Телеканал Дождь,0,0,Анна Локтева,"где же, стоки воды, это все надо прочищать, если нет их ,то делать, почему же специалисты этого не предусмотрели？это же столица！очень не красиво все это выглядит",2020-06-21T08:39:11Z,0
923,Ugx8YKuqGcHl7HeMa_B4AaABAg,5My6jw7CBhw,Телеканал Дождь,1,2,Денис Мурашов,"Это все заговоры автосервисов. Чем глубже лужи,тем больше ремонта и продаж движков.",2020-06-21T08:37:52Z,0
924,Ugx8YKuqGcHl7HeMa_B4AaABAg.9A9hy13VbNG9AGbuqNlnPy,5My6jw7CBhw,Телеканал Дождь,0,0,Gabrielle Grace,нашаманили))),2020-06-24T00:59:41Z,1
925,UgwoY4KqV-VPUO5QYHt4AaABAg,5My6jw7CBhw,Телеканал Дождь,0,0,Спагетти Монстр,надо срочно построить храм...,2020-06-21T08:35:38Z,0
926,Ugy3HPqUr7uTdHJ7Zcp4AaABAg,5My6jw7CBhw,Телеканал Дождь,0,0,Анатолий Mm,"Из каждой ситуации, великие бестолковые, а попросту проплаченные трепачи, вместо того чтобы проконтролировать текущее  состояние канализации их графики чистки. Бестолочей с длинными языками развелось много, а работать не умеют!",2020-06-21T08:32:45Z,0
927,UgzitvdwM0aCih8da2l4AaABAg,5My6jw7CBhw,Телеканал Дождь,0,0,Булат Гумаров,Сейчас ещё сотни миллионов спустят на востановления улиц и плитки))) кто то опять хорошо наживётся на этом,2020-06-21T08:32:29Z,0
928,Ugz4S8Q3SfH9zGm0JmN4AaABAg,5My6jw7CBhw,Телеканал Дождь,0,0,Alien 227807,Главное Собянин брусчатку переложить успел ))))))))))),2020-06-21T08:32:26Z,0
929,Ugyarp2Xh-F58XYWbQt4AaABAg,5My6jw7CBhw,Телеканал Дождь,0,0,Игорь Линд,И в Европе если сильный дождь тоже все топит по колено везде хорошо,2020-06-21T08:31:33Z,0
930,Ugw0w0zVbmV_1qwkG6x4AaABAg,5My6jw7CBhw,Телеканал Дождь,0,0,Валентина Балдина,Бирюков сказал что колодцы были забиты упавшей листвой.  А дворники ежедневно убирающие дворы и улицы зачем.,2020-06-21T08:30:29Z,0
931,Ugx7s14O8YFpe_d6TaN4AaABAg,5My6jw7CBhw,Телеканал Дождь,0,0,Макс Славянский,Жду официальный ответ от бордюр семеныча Длясебянина на подобе вы вы хотите как в Венеции? Московские  коммунальные службы отработали на 146 процентов),2020-06-21T08:30:12Z,0
932,UgzempY5WlKjmE9Hll14AaABAg,5My6jw7CBhw,Телеканал Дождь,0,0,Мария Семёнова,")))) Бог не фраер, его не подкупишь! Кайтесь, грешники, пока не поздно))) То ли ещё будет!",2020-06-21T08:29:15Z,0
