,id,videoId,authorVideoName,totalReplyCount,likeCount,authorDisplayName,textDisplay,publishedAt,isReply
344,Ugy4tPr_zt1TMnFqV_h4AaABAg.99z5-KyW1m899zK2qxkgae,CX7UwF1Hcws,Максим Кац,0,0,nerrain,"Да, закрыта. Из интервью Максима изданию The Village в 17-м году: «Многие люди говорили, что хотят заниматься дворами и лавочками, что муниципальное депутатство — это не политизированная история и они не хотят трогать Путина. Таких людей мы посылали в партию «Справедливая Россия», КПРФ, ЛДПР, ОНФ или самовыдвиженцами. У государства есть большой спрос на аполитизированный активизм, а мы его не поддерживаем. ... Я не хочу помогать человеку, который поддерживает Путина, даже если он хорошо ставит лавочки. Я помогаю тем, кто таких же взглядов, как я. Когда идет война с Украиной и в Сирии какая-то ненужная война, когда мы накладываем сами на себя санкции, нельзя говорить, что мне все по фиг и я буду заниматься лавочками».",2020-06-16T22:28:34Z,1
345,Ugz5UIZVykQUGOstwBt4AaABAg,CX7UwF1Hcws,Максим Кац,0,0,MrAlvital,"Прохоров, Собчак, Кац! Кто следующий?",2020-06-16T20:11:25Z,0
346,UgxDodu9YYffNSfswzp4AaABAg,CX7UwF1Hcws,Максим Кац,0,3,Khabib Gadzhimagomedov,Пора заниматься политикой!,2020-06-16T20:10:10Z,0
347,UgzGp3C3rd72V5sgb_t4AaABAg,CX7UwF1Hcws,Максим Кац,0,1,D U,Топлю за,2020-06-16T20:08:47Z,0
348,Ugywm6h-L79V57ylL1t4AaABAg,CX7UwF1Hcws,Максим Кац,0,1,Kyhulin,Замена Прохорова,2020-06-16T20:07:54Z,0
349,UgzeCIFSx9DoHoWM2Ol4AaABAg,CX7UwF1Hcws,Максим Кац,0,0,Полина Спиридонова,Продано!,2020-06-16T20:06:07Z,0
350,UgxckyztnHXqJ2tms0Z4AaABAg,CX7UwF1Hcws,Максим Кац,0,2,Martha Brown,"Жаль, что в моем городе выборов нет",2020-06-16T20:05:30Z,0
351,Ugy11QhrkawZOLtW_tB4AaABAg,CX7UwF1Hcws,Максим Кац,0,1,Александр Майоров,Спасибо!,2020-06-16T20:04:52Z,0
352,Ugwe_g87ItYHW7weCn54AaABAg,CX7UwF1Hcws,Максим Кац,0,1,Дмитрий Быконя,По разу оставлял заявку на роль волонтера и кандидата и оба раза сайт вылетает,2020-06-16T20:03:40Z,0
353,Ugwq6ZCA8zEb5GM-Nb14AaABAg,CX7UwF1Hcws,Максим Кац,0,1,Даниїл Мавриненко,Вперед!,2020-06-16T20:02:29Z,0
354,UgzlAB2FlHTU6AqB16Z4AaABAg,CX7UwF1Hcws,Максим Кац,1,4,Дмитрий Иванов,"Ребята, а как этот проект сочетается с умным голосованием Навального? Хотелось бы, чтобы мы не конкурировали друг с другом, а были в одной упряжке.",2020-06-16T20:00:35Z,0
355,UgzlAB2FlHTU6AqB16Z4AaABAg.99z36xaFMdJ9A-q0oJQlXh,CX7UwF1Hcws,Максим Кац,0,1,Katherina,"Думаю, будет как в прошлый раз. Когда будут выбирать, за кого голосовать на умном, если будут кацевские, то выберут их, а если не будет, то кого-то другого.",2020-06-17T12:35:53Z,1
356,Ugw0cmxWpBfUDq1qg0h4AaABAg,CX7UwF1Hcws,Максим Кац,6,10,Criolis,"Максим, я вас смотрю всего ничего, но прошу вас, обратите на меня внимание. Я работаю водителем трамвая в СПб. Уже два года из 4х работы в ГУП ГЭТ я пытаюсь улучшить работы нашего транспорта. Честно скажу - идёт ОЧЕНЬ туго, потому что я фактически один пытаюсь сдвинуть десятилетнюю скалу. Но если у вас есть предложения, мнения, или я могу пригодиться (по мере своей же возможности). Или вы можете дать совет как действовать и прочее - ответьте мне. Я полностью поддерживаю вас и Варламова, города нужно делать для людей, а основа таких городов - хороший общественный транспорт. Но его не будет, как бы вы ни старались, потому что наше руководство (специально или нет) разрушает его.",2020-06-16T20:00:03Z,0
357,UgxaepiEFIhp0JqOEGp4AaABAg,CX7UwF1Hcws,Максим Кац,0,1,Руссир,Хорошая идея и реализация,2020-06-16T19:58:58Z,0
358,Ugx28kL7O84_CZJOJ1p4AaABAg,CX7UwF1Hcws,Максим Кац,2,1,Анастасия Тарасова,"Где купить книгу ""100 советов мэру""? У вас на сайте продана эта книга, также в ""читай город"" нет:(",2020-06-16T19:57:44Z,0
359,Ugx28kL7O84_CZJOJ1p4AaABAg.99z2nC0QyTs99zD4m8VjsG,CX7UwF1Hcws,Максим Кац,0,0,Анастасия Тарасова,"@nerrain, омг, большое спасибо (◍•ᴗ•◍)✧*。",2020-06-16T21:27:39Z,1
360,Ugx28kL7O84_CZJOJ1p4AaABAg.99z2nC0QyTs99zAk790WAa,CX7UwF1Hcws,Максим Кац,0,1,nerrain,"Максим писал, что очень скоро выйдет переиздание, так что не переживайте.",2020-06-16T21:07:13Z,1
361,UgxaYZz14FGfrZ1ONQF4AaABAg,CX7UwF1Hcws,Максим Кац,0,1,denisgn,"Спасибо Вам Максим, за то что вы делаете!",2020-06-16T19:57:26Z,0
362,Ugywgr0WA1LOsOoDleV4AaABAg,CX7UwF1Hcws,Максим Кац,0,1,Сергей Дедов,+,2020-06-16T19:57:23Z,0
363,UgweZwHWUNXZZx94W5B4AaABAg,CX7UwF1Hcws,Максим Кац,0,0,Angry Mum,"«Влиять на улучшение из дум можно очень существенно» - серьезно? Живу в Москве, у нас в районе идет незаконная стройка (и не только в нашем районе). С января, как началась подготовка к этому безобразию, и об этом узнали жители, которые стали возмущаться, нам пытаются помочь один муниципальный депутат из «Яблока» (остальные 10 у нас из ЕР), и несколько из Мосгордумы (конкретно Митрохин, Бунимович и Ступин) – и стройка 11 мая все равно началась… В итоге, да, все видят, что они пытаются помочь, но толку никакого нет!",2020-06-16T19:57:06Z,0
364,Ugxd24AGpSo37M7qjDN4AaABAg,CX7UwF1Hcws,Максим Кац,0,1,Алексей Иванов,Нет спасибо - обойдемся без клоунады. Кац что то слишком активно топит за явку...,2020-06-16T19:55:58Z,0
365,UgzW4xS3h-R65EtgjEF4AaABAg,CX7UwF1Hcws,Максим Кац,0,0,Хава Салгираева,Не могу избавится от мыслей что этот человек очень странный и мутный тип . Его слова его манера разговора его вид кажутся мне очень странными сомнительными и неискренними. Почему!!!!,2020-06-16T19:52:53Z,0
366,UgyJXjsaClLGL3FfKZJ4AaABAg,CX7UwF1Hcws,Максим Кац,0,0,Мария Силкина,"Понятно, отвлёк кота вчера от монтажа большого ролика, чтобы он тебе политические очки на дебатах зарабатывал. Мухлежник)",2020-06-16T19:51:13Z,0
367,UgyoYRgEEmTK9D0xNMd4AaABAg,CX7UwF1Hcws,Максим Кац,1,1,Ivan Knyazev,"Регионы это круто, будем наблюдать",2020-06-16T19:51:06Z,0
368,UgyoYRgEEmTK9D0xNMd4AaABAg.99z21WOPCnu99z2BGwOtOA,CX7UwF1Hcws,Максим Кац,0,0,Ivan Knyazev,"Кстати очень странно что этим не занимается навальный, хотя он наверное может привлечь больше противодействия",2020-06-16T19:52:25Z,1
369,UgyKHWk_kNaQP1GGgZ54AaABAg,CX7UwF1Hcws,Максим Кац,0,1,Андрей Демин,Кто там в телеге на вас бочку катит? Что за сволочь?,2020-06-16T19:48:26Z,0
370,UgyyNd98pr_UidlNh-94AaABAg,CX7UwF1Hcws,Максим Кац,0,0,Anastasia Novikova,Для продвижения,2020-06-16T19:47:45Z,0
371,Ugx-QEbWJ4eN2UBWV2R4AaABAg,CX7UwF1Hcws,Максим Кац,0,1,Ilya Grigoriev,Может и в Химки заглянете? :D,2020-06-16T19:45:59Z,0
372,UgxWEXiHxsK_pjx330N4AaABAg,CX7UwF1Hcws,Максим Кац,0,0,Ксения Закирова,"А я в своё время бесплатно подписи собирала... Эх, были времена 😂",2020-06-16T19:44:04Z,0
373,Ugz7FWDyoIaFpOMDg_x4AaABAg,CX7UwF1Hcws,Максим Кац,0,0,Dmitry Nikolaev,"На 3:38 почему-то показали Потупчик. Ой, это и правда Беседина.",2020-06-16T19:43:14Z,0
374,UgxazHbTxIJOdh3_cVV4AaABAg,CX7UwF1Hcws,Максим Кац,0,0,Павел Кириллов,"О, ну поехали",2020-06-16T19:43:07Z,0
375,UgyK7JAQl8HzI0Hf7Y54AaABAg,CX7UwF1Hcws,Максим Кац,0,0,Витя,"По моему мнению, если избираться в более малых городах, то влияния будет больше, поскольку представители позиции Едра в  городах-миллионниках пытаются сильнее игнорировать либеральную",2020-06-16T19:41:40Z,0
376,UgyLrYxdSCxCMRkQMJt4AaABAg,CX7UwF1Hcws,Максим Кац,0,1,Max Nomax,"Калуга, Орёл... а можно не обходить Тулу кругами?)",2020-06-16T19:41:01Z,0
377,UgzgR1dSZSRVJnlzW894AaABAg,CX7UwF1Hcws,Максим Кац,0,0,Сергей Дрозд,"Я за сильную оппозицию, против лидеров 10 процентов.",2020-06-16T19:38:55Z,0
378,UgwSIDNSg_A15Di8ISd4AaABAg,CX7UwF1Hcws,Максим Кац,0,1,Виталий Балдеев,"Кот тоже вчера устал, даже на полку не пришел.",2020-06-16T19:38:41Z,0
379,UgwuUKroagik8zhY8wB4AaABAg,CX7UwF1Hcws,Максим Кац,0,0,Tom Cat,Кац и Шлоберг это как Троцкий и Каменев?),2020-06-16T19:37:46Z,0
380,Ugz9Ed0X7eVs8YQ-kcl4AaABAg,CX7UwF1Hcws,Максим Кац,0,1,Денис Лебедев,"Почему-то после заполнения всех возможных полей и нажатия ""участвовать"" пишет, чтобы я выбрал город из списка, но я и так выбрал... Надеюсь эта ошибка скоро исчезнет..",2020-06-16T19:37:14Z,0
381,Ugw4ncQ1wO6ICMtnBZR4AaABAg,CX7UwF1Hcws,Максим Кац,0,6,Игнат Ситников,"Причина короткого ролика железобетонная, Макс! Все вопросы снял!",2020-06-16T19:36:45Z,0
382,Ugz7Yk8yZTd2PZKD1vd4AaABAg,CX7UwF1Hcws,Максим Кац,0,1,Kootikobormotik,Спасибо большое за контент!!,2020-06-16T19:36:19Z,0
383,UgysPLc-9-haU5UjhmV4AaABAg,CX7UwF1Hcws,Максим Кац,0,0,smirnovstudio,Кац предлагает победить,2020-06-16T19:36:16Z,0
384,UgzdDO6OQr0yVnME0F94AaABAg,CX7UwF1Hcws,Максим Кац,0,2,Алекс G,Чисто для продвижения,2020-06-16T19:34:47Z,0
385,UgwD-frcQyHmcDeU2lV4AaABAg,CX7UwF1Hcws,Максим Кац,0,1,Аэро Анапа,Я пойду на своё м.о. шансы вполне реальные у меня,2020-06-16T19:33:47Z,0
386,UgyzrCDZ5xlUBTzQMlR4AaABAg,CX7UwF1Hcws,Максим Кац,3,0,Andrey Pravdivtsev,"Пора заниматься политикой!

Поздравляю с отличными дебатами. Понимаю, как легко забыть все, когда в прямом эфире. Дальше будет только лучше. В вашей позиции много сильный моментов и далеко не все были высказаны. 

Пора продолжать заниматься политикой!

Пригласите Викторию Гарсия-Берналь на дебаты! Она выпустила занимательный разбор ваших дебатов с Алексеем.
Оправдания про хайп тут быть не может, а дискуссия должна быть более жесткой. Все слабые позиции обеих сторон озвучены и два человека заявляющих о логичности своих позиций могут подготовиться и выстроить более серьезную аргументацию. 
Надеюсь увидеть эти дебаты.

PS Если у вас еще нет, то приобретите наушники SENNHEISER PC 8 USB, либо я могу их им вам заказать. Пользуюсь уже много-много лет",2020-06-16T19:33:13Z,0
387,UgyzrCDZ5xlUBTzQMlR4AaABAg.99z-zYyGNxE99z6prAdyX6,CX7UwF1Hcws,Максим Кац,0,0,Andrey Pravdivtsev,"@nerrain У меня написано ""занимательный"" а не ""замечательный"", как у вас",2020-06-16T20:33:03Z,1
388,UgyzrCDZ5xlUBTzQMlR4AaABAg.99z-zYyGNxE99z6g3VgAZI,CX7UwF1Hcws,Максим Кац,0,0,Andrey Pravdivtsev,"@nerrain  я с вами почти полностью согласен, поэтому и считаю, что им правильно будет поговорить онлайн, а не в твитере попереписываться. Пусть и покажет свои зубки в открытом диалоге, а не в удобно ей смонтированном ролике. 
У них примерно одинаковый размер аудитории, никто не должен быть в накладе",2020-06-16T20:31:43Z,1
389,UgyzrCDZ5xlUBTzQMlR4AaABAg.99z-zYyGNxE99z5_0At67l,CX7UwF1Hcws,Максим Кац,0,1,nerrain,"Ничего замечательного не вижу, она довольно злая и непоследовательная. Говорит, что у Максима плана нет, что очень плохо, а про то, что его ни у кого нет, молчит. Не люблю таких двуличных людей. Алексей при всех его некоторых ошибках хотя бы искренний и честный.",2020-06-16T20:22:01Z,1
390,UgyqR1pYAF6bGbKB9BR4AaABAg,CX7UwF1Hcws,Максим Кац,0,1,Dimitry Rusu,Когда уже что-нибудь в Подмосковье проходить будет!!,2020-06-16T19:32:54Z,0
391,UgxMkpmkZfbXnHcOe4B4AaABAg,CX7UwF1Hcws,Максим Кац,1,0,Р Г,"А есть смысл помогать своим вне Москвы? Смысл, конечно, есть, но урбанист на месте ничего сделать не сможет, поскольку бюджет выделяется с центра после перераспределения. В результате получится что нужные люди есть, а на велодорожки денег нет. Или я не прав?",2020-06-16T19:29:03Z,0
392,UgxMkpmkZfbXnHcOe4B4AaABAg.99z-W1EtKAa99z-xRNRu6R,CX7UwF1Hcws,Максим Кац,0,0,shtempel,Будет давление на власть,2020-06-16T19:32:55Z,1
393,UgyScexMSZvPE2ZGLy14AaABAg,CX7UwF1Hcws,Максим Кац,0,2,NataLisa,Поддерживающий комментарий!,2020-06-16T19:28:14Z,0
394,Ugw8d-OlyAnCgmAvs8l4AaABAg,CX7UwF1Hcws,Максим Кац,1,6,EmeJ1R,"У меня 1 вопрос.
Что такого либерального в ролике Варламова про трамвай?
На мой взгляд там здравый смысл один. 
По другому тупо нет выхода. Просто будет стоять всё Садовое и центр.
З.Ы. В ролике про трамваи тема велодорожек не раскрыта.)))",2020-06-16T19:27:06Z,0
395,Ugw8d-OlyAnCgmAvs8l4AaABAg.99z-Hm3ZKoA99z2d00Nf94,CX7UwF1Hcws,Максим Кац,0,1,Ksenia Izilanova,согласна про велодорожки!!)),2020-06-16T19:56:21Z,1
396,Ugzv7zGaEgH0XlNiLtZ4AaABAg,CX7UwF1Hcws,Максим Кац,0,1,Александр Максименков,Хорошо вчера получилось!,2020-06-16T19:26:30Z,0
397,UgyKKHdEFhPr0lqTKKF4AaABAg,CX7UwF1Hcws,Максим Кац,0,0,Konstantin,"вот такие короткие-норм. И с выражением читаете- уже лучше. Но поменьше-бы мыслей-вставок, и помедленнее пожалуйста.)",2020-06-16T19:26:15Z,0
398,UgzPen1inMIuo_oJCzR4AaABAg,CX7UwF1Hcws,Максим Кац,0,0,Sæmundar edda,"Блин Максим, смотрела долго канал новости сверхдержавы, нравился этот канал, а недавно он выпустил видео где гонит на тебя как навальный
Ну ебана
Оппозиция не ссорьтесь",2020-06-16T19:24:53Z,0
399,UgzrQq8ufBgVBdddTCx4AaABAg,CX7UwF1Hcws,Максим Кац,0,1,Денис Белоусов,Ооо! Самара! Мой город! Ура!,2020-06-16T19:23:21Z,0
400,UgzSwgfrIp6OyXum24F4AaABAg,CX7UwF1Hcws,Максим Кац,0,1,Павел Каширцев,"Не согласен с вашей аргументаций, и недавние дебаты лишь подтвердили это . Тактика « оно само» очень смешная , зачем идти голосовать , если отследить голос будет невозможно да и здоровьем рисковать . Я лучше схожу на митинг , постою в пикете , но не буду делать то , что просит Кремль . А ваша позиция только на руку Путину .",2020-06-16T19:20:03Z,0
401,UgzmEI-OW0GmcfZUMId4AaABAg,CX7UwF1Hcws,Максим Кац,0,5,Во имя Розы,Молодцы. Правильной дорогой идете. Буду голосовать за того кого порекомендуете из моего города.,2020-06-16T19:18:52Z,0
402,Ugwawf8GwsWYrTYsWvt4AaABAg,CX7UwF1Hcws,Максим Кац,0,1,Паша Исмаилов,"Макс, где контент, опять политика?))",2020-06-16T19:18:29Z,0
403,UgyLeTXgCsvGFS-blIB4AaABAg,CX7UwF1Hcws,Максим Кац,0,1,Anastasiya Protsenko,Очень жду книжечку :),2020-06-16T19:18:21Z,0
404,UgxfaP5KK-t7AXvMGxt4AaABAg,CX7UwF1Hcws,Максим Кац,1,1,ForComfortLiveSmolensk,А почему Смоленск не попал в эти 14 городов? =)),2020-06-16T19:17:08Z,0
405,UgxfaP5KK-t7AXvMGxt4AaABAg.99yz8l88WOr9A-H3KUuDd1,CX7UwF1Hcws,Максим Кац,0,0,Инга Сюсюра,"В разное время выборы в городах, посмотрите когда в вашем городе будут",2020-06-17T07:21:39Z,1
406,UgwNNNxP8nYagtLbtvF4AaABAg,CX7UwF1Hcws,Максим Кац,0,0,Sputnik WoT,"Пойду лучше новую Конституцию куплю. А вы голосуйте, голосуйте.",2020-06-16T19:16:24Z,0
407,Ugx3EVOCMH2wxpoktL54AaABAg,CX7UwF1Hcws,Максим Кац,0,0,fandom fandowgins,"Просто интересно через какое время сторонники Навального накопают на тебя компромат, о том как из хуютинского гадюшника твоё мнение считают рациональным, и исходя из этого скажут что ты куплен",2020-06-16T19:15:15Z,0
408,UgzJAu-NqkTr8OtCiBt4AaABAg,CX7UwF1Hcws,Максим Кац,0,0,Утка Пшик,Просрал дебаты😔,2020-06-16T19:14:53Z,0
409,UgzsAR2gyMU49kjs8Mp4AaABAg,CX7UwF1Hcws,Максим Кац,0,1,Dmitry Xhvdr,Поддержим этого господина.,2020-06-16T19:13:45Z,0
410,Ugx2a5jI8ddLf9-nkgJ4AaABAg,CX7UwF1Hcws,Максим Кац,0,0,bearg,"в Перми украли троллейбусы, но зато парковки платные лол и пилят бюджет на трамвайчике, когда надо переделывать его в метротрам",2020-06-16T19:11:35Z,0
411,Ugx_vZjM59AdCKGuWSN4AaABAg,CX7UwF1Hcws,Максим Кац,0,0,Елизавета Чернобахтова,"Максим, вот чем вы так мне нравитесь, так это позитивной повесткой, предложением сделать что-то конкретное и понятное.

Критика существующей власти тоже нужна, но сейчас она не производит такого впечатления на людей, как могла бы в здоровой политической системе. Нужна вера в возможность перемен.",2020-06-16T19:10:36Z,0
412,UgxlR2Yv8f4MgDgP87F4AaABAg,CX7UwF1Hcws,Максим Кац,3,0,bearg,"а если либерал и за зеро вижн, но АДЕКВАТНОЕ и против геноцида автомобилистов?",2020-06-16T19:09:57Z,0
413,UgxlR2Yv8f4MgDgP87F4AaABAg.99yyK8lkRrg99z14s5aj7t,CX7UwF1Hcws,Максим Кац,0,0,nerrain,"@bearg платили пробками, когда они ехали на общественном транспорте, узкими неудобными тротуарами, отсутствием приятных глазу дворов, зелени, своими заболеваниями лёгких, другими неудобствами, общей некрасивостью и унылостью города, где в основном асфальт и машины. Геноцид - это убийство, если вы такие сильные определения используете для того, что теперь делают практически во всех европейских городах, то вряд ли вы подойдёте.",2020-06-16T19:42:49Z,1
414,UgxlR2Yv8f4MgDgP87F4AaABAg.99yyK8lkRrg99z-8WIdmN3,CX7UwF1Hcws,Максим Кац,0,0,bearg,"@nerrain ахах и как они платили? Геноцид это истребление, выдавливание частного из города административными мерами (репрессиями).",2020-06-16T19:25:50Z,1
415,UgxlR2Yv8f4MgDgP87F4AaABAg.99yyK8lkRrg99yylyijxzu,CX7UwF1Hcws,Максим Кац,0,0,nerrain,"Смотря как вы оцениваете адекватность. Раньше за ваш автомобиль платили во многом пешеходы, теперь будете платить вы. Это будет дороже, но при чём тут геноцид?",2020-06-16T19:13:53Z,1
416,Ugzc4SwTpVkCkoeBWuV4AaABAg,CX7UwF1Hcws,Максим Кац,1,0,Astrey Rize,"А что будет канлилат, когда его выбирут? Он будет продвигать ваши с Ильей идеи в ответ на помощь в выборах?",2020-06-16T19:08:24Z,0
417,Ugzc4SwTpVkCkoeBWuV4AaABAg.99yy8m5Evm299yyU0PVDli,CX7UwF1Hcws,Максим Кац,0,0,Radna,"На сайте все написано, местный депутат полностью независимый человек, но предполагается что вы решаясь на эту затею разделяете взгляды «Городских проектов» и партиций Яблоко.",2020-06-16T19:11:18Z,1
418,UgwqrX67AY2x0s9BVg14AaABAg,CX7UwF1Hcws,Максим Кац,0,1,pstevens,"Макс, ну хватит.",2020-06-16T19:08:22Z,0
419,UgxSpwzK3QB3s_12ZqR4AaABAg,CX7UwF1Hcws,Максим Кац,0,1,Niki Fallin,"блин, только узнал о тебе вчера - восхитился. Потом псмотрел на разоблачение, которое хорошее или нет но с пруфами... потом подумал, что вроде же ты норм вещи говоришь. 
И тут ты опять блять говоришь о том, что ты с кудрявой шлюхой - Варламовым возишься... КЛАССС!! Молодец, в том же духе продолжай, пусть он наебывает людей лижет очко власти а ты ему! круто блять",2020-06-16T19:05:38Z,0
