,id,videoId,authorVideoName,totalReplyCount,likeCount,authorDisplayName,textDisplay,publishedAt,isReply
772,UgzMTXtlrEZYQkInnwZ4AaABAg,CX7UwF1Hcws,Максим Кац,0,5,Anastasia ***,"Боты на месте!:) Максим, спасибо за крутые видосы и инициативность!",2020-06-16T16:51:00Z,0
773,Ugxgfxc2egZGxlmY5UV4AaABAg,CX7UwF1Hcws,Максим Кац,0,1,Арман э,Крутое видео,2020-06-16T16:50:53Z,0
774,UgxE54YhCykDtMVQJVF4AaABAg,CX7UwF1Hcws,Максим Кац,0,0,Anastasia ***,"21k просмотров и 252 комментария за полчаса! Кацеботы, красавчики! ;)",2020-06-16T16:50:15Z,0
775,UgwQnDmqAr1KfVNpYNl4AaABAg,CX7UwF1Hcws,Максим Кац,0,1,Евгений Nosurname,Видео 5 минут. Максим совсем обленился,2020-06-16T16:49:40Z,0
776,UgzTEnSuEmMOfRjvY4d4AaABAg,CX7UwF1Hcws,Максим Кац,0,0,Julia Sun,Активность активность активность 👍,2020-06-16T16:49:28Z,0
777,UgwF4DRRGQANNbbwMd54AaABAg,CX7UwF1Hcws,Максим Кац,0,1,Пётр Сиренко,Офигенная инициатива,2020-06-16T16:49:22Z,0
778,UgxfoN4yHNVir7JHH1Z4AaABAg,CX7UwF1Hcws,Максим Кац,0,1,Аркадий Макаров,В Уфе подобное планируется?,2020-06-16T16:48:40Z,0
779,Ugy_RnuuO-NnC1pH3Y54AaABAg,CX7UwF1Hcws,Максим Кац,0,1,Tochnyy 50,"Либеральных взглядов))) левачьки слились (Ну на самом деле Максим либерал и продвигать будет либералов, логично да)",2020-06-16T16:48:40Z,0
780,UgyJXIDLwTQy7r7Uoy54AaABAg,CX7UwF1Hcws,Максим Кац,0,1,Александр Аксенов,Хорошее дело...,2020-06-16T16:47:56Z,0
781,UgwlqClEapAoHieLYgJ4AaABAg,CX7UwF1Hcws,Максим Кац,0,0,Daria Ber,"Ютьюб, давай рекомендуй уже другим",2020-06-16T16:47:51Z,0
782,UgxVi20bmXKdqsx2kUh4AaABAg,CX7UwF1Hcws,Максим Кац,0,1,Мисс Матрешка,"Думала, Макс устал вчера, хватит ли энергии на сегодняшний выпуск?.. Хватило)) Единственный блогер, которому ставлю лайки ещё до просмотра сюжетов, респект😅👍",2020-06-16T16:46:32Z,0
783,UgzF57tgFtvs2UFypGp4AaABAg,CX7UwF1Hcws,Максим Кац,0,0,FarXo,"Я бы стал политиком, но туда берут только своих",2020-06-16T16:46:15Z,0
784,Ugwm1RcbsjLwGoNwh4J4AaABAg,CX7UwF1Hcws,Максим Кац,0,0,Kvazar,Больше политиков богу политики.,2020-06-16T16:46:14Z,0
785,UgwyXk5PFyFoYbuRoc94AaABAg,CX7UwF1Hcws,Максим Кац,0,10,Дмитрий Славский,"Максим, покажите пожалуйста кота!",2020-06-16T16:45:54Z,0
786,UgySI01fGI0XBpWqMCN4AaABAg,CX7UwF1Hcws,Максим Кац,0,0,Надежда,"Подскажите, будете ли вы делать аналогичные кампании в городах Подмосковья?",2020-06-16T16:45:40Z,0
787,Ugzy55aESZU-4Hrm9x54AaABAg,CX7UwF1Hcws,Максим Кац,0,0,Михаил Сычёв,Видео Максима в массы!,2020-06-16T16:45:20Z,0
788,UgwmVM8C5cEVLK6PiwJ4AaABAg,CX7UwF1Hcws,Максим Кац,4,11,danon danonov,"удачи завтра на Эхе, Максим :)",2020-06-16T16:45:13Z,0
789,UgwmVM8C5cEVLK6PiwJ4AaABAg.99yhl8xVoIa99yr4MVIZ4Z,CX7UwF1Hcws,Максим Кац,0,1,Anastasia ***,@danon danonov спасибо!,2020-06-16T18:06:37Z,1
790,UgwmVM8C5cEVLK6PiwJ4AaABAg.99yhl8xVoIa99ymEIZGoQu,CX7UwF1Hcws,Максим Кац,0,2,mochaon,Дааа Максим у Жукова завтра в Условно ваш!,2020-06-16T17:24:17Z,1
791,UgwmVM8C5cEVLK6PiwJ4AaABAg.99yhl8xVoIa99yiYpvyMP6,CX7UwF1Hcws,Максим Кац,0,3,danon danonov,"@Anastasia *** а вот не знаю чего Максим не анонсирует, в сетке Эха Москвы стоит эфир в гостях у Егора Жукова завтра в 16:06 по Москве",2020-06-16T16:52:08Z,1
792,UgwmVM8C5cEVLK6PiwJ4AaABAg.99yhl8xVoIa99yi3L-QgoI,CX7UwF1Hcws,Максим Кац,0,0,Anastasia ***,а что будет? я всё пропустила,2020-06-16T16:47:50Z,1
793,UgyLRmkPoFzoIIVQUUF4AaABAg,CX7UwF1Hcws,Максим Кац,0,1,Sæmundar edda,Максим будь нашим президентом,2020-06-16T16:44:59Z,0
794,Ugxm-vGFalfNoIVrPrh4AaABAg,CX7UwF1Hcws,Максим Кац,0,1,Светлана Шляпникова,Когда вы в Перми будете?,2020-06-16T16:44:52Z,0
795,UgxbqkzD4n6CD7ccvN14AaABAg,CX7UwF1Hcws,Максим Кац,1,0,Sergei D,"Максим, нужны короткие видео на такие темы всегда, не все высидят 30 минут. Если видео про историю или какая то не столь срочная тема можно и побольше.",2020-06-16T16:44:50Z,0
796,UgxbqkzD4n6CD7ccvN14AaABAg.99yhiJPBbEN99z6sbmXkn6,CX7UwF1Hcws,Максим Кац,0,0,nerrain,"Длинные тоже нужны, всякие видео нужны :) Максим писал, что изучал, сколько процентов досмотрели его длинные видео до конца - столько же, сколько короткие.",2020-06-16T20:33:26Z,1
797,UgwCf2FUQkC8tb3jATx4AaABAg,CX7UwF1Hcws,Максим Кац,0,1,Sæmundar edda,Ещё комментарий для продвижения,2020-06-16T16:44:46Z,0
798,Ugyo6yV8F2H6iAz7eEN4AaABAg,CX7UwF1Hcws,Максим Кац,0,0,Андрей Уваров,ДНО,2020-06-16T16:44:44Z,0
799,UgzFSGALJ2ZP1OA6G954AaABAg,CX7UwF1Hcws,Максим Кац,0,0,Почему Потому что,Просто комментарий для продвижения ролика.,2020-06-16T16:44:42Z,0
800,Ugz0doLiUL1JJomK1wJ4AaABAg,CX7UwF1Hcws,Максим Кац,0,1,Sæmundar edda,Эх. Как жаль что я не живу ни в одном из городов из списка,2020-06-16T16:44:40Z,0
801,Ugx6aXCAEI3FsSKwI7p4AaABAg,CX7UwF1Hcws,Максим Кац,0,0,Paris,Кац - наш кандидат! Лайк!,2020-06-16T16:43:49Z,0
802,Ugws64nERKZslResVaZ4AaABAg,CX7UwF1Hcws,Максим Кац,0,11,Djedayd,"Муниципальные выборы очень важны, потому что на них легче всего выиграть. А если взять большинство в таких городах как Москва, то можно едроса до выборов мэра не допустить, так как он не пройдет муниципальный фильтр",2020-06-16T16:43:28Z,0
803,Ugyt-RRgwYxqv7PKYVN4AaABAg,CX7UwF1Hcws,Максим Кац,0,0,Дима Козюров,"У нас в Челябинске нельзя избраться на прямую в Челябинскую Городскую Думу. Нужно выиграть муниципальные выборы и из числа избранных муниципальных депутатов будут выбраны самими же муниципальными депутатами  депутаты гордумы, а гордума в свою очередь выбирает мэра. Осенью 2019 прошли муниципальные выборы и к сожалению большинство получила Единая Россия и соответственно сформировала свою гордуму.",2020-06-16T16:42:59Z,0
804,UgwGk_lwjMg8L2W0iIN4AaABAg,CX7UwF1Hcws,Максим Кац,0,1,Ольга Руднева,Вот это реальные действия!,2020-06-16T16:42:43Z,0
805,UgzAv_0Vrr1KxBVIgKR4AaABAg,CX7UwF1Hcws,Максим Кац,0,5,Юлия Юрченко,"Прекрасная идея, баллотироваться я не собираюсь, но с радостью помогу для того чтобы сделать мой город лучше",2020-06-16T16:42:19Z,0
806,UgyjiXuMZgtB-hrrtbp4AaABAg,CX7UwF1Hcws,Максим Кац,0,4,Плюшевый Кот,Отдохните:),2020-06-16T16:42:16Z,0
807,Ugwv8om40fX3nUMNok14AaABAg,CX7UwF1Hcws,Максим Кац,0,7,konradi,"В топ! Все на выборы! 
Иначе так и останемся терпилами молчунами-ворчунами",2020-06-16T16:41:56Z,0
808,UgxKw-GJyUB7-Ka5APB4AaABAg,CX7UwF1Hcws,Максим Кац,0,1,Артём Карпухин,Лайк за Орёл! Городу нужны молодые мозги),2020-06-16T16:41:44Z,0
809,UgxrHLUxxN_DIIpFIiB4AaABAg,CX7UwF1Hcws,Максим Кац,0,6,Pavel Kalashnikov,Удивительная работоспособность! Так держать! Но не перетрудитесь.,2020-06-16T16:41:37Z,0
810,UgyBj2SPvxAHDzuOOcJ4AaABAg,CX7UwF1Hcws,Максим Кац,0,0,Sasha Enough,"Сорь, не мой город и со спонсорством не помочь((( 
Ну хоть комментарий и личная любовь)",2020-06-16T16:41:26Z,0
811,UgyXZCC8ijvTJA2lgVd4AaABAg,CX7UwF1Hcws,Максим Кац,0,0,Иван Чемоданов,"Очень Круто, нужно подтягивать регионы и показывать людям, что мы можем и должны жить лучше",2020-06-16T16:41:21Z,0
812,UgwItfzjpsrHbAkUglR4AaABAg,CX7UwF1Hcws,Максим Кац,0,1,zemamba,Всем выйти из Сумрака!,2020-06-16T16:41:10Z,0
813,UgyQ2j2nJGCurnHvfcl4AaABAg,CX7UwF1Hcws,Максим Кац,0,0,Daria Di,что с Волгоградом?))),2020-06-16T16:41:09Z,0
814,UgzL13A9VlSjW8kY8Dx4AaABAg,CX7UwF1Hcws,Максим Кац,0,0,Ясос Биба,Го го го!,2020-06-16T16:41:07Z,0
815,UgyBcVu5KWRK7g1f1oZ4AaABAg,CX7UwF1Hcws,Максим Кац,1,1,Butterfly,"Очень странно что ты акцентировал внимание на либеральных взглядах. Безусловно лично для меня это более приближённые ко мне взгляды, но мне не понравилось что именно они. Что вот другие взгляды полная хрень (хотя НЕКОТОРЫЕ имеют право на существование), а наши это единственный путь развития.",2020-06-16T16:40:01Z,0
816,UgyBcVu5KWRK7g1f1oZ4AaABAg.99yhA-5_s7_99yhfWwm902,CX7UwF1Hcws,Максим Кац,0,0,Аmira Sr,"Он ищет людей, которые будут продвигать его взгляды. Логично что они должны совпадать))",2020-06-16T16:44:27Z,1
817,UgwaH9KBF1yOKEtHZQB4AaABAg,CX7UwF1Hcws,Максим Кац,0,15,andrei brovkin,"я буду"" топить"" за вас!!!  я все сказал.",2020-06-16T16:39:58Z,0
818,UgylGmXI4xrHYsBoJyJ4AaABAg,CX7UwF1Hcws,Максим Кац,0,1,Yuriy Maximov,Этот канал выражает благодарность эпидемии за оказанную возможность спокойно работать дистанционно пиля отличные выпуски .,2020-06-16T16:38:21Z,0
819,UgxeyY16QjQuWrAZ04l4AaABAg,CX7UwF1Hcws,Максим Кац,0,2,Marina B,Здорово! Поддерживаю вашу стратегию)),2020-06-16T16:38:05Z,0
820,Ugw61AGVHP10-fmJBN94AaABAg,CX7UwF1Hcws,Максим Кац,0,0,Мару Сь,"Люди говорящие хуйню о либеральных взглядах, вы ничего о них не знаете либо вам нравится быть рабами.",2020-06-16T16:38:05Z,0
821,UgwQGAXHxb_hczl0Hfl4AaABAg,CX7UwF1Hcws,Максим Кац,0,1,neveraskforthis,ВАРЛАМОВ 2024,2020-06-16T16:38:03Z,0
822,Ugx3cRspSF8wTGv5DVN4AaABAg,CX7UwF1Hcws,Максим Кац,0,0,Кирилл Соловьев,"Большое спасибо за ролики, ток хотел попросить вернуть прошлое время публикации, я раньше ложился спать посмотрев ваше видео, а теперь приходится ждать поздней ночи, (Хабаровск)",2020-06-16T16:35:51Z,0
823,UgxkFwfw1_Gm3AVwdjB4AaABAg,CX7UwF1Hcws,Максим Кац,0,0,Andrei Artamonov,"Шутка про то, что я бот, еще актуальна?",2020-06-16T16:35:47Z,0
824,UgwF09_g9n55DAlAY0d4AaABAg,CX7UwF1Hcws,Максим Кац,3,2,Супер Кроссы,"*Всё в наших руках! Самый большой миф в России - это то, что мы никогда не сможем жить богато, счастливо и хорошо. Многие развитые страны до недавнего времени тоже были бедными, но они смогли выбраться из этой ямы. И мы сможем! Слава России 🇷🇺🇷🇺🇷🇺*",2020-06-16T16:35:35Z,0
825,UgwF09_g9n55DAlAY0d4AaABAg.99ygeV8YCBQ99yjaGkHpyQ,CX7UwF1Hcws,Максим Кац,0,0,Palladin,"@Супер Кроссы практика показывает что если ты прозападная(а значит так или иначе проамериканская) страна, то рано или поздно начинаются подвижки в плане выше обозначенных вещей. Китай пошел своим путем...но то Китай. И то...даже Китай вынужден был наладить отношения с Западом для экономического роста.",2020-06-16T17:01:13Z,1
826,UgwF09_g9n55DAlAY0d4AaABAg.99ygeV8YCBQ99yhiI0THAC,CX7UwF1Hcws,Максим Кац,0,1,Супер Кроссы,"@Palladin Поверь, дело не только в финансовой помощи, если бы они сами ничего не делали, если бы они не поменяли свою систему, то ничего бы не помогло. Финляндия до 1970-ых годов была довольно коррумпированной страной, без честных судов и прочих инклюзивных институтов власти. Большой финансовой помощи тоже не было, они перестроили свою систему. России тоже нужно это: создание независимого честного суда, массовая приватизация, борьба с коррупцией и бюрократией, честная конкуренция в плане бизнес сфере, а также и в политике, интеграция в европейскую торговую зону.",2020-06-16T16:44:50Z,1
827,UgwF09_g9n55DAlAY0d4AaABAg.99ygeV8YCBQ99ygwQRQysx,CX7UwF1Hcws,Максим Кац,0,0,Palladin,Ну все крупные страны которые вышли из нищеты за последние лет 40-50 либо дружили со штатами или были Китаем.,2020-06-16T16:38:01Z,1
828,UgzwjGAVmnk0b0xZu0p4AaABAg,CX7UwF1Hcws,Максим Кац,0,7,Sergey Hazan,Максим поражаюсь вашей работоспособностью:)),2020-06-16T16:35:16Z,0
829,Ugyiqn_lyjmnpAcsbTZ4AaABAg,CX7UwF1Hcws,Максим Кац,0,12,Кирилл Соловьев,"Большое спасибо за ролики, ток хотел попросить вернуть прошлое время публикации, я раньше ложился спать посмотрев ваше видео, а теперь приходится ждать поздней ночи, (Хабаровск)",2020-06-16T16:35:08Z,0
830,UgzjHxB7FrNxLAJqfZR4AaABAg,CX7UwF1Hcws,Максим Кац,4,86,Алкесандр,"Нравится мне это ""До завтра"" в конце каждого видео.
Начинаешь верить, что это завтра наступит и оно будет светлым))",2020-06-16T16:35:04Z,0
831,UgzjHxB7FrNxLAJqfZR4AaABAg.99ygajNfWcR9A2OJDbt3aC,CX7UwF1Hcws,Максим Кац,0,0,Алина Китаева,А с новыми поправками то как заживем!,2020-06-18T12:22:43Z,1
832,UgzjHxB7FrNxLAJqfZR4AaABAg.99ygajNfWcR9A-kllQjttK,CX7UwF1Hcws,Максим Кац,0,1,Трындеж сидя на стуле в убогой панельке,"@CT-2310-83 3axap во-первых, у вас плохое представление о либеральной идее(советую почитать все таки что это такое и вы поймете, что президент никакой не либерал), а во-вторых какая вам идея ближе? что вы предлагаете?",2020-06-17T11:50:00Z,1
833,UgzjHxB7FrNxLAJqfZR4AaABAg.99ygajNfWcR99zzUtIdTRe,CX7UwF1Hcws,Максим Кац,0,0,CT-2310-83 3axap,"Не, оно реально такое, прикольное.
Но вот сама либеральная идея... На хрена нам второй Путин, вот честно?",2020-06-17T04:39:23Z,1
834,UgzjHxB7FrNxLAJqfZR4AaABAg.99ygajNfWcR99zjtdGj9Wi,CX7UwF1Hcws,Максим Кац,0,0,Vitali Kobets,Порой из его уст оно звучит как-то угрожающе,2020-06-17T02:23:06Z,1
835,UgzVgw-EPhMDczV1sBN4AaABAg,CX7UwF1Hcws,Максим Кац,0,1,NIK RO,Раз два три четыре слова,2020-06-16T16:34:50Z,0
836,UgzdN3MU9XNtC2FIAAp4AaABAg,CX7UwF1Hcws,Максим Кац,0,0,ALOV USEY,"Как можно не понимать то, что эти выборы ничего не решают? К тому же массовое скопление людей только увеличит колличество заражённых в нашей не подготовленной стране. Если внимательно прочитать, как вступают в силу поправки в конституцию, то НИКАКОЙ РЕЧИ О ГОЛОСОВАНИИ НЕ ИДЕТ. Дебаты с Начальным — способ пропиариться.",2020-06-16T16:34:18Z,0
837,Ugwsf4X45JNQuE19Tal4AaABAg,CX7UwF1Hcws,Максим Кац,0,1,Виталий Варлыгин - Лебедев,Максим  провиди  опрос  каких  взлядов  ваши подписчики?? Я вам сразу скажу что вы будете  удивлены  и либералы  будут точно  в меньшинстве!,2020-06-16T16:33:47Z,0
838,UgxUcDkOTpzP9wj5Q654AaABAg,CX7UwF1Hcws,Максим Кац,0,10,Фёдор Горошников,"Океееей, вот это уже разговор)",2020-06-16T16:33:26Z,0
839,Ugyc92hrpajV3bbntZR4AaABAg,CX7UwF1Hcws,Максим Кац,0,21,Doktor Thrasher,"Видео про трамвай, реально полезное, общественный транспорт необходим везде. А экологически чистый тем более!",2020-06-16T16:33:21Z,0
840,UgwVyqX5bHAUrHV5RGF4AaABAg,CX7UwF1Hcws,Максим Кац,0,2,Yoric,Давно пора!,2020-06-16T16:32:50Z,0
841,UgwmPF6TujF69rfaUKR4AaABAg,CX7UwF1Hcws,Максим Кац,0,13,Aliya Amantay,"Я из Казахстана, но даже мне хочется проголосовать!  Вперед, россияне 💪",2020-06-16T16:32:37Z,0
842,UgwYAoxtRT_v5CeFoRJ4AaABAg,CX7UwF1Hcws,Максим Кац,0,4,Ruslan Rustamov,Про Садовое кольцо у Варламова уже просмотренно!)),2020-06-16T16:32:33Z,0
843,UgzWbrCRlXFNCdskSpl4AaABAg,CX7UwF1Hcws,Максим Кац,0,1,Евгения Николаевна,А Ставрополь???,2020-06-16T16:32:28Z,0
844,Ugxj9C3r0mpk8GMNEQd4AaABAg,CX7UwF1Hcws,Максим Кац,0,6,Zhunushvily Djugashvilivich,"Жаль, мой город не в списке. Люди бы поддержали (надеюсь)",2020-06-16T16:32:04Z,0
845,UgxVyCBjVcgMK9yhRSR4AaABAg,CX7UwF1Hcws,Максим Кац,0,1,Noize Lucky,"Жаль в Уфе нет, город-то крупный",2020-06-16T16:31:31Z,0
846,UgzlqhKFIUz_8izA_Jh4AaABAg,CX7UwF1Hcws,Максим Кац,1,1,Lev Khrist,"Почему на видео стоит категория ""12+"" ?",2020-06-16T16:31:19Z,0
847,UgzlqhKFIUz_8izA_Jh4AaABAg.99ygAJTX2id99yu9H-ApKJ,CX7UwF1Hcws,Максим Кац,0,0,nerrain,"Всё же не совсем детский контент, наверно.",2020-06-16T18:33:30Z,1
848,UgyTe6ssSFtVEEjQbnJ4AaABAg,CX7UwF1Hcws,Максим Кац,2,1,Будущее в твоих руках,За Родину! За Сталина!,2020-06-16T16:31:06Z,0
849,UgyTe6ssSFtVEEjQbnJ4AaABAg.99yg8eEWJsg99yyFZ9i2Bk,CX7UwF1Hcws,Максим Кац,0,1,Будущее в твоих руках,@nerrain мда? хм... Это очень странно и подозрительно 🤔🤔🤔,2020-06-16T19:09:19Z,1
850,UgyTe6ssSFtVEEjQbnJ4AaABAg.99yg8eEWJsg99yuS--nwbM,CX7UwF1Hcws,Максим Кац,0,2,nerrain,"Чего, за какого ещё Сталина? Сталина нам не надо :)",2020-06-16T18:36:04Z,1
851,UgzVyqAc9FHRDi-7zjV4AaABAg,CX7UwF1Hcws,Максим Кац,0,0,Aram Gevorkyan,I WANT YOU,2020-06-16T16:31:00Z,0
