,id,videoId,authorVideoName,totalReplyCount,likeCount,authorDisplayName,textDisplay,publishedAt,isReply
1055,UgwebAihIslAhUnimc14AaABAg,CX7UwF1Hcws,Максим Кац,13,1429,Cooper Harris,"Сегодня короткое видео ПОТОМУ ЧТО Я ВЧЕРА УСТАЛ :)))))

Очень крутая и веселая фирменная интонация с которой была произнесена эта фраза. Максим, спасибо за то что ты делаешь, береги здоровье!",2020-06-16T16:07:06Z,0
1056,Ugy36L-O1-4eyAerUCN4AaABAg,CX7UwF1Hcws,Максим Кац,0,6,Ксения Илюшонкова,😊,2020-06-16T16:07:03Z,0
1057,UgwvCgMxTMnr7-PGWGx4AaABAg,CX7UwF1Hcws,Максим Кац,0,22,Uncle AM,"Так точно, товарищ Троцкий!",2020-06-16T16:06:54Z,0
1058,UgyCxRvZTiKQ_NlRlvZ4AaABAg,CX7UwF1Hcws,Максим Кац,5,15,Vadim Troitskiy,"Максим, а как же разговор о том, что мэрия любого города, если это не Москва, то это просто бухгалтерия по перечислению денег, приходящих из федерального бюджета, в котором все уже расписано? Разве может городская дума на что-то влиять?",2020-06-16T16:06:42Z,0
1059,UgyCxRvZTiKQ_NlRlvZ4AaABAg.99ydLxzsKpp99ywbytJdDO,CX7UwF1Hcws,Максим Кац,0,1,Sena Zava,"@Vadim Troitskiy не, у Злого там интереснее. Там мэрские проститутошные, МЧСовский люксовый катер для спасения бедствующих при разливах рек, распродажа автопарка городской администрации и пр. + Много инфы про Фургала. Злой не идеальный, но неплохой пример депутата оппозиционной городской думы.",2020-06-16T18:55:02Z,1
1060,UgyCxRvZTiKQ_NlRlvZ4AaABAg.99ydLxzsKpp99yw-UmrBd2,CX7UwF1Hcws,Максим Кац,0,0,Vadim Troitskiy,Владимир Беликов так федеральный бюджет из распределяет,2020-06-16T18:49:39Z,1
1061,UgyCxRvZTiKQ_NlRlvZ4AaABAg.99ydLxzsKpp99yvxqO3kB2,CX7UwF1Hcws,Максим Кац,0,0,Vadim Troitskiy,"Sena Zava я ббыло подписался на канал дневник депутата, из кпрф товарищ, буйный малый, там кроме скандалов бесконечных ничего и нет, вечно орет со своего места. Вот именно что только кровь и нервы портит. Дом-2, не иначе. Если в этом суть, то это ерунда полная",2020-06-16T18:49:17Z,1
1062,UgyCxRvZTiKQ_NlRlvZ4AaABAg.99ydLxzsKpp99yhZwyX2Rf,CX7UwF1Hcws,Максим Кац,0,9,Владимир Беликов,"Деньги можно распределять эффективно, а можно не эффективно. Это как минимум.",2020-06-16T16:43:33Z,1
1063,UgyCxRvZTiKQ_NlRlvZ4AaABAg.99ydLxzsKpp99yhZG71bRq,CX7UwF1Hcws,Максим Кац,0,0,Sena Zava,"Посмотрите канал ""Злой Дальневосточник"", там показано, что может сделать городская дума и как может попортить кровь местным коррупционерам.",2020-06-16T16:43:28Z,1
1064,UgyYTlqoAI8JCy1p5dt4AaABAg,CX7UwF1Hcws,Максим Кац,0,17,Evgeniy Nisov,Где канал о котах?,2020-06-16T16:06:25Z,0
1065,UgxWAGY_XxfNNTQ50q94AaABAg,CX7UwF1Hcws,Максим Кац,0,10,Andrey Karayvansky,"Отличная идея!
""Есть такая партия! Замечательная партия наркотиков из Тайланда!""",2020-06-16T16:06:15Z,0
1066,Ugx4b0ZeBuasiV6zqx54AaABAg,CX7UwF1Hcws,Максим Кац,0,2,пчёлка мая,Макс лайкни и мы победим,2020-06-16T16:05:06Z,0
1067,UgwEPRENYEID460f1pl4AaABAg,CX7UwF1Hcws,Максим Кац,3,51,Павел Талпа,ПравКАЦиЯ,2020-06-16T16:04:54Z,0
1068,UgwEPRENYEID460f1pl4AaABAg.99yd8lHq2Y199z0c_-MG-5,CX7UwF1Hcws,Максим Кац,0,4,Михаил Барабанов,"О да, игра слов всегда хорошо липнет. Вот ещё иногда фигурирует ""Разумный Макс"".",2020-06-16T19:38:49Z,1
1069,UgwEPRENYEID460f1pl4AaABAg.99yd8lHq2Y199yxJVCInRY,CX7UwF1Hcws,Максим Кац,0,1,Павел Талпа,"@Андрей Ц , с этим прицелом и написал....может и обратит внимание. Спасибо что сделали акцент на этом",2020-06-16T19:01:07Z,1
1070,UgwEPRENYEID460f1pl4AaABAg.99yd8lHq2Y199ywzF_yW30,CX7UwF1Hcws,Максим Кац,0,3,Андрей Ц,Классное было бы название для проекта,2020-06-16T18:58:13Z,1
1071,Ugx6NTDununcWLP7Qep4AaABAg,CX7UwF1Hcws,Максим Кац,16,332,22 xxll,"Вижу видео от Кац, автоматом лайкну ""Клац""!",2020-06-16T16:04:38Z,0
1072,UgxMEb5-AFc8W-jITNh4AaABAg,CX7UwF1Hcws,Максим Кац,4,25,Alexander Shulman,"Максим пожалуйста озвучте всю позицию Алексея, которая состоит в том (помимо того что вы рассказываете), что голосование на этом плебисците это не активное гражданское действие, этого не достаточно чтобы быть активным гражданином.",2020-06-16T16:04:11Z,0
1073,UgxMEb5-AFc8W-jITNh4AaABAg.99yd3ZPaoX79A-IkVAiA0P,CX7UwF1Hcws,Максим Кац,0,0,Павел Н.,Потапенко это все время говорит.,2020-06-17T07:36:25Z,1
1074,UgxMEb5-AFc8W-jITNh4AaABAg.99yd3ZPaoX799yelE0s6-M,CX7UwF1Hcws,Максим Кац,0,4,Galaxyfur,"Как минимум этого точно достаточно, чтобы не быть деструктивным гражданином",2020-06-16T16:19:01Z,1
1075,UgxMEb5-AFc8W-jITNh4AaABAg.99yd3ZPaoX799yeT3D3Eb8,CX7UwF1Hcws,Максим Кац,0,5,Nikolay Dementyev,"Он как бы видео выпустил про помощь региональным политикам и не только. Можно было бы хотя бы другое видео вам подобрать для комментария, чтобы так с претензией писать о недостаточно активном гражданском действии.",2020-06-16T16:16:24Z,1
1076,UgxMEb5-AFc8W-jITNh4AaABAg.99yd3ZPaoX799ye56pKkPO,CX7UwF1Hcws,Максим Кац,0,2,Channel Awful,"Уже сказал. Максим никогда не говорил, что одного лишь голосования достаточно.",2020-06-16T16:13:08Z,1
1077,UgwpsAX8T3X2s7XQ_v94AaABAg.99ydWlM93o49A9s-wguUsf,CX7UwF1Hcws,Максим Кац,0,0,Fox Mulder,"Нет наблюдателей, а те кто есть - уходят на ночь домой, выводятся на 10-20 минутную дезинфекцию. Данные паспортов уже проставлены печатными буквами. Надомное голосование. Сфальсифицировать раз плюнуть.
Власть гонит на выборы и молодёжь призывами, например с соцсетях, банерами на улицах, так что не надо рассказывать, что власть гонит только бюджетников.. 
Главное - они если надо сфальсифицируют. А может, даже скорее всего, просто нарисуют нужную цифру. Вот скажите тёзка, на кого вы работаете? Вы же явно создаёте ""легитимность""  этому голосованию!",2020-06-21T10:05:39Z,1
1078,UgwpsAX8T3X2s7XQ_v94AaABAg.99ydWlM93o49A4pP7dUeJr,CX7UwF1Hcws,Максим Кац,0,0,Вадим Чумаков,"Не знаю, читаете ли вы комментарии, но напишу. У меня подруга в чеховской психиатрической больнице им яковенко работает. Так вот, бабушки, не дееспособные вчера уже по поправкам конституции проголосовали... Вот. Хорошо жить, когода психи законы принимают, а потом другие психи их поддерживают!",2020-06-19T11:06:40Z,1
1079,UgwpsAX8T3X2s7XQ_v94AaABAg.99ydWlM93o49A3G02l4DTh,CX7UwF1Hcws,Максим Кац,0,0,Evgeniy Babkin,"Мой город в Ростовской области и здесь тоже будут проходить выборы, но в списке его нет. Почему? Для справки г. Волгодонск.",2020-06-18T20:29:26Z,1
1080,UgwpsAX8T3X2s7XQ_v94AaABAg.99ydWlM93o49A-HAWnCsiw,CX7UwF1Hcws,Максим Кац,0,0,nickola naumoff,@Олег Иванов я против бойкота,2020-06-17T07:22:38Z,1
1081,UgwpsAX8T3X2s7XQ_v94AaABAg.99ydWlM93o49A-GtA_2y_K,CX7UwF1Hcws,Максим Кац,0,1,Nikita Zaretskii,@Евгений  mbl эmo nyTuHy?,2020-06-17T07:20:08Z,1
1082,UgwpsAX8T3X2s7XQ_v94AaABAg.99ydWlM93o49A-DI6IMi-l,CX7UwF1Hcws,Максим Кац,0,1,Олег Иванов,nickola naumoff *помоги себе и другим БОЙКОТом*,2020-06-17T06:48:43Z,1
1083,UgwpsAX8T3X2s7XQ_v94AaABAg.99ydWlM93o49A-C0LLbViZ,CX7UwF1Hcws,Максим Кац,0,1,nickola naumoff,помогите и городам дальневосточного фед округа. Я из Улан-Удэ,2020-06-17T06:37:33Z,1
1084,UgwpsAX8T3X2s7XQ_v94AaABAg.99ydWlM93o49A-2O8lfJ_Z,CX7UwF1Hcws,Максим Кац,0,1,Hinducoder,"В Челябинске стартовала кампания по выборам в законодательное собрание, хотелось бы заручиться поддержкой. Написал в телегу.",2020-06-17T05:13:25Z,1
1085,UgwpsAX8T3X2s7XQ_v94AaABAg.99ydWlM93o49A-24Njq8YY,CX7UwF1Hcws,Максим Кац,0,1,Олег Иванов,Никита Белкин взаимно),2020-06-17T05:10:43Z,1
1086,UgwpsAX8T3X2s7XQ_v94AaABAg.99ydWlM93o499zzIUVIdns,CX7UwF1Hcws,Максим Кац,0,1,TheWerest,"Вы выдвигайтесь, а оно само",2020-06-17T04:37:42Z,1
1087,UgwpsAX8T3X2s7XQ_v94AaABAg.99ydWlM93o499zkeDntFwY,CX7UwF1Hcws,Максим Кац,0,0,Олег Иванов,Дмитрий Весёлый это не гипотеза - это практика стран золотого миллиарда,2020-06-17T02:29:44Z,1
1088,UgwpsAX8T3X2s7XQ_v94AaABAg.99ydWlM93o499zTlGH2Nwr,CX7UwF1Hcws,Максим Кац,0,0,ZoGame Rom,"Максим, интересно будет послушать, что ты думаешь о погромах в США",2020-06-16T23:53:24Z,1
1089,UgwpsAX8T3X2s7XQ_v94AaABAg.99ydWlM93o499zEHZlu3pN,CX7UwF1Hcws,Максим Кац,0,0,Иван Раданов,"многоходовочка, прокремли на зп будут ещё и донаты стричь",2020-06-16T21:38:08Z,1
1090,UgwpsAX8T3X2s7XQ_v94AaABAg.99ydWlM93o499zCc78nDVB,CX7UwF1Hcws,Максим Кац,0,1,Катрин Макова,"Жаль, что нет моего города. Но надеюсь будет описание предвыборных кампаний. Будем делать по ""книжечке""))).",2020-06-16T21:23:36Z,1
1091,UgwpsAX8T3X2s7XQ_v94AaABAg.99ydWlM93o499zCZ8-I159,CX7UwF1Hcws,Максим Кац,0,3,Obil'nayA TigrihA,"Проект огонь. Но вот я студентка в спб. Приехала из провинции, пока на 1м курсе. Безумно увлекаюсь варламовскими похождениями по городам. Ваши видео смотрю, впитываюсь. Как вообще дальше двигаться,  если тоже хочу принимать участие в улучшении городов по всей России вообще. В яблоко ли вступать, или другие пути искать. Как из простого смертного превратиться в политика?",2020-06-16T21:23:04Z,1
1092,UgwpsAX8T3X2s7XQ_v94AaABAg.99ydWlM93o499zC6xtAgkP,CX7UwF1Hcws,Максим Кац,0,1,Дмитрий Весёлый,"@Олег Иванов есть гипотеза, что человек - это самородный минерал артефакт, где есть что для людей, там они возникают",2020-06-16T21:19:13Z,1
1093,UgwpsAX8T3X2s7XQ_v94AaABAg.99ydWlM93o499zBs_hVeHJ,CX7UwF1Hcws,Максим Кац,0,2,Михаил Воробьёв,Сделайте Оренбург плиз. Нужна помощь,2020-06-16T21:17:07Z,1
1094,UgwpsAX8T3X2s7XQ_v94AaABAg.99ydWlM93o499zBPf11Ugf,CX7UwF1Hcws,Максим Кац,0,0,Дмитрий Весёлый,"Понятно, это ведь не мешки ворочать! Ещё и либерал, и ходит по Садовому после преступлений либерала! Постеснялись бы!",2020-06-16T21:13:02Z,1
1095,UgwpsAX8T3X2s7XQ_v94AaABAg.99ydWlM93o499zAQ3gNr-6,CX7UwF1Hcws,Максим Кац,0,1,A B,"Хороший сайт! Реально правильная идея. Очень удобно будет для избирателей, когда(если) выборы в госдуму начнутся.",2020-06-16T21:04:21Z,1
1096,UgwpsAX8T3X2s7XQ_v94AaABAg.99ydWlM93o499z00AQ0voj,CX7UwF1Hcws,Максим Кац,0,3,Маргарита Кобылкина,"Максим дай пожалуйста ссылку на чаты по городам, в которых обсуждают проблемные места инфраструктуры,
 я уже пресмотрел несколько проблемных мест в городе. Кстати привет из Липецка.",2020-06-16T19:33:26Z,1
1097,UgwpsAX8T3X2s7XQ_v94AaABAg.99ydWlM93o499z-i0yFOs9,CX7UwF1Hcws,Максим Кац,0,2,Маргарита Кобылкина,@Евгений ты это кому?,2020-06-16T19:30:49Z,1
1098,UgwpsAX8T3X2s7XQ_v94AaABAg.99ydWlM93o499ywiQKr349,CX7UwF1Hcws,Максим Кац,0,1,Евгений,"ты принимаешь на себя ответственность за тех людей, которые умрут из-за твоих призывов?  мозги включи, мудень",2020-06-16T18:55:55Z,1
1099,UgwpsAX8T3X2s7XQ_v94AaABAg.99ydWlM93o499ytPrFbX9j,CX7UwF1Hcws,Максим Кац,0,1,Альберт Эйнштейн,"Жаль что Набережные Челны нет в списке, хотя выше Ижевск или Казань есть среди городов :(",2020-06-16T18:27:02Z,1
1100,UgwpsAX8T3X2s7XQ_v94AaABAg.99ydWlM93o499ytC9dy_NM,CX7UwF1Hcws,Максим Кац,0,2,Жадность,"На сайте написано что есть два кандидата в Ростове на дону, а кто это , как узнать за кого именно агетировать?",2020-06-16T18:25:10Z,1
1101,UgwpsAX8T3X2s7XQ_v94AaABAg.99ydWlM93o499yrXRqoXv9,CX7UwF1Hcws,Максим Кац,0,1,Александр Сирик,Что порекомендуете по МО? В 20 году так же будут выборы.,2020-06-16T18:10:36Z,1
1102,UgwpsAX8T3X2s7XQ_v94AaABAg.99ydWlM93o499yqmJZe8IB,CX7UwF1Hcws,Максим Кац,0,2,Никита Белкин,"@Олег Иванов гхм а кто по вашему мнению человек ? Тот кто ну дурак ?
А дурак для вас тогда кто ? Тот кто не совершает ошибок, не делает необдуманных действий ? По сути вы сами решаете за человека дурак он или нет, это ваше поверхностное мнение, только вряд-ли оно имеет четкое обоснование. Да, кстати вы дурак.",2020-06-16T18:04:01Z,1
1103,UgwpsAX8T3X2s7XQ_v94AaABAg.99ydWlM93o499yqC93dRgU,CX7UwF1Hcws,Максим Кац,0,0,Sergey,"Максим извените, но нового Ельцина(вас) мне не хочется видеть.",2020-06-16T17:58:57Z,1
1104,UgwpsAX8T3X2s7XQ_v94AaABAg.99ydWlM93o499yo5j4oP0X,CX7UwF1Hcws,Максим Кац,0,1,HEY_MEN22,"проверьте сайт, не могу зарегистрироваться как сборщик подписей при клике на плюсик ничего не происходит",2020-06-16T17:40:36Z,1
1105,UgwpsAX8T3X2s7XQ_v94AaABAg.99ydWlM93o499yk3_hX6sv,CX7UwF1Hcws,Максим Кац,0,3,Константин,"Задонатил немного ещё туда, но ежемесячно. Помогу хоть так.",2020-06-16T17:05:21Z,1
1106,UgwpsAX8T3X2s7XQ_v94AaABAg.99ydWlM93o499yiDeO99sW,CX7UwF1Hcws,Максим Кац,0,4,Serakez,"По многим региональным штабам Навального включая Навальный LIVE сегодня вышли ролики с помпой ""Путину нужна явка"", ""Голосование не имеет смысла"". Всё это продвигается в контексте забастовки членов избирательных комиссий и укрепляет позицию бойкота и явкофобию
v=E5BuyGKn7QI
v=p3OG56tlTqs
Что скажете?",2020-06-16T16:49:15Z,1
1107,UgwpsAX8T3X2s7XQ_v94AaABAg.99ydWlM93o499yhnAtANdX,CX7UwF1Hcws,Максим Кац,0,4,Олег Никонов,"Здравствуй Максим, а что надо делать агитатору? Я хочу помочь (если что мне 16) могу ли я в таком возрасте быть полезным?",2020-06-16T16:45:30Z,1
1108,UgwpsAX8T3X2s7XQ_v94AaABAg.99ydWlM93o499ygfJQhkmj,CX7UwF1Hcws,Максим Кац,0,3,Мару Сь,Данил Данилов да пиздуй,2020-06-16T16:35:41Z,1
1109,UgwpsAX8T3X2s7XQ_v94AaABAg.99ydWlM93o499ygXIdf_Wf,CX7UwF1Hcws,Максим Кац,0,2,mols40,"Вы вот боритесь за велодвижение и комфорт пешеходов... А на этом сайте кроме сбора средств есть кнопка ""помочь как водитель"". Что за двойные стандарты? Агитаторы не могут передвигаться на вело и ОТ? Свою деятельность депутаты начнут с  ухудшения экологии и создании пробок на дорогах?",2020-06-16T16:34:27Z,1
1110,UgwpsAX8T3X2s7XQ_v94AaABAg.99ydWlM93o499ygP50cI7D,CX7UwF1Hcws,Максим Кац,0,1,Олег Иванов,"Aleksei R. Каких только дураков не бывает в России всех мастей, сортов и расцветок... только людей не хватает)",2020-06-16T16:33:20Z,1
1111,UgwpsAX8T3X2s7XQ_v94AaABAg.99ydWlM93o499yfpfALksy,CX7UwF1Hcws,Максим Кац,0,6,Роман Галиев,"Максим Кац, а что Казанская городская дума ?",2020-06-16T16:28:22Z,1
1112,UgwpsAX8T3X2s7XQ_v94AaABAg.99ydWlM93o499yfWyEW0UP,CX7UwF1Hcws,Максим Кац,0,52,Евгений Богданов,"всё ребят, расходимся, Данилов отписался",2020-06-16T16:25:40Z,1
1113,UgwpsAX8T3X2s7XQ_v94AaABAg.99ydWlM93o499yfPndYLa-,CX7UwF1Hcws,Максим Кац,0,24,Игорь Кузнецов,@Данил Данилов кого вы все отписывающиеся каждый раз пытаетесь испугать этой фразой?,2020-06-16T16:24:42Z,1
1114,UgwpsAX8T3X2s7XQ_v94AaABAg.99ydWlM93o499yfL0QnTox,CX7UwF1Hcws,Максим Кац,0,6,Наумов,"@Егор Гнездилов всё сможешь, если захочешь",2020-06-16T16:24:02Z,1
1115,UgwpsAX8T3X2s7XQ_v94AaABAg.99ydWlM93o499yf601_quE,CX7UwF1Hcws,Максим Кац,0,1,Mr. MMM,"""Пора заниматься политикой!"" Ну так давайте займемся! Я вам пишу в фейсбук, хочу совета и мысль высказать. Как же поговорить то уже?!",2020-06-16T16:21:59Z,1
1116,UgwpsAX8T3X2s7XQ_v94AaABAg.99ydWlM93o499yermXFTYK,CX7UwF1Hcws,Максим Кац,0,10,Егор Гнездилов,"Ответьте пожалуйста, если мне 14 лет я могу стать агитатором и разносить газеты например у себя в поселке?",2020-06-16T16:19:55Z,1
1117,UgwpsAX8T3X2s7XQ_v94AaABAg.99ydWlM93o499yenFSj8Mq,CX7UwF1Hcws,Максим Кац,0,7,Данил Данилов,"ОТПИСЫВАЮСЬ, Я В ЭТОЙ КЛОУНАДЕ УЧАСТВОВАТЬ НЕ СОБИРАЮСЬ!",2020-06-16T16:19:17Z,1
1118,Ugw0cmxWpBfUDq1qg0h4AaABAg.99z332Z1oIx9AAyZb1BnkN,CX7UwF1Hcws,Максим Кац,0,0,Criolis,"@Аmira Sr написал в гор проекты, там мне дали контакт Леонида Андрухова, я ему написал и дальше тишина, уже неделя прошла. Толку, видимо, нет.",2020-06-21T20:22:11Z,1
1119,Ugw0cmxWpBfUDq1qg0h4AaABAg.99z332Z1oIx9A-znhSmYW6,CX7UwF1Hcws,Максим Кац,0,0,Criolis,"@nerrain Спасибо вам и остальным, я напишу сегодня же.",2020-06-17T14:01:20Z,1
1120,Ugw0cmxWpBfUDq1qg0h4AaABAg.99z332Z1oIx9A-YJQfpa64,CX7UwF1Hcws,Максим Кац,0,0,Антон Демин,"Можно написать ещё Аркадию Гершману, он так же пишет/снимает про урбанистику",2020-06-17T09:52:24Z,1
1121,Ugw0cmxWpBfUDq1qg0h4AaABAg.99z332Z1oIx9A-XXEhVIal,CX7UwF1Hcws,Максим Кац,0,2,Irina Kuzmina,"Попробуйте лучше написать на почту Городских Проектов, так будет заметнее, чем комент на ютубе ) мне помогли советом",2020-06-17T09:45:33Z,1
1122,Ugw0cmxWpBfUDq1qg0h4AaABAg.99z332Z1oIx9A-367q6vEB,CX7UwF1Hcws,Максим Кац,0,3,Аmira Sr,"Запишитесь в Городские проекты, познакомитесь с мундепами вашего района. Кац и яблоко выбрали там в прошлом году много молодых активных мундепов, они будут писать за вас письма и запросы, как минимум. Всегда можно что то сделать.",2020-06-17T05:19:42Z,1
1123,Ugw0cmxWpBfUDq1qg0h4AaABAg.99z332Z1oIx99z56Q3fPaJ,CX7UwF1Hcws,Максим Кац,0,1,nerrain,"Думаю, можно или пытаться указывать руководству, что правильно делать, или менять руководство, что совсем хорошо. Один вы всё равно вряд ли сможете что-то сделать, нужна команда единомышленников, которая может провести какую-то кампанию в поддержку транспорта. Я думаю, вас тепло примут в Городские проекты СПб, попробуйте!",2020-06-16T20:17:58Z,1
1124,UgzOZL2XyJesMLM21Bt4AaABAg.99yqkq45P_K99yw2KO78iq,CX7UwF1Hcws,Максим Кац,0,0,Sergey,"@Либертарианец свободный Кто продвигал ценности Запада и свободной рыночной экономики? Ельцин, кто говорил о высшей ценности свобод и прав человека? Ельцин. И многое другое он тоже продвигал. Ну и по традициям либералов, как и все они он тоже напиздел, развалил все что мог и дальше знаешь сам.",2020-06-16T18:50:02Z,1
1125,UgzOZL2XyJesMLM21Bt4AaABAg.99yqkq45P_K99yvdE3um3z,CX7UwF1Hcws,Максим Кац,0,0,Либертарианец свободный,"@Sergey докажите вы, что ельцин либерал",2020-06-16T18:46:28Z,1
1126,UgzOZL2XyJesMLM21Bt4AaABAg.99yqkq45P_K99yvZr4MmwU,CX7UwF1Hcws,Максим Кац,0,0,Sergey,"@Никита Моисеев вы свои ошибки признавать не умеете и передаете их мертвой стране и комунистам, это детский и неподкрепленный миф что 90-е изза СССР. Реформы Гайдара не СССР начал, влез в колосальные долги не СССР, промышленность развалил тоже не он. То что ваши ""эфыективные"" менеджеры не смогли наладить производство он виноват? Докажи что 90-е изза СССР произошли? Только своими словами.",2020-06-16T18:45:52Z,1
1127,UgzOZL2XyJesMLM21Bt4AaABAg.99yqkq45P_K99yusnGNMA9,CX7UwF1Hcws,Максим Кац,0,0,Sergey,"@Либертарианец свободный докажи, твои слова пусты.",2020-06-16T18:39:52Z,1
1128,UgzOZL2XyJesMLM21Bt4AaABAg.99yqkq45P_K99yuei5S0B0,CX7UwF1Hcws,Максим Кац,0,0,Либертарианец свободный,@Sergey либералов там не было.,2020-06-16T18:37:56Z,1
