,id,videoId,authorVideoName,totalReplyCount,likeCount,authorDisplayName,textDisplay,publishedAt,isReply
704,UgwTO-hMywpVwZtGPB14AaABAg,EBWfg7KFUWc,Телеканал Дождь,9,118,А Д,Сегодня одно поёт. Завтра будет другое. Лишь бы хайпануть.,2020-06-15T18:21:26Z,0
705,Ugzu3xTw15BqyPlO6GV4AaABAg,EBWfg7KFUWc,Телеканал Дождь,0,2,СССР !,Не жадничай  лебединушка  поделись сомной деньгам.,2020-06-15T18:18:51Z,0
706,UgyHGgbpRhuo3OsYv494AaABAg,EBWfg7KFUWc,Телеканал Дождь,0,4,Андрей Корчинский,"Решил узнать, кто такой Лебедев... Лживое, мерзкое существо. Даже животным его назвать язык не поворачивается. Все бараны, кто не с ним. В политикутипа  не лезет, но ЦИКу лижет, т.к. он не в политике, но Панфилова ""самый крутой политик"". В этом он весь.",2020-06-15T18:18:29Z,0
707,UgwH71P2NH9Att5clXh4AaABAg,EBWfg7KFUWc,Телеканал Дождь,0,7,НИВА 6х6 ОФФРОАД,"Эх Тёма, зашквар...",2020-06-15T18:16:51Z,0
708,Ugygpa4ATCK1rxgc4EF4AaABAg,EBWfg7KFUWc,Телеканал Дождь,3,158,middle,"""Конституция и политика - это разные вещи"" 😵",2020-06-15T18:15:58Z,0
709,Ugygpa4ATCK1rxgc4EF4AaABAg.99wILuu910E9A57OZ66EBd,EBWfg7KFUWc,Телеканал Дождь,0,1,raxna gardjen,вы там держитесь!,2020-06-19T13:52:37Z,1
710,Ugygpa4ATCK1rxgc4EF4AaABAg.99wILuu910E9A-Tc8MKzev,EBWfg7KFUWc,Телеканал Дождь,0,1,fish2k,что непонятного?,2020-06-17T09:11:24Z,1
711,Ugygpa4ATCK1rxgc4EF4AaABAg.99wILuu910E99xEQkrtf15,EBWfg7KFUWc,Телеканал Дождь,0,1,mrishka5,ну это действительно разные вещи,2020-06-16T03:00:55Z,1
712,UgxCruwm0w5FAt0EuE14AaABAg,EBWfg7KFUWc,Телеканал Дождь,8,40,middle,"Блогерам, которым рассылали предложение пропиарить поправки, разъясняли, что они могут отказаться потом от своего мнения (канал Кати Конасовой)",2020-06-15T18:15:08Z,0
713,UgxTeamuyifL9LvvDWp4AaABAg,EBWfg7KFUWc,Телеканал Дождь,0,4,CuJIbBecTp,Eбать тут публика! Какие-то одноклеточные аутисты! Тёма как всегда хорош!👍,2020-06-15T18:13:15Z,0
714,Ugz9ZvDKdoZCddMmh4d4AaABAg,EBWfg7KFUWc,Телеканал Дождь,1,2,Илья Иванов,За Тёмыча лайк. А хомячки насрального пускай бомбят),2020-06-15T18:12:19Z,0
715,Ugz9ZvDKdoZCddMmh4d4AaABAg.99wHw7xauq_99wLHIRsKVM,EBWfg7KFUWc,Телеканал Дождь,0,0,b page,а ты не хомячок этого лицемера и жополиза?,2020-06-15T18:41:33Z,1
716,UgwDFzWYOVohnNqpS9F4AaABAg,EBWfg7KFUWc,Телеканал Дождь,1,59,Igor Sechin,"Да он конченый, что с ним разговаривать.",2020-06-15T18:10:01Z,0
717,UgwDFzWYOVohnNqpS9F4AaABAg.99wHfLUmrJp99wcRzxgfzk,EBWfg7KFUWc,Телеканал Дождь,0,7,Clastic Clouds Videography,"ну да, надо менять интервьюера",2020-06-15T21:20:18Z,1
718,UgyVAQpQENF0xtB5Uw94AaABAg,EBWfg7KFUWc,Телеканал Дождь,0,2,Данил Климин,"Артемий, вы им ни чего не объясните. Это же либеральная тусовка.",2020-06-15T18:06:45Z,0
719,UgzjAVTBXCaxwBjT4bh4AaABAg,EBWfg7KFUWc,Телеканал Дождь,0,2,Лилия Лилия,"Про артемку совсем слушать не буду , мутный он и засланый персонаж ..",2020-06-15T18:02:21Z,0
720,UgyCqb2MUWKCLo-Ukd54AaABAg,EBWfg7KFUWc,Телеканал Дождь,1,47,Игорь Зуев,Артюша продал свой зад всего на четыре минуты. Терь до конца жизни не отмоется.,2020-06-15T18:02:13Z,0
721,UgyCqb2MUWKCLo-Ukd54AaABAg.99wGm9PMmIJ99xo8EyKOFW,EBWfg7KFUWc,Телеканал Дождь,0,3,Napster deus,Да он всегда купался в дерме.,2020-06-16T08:21:42Z,1
722,UgzMPFS6Sh9pmGPstyx4AaABAg,EBWfg7KFUWc,Телеканал Дождь,0,2,Bw HorH,"я конечно все понимаю, но как вам удаётся быть такими беспроветно безмозглыми псевдоподобиями люда, если вы не в состоянии понять что теме на  этот раз не в чем даже объясняться и уж тем более извиняться или переобуваться. нет, конечно другого положения жители этой страны ни в коем случае не заслуживают. я думаю слишком уж даже тепличные тут условия для таких воинствующих деревяшек. вот и урфин джюс у вас есть, чо не довольны то.",2020-06-15T17:55:22Z,0
723,UgzFaqY4GGwUoVp2um54AaABAg,EBWfg7KFUWc,Телеканал Дождь,0,1,Евгений Смолин,"Кто родители, где все родственники и друзья этого продажного нелюдя??? Хватает наглости и хамства приходить и что-то ещё блеять.",2020-06-15T17:54:49Z,0
724,UgwDPqDbQFzcpnktRcJ4AaABAg,EBWfg7KFUWc,Телеканал Дождь,0,3,Сергей Занин,зачем такие мерзкие гости? высокомерный нарцисист,2020-06-15T17:53:29Z,0
725,Ugzh-vQ9r6brxdMZcVl4AaABAg,EBWfg7KFUWc,Телеканал Дождь,0,5,Alex v,"Бож, какой паноптикум в коментах🤣",2020-06-15T17:53:01Z,0
726,Ugy7myuzLn-6qvbNQ2d4AaABAg,EBWfg7KFUWc,Телеканал Дождь,0,0,Natalia H,А это кто? Он дизайнер чего?,2020-06-15T17:52:07Z,0
727,UgzbSIr2n67U3caPcfZ4AaABAg,EBWfg7KFUWc,Телеканал Дождь,8,25,Наталья Nata,Вообще неинтересный чувак. Зачем пригласили?,2020-06-15T17:50:55Z,0
728,Ugy2qg5mweyBKTw2sZ94AaABAg,EBWfg7KFUWc,Телеканал Дождь,0,0,Wolfich,"Наверно заплатили нуууууу ооооооочень много. Я вот даже не  представляю ну сколько у вас ,богатых русских, денег . Страшно подумать. Я думаю можно купить всю теслу и спэйс икс а потом там порнуху начать снимать и всё похерить поломать . Илона пустить по кругу  . И это будет малая часть потерь",2020-06-15T17:50:46Z,0
729,UgzRrCGYrplwK_QQ6-V4AaABAg,EBWfg7KFUWc,Телеканал Дождь,0,0,Дана Кара,😘,2020-06-15T17:49:59Z,0
730,Ugx4NiJvx4cNcMKOIy94AaABAg,EBWfg7KFUWc,Телеканал Дождь,8,133,Nata,"Ну а что, вполне логичная и очевидная позиция человека, у которого немерено бабла, есть связи и влияние. Конечно ему пофиг на всё и всех... Ну штрафанули на 1,5 ляма, фигня, заплатил и живет дальше, это ж не бабушку с пенсией 8т.р. на 4т.р. штрафануть за сидение на лавочке",2020-06-15T17:49:47Z,0
731,UgyJmO_wKfzMX2qHCpR4AaABAg,EBWfg7KFUWc,Телеканал Дождь,0,3,Кирилл Смиян,Очень молодец! 🤝,2020-06-15T17:49:03Z,0
732,UgxlOC3WRHRCYrIkdW14AaABAg,EBWfg7KFUWc,Телеканал Дождь,0,1,Valeria Taggart,"Самовлюбленный дилетант, но иногда смешные штуки мочит",2020-06-15T17:47:47Z,0
733,Ugzu2mROxRb6HHL07jt4AaABAg,EBWfg7KFUWc,Телеканал Дождь,0,10,Elmira Vilcane,Какую чушь несёт этот «гость».. не приглашайте это никуда и никогда.,2020-06-15T17:47:17Z,0
734,UgynBLQRJHWh8bA0Gcd4AaABAg,EBWfg7KFUWc,Телеканал Дождь,0,1,Bw HorH,ну хайпанул и хайпанул,2020-06-15T17:47:14Z,0
735,UgwZ5Ma9ChmG6MjznNR4AaABAg,EBWfg7KFUWc,Телеканал Дождь,1,78,Кирилл Кто,"Человеку нужно внимание, он об этом прямо говорит.
Все: давайте-ка посвятим ему ещё больше внимания.
Тема: Всем спасибо, все свободны.",2020-06-15T17:46:00Z,0
736,UgwZ5Ma9ChmG6MjznNR4AaABAg.99wEvMvUmO-9A9erytFkQz,EBWfg7KFUWc,Телеканал Дождь,0,0,Way Mo,"Не важно что о тебе говорят, если о тебе говорят",2020-06-21T08:10:49Z,1
737,UgwGUnWpAgxUqp1_bG14AaABAg,EBWfg7KFUWc,Телеканал Дождь,4,59,Tina Bo,"Мерзкий Лебедев, даже смотреть не хочется какую чушь он в очередной раз несёт, надеюсь режим падет и этот фальшивый «дизайнер» останется без работы!",2020-06-15T17:45:26Z,0
738,UgwGUnWpAgxUqp1_bG14AaABAg.99wErDdza3-99yzZql8sik,EBWfg7KFUWc,Телеканал Дождь,0,0,Maria Hamm,"@Рыжий Лис да нет там никакого мнения. То +, то -,  циник, холуй, переобувается в прыжке. Никакой четкой позиции. Да ладно, пусть 10 тысяч стариков умрёт. Ерунда, главное, чтоб рестораны и бары.  Мерзопакостный человечишка. Даже убийца Гиркин у Гордона выглядел приличным человеком, по сравнению с этим типом. У Гиркина хотя убеждения есть.",2020-06-16T19:20:50Z,1
739,UgwGUnWpAgxUqp1_bG14AaABAg.99wErDdza3-99y3bhMa1Cv,EBWfg7KFUWc,Телеканал Дождь,0,2,Рыжий Лис,"Человек выражает свое мнение , в этом плохого ничего не вижу . И вообще согласен с Лебедевым , жизнь изменилась  -  нужны новые законы , а значит и поправки в конституцию",2020-06-16T10:45:40Z,1
740,UgwGUnWpAgxUqp1_bG14AaABAg.99wErDdza3-99y3Ty5TXYB,EBWfg7KFUWc,Телеканал Дождь,0,0,Линия Жизни,"Смотрите в собственной слюне не утоните. У Лебедева четкая позиция, он хоть и снялся в ролике, но голосвать не собирается. А ваш Навальный топит за бойкот, тем самым обеспечивает явку только в пользу поправок.Так что тут еще подумать надо, кто фальшивит.",2020-06-16T10:44:28Z,1
741,UgwGUnWpAgxUqp1_bG14AaABAg.99wErDdza3-99xu8reOzPW,EBWfg7KFUWc,Телеканал Дождь,0,1,Вадим Петин,"К нему обращается огромное количество коммерческих организаций, тот же бизнес линч это показывает",2020-06-16T09:14:13Z,1
742,UgzG0ki7EiP5S_BX9Zh4AaABAg,EBWfg7KFUWc,Телеканал Дождь,2,146,Илья Мадорский,Удивительнозамечательненький ЛИЦЕМЕР.,2020-06-15T17:44:03Z,0
743,UgzG0ki7EiP5S_BX9Zh4AaABAg.99wEhAs__rB99y5ZxzEguC,EBWfg7KFUWc,Телеканал Дождь,0,1,лариса Маркова,"Линия Жизни, о да, тот же Навальный когда-то топил за изменения в конституцию, а когда их принять решили он тут же ""против"" топить стал. И так вся либ шиза делает, то есть ничего не делает. Лишь бы по любому поводу ""против"" покричать.",2020-06-16T11:02:46Z,1
744,UgzG0ki7EiP5S_BX9Zh4AaABAg.99wEhAs__rB99y44x8R_Ew,EBWfg7KFUWc,Телеканал Дождь,0,2,Линия Жизни,"Лицемеры это те, кто сначала требовал защиты трудового народа, или защиты прав животных, а потом переобуваются и начинают отказываться от этого. Как ваша зашквареная оппозиция.",2020-06-16T10:49:48Z,1
745,UgwdpLDdoML92HEXOe14AaABAg,EBWfg7KFUWc,Телеканал Дождь,0,0,Anrina,"Канал ведет норм, но отписался..  мнение меняется)",2020-06-15T17:43:10Z,0
746,UgwpVyFLrMBPa7-qTkp4AaABAg,EBWfg7KFUWc,Телеканал Дождь,0,2,Елена Басова,Лебедев лучший ),2020-06-15T17:42:54Z,0
747,UgwLcNg6atyeFnJFnvF4AaABAg,EBWfg7KFUWc,Телеканал Дождь,0,3,Tatyana GG,плешивому хорошо отлизал,2020-06-15T17:42:30Z,0
748,UgzmzlBXIsMCISp8Ojt4AaABAg,EBWfg7KFUWc,Телеканал Дождь,4,42,Оливер Сакс,"Извините, но дизлайк этому мерзкому снобу. (Лебедев мля)",2020-06-15T17:41:56Z,0
749,UgzmzlBXIsMCISp8Ojt4AaABAg.99wEScE5BvU99xl1f7p4w1,EBWfg7KFUWc,Телеканал Дождь,0,0,Оливер Сакс,"Tea Timurin  Отталктвает его изворотливость. Его все устраивает, ему на всё всё равно.",2020-06-16T07:54:35Z,1
750,UgzmzlBXIsMCISp8Ojt4AaABAg.99wEScE5BvU99wiu9dfdjp,EBWfg7KFUWc,Телеканал Дождь,0,1,Tea Timurin,"@Оливер Сакс Не вписывается целиком в шаблон ""либерала"" и ""раба"" ? Все-то у него то ухо торчит из шаблона, то рука... Говорит непонятное, хотя слова знакомые? Какой гад.",2020-06-15T22:16:42Z,1
751,UgzmzlBXIsMCISp8Ojt4AaABAg.99wEScE5BvU99weXFL51tB,EBWfg7KFUWc,Телеканал Дождь,0,0,Оливер Сакс,"Tea Timurin Ведущий-профессионал, а ,вот, Артемий, крайне неприятный человек, после интервью с Жуковым полностью разочаровал.",2020-06-15T21:38:29Z,1
752,UgzmzlBXIsMCISp8Ojt4AaABAg.99wEScE5BvU99wcog9bZEj,EBWfg7KFUWc,Телеканал Дождь,0,2,Tea Timurin,"Да ладно. Ведущий вполне вменяем, не сноб вовсе.",2020-06-15T21:23:32Z,1
753,UgzAN0_lLgvC5xeJkah4AaABAg,EBWfg7KFUWc,Телеканал Дождь,0,0,Тео А,мерзость=лебедев,2020-06-15T17:38:53Z,0
754,UgxJwgrlho1--JJN9I54AaABAg,EBWfg7KFUWc,Телеканал Дождь,0,33,igor kombaov,"Продался за 30 сребреников, переобувальщик",2020-06-15T17:37:04Z,0
755,UgxqEt0vzaOcuSVIpRB4AaABAg,EBWfg7KFUWc,Телеканал Дождь,0,77,Сергей Марченко,Дзядко хорош. Столько интересных ответов (пусть и их логика не укладывается в моей голове) сумел выжать из этого индивидуума. Дизлайк только из-за абсолютного несогласия с ответами интервьюируемого.,2020-06-15T17:34:04Z,0
756,UgwRQ8qcgaJs6G6r0iB4AaABAg,EBWfg7KFUWc,Телеканал Дождь,0,1,Yus,Лебедев убирает Тихона Самохвалова?,2020-06-15T17:32:11Z,0
757,UgxwOZd9YPOBp1b3SnZ4AaABAg,EBWfg7KFUWc,Телеканал Дождь,0,10,VALERAGREK,Бежит между струйками и это очень хорошо видно!,2020-06-15T17:31:25Z,0
758,Ugy_q4D9eGPh-IeuAfZ4AaABAg,EBWfg7KFUWc,Телеканал Дождь,1,9,Valery Fedorov,"Я человек простой - вижу Лебедева, ставлю диз",2020-06-15T17:30:17Z,0
759,Ugy_q4D9eGPh-IeuAfZ4AaABAg.99wD7JPeKjp99wrx_bWTki,EBWfg7KFUWc,Телеканал Дождь,0,0,pan atoman,"Я человек простой - вижу Лебедева, ставлю лайк",2020-06-15T23:35:49Z,1
760,Ugw4TMU5R7vjltXJUDx4AaABAg,EBWfg7KFUWc,Телеканал Дождь,2,44,iipoctoboba,"Гость, похоже, лукавит. Я бы даже сказал врет местами. Осилил 9 минут.",2020-06-15T17:28:42Z,0
761,Ugw4TMU5R7vjltXJUDx4AaABAg.99wCwkx_dCi99yxfLRJvDO,EBWfg7KFUWc,Телеканал Дождь,0,1,Maria Hamm,"Посмотрела всё, но много раз хотелось блевануть.",2020-06-16T19:04:14Z,1
762,Ugw4TMU5R7vjltXJUDx4AaABAg.99wCwkx_dCi99wdITs7GM-,EBWfg7KFUWc,Телеканал Дождь,0,6,сергей n1,ты очень силЁн . уважуха . реально - кремень,2020-06-15T21:27:44Z,1
763,Ugz02SS7j2_PNKRhY2B4AaABAg,EBWfg7KFUWc,Телеканал Дождь,0,22,Наталья Nata,Дизайнер! Одно слово. Пусть лучше молчит про Швецию и про глобальные вещи. Ужас.,2020-06-15T17:27:25Z,0
764,UgxyN6YUdDKnLCp0PmF4AaABAg,EBWfg7KFUWc,Телеканал Дождь,1,1,Yoffus,"Тема красавчик! Тихон, слив засчитан ;)",2020-06-15T17:26:38Z,0
765,UgxyN6YUdDKnLCp0PmF4AaABAg.99wChcKHtfk99wL8q7pGzI,EBWfg7KFUWc,Телеканал Дождь,0,0,b page,"для имбицилов да, красавчик",2020-06-15T18:40:24Z,1
766,UgyFvzu0ViK6RsoPfLB4AaABAg,EBWfg7KFUWc,Телеканал Дождь,0,3,copy3copy,У либерды подгорает. Какие же одноклеточные,2020-06-15T17:26:26Z,0
767,UgyRQ_McEfn9AjmgYMh4AaABAg,EBWfg7KFUWc,Телеканал Дождь,6,159,Александра Сергеева,"Наоборот, открылся человек. Переобувается в воздухе. Ужас, позор",2020-06-15T17:25:22Z,0
768,UgxUssrZpk3Pu2qkUud4AaABAg,EBWfg7KFUWc,Телеканал Дождь,0,1,Александр Романов,Уже вечер,2020-06-15T17:24:54Z,0
769,Ugz_lMyxsV0VVDrilnB4AaABAg,EBWfg7KFUWc,Телеканал Дождь,0,22,Sergey Modin,Идиотчесикий Тема,2020-06-15T17:23:08Z,0
770,Ugy_eiCqEZ5USPUShmV4AaABAg,EBWfg7KFUWc,Телеканал Дождь,0,92,irinatgl,"уж на сковородке, мерзкий тип",2020-06-15T17:20:50Z,0
771,UgzmgWU86rVbvpVApet4AaABAg,EBWfg7KFUWc,Телеканал Дождь,0,1,Alexy2901,А ведущий стебётся или он за правду имбицил?,2020-06-15T17:20:08Z,0
772,UgxZylhC-hQGfcNvvNl4AaABAg,EBWfg7KFUWc,Телеканал Дождь,0,1,Mariam Avagyan,Его просто не парит ),2020-06-15T17:19:36Z,0
773,UgxZmiRpOiUh1JAN77d4AaABAg,EBWfg7KFUWc,Телеканал Дождь,0,0,Diana Golovanova,🤦‍♀️🤦‍♀️🤦‍♀️,2020-06-15T17:19:28Z,0
774,Ugxlvil2qnUIZBxwG5t4AaABAg,EBWfg7KFUWc,Телеканал Дождь,0,1,Вера К,"Лебедев придурок! Какие ему вопросы можно задать? Одни понты,троллинг, престарелый мажор! Ведущему лайк!",2020-06-15T17:18:18Z,0
775,Ugx-Igu1LOAr4TjPUCB4AaABAg,EBWfg7KFUWc,Телеканал Дождь,0,1,Владислав Меншутин,Интересно.,2020-06-15T17:17:32Z,0
776,UgwqamEwWtkZbMHjpdV4AaABAg,EBWfg7KFUWc,Телеканал Дождь,0,4,Igor Maevski,Ну он и тупрй,2020-06-15T17:16:52Z,0
777,Ugz9taf2eg6psiv_FIl4AaABAg,EBWfg7KFUWc,Телеканал Дождь,0,0,Кирилл Кнышев,Мудак и ЧПСР,2020-06-15T17:16:03Z,0
778,UgxppCbNunrOO97nH6N4AaABAg,EBWfg7KFUWc,Телеканал Дождь,0,0,Нил Пецко,Ну поднаебали и поднаебали,2020-06-15T17:15:15Z,0
779,UgzUwjJL_apm4R4b_d94AaABAg,EBWfg7KFUWc,Телеканал Дождь,0,11,Margarita Nikolaevna,"Леблядев окончательно поехал кукухой, вообще он внешне очень похож на козла, да и внутренне тоже. КОЗЕЛ С ПОЕХАВШЕЙ КУКУХОЙ🤮",2020-06-15T17:14:35Z,0
780,UgyKei5OSB7BMDgr9wt4AaABAg,EBWfg7KFUWc,Телеканал Дождь,0,11,Andrew S,"Боже какой это идиот! Желание свое невежество выдать за эпатаж. Жги еще, нам без дураков жить скучно!)))",2020-06-15T17:13:18Z,0
781,Ugyg4pQL3p6Snyj059J4AaABAg,EBWfg7KFUWc,Телеканал Дождь,0,0,jibrharlaonero,"дуру гонит, бабушку лохматит, давно спекся этот лебедь",2020-06-15T17:13:13Z,0
782,Ugxt7YDGajf1mdOyEVd4AaABAg,EBWfg7KFUWc,Телеканал Дождь,0,15,Лёка А,"Я этого чмошника даже смотреть и слушать не буду, сразу диз. Что он хорошего может сказать?! Что надо уже сказал.",2020-06-15T17:12:10Z,0
783,UgylPlIGAbEVvxyRfU94AaABAg,EBWfg7KFUWc,Телеканал Дождь,0,9,Капитошка Капитонова,"Ухожу, противно смотреть из-за Лебедева!",2020-06-15T17:10:47Z,0
784,UgxBz4JHWjyKsFT4p0N4AaABAg,EBWfg7KFUWc,Телеканал Дождь,2,49,Daria Alex77,"Приспособленец, у кого нет такой возможности тот тупой, биомасса, все, что вынесла из беседы!",2020-06-15T17:10:19Z,0
785,UgxBz4JHWjyKsFT4p0N4AaABAg.99wAq6MyvMy99xOw4RnRyx,EBWfg7KFUWc,Телеканал Дождь,0,0,Daria Alex77,@Tea Timurin ничего нового он и не сказал. Как обычно сам себе противоречит.,2020-06-16T04:32:42Z,1
786,UgxBz4JHWjyKsFT4p0N4AaABAg.99wAq6MyvMy99wch1rR89v,EBWfg7KFUWc,Телеканал Дождь,0,3,Tea Timurin,"Так слушать внимательнее надо было, в чем проблема-то? Может, и еще что-нибудь удалось бы вынести...",2020-06-15T21:22:29Z,1
787,Ugx5tZPQwR86LDMkKz54AaABAg,EBWfg7KFUWc,Телеканал Дождь,0,14,Капитошка Капитонова,"Лебедев дурак! Вообще не вникает ни во что! Любит путина, жополиз!",2020-06-15T17:10:05Z,0
788,Ugy94NhNzh5bH1v8wO54AaABAg,EBWfg7KFUWc,Телеканал Дождь,0,0,Вера Пахомова,"Эстеееееэээээт.....Типичный, к сожалению",2020-06-15T17:09:55Z,0
789,UgwqOggu40koq_DFuql4AaABAg,EBWfg7KFUWc,Телеканал Дождь,0,11,Tio,Гоните его в шею!,2020-06-15T17:08:43Z,0
790,Ugzhw5bN80pONZ9Canx4AaABAg,EBWfg7KFUWc,Телеканал Дождь,0,1,Alexandr Larsen,тема жопа продажная,2020-06-15T17:08:21Z,0
791,Ugwbhw8LHSt2H8tSPD94AaABAg,EBWfg7KFUWc,Телеканал Дождь,0,7,Sergey Pakhomov,"Ему 45 лет, а сленг как у школьника!",2020-06-15T17:08:02Z,0
792,UgzAxVnMaEKQKZpr8454AaABAg,EBWfg7KFUWc,Телеканал Дождь,0,12,Антон Платон,Сказочный....))),2020-06-15T17:07:51Z,0
793,UgzG_8g7R9quSjwy-V14AaABAg,EBWfg7KFUWc,Телеканал Дождь,0,4,Леди Лямбадельта,"Я, возможно, кого-то удивлю, но Лебедев мог сразу после того, что с ним сделали и как его ""обманули"", говорить громко и четко: ""Меня обманули, продажная власть использует меня, ни в коем случае не голосуйте или голосуйте против, Никаких обновлений!"" 
Но я такого не вижу, ну конечно.",2020-06-15T17:07:25Z,0
794,Ugxt9pDEvdF4sGFxVwh4AaABAg,EBWfg7KFUWc,Телеканал Дождь,0,7,Serg Masharov,конченный хайпожор ),2020-06-15T17:07:15Z,0
795,Ugx1hLE5ecUN6B-AzPR4AaABAg,EBWfg7KFUWc,Телеканал Дождь,0,7,Сергей Михеев,один раз не п...............))))))))))))),2020-06-15T17:07:04Z,0
796,Ugw5Wxq4X33S0l-SfRJ4AaABAg,EBWfg7KFUWc,Телеканал Дождь,4,48,Tio,Лебедев торганул жопой и снова пришел рассказывать что он вне политики?,2020-06-15T17:06:50Z,0
797,Ugw5Wxq4X33S0l-SfRJ4AaABAg.99wARauBmX199xo0I1l8SH,EBWfg7KFUWc,Телеканал Дождь,0,2,Egor,"@Tea Timurin зато любят говорить, что нужно уважать любую точку зрения, потому что свобода слова. :)",2020-06-16T08:20:37Z,1
798,Ugw5Wxq4X33S0l-SfRJ4AaABAg.99wARauBmX199wdGZKrSKt,EBWfg7KFUWc,Телеканал Дождь,0,2,Tea Timurin,"Удивительно, что после его пояснения: ""многие реагируют на ключевые слова, с трудом формулируют собственую позицию"" многие тут кретикуют Лебедя за нетипичную, нешаблонную позицию, обвиняя в ""переобувании""!! Интересно, эти ""критики"" иронию видят? Прикольно! 😄",2020-06-15T21:27:28Z,1
799,Ugw5Wxq4X33S0l-SfRJ4AaABAg.99wARauBmX199wFQYg8YXt,EBWfg7KFUWc,Телеканал Дождь,0,2,Tio,"@kanistra kvasa , не приятно просто, лицемерно. И удивляют люди которые считают его нормальным.",2020-06-15T17:50:23Z,1
