,id,videoId,authorVideoName,totalReplyCount,likeCount,authorDisplayName,textDisplay,publishedAt,isReply
252,Ugw9qjMG6xcYc_NetC94AaABAg,EBWfg7KFUWc,Телеканал Дождь,0,0,Михаил Смирнов,"Артемий, кстати, сказал правильно: Конституция должна меняться как раз для того, чтобы людям было хорошо. И во многих европейских странах и в США конечно так же вносятся поправки.",2020-06-16T17:51:29Z,0
253,UgzZWhYbbNT2udc1-K54AaABAg,EBWfg7KFUWc,Телеканал Дождь,0,0,Вася Никифиров,"Лебедев конечно подорвал оппозиционные пердаки. И очень радует, что он не воспринял все это всерьез, а просто поугарал. Он за поправки и это тоже важно понимать: у него много детей, прям очень, поэтому он знает чего хочет.",2020-06-16T17:45:34Z,0
254,UgyUgnc4M7ibEdrWj4R4AaABAg,EBWfg7KFUWc,Телеканал Дождь,0,0,Иван Дуньский,"Оппозиция вообще странная у нас: сколько Лебедев не говорил о своей позиции и любви к Путину, они все равно почему-то считают его своим и так бомбят, когда он говорит обратное.",2020-06-16T17:41:06Z,0
255,UgzbUID3erZpeHYKa8V4AaABAg,EBWfg7KFUWc,Телеканал Дождь,0,0,Таня Климова,"Вообще Лебедев взрослый человек и сам в праве решать что же ему нужно. Он поддерживает большинство поправок, что не удивительно",2020-06-16T17:38:37Z,0
256,Ugx-Ns68J66uuPJ18Ch4AaABAg,EBWfg7KFUWc,Телеканал Дождь,0,0,MrZiyouren,Талантливый мудак,2020-06-16T17:25:01Z,0
257,UgzbLIhmS1iQrBZZ_qt4AaABAg,EBWfg7KFUWc,Телеканал Дождь,0,4,Жорик К,Весело в путинском концлагере,2020-06-16T17:24:34Z,0
258,UgwNF_80Nrv-V9FdZ2x4AaABAg,EBWfg7KFUWc,Телеканал Дождь,0,0,Роман,и продажная женщина..,2020-06-16T17:14:21Z,0
259,Ugyxtsb4wT4U0lMjHjJ4AaABAg,EBWfg7KFUWc,Телеканал Дождь,0,0,Роман,какая жемразь!,2020-06-16T17:12:24Z,0
260,UgwnPLnHAu3JXPUtOrl4AaABAg,EBWfg7KFUWc,Телеканал Дождь,0,0,MyDefaultChannel,В очередной раз обеждаюсь какой он мудозвон,2020-06-16T17:01:21Z,0
261,UgyUyDSovRHk2_eJTwJ4AaABAg,EBWfg7KFUWc,Телеканал Дождь,0,0,R2-D2,Жалкая попытка отмазаться от своих же слов и действий.,2020-06-16T16:19:56Z,0
262,Ugwmm2pZuJ6D7yHaIL54AaABAg,EBWfg7KFUWc,Телеканал Дождь,0,0,Андрей Антонов,думал что переубедит- хуйня не верю (((( пиздеть не мешки ворочать,2020-06-16T16:13:26Z,0
263,UgwG2VdRXDpv4MT9NV54AaABAg,EBWfg7KFUWc,Телеканал Дождь,1,6,Дмитрий Степаненко,"Артемий включил ""дурочка"" - ""ничего не знаю, я просто снялся, это прикольно, это вАще не про политику""... Ну, конечно не про политику! Это про... съёмки ролика и всё. Бляаа...",2020-06-16T16:02:45Z,0
264,UgwG2VdRXDpv4MT9NV54AaABAg.99ycu7UjHk99A2eT4mzVG4,EBWfg7KFUWc,Телеканал Дождь,0,0,AXIOM,Так и в чем он соврал?,2020-06-18T14:52:36Z,1
265,Ugw02I2DdP7Q_LpW1Kl4AaABAg,EBWfg7KFUWc,Телеканал Дождь,0,0,Владимир Аликов,посадить на мрот.весь кооператив озеро.вмести с путиным.пожизнено.,2020-06-16T16:02:08Z,0
266,UgznYZYKdnAsG6544F54AaABAg,EBWfg7KFUWc,Телеканал Дождь,0,0,Макаров Юрий,Для продвижения,2020-06-16T15:57:32Z,0
267,UgzhLoV2Sw23Q3tW4Jt4AaABAg,EBWfg7KFUWc,Телеканал Дождь,0,0,Djina Ginzburg,сидит на фед и гор заказах - не попросили артемку а ПОТРЕБОВАЛИ подлизнуть,2020-06-16T15:57:23Z,0
268,UgybttRWQ8ytCvqixV14AaABAg,EBWfg7KFUWc,Телеканал Дождь,0,0,Дима Гарин,"Диссоциативное расстройство идентичности , у этого кренделя , того который с бородой. 
 Тихон , будьте аккуратней с такими , отсаживайтесь подальше , ведь хрен его знает,что такому придёт в голову в следующую секунду...",2020-06-16T15:56:39Z,0
269,Ugwxeg24uVARLqCXKtd4AaABAg,EBWfg7KFUWc,Телеканал Дождь,0,0,Ujin Karpikov,У двухпроцентников походу не хило порвало жеппы,2020-06-16T15:56:17Z,0
270,Ugwv8m2_5O8tfWBI5rx4AaABAg,EBWfg7KFUWc,Телеканал Дождь,0,0,Djina Ginzburg,Артемиц хитрожопый ... Где же тот винт???????,2020-06-16T15:54:01Z,0
271,Ugzi6nR8oKD6lvHj8SV4AaABAg,EBWfg7KFUWc,Телеканал Дождь,0,0,Саша Алферов,Почему либералы такие тупые?,2020-06-16T15:42:34Z,0
272,UgySF5OgxMW9doGWm3h4AaABAg,EBWfg7KFUWc,Телеканал Дождь,0,0,Вячеслав Калиниченко,Артемий уже никаким санитайзером не отмоется,2020-06-16T15:37:35Z,0
273,UgyxlUzWpkA7buARAKd4AaABAg,EBWfg7KFUWc,Телеканал Дождь,0,17,Никита Деточенко,"Боже, как красиво ведущий ""размазал"" гостя на 40-ых минутах - браво!😍",2020-06-16T15:25:44Z,0
274,Ugx-bWEB4DmTRc456xJ4AaABAg,EBWfg7KFUWc,Телеканал Дождь,0,0,Катя Плисецкая,"Ведущий с явным презрением отвечает гостю и задаёт вопросы как будто изначально с целью подъебать. Плюс вечно перебивает собеседника, бесит",2020-06-16T15:23:51Z,0
275,UgwUj2JqV3GmLesU2Jh4AaABAg,EBWfg7KFUWc,Телеканал Дождь,0,0,Евгений,Неприятный тип,2020-06-16T15:19:49Z,0
276,Ugx-QwpurLaSvlcFHLV4AaABAg,EBWfg7KFUWc,Телеканал Дождь,0,0,Магомед Шихумов,Лебедев просто рвет и даже не сметает после себя))) кайфую с таких личностей.,2020-06-16T15:11:09Z,0
277,Ugx5eE5AWEUOn9pSj_94AaABAg,EBWfg7KFUWc,Телеканал Дождь,0,0,Студия мозаики Wizdecor,"Переобувается на ходу. Мезкий и циничный тип! Не смогла даже до середины досмотреть, очень противно.",2020-06-16T15:09:01Z,0
278,UgxG8gJOBFEcHyueB3B4AaABAg,EBWfg7KFUWc,Телеканал Дождь,0,0,Алексей Добрый,ДВЕ ПУСТЫШКИ В ЭПИДЕМИОЛОГИИ РАССУЖДАЮТ О COVID! ЗАЧЕМ СЛУШАТЬ ВОЗ ЕСТЬ ЖЕ ЛИБЕРОИДЫ ВСЕЗНАЙКИ С УМНЫМИ МОРДАШКАМИ.,2020-06-16T15:04:14Z,0
279,UgwWy3iInKmTLvEiLEZ4AaABAg,EBWfg7KFUWc,Телеканал Дождь,0,0,Алексей,Мне кажется Артемий мстит этому миру за что-то.,2020-06-16T15:00:31Z,0
280,UgwUDyjXWEJgQa1TwtV4AaABAg,EBWfg7KFUWc,Телеканал Дождь,0,0,максимус,ВСЕ В ТОЧКУ АРТЕМИЙ МОЛОДЕЦ ТРОЛЛЬ ЭТОГО ЧУДИКА ЛИБЕРАСТА ДЗЯТЬКО!!!!,2020-06-16T14:59:02Z,0
281,UgxF_50XIen3tEjlac14AaABAg,EBWfg7KFUWc,Телеканал Дождь,0,0,Иван Коксун,"Пиар  дешёвый ,",2020-06-16T14:58:14Z,0
282,UgzOQxPR_AwIMnYXTH94AaABAg,EBWfg7KFUWc,Телеканал Дождь,0,0,Elena G,"Талантливый дизайнер, как человек с гнильцой! Тихон вы мастерски провели интервью! У нас тоже уши вяли от нестыковок и сказок гостя :)",2020-06-16T14:58:09Z,0
283,UgwCWkYw9hWTp47SnPh4AaABAg,EBWfg7KFUWc,Телеканал Дождь,0,0,Slava_RU,"Артемий лишен какой либо логики, не исключаю конечно, что он намеренно так делает. Но стоит отметить большой прогресс с момента дебат с Навальным, в поведении на публике в общении.",2020-06-16T14:56:24Z,0
284,UgwZbwXUJjKOafATMBt4AaABAg,EBWfg7KFUWc,Телеканал Дождь,0,0,Алексей Колесников,"Куда нажать, чтобы ему **** по лбу ударили?",2020-06-16T14:56:00Z,0
285,UgyxvuIiDbmeM0_hO2B4AaABAg,EBWfg7KFUWc,Телеканал Дождь,0,0,Алексей,"Тёма, это зашквар.",2020-06-16T14:47:10Z,0
286,UgwGqo32vMe4BBvadxB4AaABAg,EBWfg7KFUWc,Телеканал Дождь,0,0,Константин Соколов,"Лебедев снова разъебал при чужой толпе!!!
АНТИХАЙП!",2020-06-16T14:43:38Z,0
287,UgzsrbXl5x6igvhnuzJ4AaABAg,EBWfg7KFUWc,Телеканал Дождь,0,0,Arina Zvereva,да ну лаадно вам Тёма АХУЕННЫЙ,2020-06-16T14:30:51Z,0
288,UgywJ0UEaID4V4bTTvd4AaABAg,EBWfg7KFUWc,Телеканал Дождь,0,0,Александр Александров,"Обман видят только те кто хотят его увидеть. А так поправки написаны настолько просто и понятно, что там даже если захочешь подвох увидеть не увидишь. Четко же сказано, что человек не сможет быть президентом больше 2-ух сроков, что гарантирует сменяемость власти. Ну и в чем подвох? - да, нет его.",2020-06-16T14:23:52Z,0
289,Ugy7YigtYtUkKG-7L0t4AaABAg,EBWfg7KFUWc,Телеканал Дождь,0,0,aleks door,"О""бнулись",2020-06-16T14:18:27Z,0
290,UgyRZvgQNZXg52pfqP94AaABAg,EBWfg7KFUWc,Телеканал Дождь,1,5,Юлия Ч,"🤦‍♀️ Татьяныч !
Самое что интересное, он реально думает что что то из себя представляет 🤦‍♀️",2020-06-16T14:02:39Z,0
291,UgyRZvgQNZXg52pfqP94AaABAg.99yQ9OVr6Q19AScJ4WJgMV,EBWfg7KFUWc,Телеканал Дождь,0,0,Татьяна Гирева,Так он и представляет. В отличие от Вас.,2020-06-28T16:54:01Z,1
292,UgyrWdLeMEsluy2Yqt14AaABAg,EBWfg7KFUWc,Телеканал Дождь,0,0,Dmitriy Suhov,Шикарное интервью!,2020-06-16T14:00:11Z,0
293,Ugx37r4W1pk3QlOhOPR4AaABAg,EBWfg7KFUWc,Телеканал Дождь,0,0,corban,ну обманули и обманули,2020-06-16T13:51:26Z,0
294,UgwB5RHRK2Eb8iAEWuR4AaABAg,EBWfg7KFUWc,Телеканал Дождь,1,0,Sasha Shurova,"Я прям вижу как Артемий Лебедев садится за обеденный стол, расправляет салфетку и с аппетитом читает ваши комментарии.",2020-06-16T13:41:30Z,0
295,UgwB5RHRK2Eb8iAEWuR4AaABAg.99yNjYu02du99yYu8LEVR7,EBWfg7KFUWc,Телеканал Дождь,0,2,Артемий Лебедев,Ага :-),2020-06-16T15:19:04Z,1
296,UgyQzJoGIijOFVGy1Ht4AaABAg,EBWfg7KFUWc,Телеканал Дождь,0,0,Игорь Попрядухин,Он дурак?,2020-06-16T13:33:38Z,0
297,UgwmCxeMUcuxMa3PiYR4AaABAg,EBWfg7KFUWc,Телеканал Дождь,0,0,Сергей Токарев,Тихон не готов к такому уровню дискуссии. Вообще не вывозит.,2020-06-16T13:26:34Z,0
298,Ugzq6f1-FxYXHZCWeS14AaABAg,EBWfg7KFUWc,Телеканал Дождь,0,0,Ros44,"Удивительно как много людей не улавливают, что говорит Лебедев",2020-06-16T13:24:50Z,0
299,UgyCw82QnHOOmTh7QYN4AaABAg,EBWfg7KFUWc,Телеканал Дождь,0,0,Xcv Xcv,Что у него в голове? Только госзаказы? Фу.,2020-06-16T13:24:20Z,0
300,UgwHChGFjcWom_EjXiB4AaABAg,EBWfg7KFUWc,Телеканал Дождь,1,0,oleg makov,"Может стоит сначала прочекать поправки, а потом уже вещать, что типа там кто - то что - то скрывает? Там все написано черным по белому без смс и регистрации. И даже про президентские сроки, которые имеют абсолютно иной смысл, чем оппо пытается выставить  -_-",2020-06-16T13:21:59Z,0
301,UgwHChGFjcWom_EjXiB4AaABAg.99yLVY5mGag99yXRziD1gW,EBWfg7KFUWc,Телеканал Дождь,0,0,Александр Александров,"oleg makov, Вчитываться в поправки для либералов опасно и вредно. Не смогут так задорно врать и набрасывать. Мозг всё равно блокирует лютую ложь, если уже всосал правдивую инфу. Куда легче с чистого листа гнать пургу. Они ж на трудах Геббельса воспитаны.",2020-06-16T15:06:21Z,1
302,UgwyaGRs37048n_656B4AaABAg,EBWfg7KFUWc,Телеканал Дождь,0,0,Гномик Пажылой,Он же даун,2020-06-16T13:18:11Z,0
303,UgxEbDaM_DxAzbOp7hJ4AaABAg,EBWfg7KFUWc,Телеканал Дождь,0,0,Сергей Токарев,Артемий красавчик 👏🏻👏🏻. Тихон в силу костности мышления даже половину его ответов не понимает и при этом пытается глупо шутьть 🤦🏼‍♂️🤦🏼‍♂️🤦🏼‍♂️,2020-06-16T13:11:29Z,0
304,UgxET8-NUodvmEqD59d4AaABAg,EBWfg7KFUWc,Телеканал Дождь,2,0,Egor,"У Артемия есть ответы на все вопросы. 
Складывается впечатление, что он в своем сознании настолько преисполнился, что он как будто бы уже сто триллионов миллиардов лет проживает на триллионах и триллионах таких же планет, как эта Земля, ему этот мир абсолютно понятен, и он здесь ищет только одного покоя, умиротворения и вот этой гармонии, от слияния с бесконечно вечным, от созерцания великого фрактального подобия и от вот этого замечательного всеединства существа, бесконечно вечного, куда ни посмотри, хоть в глубь, хоть ввысь - бесконечное большое, понимаете? А вы ему про видео, где он снялся о поправках к конституции. :)",2020-06-16T13:05:32Z,0
305,UgxET8-NUodvmEqD59d4AaABAg.99yJc8zG0U_99ye4KYPA1U,EBWfg7KFUWc,Телеканал Дождь,0,0,Egor,@Артемий Лебедев спасибо! :),2020-06-16T16:13:01Z,1
306,UgxET8-NUodvmEqD59d4AaABAg.99yJc8zG0U_99ye-x-UMfo,EBWfg7KFUWc,Телеканал Дождь,0,0,Артемий Лебедев,Точно подмечено,2020-06-16T16:12:25Z,1
307,UgzTI6G7bQTQdZXIntl4AaABAg,EBWfg7KFUWc,Телеканал Дождь,0,0,Муся Бубликова,Перевертыш Гадко,2020-06-16T12:35:42Z,0
308,Ugw50DOBqAvHlRSKLMt4AaABAg,EBWfg7KFUWc,Телеканал Дождь,0,0,Евгений Иванов,"Досмотрел до конца, Артемон пошёл нах7й! Блин с него прикол тянут, а он про поездки свои рассказывает, что в жизни нового.Представим. Ему говорят: ""как ты дурачёк не замечаешь очевидного? Ведь нас предали и продали!"" Отвечает: ""Ну он раньше хороший был. Ну и так вот мне 2 страны осталось посетить. и после их посещения получится просто крейзи. Получится что я побывал во всех странах мира...""!
Ты в этой программе, то появился по большому счёту, что бы узнать про то как ты относишься к плешивому, поправкам и Навальному! И как ты прокомментируешь свой зашквар. Гневом он питается, дерьмом ты питаешься! Выдержка ведущего - кремень!",2020-06-16T12:34:14Z,0
309,UgwuBia9gP6De1hH5Qd4AaABAg,EBWfg7KFUWc,Телеканал Дождь,0,0,Филипп Прокопенко,В остальном брехло напыщеное!,2020-06-16T12:22:49Z,0
310,UgzeIpieZ4q6rMciitl4AaABAg,EBWfg7KFUWc,Телеканал Дождь,0,0,Филипп Прокопенко,"Касательно вируса и всего вытекающего, полностью согласен!  Все сильно преувеличено!",2020-06-16T12:22:12Z,0
311,UgxM7enRlnFy87aHWu14AaABAg,EBWfg7KFUWc,Телеканал Дождь,0,0,Игорь Цветков,Тёма ходи на дождь почаще 🙂,2020-06-16T12:17:34Z,0
312,UgytevOr7ZotawpDJaR4AaABAg,EBWfg7KFUWc,Телеканал Дождь,0,1,Игорь Цветков,У Сталина вся армия расстреляна! угар,2020-06-16T12:16:54Z,0
313,UgxUqjx2udOqZVx3XwB4AaABAg,EBWfg7KFUWc,Телеканал Дождь,0,0,я,не это навальный старается копеечка к копеечки складывает 1 милион выкладывает в ютубе и вот только он накпил и штраф 1 милион за непонятную причину про ветерана это что за такой суд,2020-06-16T12:04:10Z,0
314,UgyMLYAX7FlEgxcA2Ep4AaABAg,EBWfg7KFUWc,Телеканал Дождь,0,2,GG SAY,"Артемий Лебедев - явно переоценивает свои умственные возможности, успех в карьере дизайнера ещё не говорит что ты специалист во всём))",2020-06-16T12:02:25Z,0
315,UgwTx6dc7-L78EPp95B4AaABAg,EBWfg7KFUWc,Телеканал Дождь,0,3,Евгений Ермолаев,"Тихону +, Артёму диз. Питается он хэйтом, ага, прям так и есть. Про него вот что можно сказать: сытый голодного не поймёт.",2020-06-16T12:00:59Z,0
316,Ugxtqi00aMAMXrbmAM94AaABAg,EBWfg7KFUWc,Телеканал Дождь,1,0,Basil F,"Нет бы сказать - ""мне заплатили, я снялся"". Начинает маняврировать, как уж на сковородке.",2020-06-16T12:00:41Z,0
317,Ugxtqi00aMAMXrbmAM94AaABAg.99yCC4ukgFS99yFU6PVGzN,EBWfg7KFUWc,Телеканал Дождь,0,0,Стас Стасов,Чтоб ты успокоился ?,2020-06-16T12:29:21Z,1
318,UgxSuDjwQl17W0H6kw94AaABAg,EBWfg7KFUWc,Телеканал Дождь,0,0,Стас Стасов,Лебедев Топ!,2020-06-16T11:58:00Z,0
319,Ugwyp5QABZ9AqWM3L0d4AaABAg,EBWfg7KFUWc,Телеканал Дождь,0,0,Николай Васильев,"Что- то, он слишком долго задержался на этом свете",2020-06-16T11:57:16Z,0
320,UgwI7UR_dCnutvDcICR4AaABAg,EBWfg7KFUWc,Телеканал Дождь,0,0,Михаил Ридрих,"Дно, конечно. Полный придурок.",2020-06-16T11:54:27Z,0
321,UgwMKbG-_FE18q-ta1p4AaABAg,EBWfg7KFUWc,Телеканал Дождь,0,0,Aziz Azizov,"Еще одно свидетельство, что один лишь высокий интеллект - не делает человека человеком.. Нужна еще и Любовь, которая дает Совесть и сострадание. Иначе ты - просто злой гений и кончишь как все злые гении на помойке истории.",2020-06-16T11:52:36Z,0
322,UgzcD6BRaLNfN8MQQLN4AaABAg,EBWfg7KFUWc,Телеканал Дождь,2,0,Кирилл Макаров,"Никто никого не обманывает. Все поправки в общем доступе- читай, не хочу. И при этом они сформулированы таким образом, чтобы не допустить спекуляций и многозначности трактовок. Так что все более чем понятно.",2020-06-16T11:48:18Z,0
323,UgzcD6BRaLNfN8MQQLN4AaABAg.99yAmRYPhqH99yLpsmt2M3,EBWfg7KFUWc,Телеканал Дождь,0,0,oleg makov,"@Полина Загитова а я еще читал, что дет делаться большой упор на научно - технический прогресс и его подгон под современные реалии, типа обеспечение безопасности личной инфы в цифровом варианте",2020-06-16T13:24:53Z,1
324,UgzcD6BRaLNfN8MQQLN4AaABAg.99yAmRYPhqH99yDZZXgKg3,EBWfg7KFUWc,Телеканал Дождь,0,0,Полина Загитова,"Знаю, что в качестве поправок предлагается развитая система здравоохранения. Мне кажется, что ситуация с коронавирусом и так показала, что у нас есть возможность развивать медицину и далее. Причем бесплатную медицину.",2020-06-16T12:12:37Z,1
325,Ugz54at3RuqDZcjjrux4AaABAg,EBWfg7KFUWc,Телеканал Дождь,0,4,Яна Калита,"Какой неприятный человек, я бы с ним в одну лодку не села",2020-06-16T11:43:38Z,0
326,UgyX7wfINQm1uCkZtEZ4AaABAg,EBWfg7KFUWc,Телеканал Дождь,0,0,Евгений Иванов,"Почему Лебедев считает себя чем то противоположным поправкам!? Как Слава КПСС и фанта. Ты же просто ""фрик"". Или ты в голове себе навыдумывал какой ты крутой и интересный)) Круто зашкварился в глазах понимающих людей. Как говорится интернет (история) помнит всё. Безусловно посветил лицом в ролике, дела пошли в гору. Вся эта ситуация, это повод поднять бабла. Как же смешно слышать эту мантру ""это же прикольно, я не считаю это чем то плохим"". И ты вынужден это повторять что бы хоть самому на миг в это поверить. Тьфу бл*ть... Пойду пересматривать ЧБД где тебя отжарили Артемий!!!",2020-06-16T11:36:42Z,0
327,Ugy3GnHkuTIzKhRD1F54AaABAg,EBWfg7KFUWc,Телеканал Дождь,0,0,Eduard Gabidullin,Ужасный ведущий,2020-06-16T11:34:59Z,0
328,UgzYynr1NU7zK9OvZbJ4AaABAg,EBWfg7KFUWc,Телеканал Дождь,0,0,Sana Ko,"рф можно смело в туберкулезную федерацию переименовать, и у нас даже коклюш не умеют диагностировать врачи) буквально в декабре 2019 пришлось самостоятельно гуглом диагностировать ребенку, ни платные ни бесплатные в Москве не умеют диагноз ставить. нет у нас медицины практически. не удивлюсь что 50% смертей от пневмонии это заслуга наших некомпетентных нищих врачей",2020-06-16T11:34:54Z,0
329,UgwY0JfkvSw0DEGBsXV4AaABAg,EBWfg7KFUWc,Телеканал Дождь,0,0,Евгений Кожевников,Говорит КОГНИТИВНЫЙ ДИССОНАНС,2020-06-16T11:31:43Z,0
330,Ugy3J17Q0SVZEm-MZMt4AaABAg,EBWfg7KFUWc,Телеканал Дождь,0,0,Дядя Валера,"То есть получается, что если у животного рога скручены и оно говорит ""бээээ"" - оно называется ""баран""? Ерунду какую-то говорит Лебедев)",2020-06-16T11:27:18Z,0
331,UgyxdHcjjRmhsGv97v14AaABAg,EBWfg7KFUWc,Телеканал Дождь,0,0,Sana Ko,"пора бы уже начать уважать всех кто живет в рф и не является чинушей олигархом миллиардером,  за то что человек работает и терпит этот беспредел маразм и грабеж в стране",2020-06-16T11:23:23Z,0
332,Ugx18AgvZ5T-3ULvbQl4AaABAg,EBWfg7KFUWc,Телеканал Дождь,0,0,CelestialArms,Идиот. Смотреть желания нет. Дизайнер? Когда он им был? Клоун.,2020-06-16T11:20:12Z,0
