,id,videoId,authorVideoName,totalReplyCount,likeCount,authorDisplayName,textDisplay,publishedAt,isReply
517,Ugx75_lzY2eN1yxoE-V4AaABAg.99wbYwKs8nH9A2dLUOXkNM,EBWfg7KFUWc,Телеканал Дождь,0,2,Alexey Klochkov,Это называется *реализм*,2020-06-18T14:42:50Z,1
518,Ugx75_lzY2eN1yxoE-V4AaABAg.99wbYwKs8nH99y4YJdSQiG,EBWfg7KFUWc,Телеканал Дождь,0,1,Воропаев Сергей,Цинизм такая же обыденность как пожрать или посрать. Есть ещё пиздоболы которые говорят что они не такие.,2020-06-16T10:53:48Z,1
519,Ugx75_lzY2eN1yxoE-V4AaABAg.99wbYwKs8nH99y3cERVuA9,EBWfg7KFUWc,Телеканал Дождь,0,4,Anastasiya Demyanova,"@Миша Дадонов есть такие люди, и они имеют право на свое мнение. А есть такие кто ""и нашим и вашим и споем и спляшем"", только бы денежки текли рекой и с оппозиционного ютуба, и из госзаказов;))",2020-06-16T10:45:44Z,1
520,Ugx75_lzY2eN1yxoE-V4AaABAg.99wbYwKs8nH99xzHH7Ftzz,EBWfg7KFUWc,Телеканал Дождь,0,3,Миша Дадонов,"Ну в стране могут находиться люди с разными точками зрения...есть адекватные, которым чужды ценности и гей-пропаганда с оппозиционных каналов.",2020-06-16T09:59:03Z,1
521,Ugzmx-1HFZbZnu6xHo94AaABAg,EBWfg7KFUWc,Телеканал Дождь,0,0,Кирилл Ростум,"Вроде и красиво и правильно Лебедев вещает, но вот прям тонкая грань, параллельна говну, но как говорится «параллельные прямые никогда не пересекаются». Но рядом.",2020-06-15T21:12:16Z,0
522,UgyoQJjd1hsHBGZXLIF4AaABAg,EBWfg7KFUWc,Телеканал Дождь,0,10,Карина Петрова,"Комменты золото:) после программы было классное настроение, но после прочтения комментов оно ещё улучшилось👍🏻Лебедев, ""умеете, могёте""",2020-06-15T21:09:30Z,0
523,Ugw_CPcNSkE3AyZ-MUF4AaABAg,EBWfg7KFUWc,Телеканал Дождь,0,1,Nikita Rudenko,"Не интервью, а почти дебаты. Большое спасибо за выпуск, так даже интереснее! ))",2020-06-15T21:08:16Z,0
524,UgyxPecOcOzvbIuIldh4AaABAg,EBWfg7KFUWc,Телеканал Дождь,0,9,Alex Selivanov,"Тема панковый клерк. Только власть говорит клерк, а он настаивает - панковый.",2020-06-15T21:06:31Z,0
525,UgzrZJuwQ2lzoiza9Qd4AaABAg,EBWfg7KFUWc,Телеканал Дождь,0,0,Аркадий Кузнецов,Дизайнер блеа 🤦‍,2020-06-15T21:06:24Z,0
526,UgxJ5M1F-PLNP3PCnrJ4AaABAg,EBWfg7KFUWc,Телеканал Дождь,0,0,hungpower,прихвостень путинский этот ваш Л.А.,2020-06-15T21:03:49Z,0
527,UgwSRUSVy0pAZ3b8g3J4AaABAg,EBWfg7KFUWc,Телеканал Дождь,0,0,10 10,"Пытался прекрыться, а сделал хуже. Тебя не забудут!",2020-06-15T21:03:04Z,0
528,Ugy5kL3RB6Tvf2uXOzd4AaABAg,EBWfg7KFUWc,Телеканал Дождь,0,0,Николай,"Интересно, мамка его ночами спит хорошо, не стыдно ей, что такой подонок-сын?",2020-06-15T21:03:01Z,0
529,UgypXPaevu2bxT64qx14AaABAg,EBWfg7KFUWc,Телеканал Дождь,0,3,Вячеслав Эскин,"Постирония = я делаю че хочу, у меня нет принципов, а в случае чего скажу, что это просто прикол такой, чтоб у всех горело.",2020-06-15T21:00:02Z,0
530,UgzblZJ69UZKBDcfV-V4AaABAg,EBWfg7KFUWc,Телеканал Дождь,1,68,M. K.,"У Тихона чуть пар из ушей не пошел.
Лайк только за ведущего.",2020-06-15T20:56:11Z,0
531,UgzblZJ69UZKBDcfV-V4AaABAg.99w_gNn1LWs99yyjm4xD3J,EBWfg7KFUWc,Телеканал Дождь,0,2,Maria Hamm,Выдержка у него железная. Только он смог такое интервью выдержать. Молодчина.,2020-06-16T19:13:35Z,1
532,Ugwn6Vufh0cwpCD1dGx4AaABAg,EBWfg7KFUWc,Телеканал Дождь,0,0,Шамиль Саитов,Звук говно,2020-06-15T20:55:08Z,0
533,UgyXgJYrm1gelUZNNEZ4AaABAg,EBWfg7KFUWc,Телеканал Дождь,0,0,Алекмандр Петров,Мерзкий тип. Даже не скользкий...,2020-06-15T20:53:41Z,0
534,Ugy8-tWALJVl8FkPRRZ4AaABAg,EBWfg7KFUWc,Телеканал Дождь,0,0,Шекемов Руслан,Такой скользкий конечно,2020-06-15T20:51:11Z,0
535,Ugw6nJp6e_DVYc77-c14AaABAg,EBWfg7KFUWc,Телеканал Дождь,0,0,chipscape,"Ебать левачие жопы до сих полыхают, Тема гений, просто лучший.",2020-06-15T20:49:51Z,0
536,Ugz2M_ezvqvOX1bxyWp4AaABAg,EBWfg7KFUWc,Телеканал Дождь,0,0,Bogdan Mironyuk,Жутко скользкий тип.,2020-06-15T20:49:42Z,0
537,UgxMsEBKjgrrBDP7qpZ4AaABAg,EBWfg7KFUWc,Телеканал Дождь,0,1,с г,"нафиг его позвали вообще, пусть у соловья причесывает",2020-06-15T20:48:00Z,0
538,UgxaAvrxK9HG1FvS8e94AaABAg,EBWfg7KFUWc,Телеканал Дождь,0,1,Pavel Tkachenko,"Даже смотреть не буду: один - прекрасный журналист на самом лучшем канале! Второй - омерзительный г₽&&оед, жополиз и Кремлевский агент, возомнивший себя дизайнером всея Руси!....",2020-06-15T20:47:11Z,0
539,UgwjehIEvOfH4aHwSLN4AaABAg,EBWfg7KFUWc,Телеканал Дождь,0,2,Любовь Жорник,"Зачем на него тратит время, не понимаю, одни понты, тошнит,...дизайнер!? Дизлайк и не буду слушать.",2020-06-15T20:44:38Z,0
540,UgzdBnbrAp12scyJL_14AaABAg,EBWfg7KFUWc,Телеканал Дождь,0,1,Vova St,Здоровые люди не состоят Дождь.,2020-06-15T20:43:59Z,0
541,UgzaSiLShWg7VsCkjc54AaABAg,EBWfg7KFUWc,Телеканал Дождь,0,0,Sergey Vens,"*Больше Лебедевых, умных и разных!*",2020-06-15T20:43:45Z,0
542,UgxEIS7NIlPhgQVD2GN4AaABAg,EBWfg7KFUWc,Телеканал Дождь,3,81,tuberosa 27,"Очень нравится Тихон! Вежливый, спокойный, приятный тембр голоса, умеет вести беседу. Спасибо! Артемию конечно лучше бы одну линию гнуть, а то какая-то биполярочка получается.      Совершенно не понятна позиция человека. Хочется человеку и госзаказов, и подписчиков. Так не бывает",2020-06-15T20:43:25Z,0
543,UgxEIS7NIlPhgQVD2GN4AaABAg.99wZDrTSOxU9A703VyyNvU,EBWfg7KFUWc,Телеканал Дождь,0,0,Mike Nb,Похож на твоего парня?,2020-06-20T07:27:03Z,1
544,UgxEIS7NIlPhgQVD2GN4AaABAg.99wZDrTSOxU99xgxjqvRHU,EBWfg7KFUWc,Телеканал Дождь,0,1,Sal Az,Почему не бывает?,2020-06-16T07:18:58Z,1
545,UgxEIS7NIlPhgQVD2GN4AaABAg.99wZDrTSOxU99xc5ePiROq,EBWfg7KFUWc,Телеканал Дождь,0,9,Артем Чистяков,"Очень не нравится Тихон. Постоянно запинается, ужасно задаёт вопросы, использует недопустимую лексику. Приводит какие то глупые примеры. Плохой  ведущий :D",2020-06-16T06:36:29Z,1
546,UgyQ9TIL0JVRqVGucRN4AaABAg,EBWfg7KFUWc,Телеканал Дождь,0,0,mikedonot,Как называется сериал про Саакашвили?,2020-06-15T20:42:52Z,0
547,UgykJMzgpm_5hSK6wKJ4AaABAg,EBWfg7KFUWc,Телеканал Дождь,0,1,Виктор Ольшин,Вот он даун крашеный нет слов,2020-06-15T20:41:53Z,0
548,UgzKuIqNhlLNWdWo4O14AaABAg,EBWfg7KFUWc,Телеканал Дождь,0,0,tru_ra,"пожалуйста, не заставляйте Тихона проговаривать сайты и странички. и звучит убого и функционал нулевой. выводите анимацию на экран несколько раз за эфир, а Тихон пускай напоминает о подписке и спонсорстве, но без физического адреса.",2020-06-15T20:40:20Z,0
549,UgwCVbx9rXarc-Gqkjx4AaABAg,EBWfg7KFUWc,Телеканал Дождь,0,0,S.O.D.,"Какое омерзительное животное ., помыться хочется после просмотренного ...",2020-06-15T20:39:16Z,0
550,Ugz9qO0MvMCuGq_qJPd4AaABAg,EBWfg7KFUWc,Телеканал Дождь,0,2,Sergey Vens,"_Слушая Артемия,_
_Постоянно в теме я!_",2020-06-15T20:37:41Z,0
551,UgyLy__azQtk6qlneAt4AaABAg,EBWfg7KFUWc,Телеканал Дождь,0,1,MrSterzhen,Отморозок,2020-06-15T20:34:05Z,0
552,UgwOG7rTTaDxpaC1_5J4AaABAg,EBWfg7KFUWc,Телеканал Дождь,1,3,SilVer Present,"Ставлю лайк ведущему, он молодец, а Лебедев вызывает призрение",2020-06-15T20:33:36Z,0
553,UgwOG7rTTaDxpaC1_5J4AaABAg.99wY5x_5hUL99wYAkw_fwe,EBWfg7KFUWc,Телеканал Дождь,0,1,SilVer Present,Вопросы ведущий интересно составлял и задавал этому ужу),2020-06-15T20:34:15Z,1
554,UgwpchGKMADtEjup-zF4AaABAg,EBWfg7KFUWc,Телеканал Дождь,0,0,Yaroslav TRETYAKOV,Что за бред он несёт 🤭,2020-06-15T20:33:26Z,0
555,UgypGAz3rnqDJSd93dp4AaABAg,EBWfg7KFUWc,Телеканал Дождь,0,4,Sergey Vens,*Лебедев* – молодец! *Дзятко* – молодец тоже! Класс!,2020-06-15T20:32:43Z,0
556,UgzIkhM5RiY9DvmQenN4AaABAg,EBWfg7KFUWc,Телеканал Дождь,0,1,Илья Соловьёв,"Тебя даже свои не уважают, Тёма.  Ты дизайнерский высер!",2020-06-15T20:31:27Z,0
557,UgyU7ww7Hj8d1qvaNdp4AaABAg,EBWfg7KFUWc,Телеканал Дождь,3,65,Anastasiya Demyanova,"Кручу, верчу - отбрехаться хочу🤦‍♀️",2020-06-15T20:29:38Z,0
558,UgyU7ww7Hj8d1qvaNdp4AaABAg.99wXduEAH_K99yqrH0zswt,EBWfg7KFUWc,Телеканал Дождь,0,1,Валерия Иванова,"@Ksenia Koren Может он и циник , но выражает свою точку зрения . На нее каждый имеет свое право , только оппы этого не понимают , клеймят сразу тех , кто за поправки , даже не выслушав доводы",2020-06-16T18:04:42Z,1
559,UgyU7ww7Hj8d1qvaNdp4AaABAg.99wXduEAH_K99y38oIeUaZ,EBWfg7KFUWc,Телеканал Дождь,0,1,Anastasiya Demyanova,"@Ksenia Koren да, очень неприятное производит впечатление: с одной строны самомнение зашкаливает, с другой  видно как неловко юлит там, где его Тихон поддавливает.",2020-06-16T10:41:35Z,1
560,UgyU7ww7Hj8d1qvaNdp4AaABAg.99wXduEAH_K99xxwdLZ2LI,EBWfg7KFUWc,Телеканал Дождь,0,4,Ksenia Koren,"Неприятно Лебедева слушать, цинизм зашкаливает",2020-06-16T09:47:21Z,1
561,Ugx-24b6NUSYWnzkZBl4AaABAg,EBWfg7KFUWc,Телеканал Дождь,0,1,Владимир Марко,Чучело безхребетное,2020-06-15T20:28:04Z,0
562,Ugyc-WEkpbDkzs3iwY14AaABAg,EBWfg7KFUWc,Телеканал Дождь,0,1,julia Shmeleva,Слизняк. ФУ ФУ ФУ...,2020-06-15T20:26:14Z,0
563,UgzAXgUQGFJO4uCo_954AaABAg,EBWfg7KFUWc,Телеканал Дождь,0,3,Игорь Дорофеев,"Ничего страшного он не говорит. Честно все ответил, не ерзал. Все как в его новостях. Честный, самобытный. Мне нравится",2020-06-15T20:23:10Z,0
564,UgxblolQGEphfPXw3pd4AaABAg,EBWfg7KFUWc,Телеканал Дождь,0,3,Алексей Иванов,"Диз лично продажной жопе,с крашеной башкой",2020-06-15T20:20:55Z,0
565,Ugyz2Xkg0DJmcAvYyfx4AaABAg,EBWfg7KFUWc,Телеканал Дождь,0,0,Julia S,"Артемий - художник и тролль. Всё,что он говорит и делает - это большой перформанс.",2020-06-15T20:20:36Z,0
566,UgxhIUnwdPyDL8AX_-54AaABAg,EBWfg7KFUWc,Телеканал Дождь,0,2,Denis BrezhJ,"Лебедев купленный на гос закупках,",2020-06-15T20:20:12Z,0
567,UgxhD0ASpFOX6Qb0TkJ4AaABAg,EBWfg7KFUWc,Телеканал Дождь,0,9,Oleg Sidorov,"Тёма молодец, рви их ПУКАНЫ.",2020-06-15T20:18:04Z,0
568,UgzAB9fdyxzr4MY3hHJ4AaABAg,EBWfg7KFUWc,Телеканал Дождь,2,0,Bravo Six,"У меня дед был ветеран ВОВ. Тема, где мой миллион?",2020-06-15T20:16:59Z,0
569,UgzAB9fdyxzr4MY3hHJ4AaABAg.99wWCDTVXPU99xco9683U2,EBWfg7KFUWc,Телеканал Дождь,0,0,Bravo Six,"@Sal Az Мы тоже получили положенное. Тут, как я понял, Лебедев деньги раздает и его это особо не напрягает. Пользуйся! Побегать по судам видимо тоже придётся.",2020-06-16T06:42:42Z,1
570,UgzAB9fdyxzr4MY3hHJ4AaABAg.99wWCDTVXPU99xbKO3WJEI,EBWfg7KFUWc,Телеканал Дождь,0,0,Sal Az,Просто твои родственники твои ленивые люди. Мы получили с государства и хату и машину. Ну пришлось побегать ну и дед под 30 тысяч пенсию получал,2020-06-16T06:29:46Z,1
571,UgxK5RtAlRSlXP2fbP14AaABAg,EBWfg7KFUWc,Телеканал Дождь,0,2,Bob Dylan,"Неприятный человечишка. Отписался от него, конечно.",2020-06-15T20:16:38Z,0
572,UgySbbYi6MhZ8hYHlkh4AaABAg,EBWfg7KFUWc,Телеканал Дождь,0,2,boris lavristchev,"Лебедев такой дурачёк, и был всегда и повзрослел остался.",2020-06-15T20:16:02Z,0
573,Ugx73R3ctVm-EabLeWt4AaABAg,EBWfg7KFUWc,Телеканал Дождь,0,6,Vadim Topmen,Лебедев  - красавчик!,2020-06-15T20:15:48Z,0
574,UgxTnGPeE582u2NQxtV4AaABAg,EBWfg7KFUWc,Телеканал Дождь,0,3,Konstantin Pavlov,Артемий красава. Читаю его уже лет 15)) Человечище,2020-06-15T20:13:28Z,0
575,Ugzqw1R33r67pdEXZ-54AaABAg,EBWfg7KFUWc,Телеканал Дождь,3,13,Anna Rozhkova,бедный Тихон) прям видно как он офигевал от Лебедева),2020-06-15T20:12:23Z,0
576,Ugzqw1R33r67pdEXZ-54AaABAg.99wVfWURdPW9A1r7N30ioo,EBWfg7KFUWc,Телеканал Дождь,0,0,Nora Nora,"@Maria Hamm  да его вообще  шокирует, что  кому  то может быть  плевать на  политику.. По его мнению все по  уши должны быть погружены  в нее.. А  Артемий живет  себе  в предлагаемых обстоятельствах и  сильно не  парится..",2020-06-18T07:24:00Z,1
577,Ugzqw1R33r67pdEXZ-54AaABAg.99wVfWURdPW99yy7m__ilF,EBWfg7KFUWc,Телеканал Дождь,0,0,Maria Hamm,"@Сергей Токарев будешь тут не готовым. Гость законченный циник. Да еще и переобувается в прыжке. Тихон вел себя очень спокойно,  хотя понятно, что он просто в шоке от ответов  гостя.",2020-06-16T19:08:15Z,1
578,Ugzqw1R33r67pdEXZ-54AaABAg.99wVfWURdPW99yLn234iM_,EBWfg7KFUWc,Телеканал Дождь,0,2,Сергей Токарев,Тихон не готов к такому уровню дискуссии. Вообще не вывозит.,2020-06-16T13:24:30Z,1
579,Ugys7_meBmqQ2rWH79d4AaABAg,EBWfg7KFUWc,Телеканал Дождь,0,1,Svetlana,Очень скользкий тип,2020-06-15T20:12:18Z,0
580,UgxIUrGaJIzV1eH5XJ94AaABAg,EBWfg7KFUWc,Телеканал Дождь,0,2,Ingrian Swamps,"Спасибо ведущему, спасибо гостю. 
Ты, кто сейчас читает данный комментарий, как только ты ставишь дизлайк Артемию или же оставляешь гневный коммент под его видео , ты автоматом уже работаешь на него )) ну и вполне можете чувствовать себя поюзаннами, т.к. своей активностью лишь укрепляете его бизнес.",2020-06-15T20:07:55Z,0
581,UgwO5iH2At3LoTgxfX94AaABAg,EBWfg7KFUWc,Телеканал Дождь,0,2,STAFL. RU,Зачем жополиза в программу позвали?) а самый главный вопрос про запасную обувь не спросили?,2020-06-15T20:07:28Z,0
582,UgwBaPfVDzPhVPinPEp4AaABAg,EBWfg7KFUWc,Телеканал Дождь,0,0,Елена Кор.,"Про ковид правильные вещи говорит. Поддерживаю. Но тогда не понимаю, почему поддерживает наше правительство ((((",2020-06-15T20:06:14Z,0
583,UgyeUGxtnwBRaB69Mdt4AaABAg,EBWfg7KFUWc,Телеканал Дождь,0,0,Alexey Yarnikh,Полный мудак  и конформист,2020-06-15T20:05:19Z,0
584,UgximEbHXZmjbabCtp14AaABAg,EBWfg7KFUWc,Телеканал Дождь,0,2,MrSantikka,Лебедев просто Мудила с большой буквы ... :-),2020-06-15T20:05:17Z,0
585,UgxwDT-Bw7oBwb5mOOF4AaABAg,EBWfg7KFUWc,Телеканал Дождь,4,21,Alexandr Sergeevich,"Как говорится: Я человек простой, вижу перламутрового мурзилку - ставлю диз.",2020-06-15T20:04:49Z,0
586,UgxwDT-Bw7oBwb5mOOF4AaABAg.99wUo5WoAyL99y_Rd2nVUz,EBWfg7KFUWc,Телеканал Дождь,0,0,Alexandr Sergeevich,"@Сергей Токарев ты либо поясняй свою мысль, либо ходи мимо. Мы тут не в угадай мелодию играем. Моя позиция - что Лебедев - недостойный человек по разным причинам, переобувается на ходу. И тратить тут время на думки о нем смысла не вижу. Если считаешь, что смысл есть, так пиши, а не загадками говори, ты же не девочка (я надеюсь), нечего меня пытаться заинтриговать.",2020-06-16T15:32:31Z,1
587,UgxwDT-Bw7oBwb5mOOF4AaABAg.99wUo5WoAyL99yQiEst-0d,EBWfg7KFUWc,Телеканал Дождь,0,1,Сергей Токарев,@Alexandr Sergeevich именно в этом случае и надо думать,2020-06-16T14:07:32Z,1
588,UgxwDT-Bw7oBwb5mOOF4AaABAg.99wUo5WoAyL99yOeZ-kAVp,EBWfg7KFUWc,Телеканал Дождь,0,1,Alexandr Sergeevich,"@Сергей Токарев порой да, но не в случае с этим перевертышем.",2020-06-16T13:49:33Z,1
589,UgxwDT-Bw7oBwb5mOOF4AaABAg.99wUo5WoAyL99yLZ_lLYZ0,EBWfg7KFUWc,Телеканал Дождь,0,2,Сергей Токарев,Порой стоит быть сложнее,2020-06-16T13:22:32Z,1
590,UgyrM0CGj1D9KduUjPR4AaABAg,EBWfg7KFUWc,Телеканал Дождь,0,3,AA,опять этот черт у вас. отписка. достали показывать мудозвонов.,2020-06-15T20:04:16Z,0
591,Ugwy2LZ3kwY8XsHPAdJ4AaABAg,EBWfg7KFUWc,Телеканал Дождь,2,22,ertertey1,"Тихон, с этим персонажем Вы открылись с новой интересной, более откровенной стороны! Успехов Вам!",2020-06-15T20:00:29Z,0
592,Ugwy2LZ3kwY8XsHPAdJ4AaABAg.99wUJRHNDup99yullVo2-i,EBWfg7KFUWc,Телеканал Дождь,0,2,Maria Hamm,@James Bond С суперинтеллигентной. Не послал дебила на,2020-06-16T18:38:54Z,1
593,Ugwy2LZ3kwY8XsHPAdJ4AaABAg.99wUJRHNDup99yb776V61g,EBWfg7KFUWc,Телеканал Дождь,0,1,James Bond,"Эммм, с какой ?)",2020-06-16T15:47:11Z,1
594,UgxHjE-Sf_Qsjsr7CLx4AaABAg,EBWfg7KFUWc,Телеканал Дождь,0,1,Diana Palijchuk,"мда.. и ведь уверен, что самый умный и ловкий. А все другие, с обеих сторон, - дурачки идейные...",2020-06-15T20:00:29Z,0
595,UgySbIbIUDVQEClLNrB4AaABAg,EBWfg7KFUWc,Телеканал Дождь,0,2,John Thompson,такой чушпан этот синевласка,2020-06-15T19:59:52Z,0
596,Ugx_n7Ux-apzG6Hzs514AaABAg,EBWfg7KFUWc,Телеканал Дождь,0,2,Kyrylo Kucher,Пиздит как дышит!!!,2020-06-15T19:59:19Z,0
597,Ugyilza9ySB8LmyK_J94AaABAg,EBWfg7KFUWc,Телеканал Дождь,0,1,rav vrn,"За Славика респект! Не уверен, что ты реально с него тащишься, скорее всего пиздишь)). Ну да ладно, всё равно пропиарил , бесплатно. Респект, Татьяныч 👍",2020-06-15T19:59:07Z,0
598,UgwEnUrbVdp1h0GzPLh4AaABAg,EBWfg7KFUWc,Телеканал Дождь,0,3,Тот Самый,Мне больше и больше начал нравится Лебедев,2020-06-15T19:58:22Z,0
599,UgyPToN6Z-_7bcQGoy94AaABAg,EBWfg7KFUWc,Телеканал Дождь,3,19,Данил Лысов Инвестиции 2020,"Тупой, необразованный и к тому же еще лицемер. Жаль что такие люди пропагандируют как норму деспотизм и автократию в России. Надеюсь в России будущего этого клоуна вышвырнут из страны.",2020-06-15T19:52:58Z,0
600,UgyPToN6Z-_7bcQGoy94AaABAg.99wTSPHBjTs99y516qA4e7,EBWfg7KFUWc,Телеканал Дождь,0,0,Данил Лысов Инвестиции 2020,"Линия Жизни в чем он ее любит? Зарабатывает тут бабки на гос заказах? Большинство россиян получают зарплату в 250-400 долларов. Пенсия так же 200-350 баксов. Ахринеть просто откуда вы такие тупые лезете. Путин у власти уже 20 лет. Два своих срока он честно отсидел, пускай валит. Нам нужно развитие страны, а не рецессия которая уже 8 лет идёт. Если ты хотя бы слово такое знаешь.",2020-06-16T10:58:01Z,1
601,UgyPToN6Z-_7bcQGoy94AaABAg.99wTSPHBjTs99y4_6LR5RE,EBWfg7KFUWc,Телеканал Дождь,0,0,Линия Жизни,"Этот человек топовый дизайнер, и вы с ним рядом даже не стояли. И в чем его лицемерие, что он свою страну любит и уважает? А вы не лицемер, находясь у нас в стране и зарабатывая, Европу нахваливаете?!",2020-06-16T10:54:03Z,1
602,UgyPToN6Z-_7bcQGoy94AaABAg.99wTSPHBjTs99xi1ywEVCT,EBWfg7KFUWc,Телеканал Дождь,0,1,Sal Az,Ахаха горит горит туши,2020-06-16T07:28:25Z,1
603,UgxVLHwuqFK3e7YynYl4AaABAg,EBWfg7KFUWc,Телеканал Дождь,1,31,Артем Некипелов,Прекрасный интервьюер!,2020-06-15T19:49:18Z,0
604,UgxVLHwuqFK3e7YynYl4AaABAg.99wT1SeuC9W99ywIHNeZ2y,EBWfg7KFUWc,Телеканал Дождь,0,0,Maria Hamm,Ну и нервы у него? Никак не показал своей брезгливости к собеседнику.,2020-06-16T18:52:13Z,1
605,UgxgSjhIC3PvIkbWpTZ4AaABAg,EBWfg7KFUWc,Телеканал Дождь,0,3,АО,"Артемий как всегда красавец ,на него я подписан пожизненно,про дождь хз,не моё",2020-06-15T19:47:05Z,0
606,UgxAqI3LhqxkjUWwn5l4AaABAg,EBWfg7KFUWc,Телеканал Дождь,1,6,Roman Salin,У либералов чувства юмора нет),2020-06-15T19:46:49Z,0
607,UgxAqI3LhqxkjUWwn5l4AaABAg.99wSkHnYlqU99yKZ0ZWF6Z,EBWfg7KFUWc,Телеканал Дождь,0,1,Сергей Токарев,Либералы превратились в ортодоксальных коммунистов моего детства)),2020-06-16T13:13:43Z,1
608,UgxFWNiq2LNdeyh7syh4AaABAg,EBWfg7KFUWc,Телеканал Дождь,0,0,kkid,ну обосрался и обосрался,2020-06-15T19:43:40Z,0
609,UgyRZtNpbBYVmnp74Dl4AaABAg,EBWfg7KFUWc,Телеканал Дождь,0,0,Пашин Володя,Спаси нас Бог от дураков во власти!!,2020-06-15T19:41:21Z,0
