,id,videoId,authorVideoName,totalReplyCount,likeCount,authorDisplayName,textDisplay,publishedAt,isReply
424,UgzItQRz3LtdqheCOMJ4AaABAg,IsQwbYsB1P8,Навальный LIVE,0,4,А М,"Пусть Навальный сделает опрос своей аудитории хочет ли она дебаты с Максимом Кацем или не хочет. С таким отношением когда Навальный придет к какой либо власти, будет прятаться в бункере от всех дибат, хотя раннее сам был за публичные обсуждения.
Я лично не понимаю почему он так сильно игнорирует свою аудиторию которая хочет эти дибат. 
Все больше и больше убеждаюсь что Навальный становиться похожим на действующий режим.",2020-06-14T18:21:44Z,0
425,UgzKZSdu2K8YXRzkpM14AaABAg,IsQwbYsB1P8,Навальный LIVE,0,0,Иван Узнаев,"""Мы сомневаемся в данных по смертности"", а кто такие ""МЫ""? Алексей, вы говорите прямо, что иностранные службы прямые ваши начальники, хватит строить из себя ""патриота"".",2020-06-14T18:20:47Z,0
426,UgwInInOX8V7Bw_b7yV4AaABAg,IsQwbYsB1P8,Навальный LIVE,7,99,Артур Удалов,Подскажите пожалуйста где посмотреть дебаты Алексея с Максимом?,2020-06-14T18:20:42Z,0
427,UgwRyRs0TVVGy2LgK-h4AaABAg,IsQwbYsB1P8,Навальный LIVE,0,0,Сергей Ф,не болейте Путиным,2020-06-14T18:19:42Z,0
428,UgzEWkvbrwUnU6q04vZ4AaABAg,IsQwbYsB1P8,Навальный LIVE,0,0,важный я,"С чего началась революция ,хлеба не   подвезли в питер,народ восстал,армия перешла на сторону народа,скоро все повторится ,путин хочет повторить судьбу николая романова",2020-06-14T18:18:53Z,0
429,UgwhNrWZclvjyPf_GUl4AaABAg,IsQwbYsB1P8,Навальный LIVE,0,1,Иван Узнаев,"Вы отмазались от дебатов, чтобы не опозориться, как в случае с Собчак, где вы с дрожащей рукой пили водичку и не могли ответить на элементарные вопросы?",2020-06-14T18:18:35Z,0
430,UgxzH2qEki2ZoQ_vstd4AaABAg,IsQwbYsB1P8,Навальный LIVE,0,1,Иван Узнаев,"Алексей, почему вы слились с дебатов с Кацем, чувствуете собственную слабость в сфере образования и не способны поддержать конструктивный диалог?",2020-06-14T18:17:43Z,0
431,UgzyJK8b0Q7jfCDwSXZ4AaABAg,IsQwbYsB1P8,Навальный LIVE,0,33,Asia Lyn,Ждём дебаты с Кацем!,2020-06-14T18:17:28Z,0
432,UgwBIn2j2JRzlMBQRRx4AaABAg,IsQwbYsB1P8,Навальный LIVE,0,0,Валя Ус,"Не удивительно, что в обновлениях Конституции появилась графа о защите суверенности гос-ва, чтобы подобные Навальному и его начальники больше не совали свои носы в нашу страну.",2020-06-14T18:16:41Z,0
433,UgwfWPH8gQS6U2a4frR4AaABAg,IsQwbYsB1P8,Навальный LIVE,0,1,Квартира Сочи,"*ДА ПОНЯТНО, ЧТО ПРАВИТЕЛЬСТВО ЭТО ЖУЛИКИ И ВОРЫ, ТОЛЬКО ОНИ ВЛАСТЬ СВОЮ НЕ ОТДАДУТ‼*",2020-06-14T18:16:12Z,0
434,Ugyy0cAjd4Snzf1R7j54AaABAg,IsQwbYsB1P8,Навальный LIVE,0,1,евгений мосиенко,Спасибо,2020-06-14T18:16:10Z,0
435,UgzXpToCDdUKOtd5j014AaABAg,IsQwbYsB1P8,Навальный LIVE,0,1,евгений мосиенко,Спасибо,2020-06-14T18:15:56Z,0
436,Ugy7T0j9hvP9sWV7tAJ4AaABAg,IsQwbYsB1P8,Навальный LIVE,0,0,Валя Ус,"Разводит среди своего окружения фашистов, которые поддерживают его взгляды, взгляды иностранных гос-тв, которые всячески пытаются переписать нашу историю.",2020-06-14T18:15:49Z,0
437,UgyhhMQILBjyAPYb6bZ4AaABAg,IsQwbYsB1P8,Навальный LIVE,0,0,евгений мосиенко,Спасибо,2020-06-14T18:15:48Z,0
438,UgxXyxwZl7qSK3XaFn94AaABAg,IsQwbYsB1P8,Навальный LIVE,0,0,Валя Ус,"Навальному следует не видосики пилить, а ответить за оскорбительные слова в сторону ветеранов ВОВ.",2020-06-14T18:14:52Z,0
439,UgyobLvllI-t6IkIrU14AaABAg,IsQwbYsB1P8,Навальный LIVE,2,84,Khabib Gadzhimagomedov,Дебаты с Кацем,2020-06-14T18:13:12Z,0
440,UgyobLvllI-t6IkIrU14AaABAg.99tiEktwghP99u540gobfR,IsQwbYsB1P8,Навальный LIVE,0,5,Tasselhof,@Albina Korogodova а разве важнее какой человек или какую позицию он высказывает? за личность цепляться это разве не тактика кремлёвских?,2020-06-14T21:41:27Z,1
441,UgyobLvllI-t6IkIrU14AaABAg.99tiEktwghP99u-wl_Bc93,IsQwbYsB1P8,Навальный LIVE,0,0,Albina Korogodova,Канал Клирик « Он Вам не Кац»,2020-06-14T20:56:38Z,1
442,Ugyt-_yhlOhoq7D8t4h4AaABAg,IsQwbYsB1P8,Навальный LIVE,2,51,А М,Навальный ты все больше похож на действующую власть. Беги беги от дебат.,2020-06-14T18:10:20Z,0
443,Ugyt-_yhlOhoq7D8t4h4AaABAg.99thukff5s099vAuLB98oa,IsQwbYsB1P8,Навальный LIVE,0,0,Ник Громов,чё там пригожин? жив ещё?,2020-06-15T07:51:39Z,1
444,Ugyt-_yhlOhoq7D8t4h4AaABAg.99thukff5s099toJTztB4Q,IsQwbYsB1P8,Навальный LIVE,0,4,А М,Он если хочет во власть то ему нужно привыкнуть дибатировать. Кто за частые дибаты со многими оппонентами?,2020-06-14T19:06:16Z,1
445,Ugw3yfWle9rZIthnxeh4AaABAg,IsQwbYsB1P8,Навальный LIVE,0,0,Магомед Омаров,"Очень удивлён, как бессовестно врёт человек который находиться всегда с президентом. Это означает что президент тоже такого мнения. Это позор президенту",2020-06-14T18:06:37Z,0
446,UgychxTnY9kosuv3v1p4AaABAg,IsQwbYsB1P8,Навальный LIVE,0,1,Dan Berkut,"Навальный не сливайся, призови голосовать против поправок или признай, что работаешь на путина. Раз уж от дебатов с Кацем отказался",2020-06-14T18:05:47Z,0
447,UgyjtSJQYUOrYjtQTcZ4AaABAg,IsQwbYsB1P8,Навальный LIVE,3,64,Японский Пирожок,"Все еще ждем, когда Навальный поменяет свое мнение и пойдет на дебаты с Кацем",2020-06-14T18:05:35Z,0
448,UgyjtSJQYUOrYjtQTcZ4AaABAg.99thMyltqib99vLh2NeeD6,IsQwbYsB1P8,Навальный LIVE,0,0,Иван Максимов,Derik Fant да? Откуда такая информация?,2020-06-15T09:25:58Z,1
449,UgyjtSJQYUOrYjtQTcZ4AaABAg.99thMyltqib99vJx41VSX9,IsQwbYsB1P8,Навальный LIVE,0,0,Derik Fant,Поменял) дебаты будут!,2020-06-15T09:10:40Z,1
450,UgyjtSJQYUOrYjtQTcZ4AaABAg.99thMyltqib99v76LINsWT,IsQwbYsB1P8,Навальный LIVE,0,0,Ник Громов,а смысл? это будет очень скучно.,2020-06-15T07:18:29Z,1
451,UgzPw2TPzbIJNSCGa1p4AaABAg,IsQwbYsB1P8,Навальный LIVE,0,0,NailsX 89,"Я вот не понимаю, когда у нас в стране воцарился такой вот культ лицемерия и лжи. При чем на абсолютно всех уровнях. Еще в середине двухтысячных такого треша не было вроде. Во всем цивилизованном мире сейчас политика правды и открытости, никто не пытается стыдливо что либо утаивать, ну или не стыдливо, а просто нагло врать. Куда не посмотришь у нас, везде говорят, что мы первые, у нас самая лучшая медицина, вообще все лучшее, зарплаты высокие у врачей и учителей, свободы хоть отбавляй и вообще  ""Россия самая лучшая страна на свете, а все остальные страны нам завидуют"" Да еще взять этот новояз повсеместный, не взрыв - а хлопок, не падение, а отрицательный рост, и так далее и тому подобное. Складывается ощущение что мы в какой то сказачной стране живем, в которой постепенно вводятся принципы из 1984 Оруэлла, в том смысле, что Война — это мир, свобода — это рабство, незнание — сила. Ну нигде по моему такого в мире нет, кроме того же Китая например. Все это печально в общем",2020-06-14T18:04:19Z,0
452,UgziqMsn1l34OEcxcyR4AaABAg,IsQwbYsB1P8,Навальный LIVE,0,0,Будни газелиста,"Не Песков, а Письков",2020-06-14T18:03:36Z,0
453,UgxrvWX6A5QUtR0np854AaABAg,IsQwbYsB1P8,Навальный LIVE,0,0,Сергей Ф,"Как бы сказать и не показаться назойливым
Умом Россию не понять ...",2020-06-14T18:03:11Z,0
454,UgzGvPfjh1wSikkrM-Z4AaABAg,IsQwbYsB1P8,Навальный LIVE,0,66,Vaskq,"Поддерживаю мысль про дебаты, ребята. Хд 

Каццц",2020-06-14T17:58:27Z,0
455,Ugzi1KfobIRA6Ketbxd4AaABAg,IsQwbYsB1P8,Навальный LIVE,1,0,Ольга Блинова,"Эта пандемия показала, что стоит на самом деле и наша, и иностранная медицина. Пока, особенно в некоторых западных странах, просто чудовищная смертность, у нас удаётся её сдерживать на довольно низком уровне. И доказательства того, что у нас что-то скрывают или занижают, нет ни у кого.",2020-06-14T17:57:22Z,0
456,Ugzi1KfobIRA6Ketbxd4AaABAg.99tgQlkc82499uxuzKuEMR,IsQwbYsB1P8,Навальный LIVE,0,0,Карина Ф.,"Навальному это все-равно не объяснишь. У него свои данные о смертности, причем они разнятся с теми, что предоставляла его офтальмолог Васильева))",2020-06-15T05:49:25Z,1
457,UgzCIyWiZhZFKYHaLZd4AaABAg,IsQwbYsB1P8,Навальный LIVE,0,0,Natali Zvetova,"Сидя дома мы ничем не отличаемся от баранов в стойле с пастухом Навальным.  Нет, если мы против, мы придём и скажем. Даже заведомо зная, что результат подтасуют, мы проголосуем,  чтобы эта подтасовка далась им как можно труднее.",2020-06-14T17:55:32Z,0
458,UgzF_1JKRrxB35i9sx14AaABAg,IsQwbYsB1P8,Навальный LIVE,0,1,Илья Склифосовский,"Алексей, пожалуйста, примите дебаты с Кацем)",2020-06-14T17:55:19Z,0
459,Ugx7zV3ucXZT4GV0KfN4AaABAg,IsQwbYsB1P8,Навальный LIVE,0,2,avokad tromb,"Много людей уже написало и я присоединюсь, Алексей проведите дебаты с Максимом Катц, это полезно для общества, ваша позиция по поводу того что нужно на другом концентрировать внимание, тогда говорите об этом на дебатах, а не в комментариях, я считаю что людям надо объединяться и выражать активно свою позицию по поправкам в конституцию, просто говорить не признавать это херня надо выходить и говорить НЕТ поправкам на улицу и чем больше таких людей будет тем лучше.",2020-06-14T17:54:34Z,0
460,Ugzfiy0wpSWQ4dhgidt4AaABAg,IsQwbYsB1P8,Навальный LIVE,4,111,Иван Брынза,"Алексей, Вы не правы! (и в сами знаете по какой теме)
P.S. я не бот, мой профиль на youtube открыт, таких как я очень много!",2020-06-14T17:54:14Z,0
461,Ugzfiy0wpSWQ4dhgidt4AaABAg.99tg3nx1SLp9A-rVy-fHWY,IsQwbYsB1P8,Навальный LIVE,0,0,Успеть до пенсии,Раиса Синякова раскройте глаза,2020-06-17T12:48:52Z,1
462,Ugzfiy0wpSWQ4dhgidt4AaABAg.99tg3nx1SLp99xwhbJR7H2,IsQwbYsB1P8,Навальный LIVE,0,0,Раиса Синякова,сколько же хомяков налетело. Кац новый лидер малолеток?,2020-06-16T09:36:34Z,1
463,Ugzfiy0wpSWQ4dhgidt4AaABAg.99tg3nx1SLp99tyYPnFwx2,IsQwbYsB1P8,Навальный LIVE,0,3,oladushka,то бидно что ботом обозвали(,2020-06-14T20:35:41Z,1
464,Ugzfiy0wpSWQ4dhgidt4AaABAg.99tg3nx1SLp99twJx9vH8_,IsQwbYsB1P8,Навальный LIVE,0,21,Успеть до пенсии,"Солидарен с Иваном. Я тоже никакой не бот, я просто хочу жить в нормальной стране. Идите на дебаты и давайте голосовать против поправок!",2020-06-14T20:16:14Z,1
465,UgxvMVl0fyh8F-FEwol4AaABAg,IsQwbYsB1P8,Навальный LIVE,0,1,Pinkie Pie,Ждём дебаты с Кацем.,2020-06-14T17:53:33Z,0
466,UgwnSDWtYg-5XZEoKjl4AaABAg,IsQwbYsB1P8,Навальный LIVE,0,3,Стул Прямостоящий,"Я не бот, но я за дебаты",2020-06-14T17:51:25Z,0
467,UgxopB5LYxeIZBEcQxd4AaABAg,IsQwbYsB1P8,Навальный LIVE,0,0,Sir Patrik,К дурочку привязались... Что знал на английском с КВНа и Галустяна то и ляпнул best the best of the best😂😂😂😂😂😂😂😂😂😂😂😂😂😂😂😂😂😂,2020-06-14T17:50:27Z,0
468,UgyL8FyEcT-SaaW79T14AaABAg,IsQwbYsB1P8,Навальный LIVE,0,0,Камиль Ufa,Чё делать то?...,2020-06-14T17:49:38Z,0
469,UgwjCKCCA1RwGN1jjNh4AaABAg,IsQwbYsB1P8,Навальный LIVE,0,0,--,"Лёша 
Открыли главный храм ⛪️ вооружённых сил российской многонациональной многоконфессиАнальной ордена красного знамени ордена ленина города героя 
Короче 
Открыли храм очередной а то их так мало
Прокомментируй эту новость.


И как обычно
Тьфу на тебя Лёша
И тьфу на нас всех

Да гореть нам всем в аду
Спасите и сохраните вымирающие виды населения🍄",2020-06-14T17:49:33Z,0
470,UgwNYghLJPqxx9HdCaV4AaABAg,IsQwbYsB1P8,Навальный LIVE,0,1,Глеб Марьенко,Попробуем инверсную логику. Нельзя дебатировать с Кацем! Ютьюб не место для обсуждений!)))),2020-06-14T17:47:07Z,0
471,UgzEXzIeOhLYpxLopYZ4AaABAg,IsQwbYsB1P8,Навальный LIVE,0,3,valor and honor,Дебаты с Кацом!!!,2020-06-14T17:46:32Z,0
472,UgyS-mhQRn7Sh5AteNF4AaABAg,IsQwbYsB1P8,Навальный LIVE,0,0,Harry Janzen,"Навальный, где ЧСВ со Световым?!111",2020-06-14T17:45:28Z,0
473,UgzQkp1BmZNtDmnLTsp4AaABAg,IsQwbYsB1P8,Навальный LIVE,0,0,Светлана А.,А что письков думает насчет экологии? Что у нас в стране творится? Норильск??????!!!!!!!,2020-06-14T17:40:56Z,0
474,Ugyaixvuukoof1KMEHF4AaABAg,IsQwbYsB1P8,Навальный LIVE,0,1,Ипполит,"Молодец, Алексей, мочи их!!!",2020-06-14T17:39:20Z,0
475,UgyHfltVCJmAGMBVLNl4AaABAg,IsQwbYsB1P8,Навальный LIVE,0,0,VasE1980,песков вообще говорить и не врать может?,2020-06-14T17:38:54Z,0
476,UgwWYAOv-1VwhT2PB6l4AaABAg,IsQwbYsB1P8,Навальный LIVE,2,3,Derik Fant,"Предлагаю всем дружно отписаться до тех пор, пока не будут дебаты с Кацем.

Ну, реально, это неуважение к своей аудитории. Говорит, что не хочет пиарить Каца, но отказом он пиарит его даже больше.

Да и вообще, что это за дурацкая риторика? Я не бот, я сторонник Навального, но такое поведение очень сильно разочаровывает.",2020-06-14T17:38:05Z,0
477,UgwWYAOv-1VwhT2PB6l4AaABAg.99teDYv_M3599vJdiTQ1tN,IsQwbYsB1P8,Навальный LIVE,0,0,Derik Fant,@Evgeny Kobylyatskiy у нас получилось) дебаты будут,2020-06-15T09:08:02Z,1
478,UgwWYAOv-1VwhT2PB6l4AaABAg.99teDYv_M3599tr2gFMSdz,IsQwbYsB1P8,Навальный LIVE,0,1,Evgeny Kobylyatskiy,надо его додавить. В четверг лайф. Там его и сломим. Если нет отписка,2020-06-14T19:30:11Z,1
479,UgwnX_ZI4wdFMzrhJ4d4AaABAg,IsQwbYsB1P8,Навальный LIVE,0,2,Erener,"За дебаты с Кацем! Неужели не понятно, что расследования и новости как все плохо уже не востребованы. Посмотрите комменты к новостям в яндексе. Врага уже все определили. Вопрос ""что делать?"".  А для этого нужен конструктивный диалог разных точек зрения. Например, дебаты с Кацем",2020-06-14T17:35:44Z,0
480,UgyJ4Jh1vReom7L6kDl4AaABAg,IsQwbYsB1P8,Навальный LIVE,0,1,SERGUE1959SOVOK,"В общем понятно,  в Беларуссии,  Саудовской Аравии,  Бангладеш медицина  еще лучше",2020-06-14T17:34:20Z,0
481,UgyWAwIxUD9PSNtPw8t4AaABAg,IsQwbYsB1P8,Навальный LIVE,0,0,оксана примак,"для пескова и есть лучшее здравоохранение.....он с начало ходил с этой бумажкой отгоняющей вирус,заразился,уверена напугался до смерти ,его вылечили и он теперь счастлив,а на других ему все равно",2020-06-14T17:33:27Z,0
482,UgxvLvmaEy_4bfatb9N4AaABAg,IsQwbYsB1P8,Навальный LIVE,0,21,Лена Павленкова,Навальный пожалуйста согласись на дебаты с Катцом!!!,2020-06-14T17:32:22Z,0
483,UgzwvmzGZSBGfYynUzp4AaABAg,IsQwbYsB1P8,Навальный LIVE,0,5,GG Gorodetskiy,"Аудитория Навального и ФБК в общем, поведение ваших главнокомандующих, похожа на поведения главнокомандующего РФ. Что с вами со всеми происходит!!!",2020-06-14T17:32:16Z,0
484,Ugw-8V-Ymr3BX8Dh89V4AaABAg,IsQwbYsB1P8,Навальный LIVE,3,62,Derik Fant,"Я сторонник Навального, не бот и хочу дебатов.",2020-06-14T17:31:45Z,0
485,Ugw-8V-Ymr3BX8Dh89V4AaABAg.99tdV9-Hxb099tjFdimF-I,IsQwbYsB1P8,Навальный LIVE,0,3,DCxDemo,"шоу - это дебаты двух собчак на эхе москвы. а здесь была бы интересная дискуссия, если бы кто-то не сливался.",2020-06-14T18:22:03Z,1
486,Ugw-8V-Ymr3BX8Dh89V4AaABAg.99tdV9-Hxb099tgedIi2t-,IsQwbYsB1P8,Навальный LIVE,0,1,Людмила a,"Я бот, не ходи Алеша,  просто люди ждут ШОУ.",2020-06-14T17:59:23Z,1
487,Ugw-8V-Ymr3BX8Dh89V4AaABAg.99tdV9-Hxb099te_TJfIhM,IsQwbYsB1P8,Навальный LIVE,0,2,Илья Иванов,Зачем? Сам подумать ни как? Нужно чтоб титьку в рот положили и сказали что делать?,2020-06-14T17:41:12Z,1
488,UgzYqhiYTHCZL7O8jSp4AaABAg,IsQwbYsB1P8,Навальный LIVE,0,0,Илья Иванов,"Алексей НЕ ходите на дебаты с Кацем. И где адекватный народ в коментах засрали все комменты этими дебатами. Как дети малые, которые просят включить мультики.",2020-06-14T17:31:24Z,0
489,Ugw4pM-x1MMPfp9FHEZ4AaABAg,IsQwbYsB1P8,Навальный LIVE,0,0,Francis Walsingham,"что вы делайте?какие заболевшие?какие жертвы? каково эпидемии не было и нету!! я просто в шоке от недопонимании что вй делайте именно вы ваша команда??? место тово чтоб говорить правду всем кто вас доверяет и поддерживает ве обманывайте их!!  10 марта обнулили сроки путина (именно тот момент когда началось паника) в европе за счет придуманово ""эпидемии"" реаяются другие проблемы!! всё в банкротстве на самом деле с 2015 года закрываются одни за другими ведущие фирмы,корпорации,магазины,банки, ведущие производители разных технологий закрывают новейшие проикты потомучто не сопостовым со старыми образцами!! закрывались звукозаписывающие студии,киностудии,модные агенство,телевидение не кому не нужный уже!вссе спонсоры и огромный деньги идут в интернет проектах!! телеведущие,знаменитые коментаторы,популярные люди все открывают в ютуб,твитер и.т.г каналы и миллионы людей смотрят!! всё это не просто так!! всё на грани опкончательново банкротство!! из за удобново интернет сервиса закрываются филиалы ведущих,брендовых магазин и освобождают персонал и рабочих сил во всем мире!!сотнями тысячами остались без работ в 2019 году только великобритании 256000 человек остались без работы (в основном женщины консультанты,продавцы и.т.г.).... пожалуйсто объясните почему вы ведете себе так странно?я 100% уверен что всё это вы прекрасно знаете!!! почему врёте!",2020-06-14T17:27:34Z,0
490,Ugyzd1FEyXa2FF4DezV4AaABAg,IsQwbYsB1P8,Навальный LIVE,2,30,Derik Fant,"Ну, хоть комментарии от спонсоров  не будут называть ботами?
Или тоже все проплатили?",2020-06-14T17:23:53Z,0
491,Ugyzd1FEyXa2FF4DezV4AaABAg.99tcaabFvuR99tpRbIRtWr,IsQwbYsB1P8,Навальный LIVE,0,0,Evgeny Kobylyatskiy,урбанисты все проплатили😂,2020-06-14T19:16:07Z,1
492,Ugyzd1FEyXa2FF4DezV4AaABAg.99tcaabFvuR99tgk955XkF,IsQwbYsB1P8,Навальный LIVE,0,0,Людмила a,"Конечно, я из своей зарплаты заплатила",2020-06-14T18:00:09Z,1
493,UgySokAFdsQSnniL2ER4AaABAg,IsQwbYsB1P8,Навальный LIVE,0,0,future world,"Писькову десяточка светит, на нарах будет рассказывать заключенным про невероятную медицину. Где семеро погибших только от ивл местного розлива. А погибших от короны раза в четыре больше.",2020-06-14T17:23:03Z,0
494,UgwU3R70M8OvslYvuC54AaABAg,IsQwbYsB1P8,Навальный LIVE,0,0,Вик Твит,"... Мерзавец, негодяй ... Конечно! Чего удивляться его постоянной лжи? .... Сволочь.",2020-06-14T17:22:22Z,0
