,id,videoId,authorVideoName,totalReplyCount,likeCount,authorDisplayName,textDisplay,publishedAt,isReply
1244,UgzQ6t6avTIU0ucN0Zl4AaABAg,IsQwbYsB1P8,Навальный LIVE,0,1,Дмитрий Кочнев,Второй,2020-06-14T11:56:20Z,0
1245,Ugx0gl9IXVJoFbzGzLx4AaABAg,IsQwbYsB1P8,Навальный LIVE,7,40,danya,22 июня на митинг все. Лайк!,2020-06-14T11:56:15Z,0
1246,Ugwh02P_Dsq1U3aRAAF4AaABAg.99mc9_vyKmi9A737P4_A-w,IsQwbYsB1P8,Навальный LIVE,0,0,Dim Dim,"Медецина лучше в России,но лечат их лучше в Германии",2020-06-20T07:53:48Z,1
1247,Ugwh02P_Dsq1U3aRAAF4AaABAg.99mc9_vyKmi99vhKFTd4tV,IsQwbYsB1P8,Навальный LIVE,0,1,Александр Ширшов,"@Лиля Пономарева    Вы правы! Его настоящая
фамилия-Письков!",2020-06-15T12:43:41Z,1
1248,Ugwh02P_Dsq1U3aRAAF4AaABAg.99mc9_vyKmi99vA53vAl9z,IsQwbYsB1P8,Навальный LIVE,0,0,Aлла Кошкина,"ВСЕ БОЛЬНИЦЫ В РОССИИ УЗЯСТНЫЕ. ИХ НАДО ЛИКВИДИРОВАТЬ ПОСТРОИТЬ ОДНУ ХОРОШУЮ ,БОЛЬШУЮ В МОСКВЕ. ДЛЯ  БЕДНЫХ ОСТАВИТЬ ПО ОДНОЙ В ОБЛАСТНЫХ ГОРОДАХ,НО ПЛАТНЫЕ И НЕ ДОСТУПНЫЕ ДЛЯ БОЛЬШИНСТВА ПЛЕБЕЕВ,ЭТО ТОЧНО ТАК ,КАК НА УКРАИНЕ ПО РЕФОРМЕ СУПРУН.  ВНЕМЛИТЕ СЛОВАМ НАВАЛЬНОГО. ОН ГОВОРИТ ПРАВДУ- МЕДИЦИНА И БОЛЬНИЦЫ УЖАСТНЫЕ -УНИЧТОЖИТЬ.САМО ЭТО ДАРОВАНИЕ И ДЕМОКРАТИЧЕСКОЕ ЧУДО ЛЕТАЕТ В ШТАТЫ ЛЕЧИТЬ НАСМОРК",2020-06-15T07:44:31Z,1
1249,Ugwh02P_Dsq1U3aRAAF4AaABAg.99mc9_vyKmi99v9dcCooNU,IsQwbYsB1P8,Навальный LIVE,0,1,Lord,Голосовать ПРОТИВ поправок!,2020-06-15T07:40:38Z,1
1250,Ugwh02P_Dsq1U3aRAAF4AaABAg.99mc9_vyKmi99v3j-Yxkib,IsQwbYsB1P8,Навальный LIVE,0,2,Карп Макс,Дебыты с кацем,2020-06-15T06:48:56Z,1
1251,Ugwh02P_Dsq1U3aRAAF4AaABAg.99mc9_vyKmi99v0GN4bJyd,IsQwbYsB1P8,Навальный LIVE,0,3,Vita Magneto,"Алексей Анатольевич, пожалуйста, подумайте об участии в дебатах с МК ещё раз! Это же очень важно для всех нас. Обращаюсь со всем уважением",2020-06-15T06:18:41Z,1
1252,Ugwh02P_Dsq1U3aRAAF4AaABAg.99mc9_vyKmi99v01gN1EN0,IsQwbYsB1P8,Навальный LIVE,0,3,Віталій Сабадишин,Дебаты с Кацем,2020-06-15T06:16:41Z,1
1253,Ugwh02P_Dsq1U3aRAAF4AaABAg.99mc9_vyKmi99uhAwOM0Hd,IsQwbYsB1P8,Навальный LIVE,0,0,А. П.,@Даниил Григорьев надо быть звякнутым на голову человеком если голосовать против поправок в колониальную конституцию РФ написанную Соединенными Штатам в 1993 году,2020-06-15T03:23:11Z,1
1254,Ugwh02P_Dsq1U3aRAAF4AaABAg.99mc9_vyKmi99ucydHpdHy,IsQwbYsB1P8,Навальный LIVE,0,1,Евгений СССР,"@Даниил Григорьев Всё же вы должны внутри понимать, что в стране, те, кто за поправки все равно больше, тех кто против. Можно обсуждать, спорить, а старшее поколение придёт и проголосует за пенсии и кошек, им так обьяснили и они это поняли.",2020-06-15T02:46:25Z,1
1255,Ugwh02P_Dsq1U3aRAAF4AaABAg.99mc9_vyKmi99ucSrd3Ij7,IsQwbYsB1P8,Навальный LIVE,0,1,Евгений СССР,"@Даниил Григорьев После того, как Навальный оскорбил ветерана ВОВ и кардиохирурга, нужно не обьединяться вокруг его, а в лицо плевать. Дед воевал за то, что мы сейчас живём. 93 летнего старика с боевыми наградами оскорблять нельзя.",2020-06-15T02:41:56Z,1
1256,Ugwh02P_Dsq1U3aRAAF4AaABAg.99mc9_vyKmi99uHhdqlTXM,IsQwbYsB1P8,Навальный LIVE,0,1,Даниил Григорьев,"Вы понимаете, что вся страна будет обсуждать голосование? будут спорить,  дискитируровать, будут готовы менять точку зрения? Люди могут увидеть бесприцидентный масштаб фальсификаций и, если раньше им было пофиг, то сейчас они скажут какого черта? И это будет по всей стране, общая тема для всех. Могут вспоминть про Навального. Зачем вы игнорите такую возможность объединить всех кто ПРОТИВ???",2020-06-14T23:31:51Z,1
1257,Ugwh02P_Dsq1U3aRAAF4AaABAg.99mc9_vyKmi99u7niVYDPD,IsQwbYsB1P8,Навальный LIVE,0,1,Lorena Li,"Алексей, снимите пожалуйста о ситуации в карачаево-черкессии,  там то же самое происходит с эпидемией, что было в дагестане. Но при этом власти не хотят запрашивать помощь. Нужно чтоб все об этом знали. Есть ролики о кчр у Руслана Курбанова.",2020-06-14T22:05:18Z,1
1258,Ugwh02P_Dsq1U3aRAAF4AaABAg.99mc9_vyKmi99txN3pwZ5m,IsQwbYsB1P8,Навальный LIVE,0,0,АлександрЛука,"Помогите кто нибудь на продукты, хоть 50р, сбeрбанк 4817 7601 1969 7237",2020-06-14T20:25:24Z,1
1259,Ugwh02P_Dsq1U3aRAAF4AaABAg.99mc9_vyKmi99tu35QMxh7,IsQwbYsB1P8,Навальный LIVE,0,1,Евгений СССР,"Почему дебаты с Кацем интересуют всех, а то, что оскарбление ветерана войны прошло, 93 деда, который воевал за всех, не интересует ни кого. Народ, мы живём, потому, что они воевали, а всех интересует Кац. Этот мир куда катится.",2020-06-14T19:56:28Z,1
1260,Ugwh02P_Dsq1U3aRAAF4AaABAg.99mc9_vyKmi99torxF-j1M,IsQwbYsB1P8,Навальный LIVE,0,2,А. П.,@А М Навальный станет президентом? 😂😂😂😂😂 ты башкой своей не стукался? 😂😂😂😂😂😂,2020-06-14T19:11:07Z,1
1261,Ugwh02P_Dsq1U3aRAAF4AaABAg.99mc9_vyKmi99tnh54Id9F,IsQwbYsB1P8,Навальный LIVE,0,3,А М,Алексей если вы станете президентом то вам каждую неделю придется публично дибатировать с разными оппонентом. Так что для вас это возможность потренировать. Не упускайте свой шанс.,2020-06-14T19:00:53Z,1
1262,Ugwh02P_Dsq1U3aRAAF4AaABAg.99mc9_vyKmi99tjr7NP9uG,IsQwbYsB1P8,Навальный LIVE,0,3,ArmyArmor,Я очередной кремлебот призывающий на дебаты с Кацем (он не провластный).,2020-06-14T18:27:19Z,1
1263,Ugwh02P_Dsq1U3aRAAF4AaABAg.99mc9_vyKmi99te50wcRaK,IsQwbYsB1P8,Навальный LIVE,0,2,Дмитрий Зеков,"Я что не прав что ли? Я сразу ему сказал: пиши в Израиль письма, там тебе помогут, и не лезь в чужой карман. Укроина и так уже отдаёт последнее на борьбу с Путиным.",2020-06-14T17:36:55Z,1
1264,Ugwh02P_Dsq1U3aRAAF4AaABAg.99mc9_vyKmi99tdVYQbIa9,IsQwbYsB1P8,Навальный LIVE,0,2,Дмитрий Зеков,"Льошик, намёк понял: если не совсем дурак то сам сдриснет.",2020-06-14T17:31:48Z,1
1265,Ugwh02P_Dsq1U3aRAAF4AaABAg.99mc9_vyKmi99tcXfbg-ZR,IsQwbYsB1P8,Навальный LIVE,0,2,Дмитрий Зеков,"@Елена Глоба 
Но ты не переживай, ведь я то сужу с позиции русских, а мы ничего не забываем. А ты можешь и дальше целоваться с теми кто устроил Львовскую резню и Бабий Яр.",2020-06-14T17:23:21Z,1
1266,Ugwh02P_Dsq1U3aRAAF4AaABAg.99mc9_vyKmi99tb-92ZsKD,IsQwbYsB1P8,Навальный LIVE,0,4,Елена Глоба,"@Дмитрий Зеков, в рамках этой беседы я рассматриваю только конкретные аргументы по поводу конкретной дилеммы - дилеммы голосования за конституцию. Меня не интересуют мрачные тайны любого из оппонентов. Только их доводы. С остальным - не ко мне, сорян)",2020-06-14T17:09:54Z,1
1267,Ugwh02P_Dsq1U3aRAAF4AaABAg.99mc9_vyKmi99taQXWz9NG,IsQwbYsB1P8,Навальный LIVE,0,0,Елена Глоба,"@Дмитрий Зеков, это - их проблемы)",2020-06-14T17:04:54Z,1
1268,Ugwh02P_Dsq1U3aRAAF4AaABAg.99mc9_vyKmi99ta6euHp3w,IsQwbYsB1P8,Навальный LIVE,0,0,Елена Глоба,"@Дмитрий Зеков , пожалуйста, либо разверните свой вопрос, либо переформулируйте =)

Мой вопрос был ""кого"" и ""за что"", а не ""кто"". Простите за интимный встречный вопрос... Вы - бот?)",2020-06-14T17:02:11Z,1
1269,Ugwh02P_Dsq1U3aRAAF4AaABAg.99mc9_vyKmi99ta20fdLD1,IsQwbYsB1P8,Навальный LIVE,0,2,МЫ-ВЕНОМ МЫ-ВЕНОМ,"@Павел Погодин Панфилова заявила,что они лигитивны,а Путин просто хочет узнать мнение народа",2020-06-14T17:01:33Z,1
1270,Ugwh02P_Dsq1U3aRAAF4AaABAg.99mc9_vyKmi99t_palK055,IsQwbYsB1P8,Навальный LIVE,0,2,Дмитрий Зеков,"@Елена Глоба 
Львовскую резню и резню в Бабьем Яре.",2020-06-14T16:59:43Z,1
1271,Ugwh02P_Dsq1U3aRAAF4AaABAg.99mc9_vyKmi99t_JHkVxOv,IsQwbYsB1P8,Навальный LIVE,0,0,Елена Глоба,"@Дмитрий Зеков, кого простил, извините?)
Upd: и за что О_о",2020-06-14T16:55:10Z,1
1272,Ugwh02P_Dsq1U3aRAAF4AaABAg.99mc9_vyKmi99tXVPUtind,IsQwbYsB1P8,Навальный LIVE,0,2,Дмитрий Зеков,"@Елена Глоба 
Кац уже всё простил?",2020-06-14T16:30:37Z,1
1273,Ugwh02P_Dsq1U3aRAAF4AaABAg.99mc9_vyKmi99tWRJ0lriy,IsQwbYsB1P8,Навальный LIVE,0,12,Елена Глоба,"Уважаемый Алексей и команда ФБК!
Благодаря Вам я относительно недавно начала интересоваться политикой и смогла начать формирование собственной гражданской позиции.

Я не знаю, что там у Вас за история отношений с Кацем (да меня это, в сущности, и не волнует).

Но Вы сами меня научили в своё время не идти  вслепую за авторитетами и громкими именами.

Конкретно в случае с голосованием аргументы Вашего оппонента кажутся мне более убедительными. И мне было бы полезно послушать дискуссию между вами - двумя умными людьми. Подозреваю, что это было бы бесконечно далеко от тех ""кошачьих драк"", что устраивает тот же г-н Соловьёв...

Если кто-то из ФБК дочитал сюда - во-первых, спасибо =) Во-вторых - любым удобным для Вас и безопасным для меня образом я готова доказать, что я не бот.

С уважением.",2020-06-14T16:21:19Z,1
1274,Ugwh02P_Dsq1U3aRAAF4AaABAg.99mc9_vyKmi99tWLnVGNQ9,IsQwbYsB1P8,Навальный LIVE,0,13,Константин Кондратенко,"Нэвэвльный блэт, я не бот, го дебаты с Кацем!",2020-06-14T16:20:34Z,1
1275,Ugwh02P_Dsq1U3aRAAF4AaABAg.99mc9_vyKmi99tVJ7gQUKL,IsQwbYsB1P8,Навальный LIVE,0,0,Дмитрий Зеков,"@Полина Проничкина 
Ну вот и ладушки. Так что продолжим: 
после такого оскорбления какие ещё могут быть переговоры между Навальным и Кацем?",2020-06-14T16:11:28Z,1
1276,Ugwh02P_Dsq1U3aRAAF4AaABAg.99mc9_vyKmi99tU0nVXrG4,IsQwbYsB1P8,Навальный LIVE,0,15,veer & vilka,"Алексей, ваша аудитория не ядерный электорат. Даже если вы измените позицию (или наоборот не измените), это не обрушит ваш рейтинг. Все просто хотят услышать ваше мнение.",2020-06-14T16:00:13Z,1
1277,Ugwh02P_Dsq1U3aRAAF4AaABAg.99mc9_vyKmi99tJMOJuxGZ,IsQwbYsB1P8,Навальный LIVE,0,21,Полина Проничкина,"Алексей, я смотрю ваши видео уже более 4 лет и только сейчас мое мнение о вас упало ниже плинтуса, почему вы не слышите своих зрителей, почему когда я пишу что хочу увидеть дебаты с кацем и разобраться в плане действий- меня называют ""Кремле ботом""? 
Я живой человек, которому как и многим нужно понять что делать дальше, а вы отказыаете нам",2020-06-14T14:27:03Z,1
1278,Ugwh02P_Dsq1U3aRAAF4AaABAg.99mc9_vyKmi99tIl3mS7ky,IsQwbYsB1P8,Навальный LIVE,0,17,Capitan Crab,"Алексей, в Ваших же интересах, я считаю, провести дебаты с Максимом Кацем, здоровая конкуренция нужна везде, если же вы проведете их, то часть аудитории воспримет это как уход от неудобных для вас действий, что постоянно делает Путин и компания, не скатывайтесь, пжлст, в эту яму! Убедите нас в правильности своей точки зрения! И пожалуйста не клейте ярлыки на людей с ничего",2020-06-14T14:21:49Z,1
1279,Ugwh02P_Dsq1U3aRAAF4AaABAg.99mc9_vyKmi99tEdRZsxzp,IsQwbYsB1P8,Навальный LIVE,0,13,Дмитрий Зеков,"@Natasha Miu 
Навальный глуп, и не пойдёт на дебаты с Кацем.",2020-06-14T13:45:49Z,1
1280,Ugwh02P_Dsq1U3aRAAF4AaABAg.99mc9_vyKmi99tECq5qt9d,IsQwbYsB1P8,Навальный LIVE,0,22,Natasha Miu,"Ну Але! Мы не боты, а живые люди! И нам  услышать ваш  диалог с Максимом Кац, многие как и я уже тупо запутались и не понимают вашу логику, почему ненужно идти голосовать?! Скоро уже день голосования, а люди мечется не понимая что делать. 
Нам нужна ваша помощь, ненужно игнорировать нашу просьбу.  
Что за глупые отговорки как у подростков на Ютубе "" я не буду ему отвечать, потому что это хайп и реклама для него"", да какая нахер разница?  Поговорить с ненормальной бухой тёткой, которая в пьяном бреду вас пригласила на дебаты... Так пожалуйста! Хотя это бы не к чему не привело, а когда появляются дебаты которые не превратится в цирк и ответят на многие интересующие вопросы так "" ой да он на мне хайпится, гадкий шулер. Не буду с ним говорить."".  Это глупо! На этом все, аж обида грызет от такого отношения.",2020-06-14T13:42:03Z,1
1281,Ugwh02P_Dsq1U3aRAAF4AaABAg.99mc9_vyKmi99tDX_-7cYk,IsQwbYsB1P8,Навальный LIVE,0,1,Лиля Пономарева,"Песков разговаривает как настоящий  американец,повод задуматься,а настоящая ли его  фамилия Песков.",2020-06-14T13:36:09Z,1
1282,Ugwh02P_Dsq1U3aRAAF4AaABAg.99mc9_vyKmi99tDKmvr-XA,IsQwbYsB1P8,Навальный LIVE,0,0,Vavelo Zadrot,@Дмитрий Зеков а жаль(,2020-06-14T13:34:24Z,1
1283,Ugwh02P_Dsq1U3aRAAF4AaABAg.99mc9_vyKmi99tCXMH_byv,IsQwbYsB1P8,Навальный LIVE,0,1,Дмитрий Зеков,"@Vavelo Zadrot 
Наверное никогда, донат слабый.",2020-06-14T13:27:23Z,1
1284,Ugwh02P_Dsq1U3aRAAF4AaABAg.99mc9_vyKmi99tBFqbHJpQ,IsQwbYsB1P8,Навальный LIVE,0,3,Vavelo Zadrot,Когда ты станешь президентом?,2020-06-14T13:16:15Z,1
1285,Ugwh02P_Dsq1U3aRAAF4AaABAg.99mc9_vyKmi99tAxwuSX17,IsQwbYsB1P8,Навальный LIVE,0,24,Chemistry & life,"Дебаты с Кацем нужны, не становитесь тем, кого вы обвиняете...",2020-06-14T13:13:40Z,1
1286,Ugwh02P_Dsq1U3aRAAF4AaABAg.99mc9_vyKmi99t9xyL9gbS,IsQwbYsB1P8,Навальный LIVE,0,3,Artur Rus,"@ЗОЖ и вечное сияние чистого разума Это не мнение секретарши, это Путин делает себе имидж вождя и царя. Для него важна дистанция с народом.
И если вдруг слова Пескова будут приняты народом в штыки, Путин отругает Пескова и вновь будет на коне.",2020-06-14T13:04:56Z,1
1287,Ugwh02P_Dsq1U3aRAAF4AaABAg.99mc9_vyKmi99t9SbRNZx6,IsQwbYsB1P8,Навальный LIVE,0,4,VAN GOG,"Леха поменяй тему, уже не интересно и не смешно. Ближе к простому народу двигайся..., ждем!",2020-06-14T13:00:31Z,1
1288,Ugwh02P_Dsq1U3aRAAF4AaABAg.99mc9_vyKmi99t9FUYagxR,IsQwbYsB1P8,Навальный LIVE,0,2,Vitalikoc koneev,@Wrtp S Не матерись,2020-06-14T12:58:43Z,1
1289,Ugwh02P_Dsq1U3aRAAF4AaABAg.99mc9_vyKmi99t8zV5KyIT,IsQwbYsB1P8,Навальный LIVE,0,0,Ғәли Башҡөрд батыры Салауат Юлай улы Көҙәй ырыуынан,"Хаайуандар. Мэрзавцы и прэступники они, каторые лгут нагло. Недавериее хютин бую и халуям, шулай",2020-06-14T12:56:24Z,1
1290,Ugwh02P_Dsq1U3aRAAF4AaABAg.99mc9_vyKmi99t8KTkqrkJ,IsQwbYsB1P8,Навальный LIVE,0,5,Artur Rus,"Что можно ожидать от человека, который на полном серьезе ходил с бейджиком: БЛОКАТОР ВИРУСОВ..
Песков и еще Кокорин. Вот два брата акробата .
И это говорящая голов президента",2020-06-14T12:50:40Z,1
1291,Ugwh02P_Dsq1U3aRAAF4AaABAg.99mc9_vyKmi99t7VZmzLvl,IsQwbYsB1P8,Навальный LIVE,0,29,Спасский Никита,Даешь дебаты с  Кацем или Шульман,2020-06-14T12:43:27Z,1
1292,Ugwh02P_Dsq1U3aRAAF4AaABAg.99mc9_vyKmi99t6bT3R_TN,IsQwbYsB1P8,Навальный LIVE,0,16,Павел Погодин,"Поправки НЕ приняты! Алексей, пожалуйста, не ведите страну в ад!",2020-06-14T12:35:39Z,1
1293,Ugwh02P_Dsq1U3aRAAF4AaABAg.99mc9_vyKmi99t6O7aqvxi,IsQwbYsB1P8,Навальный LIVE,0,27,Wrtp S,Дебаты с Кацем,2020-06-14T12:33:41Z,1
1294,Ugwh02P_Dsq1U3aRAAF4AaABAg.99mc9_vyKmi99t5I3ZanpD,IsQwbYsB1P8,Навальный LIVE,0,25,ЭХО- МОСКВЫ!!!,Дебаты с Кацем,2020-06-14T12:24:07Z,1
1295,Ugwh02P_Dsq1U3aRAAF4AaABAg.99mc9_vyKmi99t3LzxMJKO,IsQwbYsB1P8,Навальный LIVE,0,8,ЗОЖ и вечное сияние чистого разума,"""Песков в каждой бочке затычка, в какой бы стране мнение секретарши президента было так интересно"" Н. Н. Бонадренко",2020-06-14T12:07:11Z,1
1296,Ugwh02P_Dsq1U3aRAAF4AaABAg.99mc9_vyKmi99t32ZRAOQd,IsQwbYsB1P8,Навальный LIVE,0,20,Serakez,Debati s Katcem!,2020-06-14T12:04:32Z,1
1297,UgwBJllzjNvSqOtY_cx4AaABAg.99tjL1-xQBs99wh-HsUk_M,IsQwbYsB1P8,Навальный LIVE,0,0,Ник Громов,"@Евгений 
алгоритмы вещь простая и тупая. если мат не употреБлять, то это не значит, что его нет).
а дебаты с Кацем, это Навальный согласился зря. не одобряю от слова совсем.",2020-06-15T22:00:04Z,1
1298,UgwBJllzjNvSqOtY_cx4AaABAg.99tjL1-xQBs99wbJxWMRTx,IsQwbYsB1P8,Навальный LIVE,0,0,Евгений,"@Ник Громов да нет, всё писал культурно, цензурно и развёрнуто; удивлялся, почему Навальный ведёт себя так странно по отношению к дебатам с Кацем; но вроде бы они всё-таки состоялись",2020-06-15T21:10:28Z,1
1299,UgwBJllzjNvSqOtY_cx4AaABAg.99tjL1-xQBs99v9ErxoXY0,IsQwbYsB1P8,Навальный LIVE,0,0,Ник Громов,"комменты трут алгоритмы ютуба если в них есть мат. не всегда срабатывает, но если выматерились, не удивляйтесь, что комент потом исчезнет (на собственном опыте проверено, так что теперь ставлю звёздочки, что б что это мат, понял только человек).",2020-06-15T07:37:07Z,1
1300,UgwBJllzjNvSqOtY_cx4AaABAg.99tjL1-xQBs99uqUjf5aVS,IsQwbYsB1P8,Навальный LIVE,0,0,Арина Юрченко,тереть комментарийи - это кредо Лехи и Любки по жизни,2020-06-15T04:44:31Z,1
1301,UgwBJllzjNvSqOtY_cx4AaABAg.99tjL1-xQBs99ujG3L5CIK,IsQwbYsB1P8,Навальный LIVE,0,0,Ульяна Ясевича,"должна же создаваться иллюзия того, что все Алексея поддерживают",2020-06-15T03:41:21Z,1
1302,UgwBJllzjNvSqOtY_cx4AaABAg.99tjL1-xQBs99u5qTT9t9q,IsQwbYsB1P8,Навальный LIVE,0,2,Derik Fant,"Не думаю, что они трут комментарии, но от дебатов нельзя отказываться, это точно.",2020-06-14T21:48:12Z,1
1303,UgwBJllzjNvSqOtY_cx4AaABAg.99tjL1-xQBs99u08_MC9lK,IsQwbYsB1P8,Навальный LIVE,0,4,Mikhail Rozhin,"комментарии может тереть сам youtube автоматически, если они не соответствуют правилам. Например, за наличие ссылок.",2020-06-14T20:58:23Z,1
1304,UgwInInOX8V7Bw_b7yV4AaABAg.99tj5dYp9X_99v66EmdTgH,IsQwbYsB1P8,Навальный LIVE,0,0,Соня Осень,В моих мечтах,2020-06-15T07:09:44Z,1
1305,UgwInInOX8V7Bw_b7yV4AaABAg.99tj5dYp9X_99v1CAed7uz,IsQwbYsB1P8,Навальный LIVE,0,0,name name,Лёха должен знать о каждом новом высере на ютубе бросающим ему дебаты?,2020-06-15T06:26:51Z,1
1306,UgwInInOX8V7Bw_b7yV4AaABAg.99tj5dYp9X_99uJnMU7SEj,IsQwbYsB1P8,Навальный LIVE,0,0,werty _,Навальный отказался,2020-06-14T23:50:06Z,1
1307,UgwInInOX8V7Bw_b7yV4AaABAg.99tj5dYp9X_99u6Un6imul,IsQwbYsB1P8,Навальный LIVE,0,0,Mikhail Rozhin,"@DCxDemo запостите плз ссылку, как закончится стрим. Я так понимаю ближе к утру.",2020-06-14T21:53:50Z,1
1308,UgwInInOX8V7Bw_b7yV4AaABAg.99tj5dYp9X_99tpMCZENCj,IsQwbYsB1P8,Навальный LIVE,0,4,Max Power,"@DCxDemo ахахаха, хорош!!",2020-06-14T19:15:23Z,1
1309,UgwInInOX8V7Bw_b7yV4AaABAg.99tj5dYp9X_99tmp5Rx2Y4,IsQwbYsB1P8,Навальный LIVE,0,5,smotritelglav,😂,2020-06-14T18:53:15Z,1
1310,UgwInInOX8V7Bw_b7yV4AaABAg.99tj5dYp9X_99tm6X3N8ZS,IsQwbYsB1P8,Навальный LIVE,0,30,DCxDemo,в ночном кошмаре навального),2020-06-14T18:47:01Z,1
1311,UgyMEaEZWi0SnoyHrk14AaABAg.99tbMIBWkyM99wCqdBlXCo,IsQwbYsB1P8,Навальный LIVE,0,0,Marina Kolomitseva,"@Андрей Бессонов Тупые это те, кто не интересовался политикой раньше. Работали за границей и там же учились. Были другие дела и интересы.",2020-06-15T17:27:52Z,1
