,id,videoId,authorVideoName,totalReplyCount,likeCount,authorDisplayName,textDisplay,publishedAt,isReply
0,Ugwh02P_Dsq1U3aRAAF4AaABAg,IsQwbYsB1P8,Навальный LIVE,51,167,Навальный LIVE,"Кампания «Пять шагов для России»: https://5steps.vote
Петиция во «ВКонтакте»: https://vk.com/app6890792#p=49738
Петиция на Сhange.org: https://change.org/5stepsvote

Станьте нашим спонсором: https://youtube.com/channel/UCgxTPTFbIbCWfTR9I2-5SeQ/join

Смотрите полный выпуск программы Алексея Навального #РоссияБудущего от 11 июня: https://youtu.be/A9mny08uI8s",2020-06-12T00:05:23Z,0
1,UgwpUs6s8JUFGKEbRIx4AaABAg,IsQwbYsB1P8,Навальный LIVE,0,0,Татьяна Голихова,Смертность не может быть намного  ниже летальности !,2020-06-29T12:08:41Z,0
2,UgzAHgpHXzdBgfcm0494AaABAg,IsQwbYsB1P8,Навальный LIVE,0,0,Игорь Коваленко,Усатый таракан 🙈🙈🙈,2020-06-26T20:27:08Z,0
3,Ugw8LpHNWHvY7I5vq7J4AaABAg,IsQwbYsB1P8,Навальный LIVE,0,0,Michaelis Divinus,"Если вы будите топить за карантин и ограничение я буду голосовать за Конституцию 😁 
Карантина нет! ⛔",2020-06-24T13:48:09Z,0
4,UgwoMw6aPftuWPN1B4N4AaABAg,IsQwbYsB1P8,Навальный LIVE,0,0,Марина Дубровная,"Пусть съездят в Смоленскую область, в маленькие города, где людей нечем лечить, потому что нет нужных лекарств и всем известных аппаратов ИВЛ! Где в инфекционном отделении стены в плесени... А все врачи либо сами болеют, либо увольняются, чтобы сохранить себе жизнь, т.к.нет нужных средств защиты, а надбавки обещанные никто не платит! И в то же время строят ""больницы"", которые потом просто стоят закрытые и не принимают тяжело больных!!!! Люди умирают... но не от самого короновируса, а от того, что лечить его нечем! Зато есть больница, наскоро построенная для министерства обороны, где лежат всего 2 человека, а в Красном кресте г. СМОЛЕНСКА уже просто нет мест для размещения тяжелобольных пациентов! А Островский (губернатор области) тем временем дает негласные указания снижать показатели смертности и заболеваемости короновирусом, чтобы перед зажравшейся  властью сохранить ""лицо"" и участвовать в будущих выборах! Слов кроме мата уже нет! Совести нет никакой у всех причастных, для них люди- это рабы! Насколько же это мерзко и противно! Главные врачи больниц настолько боятся потерять своё место, что забывают свою главную клятву!! И вместо того, чтобы требовать от правительства и министерства здравоохранения необходимые медикаменты для лечения пациентов с короновирусом, для пациентов с тяжелыми формами заболевания спец. мед
 оборудование и все необходимые средства защиты, они отчитываются, что всё классно!",2020-06-22T21:51:22Z,0
5,UgxnuUfTm22Z_uiNOSt4AaABAg,IsQwbYsB1P8,Навальный LIVE,0,0,Виктория Семяшена,"Только став независимой страной мы сможем вкладывать деньги в медицину, инфраструктуру...,а не в гос облигации США. Сможем спалить этот грёбанный ЦБ который управляет банками, деньгами но подчиняться МФВ",2020-06-22T04:12:50Z,0
6,UgxYtWNlw0KAqUplFmR4AaABAg,IsQwbYsB1P8,Навальный LIVE,0,0,Виктория Семяшена,А доказательства занижения есть?,2020-06-22T04:07:08Z,0
7,UgxmPafdj-m7V-soP9d4AaABAg,IsQwbYsB1P8,Навальный LIVE,0,0,Виктория Семяшена,"Боюсь, как бы Навального не грохнули свои же ""либералы""... обвинив Путина... ""кровавый режим Путина..АААА""- кричать они потом будут.
Лёха береги себя...",2020-06-22T04:04:52Z,0
8,Ugy2aREv_Uy3KangzOB4AaABAg,IsQwbYsB1P8,Навальный LIVE,0,0,Чёрный Лис,"В России нет нормального здравоохранения.
Коронавирус на 70 % это фейк.
Песков-говорящая голова, путинская секретутка.
Ну а ВОЗ я вообще молчу...",2020-06-21T12:41:48Z,0
9,UgxQDcyCdgQfaFgnV3p4AaABAg,IsQwbYsB1P8,Навальный LIVE,0,0,Sanchello 007,Леша- хорошь нюхать,2020-06-20T20:34:22Z,0
10,UgxmYFKXRKycJYm1odN4AaABAg,IsQwbYsB1P8,Навальный LIVE,0,0,дима чирков,Медицина в России это попрашайничество на всех уровнях стало нормой. С другой стороны кто просит для себя или другого на улице это преступник.,2020-06-20T17:25:53Z,0
11,UgybctuRPcgVhXDwXuJ4AaABAg,IsQwbYsB1P8,Навальный LIVE,0,0,Настя Настина,Почему у Алексея всегда Красный галстук и Оранжевый стаканчик???? Пишите в коментах!,2020-06-20T16:51:23Z,0
12,UgwA3gpyfO0_9rswW754AaABAg,IsQwbYsB1P8,Навальный LIVE,0,0,Елена Кольчугина,Давайте теперь самоизолируемся добровольно до 2 июля. Страшно.,2020-06-20T10:07:25Z,0
13,UgwJmzYPA47WOhhGtnZ4AaABAg,IsQwbYsB1P8,Навальный LIVE,0,0,Елена Кольчугина,"Нас захватили гномы и карлики, подземные жители. ( Это конспирология)",2020-06-20T09:52:33Z,0
14,UgzNy1__hs0nnu1Si_J4AaABAg,IsQwbYsB1P8,Навальный LIVE,0,0,Артур,"В Москве возможно да неплохая медицина и то не вовсех медучреждениях, но вся остальная часть России в ужасном состоянии, видно же всё, случись где что везут на лечение в Московские больницы потому как по месту немогут и нечем лечить",2020-06-19T15:56:57Z,0
15,Ugx67hOiqhb2rjriq094AaABAg,IsQwbYsB1P8,Навальный LIVE,0,0,Татьяна Ф,"Я думаю , маски от Собяки он сможет продать на запад, флаг ему в руки и враньё в ж.....пу",2020-06-19T10:44:16Z,0
16,UgwIAJnVjeKwLOyTbw14AaABAg,IsQwbYsB1P8,Навальный LIVE,0,0,Яков Калинин,👍🔥👍,2020-06-18T19:47:29Z,0
17,Ugx5XfBHvRPN93d-IR54AaABAg,IsQwbYsB1P8,Навальный LIVE,0,0,ШАМАН,"Пыня Дырявый скоро всё, покидает нас ☠️ /+/",2020-06-18T12:16:04Z,0
18,UgwMtA8Y6Ig37cllurB4AaABAg,IsQwbYsB1P8,Навальный LIVE,0,0,POLINER MM,"Алексей,похоже вся эта правящая верхушка-преступна ..почему они не под следствием и не под судом? Откуда у них горы бобла ??? У ветеранов войны пенсии по 20-30т.р ,конечно,по сравнению с мировым уровнем ,с уровнем пенсий ""побеждённых"" это мизер но на это ещё можно как то жить, а  у нас первых ""детей""послевоенных лет,пионеров,комсомольцев ,после того как раздербанили страну и лёгкую и тяжёлую промышленность в купе с колхозными сельскохозяйственными предприятиями у нас ,ставших теперь пенсионерами, у нас пенсии вдвое-втрое  ниже !!! Мы поставлены на уровень биосуществования, когда уплатив ЖКХ вы  остаётесь элементарно без денег .это не фигура речи,а так и есть .к примеру ваша пенсия 10500,платёж за ЖКХ 9700 ,в остатке 800р...это на месяц !!!! И? Куда потратить эту сказочную сумму? ?? На верёвку ??!!!",2020-06-18T07:11:45Z,0
19,UgxVISM3amBcH07B5TZ4AaABAg,IsQwbYsB1P8,Навальный LIVE,0,0,Алексей Иванов,Как же мерзко смотреть этого рыжего таракана! Путина в отставку!,2020-06-18T06:29:27Z,0
20,Ugz0zp1eCM58VgMtF3Z4AaABAg,IsQwbYsB1P8,Навальный LIVE,0,0,Рен Хамидов,вранье на вранье,2020-06-18T05:10:56Z,0
21,Ugyweykk5CJ4nC_1TS54AaABAg,IsQwbYsB1P8,Навальный LIVE,0,0,иван евтюхов,ЭТОГО НЕТ   В ИТОГЕ ПРИХОДИМ КАК НИ СТРАННО К ВОЙНЕ ВОПРОС ВРЕМЕНИ        ЧТО БУДЕТ КАДА ВОЙНА И ЧТО ЗАХОТЯТ СОВРЕМЕННЫЕ ПОБЕДИТЕЛИ УЙДЕТ В ИСТОРИЮ     НО СЕЙЧАС ДВИЖЕНИЕ ПРАВИТЕЛЬСТВА ЭТО РОЗЖИГ ВОЙНЫ,2020-06-17T18:34:07Z,0
22,Ugyv4vJzIk_6zJ-dnxV4AaABAg,IsQwbYsB1P8,Навальный LIVE,0,0,иван евтюхов,ВАЖНО ДЛЯ НАЧАЛО СОБЛЮДАТЬ ОСНОВНЫЕ ПРАВИЛА КОНСТИТУЦИИ,2020-06-17T18:30:27Z,0
23,Ugw-JFcJUISMTKqxqLd4AaABAg,IsQwbYsB1P8,Навальный LIVE,0,0,иван евтюхов,ОНИ НЕ ВРУТ ОНИ ПИШУТ ТЕ ЦИФРЫ КОТОРЫЕ ИМ СКАЗАЛИ,2020-06-17T18:28:24Z,0
24,Ugxsnpa6-bFAOEvHVMh4AaABAg,IsQwbYsB1P8,Навальный LIVE,0,0,иван евтюхов,все что вы несете чушь все что вносится в конституцию чушь  ВАЖНО это защита прав человека КЕМ оно защищается И защищается  как    потому что весь ваш словесный  панос не имеет смысла когда на ту же КОНСТИТУЦИЮ просто кладут и ее защита просто ОТСУТСТВУЕТ,2020-06-17T18:02:33Z,0
25,UgyU719ept0dqjYLua14AaABAg,IsQwbYsB1P8,Навальный LIVE,0,1,Кузя,"Навальный молодец, спасибо за то, что вы освещаете важные новости",2020-06-17T12:20:47Z,0
26,UgzlOrzMfgkaQmear_p4AaABAg,IsQwbYsB1P8,Навальный LIVE,0,0,Артур Позыкаев,"У России лучшая медицина, но только письков забыл сказать, что у России, точнее у них, она в Израиле!А в России вместо больниц-конюшни!",2020-06-17T06:01:07Z,0
27,UgxdqsDMzIwdFwAMqah4AaABAg,IsQwbYsB1P8,Навальный LIVE,0,1,К Вадрат,"‪Предлагаю объявить российским звёздам, блогерам,   Народный-БАЙКОТ!!    (Не ходить на концерты, отписаться во всех соц.сетях и тд.) Шавки кремлевские. ‬",2020-06-17T03:38:01Z,0
28,UgyuGDcfLC86j1cUgB14AaABAg,IsQwbYsB1P8,Навальный LIVE,0,0,Шамиль Якубов,Какой ты подлец навальный. Все что вроде бы хорошо ты должен запачкать обязательно.,2020-06-17T01:00:32Z,0
29,UgzsRDrZZKo2BXvK27N4AaABAg,IsQwbYsB1P8,Навальный LIVE,0,1,Константин Самсонов,"""Самая лучшая система здравоохранения"", но лечиться ездят за границу и постоянно собирают деньги на лечение за рубежом.",2020-06-16T21:33:06Z,0
30,UgyTXvekeI65W7E__y94AaABAg,IsQwbYsB1P8,Навальный LIVE,0,0,Tatu Tata Gribulina,Peskow - nagljadnyj primer beznakazannosti I bezotwetstwennosti w Rossii. Absoljutno naglaja merzkaja samodowoljnaja morda!,2020-06-16T17:31:02Z,0
31,UgwlXO5jx4n9aR4TZVh4AaABAg,IsQwbYsB1P8,Навальный LIVE,0,1,Mr_feel,"*Наша медицина,аналогов нет!* 😅😅🤣 
П.С. Даже аспирин без поставок компонентов из Китая выпускать не можем!  😂",2020-06-16T15:17:52Z,0
32,Ugz_u9a2JlAQSEa6ADF4AaABAg,IsQwbYsB1P8,Навальный LIVE,0,0,Андрей Литвинов,Песок под моими ногами скрипит,2020-06-16T14:09:42Z,0
33,Ugzs2yWXTW6buTZBMjR4AaABAg,IsQwbYsB1P8,Навальный LIVE,0,0,Неизвестно Неизвестный,видео в топ!,2020-06-16T11:23:15Z,0
34,UgyQ85QvtLW5jzOmgpV4AaABAg,IsQwbYsB1P8,Навальный LIVE,0,0,Андрей Петров,Вы целыми монастырями и казармами записываете людей в больных.,2020-06-16T10:35:05Z,0
35,UgxXoWrbxHgX7rE1vcV4AaABAg,IsQwbYsB1P8,Навальный LIVE,0,0,Андрей Петров,"А что не так со смертностью? А почему заразность превышает выздоровевших? Число не меняется заболевших а число выпесаных в 2 раза или на 30% меньше и так проходит 2,3,4 недели где эти люди , я посчитал по своему региону где заражений больще ста и было 200 ,17 дней назад 3 дня выздоравливоло по 10 чел , выходные, я приготовился что сегодня выздоровет как минимум 500, выздоровило 106. Где остальные? Почему их ни где нет? Вы нашли вирус который можно найти у 60% населения с которым человек может жить и все болячки списываете на этот вирус? Чтоб сидели дома? Чтоб не митинговали? А это маска это символ ""свободы слова""? Почему же ваши графики показывают во всех странах заражения 0 кроме Америки ? Америка враг все понятно у нас не должно быть больше! А Италия, Испания, Германия близки к 0 по заражениям у нас что люди из другого мяса? Так что пусть П и его банда дальше сидят на своих местах . пусть воруют Бог им судья. Но я не хочу сидеть в маске везде я хочу чтоб мои дети нормально учились. А вы ждете смертности не пойми от чего... Все умершие имели тчжкие хронические заболевания. Не про одного не сказано умер спортсмен ни чем не болевший. Не один продавец Радежа не заболел статистика управляющего в моем городе. Если Леша начнет сейчас митинги сразу смертность нарисуют и его во всем обвинят. Поэтому у Навального теперь другая стратегия нагонять жуть. Но это тоже не правильный ход. Если вы всего боитесь то сейчас вам и наденут  ошейники и сделают поводок. И вы попадете в пресловутый "" Эл ектронный конслагерь"". Ваше ДНК собирают, Единый Реестр делают. Электроные поспорта вводят. Для чего? Распознование лиц для чего? Леша проснись! Посмотри выпуск Платошкина на обращение П. Все по полочкам. Может Леша наоборот лабирует введение цифровизации и сбора данных?",2020-06-16T10:33:55Z,0
36,UgwyRjMeaZJYkdCKE-V4AaABAg,IsQwbYsB1P8,Навальный LIVE,0,0,Теплый Пледик,"Алексей Навальный был хотя бы в одной бюджетной больнице? Я вот была. И претензий вообще к ним не имею. Но о чем это я... Какими бабками ворочает Навальный, что больной глазик летит лечить за границу)))",2020-06-16T09:55:52Z,0
37,UgwKCBz_WpOTZv8PFfJ4AaABAg,IsQwbYsB1P8,Навальный LIVE,0,0,Раиса Синякова,ВОЗ тоже коррумпированный? Навальный во всем потокает кураторам из США?,2020-06-16T09:25:18Z,0
38,UgzcRDGRThh2pLCgCmh4AaABAg,IsQwbYsB1P8,Навальный LIVE,0,0,Роман Полянский,"Уважаемый Алексей. Немного не по теме, но очень бы хотелось, чтобы вы обратили внимание на ситуацию с Крымскими обсерваторами. Создаётся впечатление (и оно не без основательно) что Роспотребнадзор, Аксёнов и владельцы некоторых пансионатов в сговоре и очень хорошо зарабатывают за счёт государства. Всех местных моряков прибывших из-за границы принудительно отправляют в обсерваторы, когда всем остальным гражданам России, добро пожаловать на курорт. И вот что интересно, почему власти отказываются использовать covid тесты на границе. Видимо Им выгодно посадить человека в клетку и ещё заработать на этом. Сейчас, после многих месяцев полной изоляции моряки наконец получили возможность вернуться домой, но в место этого в обсерваторы с ужасными условиями, в комнаты с незнакомыми людьми. Мы готовы платить за эти тесты из своего Кормана, но власти умышленно не дают этого делать. Заранее спасибо и респект от всех Крымских моряков!",2020-06-16T08:38:57Z,0
39,UgyEG6XdT95fRFA9PW94AaABAg,IsQwbYsB1P8,Навальный LIVE,0,0,Гриша Гриша,Навальному верить - себя не уважать,2020-06-16T08:02:04Z,0
40,Ugw9F_CBfzxwFhTx6et4AaABAg,IsQwbYsB1P8,Навальный LIVE,0,0,Творю Добро,Ха ха Плесков в политические Стендаперы подался? Видать было чем заниматься когда боролся с вирусом отважно,2020-06-16T06:26:48Z,0
41,UgypWUsLnxzg11RL5Ut4AaABAg,IsQwbYsB1P8,Навальный LIVE,0,0,olka,"Можно не слушать Пескова, а просто смотреть в его глаза - глаза мошенника, который всю жизнь пробрехал, причем его ложь достигла высокого профессионализма, который оттвчивался на протяжении 20 лет.",2020-06-16T04:03:18Z,0
42,UgxWyJ1socWZ5jHv2Jd4AaABAg,IsQwbYsB1P8,Навальный LIVE,0,0,Ольга Ковалева,Не надо сать нам в уши Навальный,2020-06-16T03:18:15Z,0
43,UgyzvjIwRmlBip7qhZB4AaABAg,IsQwbYsB1P8,Навальный LIVE,0,0,Ольга Ковалева,Интересно сколько навальной платят из сша,2020-06-16T03:17:25Z,0
44,UgwtpafUxFJWhc0bxUx4AaABAg,IsQwbYsB1P8,Навальный LIVE,2,0,Василий Бай,"Просто ненавижу эту личность за такие слова, лучшая медицина которой нет. ..",2020-06-15T21:12:23Z,0
45,UgwtpafUxFJWhc0bxUx4AaABAg.99wbY00fjUl99xlxHCUcbs,IsQwbYsB1P8,Навальный LIVE,0,0,Гриша Гриша,мозгов у тебя нет,2020-06-16T08:02:35Z,1
46,UgwtpafUxFJWhc0bxUx4AaABAg.99wbY00fjUl99x4a6p0_IB,IsQwbYsB1P8,Навальный LIVE,0,0,Павел Дутов,Медицина которой нет? Что ж вы тогда еще живы до сих пор?,2020-06-16T01:34:57Z,1
47,UgxGOzzEvS--1xjIItJ4AaABAg,IsQwbYsB1P8,Навальный LIVE,0,0,Арн Айвазовский,Ну да дети пескова за границей от нас морга лечатся... И всех этых.. П.... И самы и семьи там за бугром... А для народа и наша пойдёт...,2020-06-15T20:01:26Z,0
48,UgyzqltnvMjz0qMT22d4AaABAg,IsQwbYsB1P8,Навальный LIVE,0,0,koshka linocka lolo,ну не хочет Нава на дебаты !!!  Отъе ..итесь уже от человека  !!!,2020-06-15T19:09:53Z,0
49,Ugwf-ZUXut5e_QQKjaB4AaABAg,IsQwbYsB1P8,Навальный LIVE,0,0,Мухаммад Убайдулаев,Да унас Рф лучшая медицина а ты навальный думал что у вас в америке лучшая?ты для патриотов кукла американская,2020-06-15T18:22:39Z,0
50,UgymBvyV6rpsYzpIj3Z4AaABAg,IsQwbYsB1P8,Навальный LIVE,0,0,Папа Сын Футбол Пандемия футбола,"Пора народу приватизировать Воду, и продавать политикам 1 литр воды 100 т.р.",2020-06-15T17:27:31Z,0
51,UgxJZGSTkJGmf0WuWZt4AaABAg,IsQwbYsB1P8,Навальный LIVE,0,0,Алекс Ник,"Не хочу ни о ком плохо говорить. Они болеют, их то лечат. Мишустин заболел, вылечили. Песков заболел, вылечили. Министры заболели, лечат. Губернаторов и мэров самолётами в Москву везут. А нам куда простым гражданам деваться? Сам очень нуждаюсь в медпомощи, живу что каждый новый день, как последний и выхода нет. Меня ведь в Москву никто не заберёт? А мы ведь тоже люди и жить хотим. Считайте, что это Крик о помощи. Правду написал. А мне просить кого? Дмитрий Сергеевич, у вас есть выход на президента, а у меня нет. Я бы позонил ему с просьбой о помощи.... в администрацию смысла нет писать.",2020-06-15T16:31:40Z,0
52,UgzGUJ6N2OtKhxfv8_14AaABAg,IsQwbYsB1P8,Навальный LIVE,0,0,Илья Русин,Лайк,2020-06-15T16:22:47Z,0
53,UgzCHh3tm_117PneIAR4AaABAg,IsQwbYsB1P8,Навальный LIVE,1,0,Нина Михай,"Стивин Кинг сказал УЖАС,  и выключил Елену Малышеву",2020-06-15T16:21:58Z,0
54,UgzCHh3tm_117PneIAR4AaABAg.99w5IxlXmOh99w5v53kBOD,IsQwbYsB1P8,Навальный LIVE,0,0,Нина Бердяева,потом увидел шоу лешки и вернул малышеву,2020-06-15T16:27:19Z,1
55,UgywWQZcliXykEwSPa54AaABAg,IsQwbYsB1P8,Навальный LIVE,1,0,Сметанка Лайт,"Песков, приезжай лечится в провинцию, а лучше детей и внуков привози. Только средство от тараканов захвати",2020-06-15T16:20:42Z,0
56,UgywWQZcliXykEwSPa54AaABAg.99w59bYbAzV99w5TyHjJmB,IsQwbYsB1P8,Навальный LIVE,0,0,Полина Рублева,надо будет - приедет),2020-06-15T16:23:28Z,1
57,Ugx93tmlFeApTpSYLSB4AaABAg,IsQwbYsB1P8,Навальный LIVE,1,0,Людмила Нарыкова,Жду дебаты с Кацем,2020-06-15T16:16:00Z,0
58,Ugx93tmlFeApTpSYLSB4AaABAg.99w4cFEXXoZ99w5wVS3oCG,IsQwbYsB1P8,Навальный LIVE,0,0,Нина Бердяева,не ждите) трусишка лешка снова отмажется),2020-06-15T16:27:30Z,1
