,id,videoId,authorVideoName,totalReplyCount,likeCount,authorDisplayName,textDisplay,publishedAt,isReply
0,UgxdF03aaF4vkhMkAPV4AaABAg,oHHUHSDq2hQ,Телеканал Дождь,0,0,atom atom,"Сейчас удобно быть либерастом. Можно воровать, убивать, а если поймают, то тут же поднять шумиху ""я политический, власть меня убирает"". И все нормально будет.",2020-07-01T21:29:22Z,0
1,UgwbUdVhb9v0aYx9ndJ4AaABAg,oHHUHSDq2hQ,Телеканал Дождь,0,0,качко олег качко,Очень маленький сррк,2020-07-01T03:59:08Z,0
2,Ugx4PHsgMFjMTr8k1C14AaABAg,oHHUHSDq2hQ,Телеканал Дождь,0,2,Матвей Ивашин,"129 миллионов украли, получили условно. Как так можно???",2020-06-27T18:00:31Z,0
3,UgzFNCkjj4lt0attU9l4AaABAg,oHHUHSDq2hQ,Телеканал Дождь,0,1,Справедливый Пенсионер,"А Сердюков когда посадят, по телевизору всем показали какой он вор,,, почему не сидит он?",2020-06-27T15:02:51Z,0
4,UgwSIVsnzcACaJ416_x4AaABAg,oHHUHSDq2hQ,Телеканал Дождь,0,0,Справедливый Пенсионер,"Никто не верит что они виновные, это брехня",2020-06-27T14:59:15Z,0
5,Ugx_rqm2Ng3ZVegTgz14AaABAg,oHHUHSDq2hQ,Телеканал Дождь,0,2,Валентина Козеева,"Если украл,присвоил госуд.средства,отвечай по полной.Не нужно собирать театральное сообщество.Замахали уже!!!",2020-06-27T12:40:53Z,0
6,UgxKgI954xzfdVPIxSN4AaABAg,oHHUHSDq2hQ,Телеканал Дождь,0,0,Maxus Gladius Simone,"""судьи"", вы, либо приговор обоснуйте,
либо обвинение снимите.
... обвинялка ж на пожизненное тянет.
А то КРАСТЬ МНОГО - МОЖНО И НУЖНО!",2020-06-27T10:16:58Z,0
7,Ugwyo64buysp1Tcgq0N4AaABAg,oHHUHSDq2hQ,Телеканал Дождь,0,0,Анна Сергеева,Цой бы блеванул если бы увидел этот фильм,2020-06-27T09:18:29Z,0
8,UgyX-iE06ZGjiyaKCBJ4AaABAg,oHHUHSDq2hQ,Телеканал Дождь,0,2,Андрей В,Ворьё.,2020-06-27T08:59:27Z,0
9,UgxYe9jsXrKZADAubYt4AaABAg,oHHUHSDq2hQ,Телеканал Дождь,0,0,NINA ZHUKOVA,"А те чёрные лесорубы   Сыктывкара? Денег наколотили, столько!!!!!!! Лесов вырубили за 2 копейки продавали вековые леса,  и им ничего! 🥺",2020-06-27T07:26:46Z,0
10,Ugx_nXoViYqwfWzJ13V4AaABAg,oHHUHSDq2hQ,Телеканал Дождь,0,0,D Im,Сколько бы денег этот «творец» собрал за свое творчество ? Что то мне подсказывает что он очередной кусок говна,2020-06-27T05:43:37Z,0
11,UgyhLAhA3pqO5vJQD854AaABAg,oHHUHSDq2hQ,Телеканал Дождь,0,2,Виталий Матвеев,Вор должен сидеть в тюрьме,2020-06-27T05:37:53Z,0
12,UgyXxxRMZQW7dvWlHQx4AaABAg,oHHUHSDq2hQ,Телеканал Дождь,0,3,86chemist1,"Вор должен сидеть в тюрьме, а не условно освобожденный ! ! !",2020-06-27T02:02:12Z,0
13,Ugzaasl8iqrXnmE_uKl4AaABAg,oHHUHSDq2hQ,Телеканал Дождь,0,1,Юрий X,"Серебренникову и Апфельбаум за кражу 129 миллионов рублей дали условно?! 🤔 Иванов и Петров, наверное, получили бы за это минимум 20 лет строгача! 😂😂😂",2020-06-26T23:16:01Z,0
14,UgzBzZMSzSV3vzeA9yp4AaABAg,oHHUHSDq2hQ,Телеканал Дождь,0,0,Любовь Костыгина,"Как не стыдно, - воруют миллиардами, безнаказанно, а честных людей засуживают!
Люди, это нельзя позволять!!",2020-06-26T22:02:59Z,0
15,Ugy7rSWcd8K0r8fxmjN4AaABAg,oHHUHSDq2hQ,Телеканал Дождь,0,0,Т - И - З,"Да, богема победила, нагнула и государство и простой народ: простой смертный получил бы реальный срок за кражу миллиона. А тут устойчивая преступная группа, мало того что ущерб не вернули, а вину не признали и сотни миллионов возвращать не собираются и с...ли они на правосудие. Основой для применения условного наказания является возмещение ущерба и деятельное раскаяние!!! А тут ничего из перечисленно го. И также закон прогнется перед алкашем- наркоманом-убийцей и просто хорошим парнем Ефремовым - дадут ему как Климу Чугункину 12 лет каторги условно за пролетарское (а ныне богемное) происхождение.",2020-06-26T19:18:48Z,0
16,UgxQ4xwY5W8ymBdgTFd4AaABAg,oHHUHSDq2hQ,Телеканал Дождь,0,1,Т - И - З,"ч. 4 ст. 159 УК РФ мошенничество, совершенное организованной группой либо в особо крупном размере наказывается лишением свободы на срок от пяти до десяти лет... Этой статьей не предусмотрен условный срок",2020-06-26T19:17:21Z,0
17,UgxaGrXBt-hF3wPvsyB4AaABAg,oHHUHSDq2hQ,Телеканал Дождь,0,0,Т - И - З,"Смехотворный приговор продажной судьи еще раз говорит о несправедливой судебной системы, возглавляемой старцем Лебедевым. Насколько знаю, если голодный гастарбайтер возьмет кусок колбасы в магазине, то его сразу этапируют в СИЗО, где он как минимум просидит 6 мес и получит наказание. А вор в законе Серебрянников украл у нас с вами из бюджета страны 128,9 млн.руб. то его почему-то не привлекли к уголовной ответственности. Позор суду и всей судебной путинской системе!",2020-06-26T19:13:16Z,0
18,UgygAJf3jlHWWHeiIsh4AaABAg,oHHUHSDq2hQ,Телеканал Дождь,0,0,Т - И - З,Это вам не мелочь по карманам тырить. Уважаемые люди заступились.,2020-06-26T19:12:42Z,0
19,Ugy_VuJHHNEHTMcKwet4AaABAg,oHHUHSDq2hQ,Телеканал Дождь,0,0,Т - И - З,"А че, так можно???? Ущерб 128,9 млн руб., а за это условный срок и штраф 800 тыс. руб.???? Пипец, да в стране минимум 50% населения с такими приговорами стали бы воровать... Ну как так можно? Обокрал государство (=нас, налогоплательщиков) и условный срок?! А видел, ктонидь его какашка-спектакли? Очень сомневаюсь, что на них налогоплательщики ходят. Просто креативный парень придумал схему заработка, заинтересовал кого надо, и все!!! Мое мнение: деньги украденные вернуть, тогда и можно условно...",2020-06-26T19:10:48Z,0
20,UgxmhZ4oerd_IoZRaN94AaABAg,oHHUHSDq2hQ,Телеканал Дождь,0,1,Владимир М морской Кот,Как то не логично Свистнули 129 млн и вот три года условно!! Какому бы инженеру с завода дали бы лет 14 а тут...Нееет...надо бы дать лет 13,2020-06-26T18:00:16Z,0
21,UgyQeIFalgJf_iPBXzt4AaABAg,oHHUHSDq2hQ,Телеканал Дождь,0,0,Anya V,"Все ресурсы, которые освещают это дело, зачищают комментарии. Это о многом говорит.",2020-06-26T15:05:07Z,0
22,Ugyk0fD6VLqbal3Os2J4AaABAg,oHHUHSDq2hQ,Телеканал Дождь,0,0,Александр Мозговой,"Только ""нужные""комментарии, оставляет автор видео (либерастный дождь)",2020-06-26T14:56:03Z,0
23,UgxlIqrBnGE-leVBJLB4AaABAg,oHHUHSDq2hQ,Телеканал Дождь,0,1,Виталий Аверьянов,"Жаль шайку не закрыли! Все эти ахим яхим, сидеть должны! Их выстрел понят и цель ясна! А за поступок отвечать надо, азохен вей!",2020-06-26T14:42:25Z,0
24,UgzlCy6POgZFNjTr8Hp4AaABAg,oHHUHSDq2hQ,Телеканал Дождь,0,1,Таня Потапова,"Потанина надо на пожизненно посадить за его делишки, а то нашли крайних актеров. Дебилизм полный.",2020-06-26T14:19:55Z,0
25,Ugwfvfk1N39imiweqxF4AaABAg,oHHUHSDq2hQ,Телеканал Дождь,0,0,Malloriak,Украл 130 лямов и условно дали....,2020-06-26T13:44:45Z,0
26,Ugy5XOhMfi56_8KFcjh4AaABAg,oHHUHSDq2hQ,Телеканал Дождь,0,0,Stator 779,Бездарь и наркоман получил по заслугам. Справедливо!,2020-06-26T13:22:18Z,0
27,Ugxy85ui3YsCJL-nUcp4AaABAg,oHHUHSDq2hQ,Телеканал Дождь,0,1,Понемногу обо всем.,"Это было хищение молодых душ и здорово, что у них : к.с и др. будет время подумать, что они творили с подмостков театра. Ну, а то, что сейчас произошло - это наказание за содеянное .",2020-06-26T12:58:55Z,0
28,UgyUHrj9bj4uvJqKhph4AaABAg,oHHUHSDq2hQ,Телеканал Дождь,0,1,Vera Shiyanova,"Ходорковский  запросился на свободу-  под болезнь МАМЫ , обещая не лезть в ПОЛИТИКУ - подлый ЛЖЕЦ.     А,СЕРЕБРЕННИКОВ,  интересно , под кого будет клянчить  СВОБОДУ ?",2020-06-26T12:42:34Z,0
29,UgyzmnuEM2CX5OjCKjB4AaABAg,oHHUHSDq2hQ,Телеканал Дождь,1,0,Елена Бушмакина,Суки. Хочется взять автомат в руки и по пукинским шавкам пройтись.,2020-06-26T12:36:08Z,0
30,UgyzmnuEM2CX5OjCKjB4AaABAg.9AN0CTpIOJx9AUmt3R0YmT,oHHUHSDq2hQ,Телеканал Дождь,0,0,Татьяна Воронина,млеешь от развратного серебренникова?,2020-06-29T13:04:56Z,1
31,Ugw_5i-LsaFancIhpll4AaABAg,oHHUHSDq2hQ,Телеканал Дождь,0,2,Мугульсум Тикушева,"Интересно, можно найти, хотя бы одного, среди депутатов, начиная от главы до мелкой сошки, чтобы не воровали.
А у остальных артистов и золотой молодёжи, двойное гражданство, дома, виллы в Майями и на западе .
Сколько было видио на ютубе, показывали, сами свои виллы и деткам и внуков.
Серебренников стал, просто не удобен.",2020-06-26T11:54:39Z,0
32,Ugz2WRSN5Dvkjr9-fot4AaABAg,oHHUHSDq2hQ,Телеканал Дождь,0,0,DMX TM,Реально Марфуша никакуша.,2020-06-26T11:45:45Z,0
33,Ugy3NigfjK1T05jF-h54AaABAg,oHHUHSDq2hQ,Телеканал Дождь,0,0,Alexander Bogdanov,четыре еврейские фамилии не много ли?,2020-06-26T11:34:36Z,0
34,Ugw4t-QIREezRdy-vrF4AaABAg,oHHUHSDq2hQ,Телеканал Дождь,0,0,Александр Камкин,"На чей конец должен начать Серебренников, Марфа?",2020-06-26T11:19:42Z,0
35,UgzPQdZ5Qu_qC3tOE5B4AaABAg,oHHUHSDq2hQ,Телеканал Дождь,0,0,Александр Камкин,"Деньги, которые должны были быть потрачены на ""постановку"", обналичили...Что это? Хищение.",2020-06-26T11:16:43Z,0
36,UgxilrZDhDSub6cTcxV4AaABAg,oHHUHSDq2hQ,Телеканал Дождь,0,0,MultiMatola,"Безобразие!
Когда  и  где  еще  судили  творцов?!
Это -  самые  злостные  разрушители  системы?
Впрочем,  может,  так  оно  и  есть.",2020-06-26T10:58:44Z,0
37,UgzbmZidg_Sz9RO0igx4AaABAg,oHHUHSDq2hQ,Телеканал Дождь,1,2,vlad kom,Вор должен сидеть в тюрьме)))),2020-06-26T10:42:59Z,0
38,UgzbmZidg_Sz9RO0igx4AaABAg.9AMoFiSOXmD9ANU4jFeNlF,oHHUHSDq2hQ,Телеканал Дождь,0,0,Артур Гулицький,А ты на бутылке сидеть должен),2020-06-26T16:57:13Z,1
39,Ugw9Im-1RxGUiBIzq0B4AaABAg,oHHUHSDq2hQ,Телеканал Дождь,0,0,Татьяна Львова,"Хватит травить Кирилла!. Уже было доказано что он не виноват и даже вкладывал свои личные деньги.А когда осудят Сердюкова с Васильевой , Потанина и других настоящих преступников?",2020-06-26T10:17:13Z,0
40,Ugzmg646fhAt9o03Ddx4AaABAg,oHHUHSDq2hQ,Телеканал Дождь,1,1,Путинизм Мёртв,А золотовых и других чубайсов когда посадят?,2020-06-26T09:56:43Z,0
41,Ugzmg646fhAt9o03Ddx4AaABAg.9AMixudlvM89ARrI1TM9bd,oHHUHSDq2hQ,Телеканал Дождь,0,0,Николай Банник,"Когда ты слезешь с дивана и бросишь свое героическиое тело на амбразуру. Надеешься , что ты будешь лежать на диване, дуть пиво, а другие будут класть свою жизнь и топтать зону за твоё светлое будущее?",2020-06-28T09:45:42Z,1
42,Ugys-BtTIcyfU8StrAt4AaABAg,oHHUHSDq2hQ,Телеканал Дождь,0,3,agha sh34,"Украл курицу десят лет тюрьмы, а украл миллионы почёт и место в парламенте. Так во всех странах бывшего СССР.",2020-06-26T09:49:58Z,0
43,UgwohLe6MEdqNvHFsQZ4AaABAg,oHHUHSDq2hQ,Телеканал Дождь,1,1,Susan Miller,Культурные воришки,2020-06-26T09:47:27Z,0
44,UgwohLe6MEdqNvHFsQZ4AaABAg.9AMhu5ttQyH9AMjTbBXsZK,oHHUHSDq2hQ,Телеканал Дождь,0,0,Роман Шилов,"В данном случае скорее как у Ильфа и Петрова - ""голубые"":))).",2020-06-26T10:01:11Z,1
45,Ugzpvj4MxSth9cjGe254AaABAg,oHHUHSDq2hQ,Телеканал Дождь,0,3,Мила. Мила,"Урааааа,мало дали. Надо было больше.",2020-06-26T09:00:39Z,0
46,UgwYuB7fQuwIa66b-C54AaABAg,oHHUHSDq2hQ,Телеканал Дождь,0,2,олег трофимов,Это ворье никогда не сгинет пока вы всех по очереди не перевешаете !,2020-06-26T08:57:42Z,0
47,UgwBWrvK0vfjvm-BI5Z4AaABAg,oHHUHSDq2hQ,Телеканал Дождь,0,8,Malloriak,"Читаю комменты либерды и удивляюсь:
Либерда : посадить коррупционеров!
Суд: Ок. Сажаем
Либерда: Ай  не того ворюгу посадили",2020-06-26T08:42:44Z,0
48,Ugw0chA-11jCRf-HffZ4AaABAg,oHHUHSDq2hQ,Телеканал Дождь,0,2,Muhomor 1,А обналичивание государственных денег это не нарушение закона? Серьезно!!!!????,2020-06-26T06:31:26Z,0
49,UgxA0Lt8RZsn0sfgeJ54AaABAg,oHHUHSDq2hQ,Телеканал Дождь,1,0,Татьяна Карелина,Стыдно то как! Позорище! Ненавижу наше правительство!,2020-06-26T06:22:40Z,0
50,UgxA0Lt8RZsn0sfgeJ54AaABAg.9AMLT7RWox49AMi3Fil0Qd,oHHUHSDq2hQ,Телеканал Дождь,0,1,Susan Miller,Почему? Воровать гос деньги не хорошо.,2020-06-26T09:48:51Z,1
51,Ugx60kb6ohk5d8NLgNV4AaABAg,oHHUHSDq2hQ,Телеканал Дождь,0,4,Жанна Савченко,"Серебренников- садом и Гоморра, публичные оргии пусть у себя дома ставит и на свои ☝🏻деньги. На чужие и дурак может . Хватит переигрывать классиков- не позорится пусть, своего ничего кроме голых жоп придумать не может. Свои болезни навязываать народу России НЕ НАДО! ( ну а с остальными Потаниными Чубайсами Уссами ... так и до них дело дойдет... они хотябы гениталиями при детях не сверкают толпой как Серебренников на сцене)",2020-06-26T04:30:01Z,0
52,UgwB83zW5gB8zmk5gY14AaABAg,oHHUHSDq2hQ,Телеканал Дождь,1,0,жи есть,А сколько лет обнулянту- грабителю??,2020-06-25T10:49:56Z,0
53,UgwB83zW5gB8zmk5gY14AaABAg.9AKFFkdhgE39AKozQ4JxcF,oHHUHSDq2hQ,Телеканал Дождь,0,0,Женя Сметанин,расстрел,2020-06-25T16:10:52Z,1
54,UgzkuyGYWaDkDX3zWp14AaABAg,oHHUHSDq2hQ,Телеканал Дождь,0,0,Francesca Parolisi,"Так если он украл деньги, то деньги где то должны быть. Не закопал же он их на даче. Может он недвижимость купил, произведения искусства и так далее. Испарились что ли???",2020-06-25T09:05:28Z,0
55,UgwARNZ16t2a__QDrAR4AaABAg,oHHUHSDq2hQ,Телеканал Дождь,0,0,Татьяна Голихова,"А теперь , по исправленной Конституции , судьи подконтрольны и примат внутренних законов над международными.",2020-06-25T08:05:28Z,0
56,UgzTEHM5iV59VEalkoV4AaABAg,oHHUHSDq2hQ,Телеканал Дождь,0,1,Art Bae,"Сожаем, сожаем... на даче огурцы.
А как вы хотели...?  ""дачи"" не зря строили. Скоро в России народу не останется.
Все сидеть будут. Может выростут?",2020-06-25T06:57:54Z,0
57,Ugzujt9C06Q1KtK7rGh4AaABAg,oHHUHSDq2hQ,Телеканал Дождь,0,1,Кира Тимофеева,Когда эта шайка отвали от Кирилла 🤬,2020-06-25T06:45:24Z,0
58,UgzgzFOep3VFa-QuGKJ4AaABAg,oHHUHSDq2hQ,Телеканал Дождь,0,1,Елена Швец,Позор нашей судебной системе!!! Идиотизм!,2020-06-25T03:15:18Z,0
59,UgxwLd4G3u63nQJ0Oxh4AaABAg,oHHUHSDq2hQ,Телеканал Дождь,3,4,иван иванов,"Странно, когда эти люди борются с коррупцией и тут же хотят протестовать против решения суда, который хочет посадить коррупционера!?  Вы себя слышите?",2020-06-24T17:01:13Z,0
60,UgxwLd4G3u63nQJ0Oxh4AaABAg.9AIKxKOo6iH9AMjne5LshJ,oHHUHSDq2hQ,Телеканал Дождь,0,1,Роман Шилов,"@Анастасия Старостенкова А решение какого ""суда"" вас устроит? Амерского,ватиканского,уругвайского? Вот туда и....шуруйте.",2020-06-26T10:04:03Z,1
61,UgxwLd4G3u63nQJ0Oxh4AaABAg.9AIKxKOo6iH9ALAUWGQCfC,oHHUHSDq2hQ,Телеканал Дождь,0,4,иван иванов,"@Анастасия Старостенкова для меня как для Русского, решение Российского суда это закон. Серебренников - вор, а вор должен сидеть в тюрьме!",2020-06-25T19:27:29Z,1
62,UgxwLd4G3u63nQJ0Oxh4AaABAg.9AIKxKOo6iH9AL3K_VEceF,oHHUHSDq2hQ,Телеканал Дождь,0,0,Анастасия Старостенкова,"Где доказательства, что он коррупционер? Решение российского суда - не доказательство.",2020-06-25T18:24:58Z,1
63,Ugw4pbyLQRGLKdMErH14AaABAg,oHHUHSDq2hQ,Телеканал Дождь,3,0,Юлия Полосина,"Что происходит? Я живу в какой стране?  Мерзавцы осуществляют  политический процесс против  людей искусства, которые покусились на то, чтобы  развивать нашу культуру!!! Какая мерзость!!",2020-06-24T16:56:28Z,0
64,Ugw4pbyLQRGLKdMErH14AaABAg.9AIKPSU_yeJ9AUnMkXNyk2,oHHUHSDq2hQ,Телеканал Дождь,0,1,Татьяна Воронина,"развивайте ""свою культуру"" у себя на исторической родине. там развращайте детей и молодёжь. вся ваша культура имени сатаны.",2020-06-29T13:09:07Z,1
65,Ugw4pbyLQRGLKdMErH14AaABAg.9AIKPSU_yeJ9ARuPxmUr59,oHHUHSDq2hQ,Телеканал Дождь,0,1,Николай Банник,"""Развивают"" ещё как: Главными темами театральных постановок Серебренникова являются гомосексуализм и агрессивная социопатия. Главный объект презентации, присутствующий как фирменное клеймо практически в каждом спектакле, - обнажённый мужской зад, так сказать, ""икона"" телесности, лишённой всякого духовного измерения. В этих спектаклях герои кривляются, становятся на четвереньки, лают, испражняются, рассматривают свои гениталии, показывают их окружающим. Человеческое начало сведено даже не просто до телесного, а до зоологического. ""Человек - это низкоранговое животное, живущее своей никчёмной нежизнью"", - говорит практически каждый серебренниковский спектакль. И если в чём-то и проявляется попытка вырваться за этот порочный круг, так это в убийстве себе подобных, через которое ""продвинутый"" возвышается над обывателями (именно такова философия самого, пожалуй, удачного из произведений режиссёра - фильма ""Изображая жертву"").",2020-06-28T10:13:00Z,1
66,Ugw4pbyLQRGLKdMErH14AaABAg.9AIKPSU_yeJ9AMDjupF-R6,oHHUHSDq2hQ,Телеканал Дождь,0,0,Елена Захарова,"Эта страна такой была всегда,вспомните Ахматову,ПастернакаБродского и многих других,что вас удивляет?",2020-06-26T05:15:11Z,1
67,Ugz3QwWsbmkpXy2dd_h4AaABAg,oHHUHSDq2hQ,Телеканал Дождь,0,3,оля клишина,ПУСКАЙ  НА ЗОНЕ ПЕРЕВОСПИТЫВАЕТСЯ УРОД!!!!,2020-06-24T16:23:18Z,0
68,UgwPYJ9vJIwPGIuX-j14AaABAg,oHHUHSDq2hQ,Телеканал Дождь,2,2,иван иванов,А как они сэкономили деньги? Одежду актёрам не выдавали?,2020-06-24T16:22:36Z,0
69,UgwPYJ9vJIwPGIuX-j14AaABAg.9AIGXPr-rGx9AMCfSzSmbB,oHHUHSDq2hQ,Телеканал Дождь,0,3,иван иванов,@Елена Захарова квартира в Германии - мало? Остальное припрятал хорошо.,2020-06-26T05:05:50Z,1
70,UgwPYJ9vJIwPGIuX-j14AaABAg.9AIGXPr-rGx9AMCNC3-pvO,oHHUHSDq2hQ,Телеканал Дождь,0,0,Елена Захарова,"А куда разворовали,может покажете их яхты и недвижимость за рубежом.",2020-06-26T05:03:12Z,1
71,UgwtY6A4MZjqPywPCj54AaABAg,oHHUHSDq2hQ,Телеканал Дождь,0,3,иван иванов,Вообще-то для этих коррупционеров сроки маленькие! Желательно сроки увеличить! Народ против коррупции! Народ против коррупционеров!,2020-06-24T16:19:48Z,0
72,UgydAuO5w9EC2AllRVJ4AaABAg,oHHUHSDq2hQ,Телеканал Дождь,3,4,Иванов Сергей,"За ,, творчество"" 7 студии можно и больше дать. Столько любителей театра пострадало, спектакли- говно.",2020-06-24T13:51:05Z,0
