,id,videoId,authorVideoName,totalReplyCount,likeCount,authorDisplayName,textDisplay,publishedAt,isReply
428,UgwiIx1mMLzj8mLZrSN4AaABAg.9ADcjv4b90q9AFMNrWRZds,oHHUHSDq2hQ,Телеканал Дождь,0,3,Mickey Simon,"@Алексей Гусев Дуру пока гонишь ты. Пол страны не платит налоги и зарабатывает на стороне. Всех хочешь посадить? Серебренников очень обеспеченный человек. Он уже снял не один фильм и является пожалуй самым известным театральным режиссером страны. Да действительно, откуда ж у него деньги на хату.",2020-06-23T13:16:00Z,1
429,UgwiIx1mMLzj8mLZrSN4AaABAg.9ADcjv4b90q9AFJHMeh2V2,oHHUHSDq2hQ,Телеканал Дождь,0,1,Алексей Гусев,"@Mickey Simon Стоп, тебе доки нужны? А хату твой святой на какие ...купил? Он сам не знает, как так получилось...не может этого объяснить...НЕ МОЖЕТ! Открыл тумбочку , наверное, а там, денег на квартиру в Германии...Дуру не гони...",2020-06-23T12:48:54Z,1
430,UgwiIx1mMLzj8mLZrSN4AaABAg.9ADcjv4b90q9AFFC0Er5Jx,oHHUHSDq2hQ,Телеканал Дождь,0,3,Mickey Simon,"@Vladimir Hromov такие как вы? Люди борююшиеся с несправедливостью? Ну таким как вам то конечно хочется посадить его. Доказательств ноль, а дело на кого то шить нужно. Случайно не мент?",2020-06-23T12:13:12Z,1
431,UgwiIx1mMLzj8mLZrSN4AaABAg.9ADcjv4b90q9AFDYn5DPz5,oHHUHSDq2hQ,Телеканал Дождь,0,1,Vladimir Hromov,"@Mickey Simon Так вот пытаются, а такие как вы визжите что не надо, простите, он хоть и жулик но еврей,евреев не сажают)))",2020-06-23T11:58:51Z,1
432,UgwiIx1mMLzj8mLZrSN4AaABAg.9ADcjv4b90q9AEzadafrT6,oHHUHSDq2hQ,Телеканал Дождь,0,6,Mickey Simon,@Vladimir Hromov как раз жуликов сажать не начали,2020-06-23T09:48:10Z,1
433,UgwiIx1mMLzj8mLZrSN4AaABAg.9ADcjv4b90q9AEYcj2MFK3,oHHUHSDq2hQ,Телеканал Дождь,0,1,Momo Omm,Ну поднимай свой богему....жги...чо,2020-06-23T05:43:47Z,1
434,UgwiIx1mMLzj8mLZrSN4AaABAg.9ADcjv4b90q9AERXw7L-Ux,oHHUHSDq2hQ,Телеканал Дождь,0,2,Vladimir Hromov,Владимир Ильин не нравится что жуликов сажать начали?,2020-06-23T04:41:49Z,1
435,Ugz7z1MzMUYGy4UjeRN4AaABAg.9ADYd2soyRT9AISr8HxPpN,oHHUHSDq2hQ,Телеканал Дождь,0,0,Лиза,"@Кала Бельды блин, ты  из какого лесу вышел-то и когда? О каком Серебрякове бормочешь или уже двоится в глазах?",2020-06-24T18:10:17Z,1
436,Ugz7z1MzMUYGy4UjeRN4AaABAg.9ADYd2soyRT9AFaISfGImQ,oHHUHSDq2hQ,Телеканал Дождь,0,0,Марина Васько,@Lil Vayne нет.,2020-06-23T15:26:20Z,1
437,Ugz7z1MzMUYGy4UjeRN4AaABAg.9ADYd2soyRT9AFYn7je-7S,oHHUHSDq2hQ,Телеканал Дождь,0,1,Кала Бельды,"Сколько требует закон, столько и будут судить этого мошенника Серебрякова. На подходе ещё один ""гений"" который по пьяне угробил простого работягу. Лпился и дочитался своими погаными пасквилями. Бог всё видит.",2020-06-23T15:04:26Z,1
438,Ugz7z1MzMUYGy4UjeRN4AaABAg.9ADYd2soyRT9AEgUQADpUS,oHHUHSDq2hQ,Телеканал Дождь,0,1,Алексей Гусев,@Фил Роот Так доказали уже...Бухгалтер всё слила,2020-06-23T07:01:09Z,1
439,Ugz7z1MzMUYGy4UjeRN4AaABAg.9ADYd2soyRT9AEb0d5enYe,oHHUHSDq2hQ,Телеканал Дождь,0,0,Фил Роот,Алексей Гусев вот пускай докажут в честном и независимом суде,2020-06-23T06:13:24Z,1
440,Ugz7z1MzMUYGy4UjeRN4AaABAg.9ADYd2soyRT9AEUaX1iqqs,oHHUHSDq2hQ,Телеканал Дождь,0,1,Алексей Гусев,"Так он украл, или нет? Перед законом все равны...",2020-06-23T05:08:31Z,1
441,Ugz7z1MzMUYGy4UjeRN4AaABAg.9ADYd2soyRT9ADhBWBHORE,oHHUHSDq2hQ,Телеканал Дождь,0,1,Lil Vayne,Бохнакажет за мат?,2020-06-22T21:48:04Z,1
442,Ugzki3FVH4E58OsBX-d4AaABAg.9ADWihDZkDW9AKjrccp6KC,oHHUHSDq2hQ,Телеканал Дождь,0,0,Семён Горбунков,@Арина Гусева откуда инфа что в разы больше? и чего сказал такого что не понравилось?,2020-06-25T15:26:07Z,1
443,Ugzki3FVH4E58OsBX-d4AaABAg.9ADWihDZkDW9AHeBp_xdCr,oHHUHSDq2hQ,Телеканал Дождь,0,2,Vladimir Hromov,Lubova Strezneva этот жулик пусть не на бюджетные деньги ставит,2020-06-24T10:38:51Z,1
444,Ugzki3FVH4E58OsBX-d4AaABAg.9ADWihDZkDW9AHcQo5DLq1,oHHUHSDq2hQ,Телеканал Дождь,0,0,Lubova Strezneva,"Это понятно. А вдруг народ думать начнёт из-за фильмов Серебряникова. Его фильм Ученик круче, чем Идиот от Быкова.",2020-06-24T10:23:26Z,1
445,Ugzki3FVH4E58OsBX-d4AaABAg.9ADWihDZkDW9AFIY85d0Ss,oHHUHSDq2hQ,Телеканал Дождь,0,1,Алексей Гусев,"@Маня Несказочная А ты откуда знаешь, что он ...того? Поделись...Врёшь ведь...Собянин много сделал для Москвы...А вот Лужок денег поднял не хило на городе...И все его хвалят...За что?",2020-06-23T12:42:27Z,1
446,Ugzki3FVH4E58OsBX-d4AaABAg.9ADWihDZkDW9AFDB106vGo,oHHUHSDq2hQ,Телеканал Дождь,0,3,Vladimir Hromov,"@Маня Несказочная и еще раз, дурилка, почему этот рваный театрал на свои деньги не ставил спектакли? Ну если он такой талантливый, то пусть как все нормальные люди - продает свой талант, а не ворует деньги из бюджета.",2020-06-23T11:55:36Z,1
447,Ugzki3FVH4E58OsBX-d4AaABAg.9ADWihDZkDW9AFD3iXn5Vc,oHHUHSDq2hQ,Телеканал Дождь,0,3,Vladimir Hromov,"@Маня Несказочная, где он украл? есть пруфу. У Кирюхи бугалтер на обезнальную контору деньги кидал и курьер эти деньги возил. И бух и курьер дали показания. Кирюха обычный жулик. А на оленевода кто дал показания? Давай сюда факты, что и где он украл, балаболка",2020-06-23T11:54:36Z,1
448,Ugzki3FVH4E58OsBX-d4AaABAg.9ADWihDZkDW9AF8GN1RMGs,oHHUHSDq2hQ,Телеканал Дождь,0,0,Маня Несказочная,Vladimir Hromov а клоун Собянин почему не сидит до сих пор? Он в сотни раз больше стырил.,2020-06-23T11:12:38Z,1
449,Ugzki3FVH4E58OsBX-d4AaABAg.9ADWihDZkDW9ADnU592723,oHHUHSDq2hQ,Телеканал Дождь,0,3,Vladimir Hromov,этот клоун высокоинтеллектуальный почему на свои деньги не ставил? Почему бюджет воровал?,2020-06-22T22:43:02Z,1
450,Ugzki3FVH4E58OsBX-d4AaABAg.9ADWihDZkDW9ADXGySe1Fl,oHHUHSDq2hQ,Телеканал Дождь,0,3,Алексей Гусев,Более 100 миллионов стырили...Точно высоко интеллектуальные люди...,2020-06-22T20:12:42Z,1
451,Ugxozk2M3mOK-96D0UF4AaABAg.9ADUxUCTQ6n9ANA-DPwVnV,oHHUHSDq2hQ,Телеканал Дождь,0,2,Gelena N,"Дебет — правильное написание бухгалтерского термина, пишется через букву «е» в обоих слогах. Слово является заимствованным (от лат. Debet — «(он) должен»), правильность написания следует запомнить. Ударения приходится на первый слог — дЕбет.
По моим данным дебет счета не сходится.
В акте сверки неправильно указана сумма по дебету.
Данная операция отображается по дебету счета.",2020-06-26T14:01:42Z,1
452,Ugxozk2M3mOK-96D0UF4AaABAg.9ADUxUCTQ6n9AN0CZs1LUL,oHHUHSDq2hQ,Телеканал Дождь,0,3,Николай Банник,"@MultiMatola Де́бет и кре́дит  — стандартизированные методологические приёмы бухгалтерского учёта.  А через И пишется другое, но похожее слово: дебИл.",2020-06-26T12:36:05Z,1
453,Ugxozk2M3mOK-96D0UF4AaABAg.9ADUxUCTQ6n9AMrJQG6Kxu,oHHUHSDq2hQ,Телеканал Дождь,0,0,Gelena N,@MultiMatola дебИт,2020-06-26T11:09:41Z,1
454,Ugxozk2M3mOK-96D0UF4AaABAg.9ADUxUCTQ6n9AMqyswVOC0,oHHUHSDq2hQ,Телеканал Дождь,0,0,MultiMatola,"Ходили  в  театр??!!!!
Пишется  ДЕБИТ",2020-06-26T11:06:45Z,1
455,Ugxozk2M3mOK-96D0UF4AaABAg.9ADUxUCTQ6n9AKF08qd7KE,oHHUHSDq2hQ,Телеканал Дождь,0,0,Николай Банник,"О, брат. Тогда следственный комитет и суды только будут пахать по театральной коррупции и воровству.",2020-06-25T10:47:48Z,1
456,Ugxozk2M3mOK-96D0UF4AaABAg.9ADUxUCTQ6n9AETae85Hen,oHHUHSDq2hQ,Телеканал Дождь,0,2,Наталья Львовна,И госкорпораций,2020-06-23T04:59:48Z,1
457,UgwygzxayQgOgCbEsct4AaABAg.9ADUZQkgVr_9AMbnBfPALF,oHHUHSDq2hQ,Телеканал Дождь,0,1,Malloriak,@Фил Роот ржу с нашей либерды: посадили вора Серебрянникова - суд не прав. Навальный сказал- ой то-то вор. Хомячки сразу : да-дада Потани н/Путин вор!,2020-06-26T08:54:05Z,1
458,UgwygzxayQgOgCbEsct4AaABAg.9ADUZQkgVr_9AFDm_rUjm4,oHHUHSDq2hQ,Телеканал Дождь,0,1,Vladimir Hromov,"@Богатый Бездельник ну а вот на того кирюху нужны пруфы, что ворует",2020-06-23T12:00:52Z,1
459,UgwygzxayQgOgCbEsct4AaABAg.9ADUZQkgVr_9AEaYIVs2QX,oHHUHSDq2hQ,Телеканал Дождь,0,5,Фил Роот,Vladimir Hromov а что доказали? Наш самый справедливый суд в мире что-то смог доказать? Или как с делом Сети? Может и их тоже за дело посадили?,2020-06-23T06:09:15Z,1
460,UgwygzxayQgOgCbEsct4AaABAg.9ADUZQkgVr_9AEXs4xaR6k,oHHUHSDq2hQ,Телеканал Дождь,0,5,Богатый Бездельник,"@Vladimir Hromov кирюхе не только можно воровать но и нужно.
особенно если  у него фамилия гуньдяев.",2020-06-23T05:37:08Z,1
461,UgwygzxayQgOgCbEsct4AaABAg.9ADUZQkgVr_9AEV_gg9gz8,oHHUHSDq2hQ,Телеканал Дождь,0,2,Vladimir Hromov,"Георгий Жуков так дело ещё идёт. Кирюха попался не вчера, а все никак не сядет.",2020-06-23T05:17:09Z,1
462,UgwygzxayQgOgCbEsct4AaABAg.9ADUZQkgVr_9AESF0MW0MP,oHHUHSDq2hQ,Телеканал Дождь,0,5,Георгий Жуков,"Vladimir Hromov   Всем можно, но если попался суд должен быть! :))))",2020-06-23T04:47:59Z,1
463,UgwygzxayQgOgCbEsct4AaABAg.9ADUZQkgVr_9AERP3gxXlL,oHHUHSDq2hQ,Телеканал Дождь,0,4,Vladimir Hromov,Георгий Жуков а Кирюхе воровать значит можно?))),2020-06-23T04:40:37Z,1
464,Ugwtnc9BGt8yWgZ5Om94AaABAg.9ADRbJK4opZ9ARqXCg8x3y,oHHUHSDq2hQ,Телеканал Дождь,0,0,Николай Банник,@Vladimir Hromov Исправьте: ОБНАЛИЧИВАЛИ... По сути же вы абсолютно правы.,2020-06-28T09:39:02Z,1
465,Ugwtnc9BGt8yWgZ5Om94AaABAg.9ADRbJK4opZ9AFS9ERo2bU,oHHUHSDq2hQ,Телеканал Дождь,0,2,Daniil Grinshpun,"@Vladimir Hromov конечно не воруешь, у тебя все время уходит на то, чтобы ответить на каждый коммент под видео, самый натуральный диванный эксперт с кучей времени и наивный дурачок, который думает, что ему в открытый доступ всю инфу выложат в России.",2020-06-23T14:06:25Z,1
466,Ugwtnc9BGt8yWgZ5Om94AaABAg.9ADRbJK4opZ9AEX5fVyMkJ,oHHUHSDq2hQ,Телеканал Дождь,0,2,Vladimir Hromov,Вячеслав Калякин я не ворую бюджетные деньги. А вы из обезнальной конторы? Что так печётесь?,2020-06-23T05:30:23Z,1
467,Ugwtnc9BGt8yWgZ5Om94AaABAg.9ADRbJK4opZ9AEWrjizGsr,oHHUHSDq2hQ,Телеканал Дождь,0,1,Вячеслав Калякин,"Vladimir Hromov я смотрю Вы тролль ? откуда злорадство, думаете Вас подобное не коснется ?",2020-06-23T05:28:21Z,1
468,Ugwtnc9BGt8yWgZ5Om94AaABAg.9ADRbJK4opZ9AESccwxlgJ,oHHUHSDq2hQ,Телеканал Дождь,0,0,GHJFU,"@Vladimir Hromov зато ты хорошо ознакомился. А то что там написано..... Мы знаем...  Как и дело Ивана Голунова. Так что там написано, не всегда описывается объективно да ещё и нынешней прислугой власти!!!!",2020-06-23T04:51:20Z,1
469,Ugwtnc9BGt8yWgZ5Om94AaABAg.9ADRbJK4opZ9AERIVH5JVn,oHHUHSDq2hQ,Телеканал Дождь,0,2,Vladimir Hromov,"GHJFU дурилка, дело в открытом доступе. Позиция и доказательства прокуратуры всем досиупна. У тебя мозгов не хватило ознакомиться с позицией обвинения, но ты мычишь о том что Кирюха не виновен? В Китае за такое преступление Кирюху бы к вышке приговорили. В штатах бюджетные деньги на таких дурачков не выделяют, но даже при растратах в коммерческом секторе его бы лет на 15 посадили бы. Там эта шайка деньги бюджетные списывала якобы за оказанные услуги на обнальные конторы и нал забирали. И как тратили этот нал никто не знает. Это преступление в любой стране мира. Так о чем ты, дурилка?",2020-06-23T04:39:43Z,1
470,Ugwtnc9BGt8yWgZ5Om94AaABAg.9ADRbJK4opZ9AEP1q5J_vT,oHHUHSDq2hQ,Телеканал Дождь,0,1,GHJFU,@Vladimir Hromov ты почитай.... Прям так и дали почитать дело всему миру. Эта власть и её прислуга заточены только на репрессии и еще  больше репрессий. Так что отдыхай бот.,2020-06-23T04:19:58Z,1
471,Ugwtnc9BGt8yWgZ5Om94AaABAg.9ADRbJK4opZ9ADpJKksdr-,oHHUHSDq2hQ,Телеканал Дождь,0,3,Vladimir Hromov,"@Benjamin Batton какой-то ты злой. )) Если Кирилл не хотел воровать, то зачем он на бюджет сел?))) Именно чтобы воровать! Я вот не ворую, я с бюджетом никак не связан. А Кирилл воровал. Ты материалы дела почитай, там же все ясно. Показания есть как обезналивали деньги. А Кирюха кричит что он типа не при делах))) Это как драг диллера поймают и он тоже говорит что не его пакет)))",2020-06-22T22:59:02Z,1
472,Ugwtnc9BGt8yWgZ5Om94AaABAg.9ADRbJK4opZ9ADo1vCjSRT,oHHUHSDq2hQ,Телеканал Дождь,0,6,Benjamin Batton,"@Vladimir Hromov никто не хочет воровать так, как ворует вороватая власть моля ботоксовой",2020-06-22T22:47:55Z,1
473,Ugwtnc9BGt8yWgZ5Om94AaABAg.9ADRbJK4opZ9ADn0q_DTvk,oHHUHSDq2hQ,Телеканал Дождь,0,1,Vladimir Hromov,тоже воровать хочешь?),2020-06-22T22:39:02Z,1
474,UgwqPQKHGS4kXlTtIJh4AaABAg.9ADR0ffodyu9AKqerCQy4k,oHHUHSDq2hQ,Телеканал Дождь,0,0,маша иванова,"@Vladimir Hromov это Вы, товарищ майор? Не сразу узнала.",2020-06-25T16:25:32Z,1
475,UgwqPQKHGS4kXlTtIJh4AaABAg.9ADR0ffodyu9AKZED3oe9j,oHHUHSDq2hQ,Телеканал Дождь,0,1,Vladimir Hromov,"@маша иванова кирюха это жулик и вор и он должен сесть. если ты знаешь о других фактах воровства, пиши заявление в полицию, и ставь нас в известность что по этим делам происходит. Ты Кирюхе скажи чтобы он своих падельников в  минкульте выдал, понятное дело что он не один воровал, у них там опг своё. пусть мужиком будет",2020-06-25T13:44:29Z,1
476,UgwqPQKHGS4kXlTtIJh4AaABAg.9ADR0ffodyu9AKZ46jUX-V,oHHUHSDq2hQ,Телеканал Дождь,0,1,Vladimir Hromov,"@маша иванова т как только видишь человека с иным мнением ты называешь его ботом. Ответь на простой вопрос, почему этот жилик и вор не ставил коммерческие постановки, как это делают его коллеги во всем мире? Почему он способен только воровать? И я против чтобы деньги из бюджета тратились на всякое фигню безкультурную. В штатах бюджет не тратиться на подобной и в швейцарии и в англии. А в России есть жулье, типа кирюши, к сожалению",2020-06-25T13:43:06Z,1
477,UgwqPQKHGS4kXlTtIJh4AaABAg.9ADR0ffodyu9AKSPVi1UpX,oHHUHSDq2hQ,Телеканал Дождь,0,0,маша иванова,"@Vladimir Hromov Ну думайте как хотите, Вы же не тот человек, которого можно в чем-то убедить. Скорее всего Вы просто бот. Лучше бы обратили свою энергию на производство фильмов. Тратятся миллионы долларов неизвестно на что. И не одного суда.",2020-06-25T12:44:51Z,1
478,UgwqPQKHGS4kXlTtIJh4AaABAg.9ADR0ffodyu9AKPJil5MUz,oHHUHSDq2hQ,Телеканал Дождь,0,0,Vladimir Hromov,"маша иванова ты дело почитай. Вина доказана и только потому что на судей оказывается давление, он никак решение не примет",2020-06-25T12:17:51Z,1
479,UgwqPQKHGS4kXlTtIJh4AaABAg.9ADR0ffodyu9AKPB3caV_Q,oHHUHSDq2hQ,Телеканал Дождь,0,1,Vladimir Hromov,"Melancholy причём тут все? Если этот клоун успешный пусть ставит коммерческие постановки, как это делается во всем мире.  А этот бездарь просто развлекался за счёт народа.",2020-06-25T12:16:40Z,1
480,UgwqPQKHGS4kXlTtIJh4AaABAg.9ADR0ffodyu9AKKEYiU8aN,oHHUHSDq2hQ,Телеканал Дождь,0,0,Melancholy,"@Vladimir Hromov а на чьи деньги по вашему ставят эти коммерчески успешные спектакли? У нас все театры ставят на деньги государства..
 Что вы несёте",2020-06-25T11:33:27Z,1
481,UgwqPQKHGS4kXlTtIJh4AaABAg.9ADR0ffodyu9AFuvipCk2i,oHHUHSDq2hQ,Телеканал Дождь,0,0,маша иванова,@Vladimir Hromov зачем Вы врете?,2020-06-23T18:26:35Z,1
482,UgwqPQKHGS4kXlTtIJh4AaABAg.9ADR0ffodyu9AFj0d3m-n9,oHHUHSDq2hQ,Телеканал Дождь,0,1,Vladimir Hromov,"@маша иванова он воровал)) именно воровал. клоуну дали деньги на постановку спектаклей, а он их похитил, путем обналичивания. Он шут гороховый, режиссеры мирового уровня ставят коммерчески успешные спектакли, они не клянчат деньги у государства. А это уродец, который откатывал деньги в мин. культ, потом посрался с чиновниками и его теперь сажают. Почему этот уродец не ставил спектакли на коммерческой основе? потому что его никто не смотрит, он убыточный",2020-06-23T16:42:32Z,1
483,UgwqPQKHGS4kXlTtIJh4AaABAg.9ADR0ffodyu9AFFH28VORy,oHHUHSDq2hQ,Телеканал Дождь,0,0,маша иванова,"@Vladimir Hromov его государство наняло на работу. Доказывать ничего не надо. Ибо были поставлены спектакли. Последняя из экспертиз доказала, что деньги были израсходованы экономно. И Серебренников не клоун. Он режисер мирового уровня. Он прославляет нашу страну.",2020-06-23T12:13:54Z,1
484,UgwqPQKHGS4kXlTtIJh4AaABAg.9ADR0ffodyu9AFEEwMV_A6,oHHUHSDq2hQ,Телеканал Дождь,0,1,Vladimir Hromov,"@маша иванова следствие доказало факт обналичивания денег. а как ты докажешь что деньги эти не были украдены?) это же нал, кто знает куда его эти жулики распихали. Почему этот клоун на свои деньги спектакли не ставил? Почему он воровал наши с вами бюджетные деньги?",2020-06-23T12:04:52Z,1
485,UgwqPQKHGS4kXlTtIJh4AaABAg.9ADR0ffodyu9AErRP0ZJCZ,oHHUHSDq2hQ,Телеканал Дождь,0,1,маша иванова,"@Vladimir Hromov он не воровал. Обналичить и украсть это разные вещи. Деньги были потрачены на то , на что они были предназначены.",2020-06-23T08:36:51Z,1
486,UgwqPQKHGS4kXlTtIJh4AaABAg.9ADR0ffodyu9ADnFWXJ3VZ,oHHUHSDq2hQ,Телеканал Дождь,0,1,Vladimir Hromov,так пусть клоун ставит на свои деньги. Зачем воровал из бюджета?,2020-06-22T22:41:02Z,1
487,UgzfCq0cfnAEVgER-Pd4AaABAg.9ADQ75qZqfb9ANFoQf7fK5,oHHUHSDq2hQ,Телеканал Дождь,0,0,Семён Горбунков,@Елена Захарова так вон Ефремов не просыхает. и чего хорошего? каждый день в драбадан.,2020-06-26T14:52:31Z,1
488,UgzfCq0cfnAEVgER-Pd4AaABAg.9ADQ75qZqfb9AMBEI3_rFv,oHHUHSDq2hQ,Телеканал Дождь,0,0,Елена Захарова,"@Семён Горбунков Да лучше бы он не просыхал,подлец...",2020-06-26T04:53:15Z,1
489,UgzfCq0cfnAEVgER-Pd4AaABAg.9ADQ75qZqfb9AKieI5Is32,oHHUHSDq2hQ,Телеканал Дождь,0,0,Семён Горбунков,Безруков трезвый за рулем ездит. не то что алкашня позорная. харю зальют и давай таранить всех подряд. ну нахер,2020-06-25T15:15:33Z,1
490,UgzfCq0cfnAEVgER-Pd4AaABAg.9ADQ75qZqfb9AHcTfoJc_H,oHHUHSDq2hQ,Телеканал Дождь,0,0,Lubova Strezneva,Пока наслаждаемся пародиями на него.,2020-06-24T10:23:49Z,1
491,UgzfCq0cfnAEVgER-Pd4AaABAg.9ADQ75qZqfb9AEXyxQ01Wh,oHHUHSDq2hQ,Телеканал Дождь,0,3,миру мир добро победит зло,Джигарханяна тоже надо проверить,2020-06-23T05:38:04Z,1
492,UgzfCq0cfnAEVgER-Pd4AaABAg.9ADQ75qZqfb9AD_TCtfI5g,oHHUHSDq2hQ,Телеканал Дождь,0,11,Tina Bo,"Никогда, для этого Безруков регулярно вылизывает власть",2020-06-22T20:40:35Z,1
493,Ugx-zeRwYk56oWcEqxl4AaABAg.9ADQ0ih64L29AHrTawSl1I,oHHUHSDq2hQ,Телеканал Дождь,0,0,Семён Горбунков,ну а че. красиво грузины территории просрали. лепота))))),2020-06-24T12:34:53Z,1
494,Ugx-zeRwYk56oWcEqxl4AaABAg.9ADQ0ih64L29AFPjfjRMrB,oHHUHSDq2hQ,Телеканал Дождь,0,0,Галина Александровна,"@Бог - рюского мира , а у кого-то голова лишняя?",2020-06-23T13:45:19Z,1
