,id,videoId,authorVideoName,totalReplyCount,likeCount,authorDisplayName,textDisplay,publishedAt,isReply
92,UgyPyOjSPMD8JKk3BxB4AaABAg,rroUrlGfY40,Телеканал Дождь,0,2,Elena Starikovsky,Министр культуры начала писать своё CV ...,2020-05-31T11:49:11Z,0
93,UgzvaGOelO_CbNCZPLd4AaABAg,rroUrlGfY40,Телеканал Дождь,0,2,Elena Starikovsky,Неужели нет других земель в стране?...,2020-05-31T11:47:43Z,0
94,UgynAVECsEgFMQ_TEMR4AaABAg,rroUrlGfY40,Телеканал Дождь,0,6,Анна П,"Как страшно и жалко! Как плешивая моль ещё живёт и в зеркало смотрится, наплодил уродов!",2020-05-31T11:46:47Z,0
95,UgzFDHkjJ3eD6Qi2O5d4AaABAg,rroUrlGfY40,Телеканал Дождь,0,6,сергей барычев,"Это поколение чиновников действительно самое подлое за всю историю россии,то на что решаются они не решились многие до них, когда мы наконец отбросим свои страхи и начнем действовать.",2020-05-31T11:45:19Z,0
96,Ugwn19OS_7XUsKntm-h4AaABAg,rroUrlGfY40,Телеканал Дождь,0,6,Анна П,"Путина посадим в тюрьму, ВСЁ ВЕРНЁМ ЛЮДЯМ!",2020-05-31T11:42:24Z,0
97,UgznrVElQfC2ncT9o2V4AaABAg,rroUrlGfY40,Телеканал Дождь,0,8,Анна П,И всё это правление путина! Позорище!,2020-05-31T11:39:50Z,0
98,UgzmOVGcAG6kgq8XOxZ4AaABAg,rroUrlGfY40,Телеканал Дождь,0,5,Shikaevna,"Ребята, вы просто потрясающие!🙏❤️",2020-05-31T11:29:20Z,0
99,Ugx3xIJC-GYFHUyTP6F4AaABAg,rroUrlGfY40,Телеканал Дождь,0,1,Бесплатная Консультация!,"*В Арабских Эмиратах можно УДАЛЕННО учредить фирму (без посещения Арабских Эмиратов).*

Дистанционное создание компании возможно в некоторых свободных зонах, в том числе и в Дубае.

Однако, в некоторых свободных зонах учредить компанию можно только при личном визите.

В других эмиратах компанию можно создать в два-три раза дешевле чем в Дубае.

Все документы таких компаний всегда составляются на английском языке.

Всего в Эмиратах создано уже больше 40 свободных экономических зон.

Компании, созданные в свободных экономических зонах, называются «компаниями свободных зон».

Фирмы, открытые в ОАЭ за пределами свободных зон, называются «местными компаниями».

В некоторых свободных зонах можно создать и оффшорную компанию. Однако, оффшорная компания не может вести бизнес на территории Арабских Эмиратов.

По документам компании свободных зон имеют полноценный адрес, несмотря на то, что можно арендовать совмещаемое рабочее место (использовать его разрешено всего несколько часов в месяц, однако, этими рабочими местами, как правило, никто и не пользуется).

В Арабских Эмиратах ОТСУТСТВУЕТ НАЛОГООБЛОЖЕНИЕ, исключением является только НДС - всего 5 процентов, но при международной торговле его оплачивать не надо. Нет налогов на корпоративные доходы, нет ограничений на вывод капитала и прибыли в другие страны, нет налогов на зарплату, нет налогов на доходы физических лиц, отсутствуют валютные ограничения, отсутствуют налоги на недвижимость, отсутствуют налоги на дивиденды.

И важно еще и то, что если у вас фирма в свободной экономической зоне, то Вам не придется платить таможенные пошлины при импортировании товаров в эту свободную зону и при экспортировании товаров из свободной зоны в другие страны.

То есть, например, если в какой-либо свободной зоне Эмиратов создать производство, то в ОАЭ не придется платить вообще никаких налогов – не нужно будет платить никаких налогов на прибыль, и не нужно будет платить таможенных пошлин.

Однако если Вы будете вывозить товар из свободной зоны внутрь Эмиратов, то тогда будет необходимо уплачивать таможенную пошлину 5 процентов.

Многие свободные экономические зоны имеют онлайн-порталы, посредством которых можно производить различные операции со своей компанией.

На такую компанию также можно оформлять товарные знаки, патенты и программы.

Важно также отметить, что привлекать в качестве акционера гражданина ОАЭ не потребуется – «компанией свободной зоны» Вы сможете владеть единолично.

Важно отметить, что компания, открытая в свободной зоне может вести бизнес только либо в свободной зоне, либо за границей Арабских Эмиратов. Внутри Эмиратов, но за пределами свободной зоны такая фирма не сможет вести деятельность.

Чтобы вести бизнес непосредственно внутри ОАЭ, но за пределами свободных экономических зон, необходимо открывать «местную компанию», а не «компанию свободной зоны».

Эмиратская компания сможет владеть любым имуществом в любой стране.

Кроме того, в Дубае можно составить завещание, которое будет исполняться в соответствии с английским общим правом.

Создание компании также предоставляет право учредителю и сотрудникам получить постоянные визы ОАЭ.

То есть Эмираты дают возможность получить визы просто за учреждение компании. В отличие от других юрисдикций, не требуется делать какие-либо инвестиции!

Эти визы выдаются на 3 года, и их можно продлевать неограниченное количество раз на следующий трехлетний срок.

Также долгосрочные визы можно сделать и для членов семей работников и владельцев.

Это значит, что имеется возможность сделать резидентские визы среди прочего для своих друзей, если оформить их как сотрудников.

При некоторых условиях можно сделать визу ОАЭ на пять лет или даже на десять.

Также в Эмиратах можно приобрести недвижимость. К примеру, покупая люксовую недвижимость (виллу либо апартаменты, либо таунхаус), обычно, с высококачественной отделкой, c элегантным дизайном и с панорамными окнами, у какого-нибудь крупного застройщика, как правило, предоставляется беспроцентный план рассрочки платежа. Строящиеся объекты обходятся дешевле.

Элитные апартаменты в Дубае площадью от 50 кв. м стоят примерно от 190,000 долларов. Для них, как правило, можно оформить БЕСПРОЦЕНТНУЮ рассрочку до пяти лет.

Иногда встречаются такие варианты – крупный застройщик в Дубае продает гостиничные номера в собственном отеле.

В таком номере владелец сможет жить только две недели в году, однако, за все остальное время Вам будет перечисляться 40% с прибыли от этого Вашего гостиничного номера.

При этом не требуется ничего платить за обслуживание и коммунальные услуги.

Также еще важно отметить, что если сдать квартиру в аренду в Дубае, можно получать в среднем 6 процентов, а в некоторых районах можно получать и до 8 – 10 процентов прибыли в год со стоимости квартиры.

То есть квартиру можно купить просто для извлечения прибыли от аренды.

Причем, если квартира стоит больше 270 тысяч долларов, то владелец также может оформить визу Эмиратов без необходимости открывать какую-либо компанию (но это при том условии, что квартира уже в Вашей собственности, а не в рассрочке).

Все вопросы в Дубае можно решить на английском языке. Арабский язык специально учить не потребуется.

*Если Вы хотите узнать все подробности, как все сделать, несмотря на COVID-19, в каких ситуациях нужно выбирать другую юрисдикцию, сроки, возможные ошибки, процедуры, плюсы и минусы, цены, обращайтесь на почту!*",2020-05-31T11:18:04Z,0
100,UgxFet1xPhGEFioW3aB4AaABAg,rroUrlGfY40,Телеканал Дождь,0,4,Иван Васкевич,"А что по этому поводу сказал бы Тайлер Дёртон? 
Нам нужно мыло- чтоб очистить мир.",2020-05-31T11:17:31Z,0
101,UgzkOoihKvwiBl98A6d4AaABAg,rroUrlGfY40,Телеканал Дождь,0,2,Сергей Ю,"Продали они все и себя. А вы живите, последний доедайте без соли...",2020-05-31T11:17:11Z,0
102,UgyK-S8kCMt4M0yu8n94AaABAg,rroUrlGfY40,Телеканал Дождь,0,8,Света Иванова,Какое свинство,2020-05-31T11:15:25Z,0
103,Ugwf-TXA5XB5wom-K5V4AaABAg,rroUrlGfY40,Телеканал Дождь,0,0,Аюб Ибрагимов,"Авторские прaва на инструмент Росреестра у USA. (ЭВМ)
Подведомство - министерство-максимал-эконом развития в РФ ( Силуанов ).",2020-05-31T11:09:04Z,0
104,UgxFyGonQjHQgkZ2qzB4AaABAg,rroUrlGfY40,Телеканал Дождь,0,12,Anastasia Dorozhkina,Совсем из ума выжили?!,2020-05-31T11:09:02Z,0
105,UgzwuvOg62xpMiDEloV4AaABAg,rroUrlGfY40,Телеканал Дождь,1,33,ciserf,"Народ, молчит- его и дальше будут нагибать: и новые реновации, и новые налоги, и новые законы с Конституцией, только без прав гражданину.",2020-05-31T11:03:49Z,0
106,UgzwuvOg62xpMiDEloV4AaABAg.99JtydoAODI99PlWlZ9yKg,rroUrlGfY40,Телеканал Дождь,0,1,Светлана lana,"Народ не молчит, но карательные меры все более и более совершенствуются",2020-06-02T17:45:25Z,1
107,UgyWWRcSKkR0VJRGPdZ4AaABAg,rroUrlGfY40,Телеканал Дождь,0,2,Ju Vergen,"Ну эта одноклеточная с позволения сказать министерШа с подачи Михалкова  теперь будет за взятки раздавать Финансы и Архангельское.   Идиотизм расцветает.  
Долой Ольгу Любимову !!!! Призвать к порядку Никиту Михалкова !! Страна Дураков и алчных Недоучек",2020-05-31T10:59:57Z,0
108,UgzcNYrQJy8mIs_8OQt4AaABAg,rroUrlGfY40,Телеканал Дождь,0,1,Андрей А.,"Ну вот я в замешательстве, с одной стороны эти культурные объекты - просто зарастающий пустырь, с какими-то руинами и мусором, а с другой вроде как историческая ценность.. Не знаю.",2020-05-31T10:58:01Z,0
109,UgzDfpCtcGfOiMtFp414AaABAg,rroUrlGfY40,Телеканал Дождь,0,7,Роман Творческий,"Ничего святого у этих людей, не понимают что их время не вечно. За содеянное придется родственникам отвечать, которые их же и проклянут.",2020-05-31T10:57:19Z,0
110,UgxdWAcs4FegXzecPu54AaABAg,rroUrlGfY40,Телеканал Дождь,0,8,Жанна жанна,"У российских граждан безжалостно отбирают прошлое, получается и будущее. Как жить дальше в России, страшно очень, не за себя за детей",2020-05-31T10:52:24Z,0
111,UgzJyEMe5pGM2FkDKaR4AaABAg,rroUrlGfY40,Телеканал Дождь,0,2,Александр Алехнович,Кто бы сомневался,2020-05-31T10:52:17Z,0
112,UgzRBAU1xwZESFjHhBJ4AaABAg,rroUrlGfY40,Телеканал Дождь,0,0,Марина Сутырина,"А кто спросит то? Вы глаза то немного откройте,посмотрите сколько детей у вас в вашем дворе...",2020-05-31T10:51:39Z,0
113,UgwSZXdP6GXkAF-IelV4AaABAg,rroUrlGfY40,Телеканал Дождь,1,59,Pavel,"чинушам не нужен лес и природа , ведь они ездят в испанию и т.д",2020-05-31T10:48:31Z,0
114,UgwSZXdP6GXkAF-IelV4AaABAg.99JsDbPXDFV99L1f205LwP,rroUrlGfY40,Телеканал Дождь,0,1,Надежда Nadi,Сказать Нет проекту - http://helparh.ru/,2020-05-31T21:39:01Z,1
115,UgyH9bg3MaUacnASnL14AaABAg,rroUrlGfY40,Телеканал Дождь,0,0,Вера Владимирская,"Элсети,судоремзавод.. Минобороны Севастополь КРЫМ! СТРАТЕГИЧЕСКИЕ ОБЪЕКТЫ! мало дерипаски? включ в план прихватизации http://www.consultant.ru/document/cons_doc_LAW_342515/4fca1b5dc81568219fd0af71f86f111547e87369/",2020-05-31T10:48:00Z,0
116,UgzNtnnrSLvAuX4FQWd4AaABAg,rroUrlGfY40,Телеканал Дождь,0,6,Марина Сутырина,Построит себе кто то особнячок..обнесет забором метров 10 в высоту...А все остальное то останется..очередная особь отмывает деньги.,2020-05-31T10:47:40Z,0
117,Ugyx9tBHnkiIn_dYY2J4AaABAg,rroUrlGfY40,Телеканал Дождь,2,13,Михаил Дюмин,В мин культуры специально дураков берут,2020-05-31T10:47:39Z,0
118,Ugyx9tBHnkiIn_dYY2J4AaABAg.99Js7F75Jwn99MUc-yK7y9,rroUrlGfY40,Телеканал Дождь,0,1,Гетафакаут всем,Михаил Дюмин а в остальных сплошь интеллектуалы?,2020-06-01T11:11:15Z,1
119,Ugyx9tBHnkiIn_dYY2J4AaABAg.99Js7F75Jwn99L25qbPuor,rroUrlGfY40,Телеканал Дождь,0,0,Надежда Nadi,Сказать Нет проекту - http://helparh.ru/ 🙏,2020-05-31T21:42:49Z,1
120,Ugx2MbCGbksantK82814AaABAg,rroUrlGfY40,Телеканал Дождь,2,32,Оксана Горностаева,"Друзья, надо бороться за Архангельское!!!",2020-05-31T10:47:33Z,0
121,Ugx2MbCGbksantK82814AaABAg.99Js6RgzWLP99zCZtw6Dkz,rroUrlGfY40,Телеканал Дождь,0,2,Оксана Горностаева,"Надежда Nadi Я написала Президенту три раза, они перенаправляют Московской области, Минкульту, который сам же и продал эту землю. Но нужно, чтобы много людей писали, создать инициативу😢
Канал mortongradunet рассказывает о происходящем!",2020-06-16T21:23:10Z,1
122,Ugx2MbCGbksantK82814AaABAg.99Js6RgzWLP99L1zjmpKHs,rroUrlGfY40,Телеканал Дождь,0,3,Надежда Nadi,Сказать Нет проекту - http://helparh.ru/ 🙏,2020-05-31T21:41:51Z,1
123,UgxvgNBD-07kmKQaaCh4AaABAg,rroUrlGfY40,Телеканал Дождь,0,13,Оксана Горностаева,Они офигели???,2020-05-31T10:46:40Z,0
124,UgzFYDgzJZUmhPw5oRV4AaABAg,rroUrlGfY40,Телеканал Дождь,0,0,SH AMIL',ОПЯТЬ МИГРАНТЫ ВИНОВАТЫ ВО ВСЁМ КАК ДУМАЮТ НЕКОТОРЫЕ,2020-05-31T10:45:31Z,0
125,UgxGPIzbqYTihHP0y854AaABAg,rroUrlGfY40,Телеканал Дождь,0,1,I_love_Corgi,"Уроды!!!! Всех к стенке!!! Сил нет больше все это терпеть!!! И так хапают ртом и жопой, за историю взялись теперь!!!",2020-05-31T10:45:27Z,0
126,UgxqHVxZ_4UU41mRv_R4AaABAg,rroUrlGfY40,Телеканал Дождь,0,0,Вера Владимирская,"Орловских рысаков и др., конезаводчиков...в прихватизацию http://www.consultant.ru/document/cons_doc_LAW_342515/5c5c0fec7b9e86d56be2a72b623a50dbe8af4de4/",2020-05-31T10:45:15Z,0
127,UgyNz6-cGuWEvWndsyJ4AaABAg,rroUrlGfY40,Телеканал Дождь,0,10,Niedźwiedź Biały,на фоне играет музыка современного российского композитора Ильи Бешевли. Узнал ночной лес (Night forest). Приятно было его услышать)),2020-05-31T10:44:38Z,0
128,UgzLLXLoKEMz2rP-Z-h4AaABAg,rroUrlGfY40,Телеканал Дождь,0,8,Valeriy R,Едросовская власть уничтожает природу России! Воробьёв гнида!,2020-05-31T10:44:29Z,0
129,UgxGwWWTdqR_lxxvfRd4AaABAg,rroUrlGfY40,Телеканал Дождь,0,29,Игорь Старченко,"Всё Продали, Спасибо Партии Жуликов и Воров под Названием Едим Россию.",2020-05-31T10:43:18Z,0
130,UgylLNrWI7NlaM_Qcrp4AaABAg,rroUrlGfY40,Телеканал Дождь,0,0,Вера Владимирская,Фирма МЕЛОДИЯ отдают в прихватизацию http://www.consultant.ru/document/cons_doc_LAW_342515/f684427c2cd17e0ff7c8846f3b3522597a681cd8/,2020-05-31T10:43:04Z,0
131,Ugy_pHhTJAUJGTEHX594AaABAg,rroUrlGfY40,Телеканал Дождь,0,8,FupFox,Страшно,2020-05-31T10:42:28Z,0
132,UgyZScLL5LEWFH0hS0N4AaABAg,rroUrlGfY40,Телеканал Дождь,0,24,Понял Понял,все уничтожить и продать. слоган партии ЕдРо,2020-05-31T10:40:39Z,0
133,UgzD_rz8d-qCCwLgF9h4AaABAg,rroUrlGfY40,Телеканал Дождь,0,1,Вера Владимирская,"Киностудия СОЮЗМУЛЬТФИЛЬМ,  Фирма МЕЛОДИЯ, народное ДОСТОЯНИЕ в плане прихватизации http://www.consultant.ru/document/cons_doc_LAW_342515/59b3337d5879a17e69a441fb7c32b3dcefa9cc7c/",2020-05-31T10:39:47Z,0
134,UgyHTROwncGwa_eEk1R4AaABAg,rroUrlGfY40,Телеканал Дождь,0,1,Вера Владимирская,Росгосэкспертиза в области архитектурн. памятников культуры Москва  в плане прихватизации .....http://www.consultant.ru/document/cons_doc_LAW_342515/3ed100af8fcbb4c88d87491ca8dcdc20a686951d/,2020-05-31T10:37:53Z,0
135,UgzqRPSNG1l_k4WaCGd4AaABAg,rroUrlGfY40,Телеканал Дождь,0,11,Вера Владимирская,О боже... вахтовиков в отставку...,2020-05-31T10:35:59Z,0
136,UgyPHs_XHhScGepI7ox4AaABAg,rroUrlGfY40,Телеканал Дождь,1,23,Svetlana Schwabauer,И короновирус их гадов не берет,2020-05-31T10:34:47Z,0
137,UgyPHs_XHhScGepI7ox4AaABAg.99Jqdwf1Xn-99L1xtsuIIG,rroUrlGfY40,Телеканал Дождь,0,1,Надежда Nadi,Сказать Нет проекту - http://helparh.ru/ 🙏,2020-05-31T21:41:36Z,1
138,UgyxL4734u5g9GFwQc94AaABAg,rroUrlGfY40,Телеканал Дождь,0,11,Оксана Петрова,Беспредел,2020-05-31T10:34:33Z,0
139,UgxuJFjXW66GaihIyt54AaABAg,rroUrlGfY40,Телеканал Дождь,6,40,Sergey Arsyutin,"Надо требовать отставки Министра культуры и Премьер Министра , готовы всё продать и застроить...;((😡👎",2020-05-31T10:33:53Z,0
140,UgzWfX7xPufnMAQ-ZUN4AaABAg,rroUrlGfY40,Телеканал Дождь,0,14,QAZ MLP,а нахера банановой республике память?,2020-05-31T10:33:02Z,0
141,Ugx1tPS7fXDcdonsmIB4AaABAg,rroUrlGfY40,Телеканал Дождь,0,22,Всегда тут,Отдельная цивилизация..,2020-05-31T10:32:50Z,0
142,Ugz1NGzrfqCLKaaTINl4AaABAg,rroUrlGfY40,Телеканал Дождь,0,0,tayrus,Пара слов для статистики ублюдочного утюба,2020-05-31T10:32:21Z,0
143,Ugyundd2J6IclSmaPld4AaABAg,rroUrlGfY40,Телеканал Дождь,1,17,Sergey Arsyutin,Ну это просто варварство какое-то ;((☝️⛔️🖐,2020-05-31T10:31:04Z,0
144,Ugyundd2J6IclSmaPld4AaABAg.99JqDhx3Cnb99L26nImOxp,rroUrlGfY40,Телеканал Дождь,0,1,Надежда Nadi,Сказать Нет проекту - http://helparh.ru/ 🙏,2020-05-31T21:42:57Z,1
145,UgyuE0TxIF98UAokodR4AaABAg,rroUrlGfY40,Телеканал Дождь,0,9,Larisa Kruglyakova,Можно уже ничему удивляться.!!!,2020-05-31T10:27:54Z,0
146,Ugz4PJkygTPOnpqJfqB4AaABAg,rroUrlGfY40,Телеканал Дождь,2,46,T-Rex,А минкультуры это кто? Одни хряки беспринципные.,2020-05-31T10:26:51Z,0
147,Ugz4PJkygTPOnpqJfqB4AaABAg.99JpjojxFC499M0MUM3pjo,rroUrlGfY40,Телеканал Дождь,0,4,Jaufmann Irina,"минкультуры это протеже и крестница михалкова, он её на этот пост пропихнул, и о чудо на следующий месяц получил 3 млрд рублей, не понятно на что правда.",2020-06-01T06:46:51Z,1
148,Ugz4PJkygTPOnpqJfqB4AaABAg.99JpjojxFC499L1fos7hlu,rroUrlGfY40,Телеканал Дождь,0,2,Надежда Nadi,Сказать Нет проекту - http://helparh.ru/,2020-05-31T21:39:08Z,1
149,UgxSu4lU0wZLimBR18t4AaABAg,rroUrlGfY40,Телеканал Дождь,0,0,Николай Чирятьев,Уроды уродуют страну,2020-05-31T10:25:05Z,0
150,UgytK5sXGes0nNDJ-354AaABAg,rroUrlGfY40,Телеканал Дождь,2,5,Константин Родионов,Какие усадьбы всех снести. Стонут они валите в сша,2020-05-31T10:24:28Z,0
151,UgytK5sXGes0nNDJ-354AaABAg.99JpTQMALSY99Jqn4CWspM,rroUrlGfY40,Телеканал Дождь,0,0,Константин Родионов,@Антон Гнатюк каждый сам решит где и что поставить.,2020-05-31T10:36:01Z,1
152,UgytK5sXGes0nNDJ-354AaABAg.99JpTQMALSY99JqN0uZKvz,rroUrlGfY40,Телеканал Дождь,0,2,Антон Гнатюк,"Чувак, поставь запятые. а то непонятно ничего",2020-05-31T10:32:20Z,1
153,UgyxaP4yze1rx_nTQL14AaABAg,rroUrlGfY40,Телеканал Дождь,0,18,Elena B,Ужас,2020-05-31T10:24:17Z,0
