,id,videoId,authorVideoName,totalReplyCount,likeCount,authorDisplayName,textDisplay,publishedAt,isReply
154,Ugz9tuRapLiDyQaR4wt4AaABAg,rroUrlGfY40,Телеканал Дождь,0,37,Евгений Протасов,чекисты кроме власти никогда ничего не любили,2020-05-31T10:24:05Z,0
155,UgxSKaUerCvsqkZGD2F4AaABAg,rroUrlGfY40,Телеканал Дождь,2,26,Лев Раскин,"Коммерциализация всего и вся началась ещё при Ельцине под лозунгом ""Обогащайтесь!"" Забыли добавить - кому Бог даст. Вот Бога уже и приватизировали. А вы всё удивляетесь.",2020-05-31T10:23:55Z,0
156,UgxSKaUerCvsqkZGD2F4AaABAg.99JpPOxRW4H99LuFNcReJU,rroUrlGfY40,Телеканал Дождь,0,1,Phibrizzo,"Это не коммерциализация, а захват территории шайкой, под свои элитные дачи.
Разные вещи.",2020-06-01T05:44:43Z,1
157,UgxSKaUerCvsqkZGD2F4AaABAg.99JpPOxRW4H99L1eAbPdlq,rroUrlGfY40,Телеканал Дождь,0,1,Надежда Nadi,Сказать Нет проекту - http://helparh.ru/,2020-05-31T21:38:54Z,1
158,UgyU2pXd0YFFDtQGk6F4AaABAg,rroUrlGfY40,Телеканал Дождь,0,0,Владимир Матвеев,"ГДЕ РЕФЕРЕНДУМ , НАХ,. МИНКУЛЬТУРУ, ИБАЛ Я ЭТУ МИНКУЛЬТУРУ!!!",2020-05-31T10:23:09Z,0
159,UgxC8clsMcdY5Bq80fh4AaABAg,rroUrlGfY40,Телеканал Дождь,2,71,Евгений Протасов,"так поступают только захватчики, а не созидатели любящие свое государство",2020-05-31T10:22:39Z,0
160,UgxC8clsMcdY5Bq80fh4AaABAg.99JpG8Rns9v99L1x1NPkw8,rroUrlGfY40,Телеканал Дождь,0,2,Надежда Nadi,@Ааа Ппп Сказать Нет проекту - http://helparh.ru/ 🙏,2020-05-31T21:41:29Z,1
161,UgxC8clsMcdY5Bq80fh4AaABAg.99JpG8Rns9v99JqZfzv8Zm,rroUrlGfY40,Телеканал Дождь,0,2,Ааа Ппп,Евгений Протасов    сдали страну полностью  предатели,2020-05-31T10:34:03Z,1
162,UgwO41VzsiMTigUWCFV4AaABAg,rroUrlGfY40,Телеканал Дождь,0,52,Мария Зорина,А кремль для застройки еще закрыт? Потомки печенегов и половцев ждут дня открытых дверей и приглашают всех патриотов голосовать за поправки.,2020-05-31T10:22:20Z,0
163,UgyODrtXjNmitVjjucl4AaABAg,rroUrlGfY40,Телеканал Дождь,4,29,Iwan,"Я только не понял, разве эти важные чиновники хотят, чтобы рядом с их поместьями были жилые микрорайоны а не природа? Где логика?",2020-05-31T10:21:43Z,0
164,UgyODrtXjNmitVjjucl4AaABAg.99Jp9IxRJVV99L21pjZH5D,rroUrlGfY40,Телеканал Дождь,0,1,Надежда Nadi,Сказать Нет проекту - http://helparh.ru/ 🙏,2020-05-31T21:42:16Z,1
165,UgyODrtXjNmitVjjucl4AaABAg.99Jp9IxRJVV99Kn4Q00UI0,rroUrlGfY40,Телеканал Дождь,0,0,Жанна Приморская,У них нет логики....,2020-05-31T19:22:49Z,1
166,UgyODrtXjNmitVjjucl4AaABAg.99Jp9IxRJVV99K-QW7pBTF,rroUrlGfY40,Телеканал Дождь,0,4,sv ya,Они покидают их. И продают . Уезжают жить за границу. Не зря говорят китай зд будет после вакцины,2020-05-31T12:00:11Z,1
167,UgyODrtXjNmitVjjucl4AaABAg.99Jp9IxRJVV99JpW0FdyFQ,rroUrlGfY40,Телеканал Дождь,0,6,Yash Bykhal,"Логика в $$$, природа не платежеспособна",2020-05-31T10:24:49Z,1
168,UgzxlYMafXOY3HemyIN4AaABAg,rroUrlGfY40,Телеканал Дождь,2,84,Виталий Резцов,"Защитим Архангельское защитим  свободу, защитим своих детей и внуков от антиародной власти",2020-05-31T10:21:18Z,0
169,UgzxlYMafXOY3HemyIN4AaABAg.99Jp6AhPFZV99M8zk3UX9X,rroUrlGfY40,Телеканал Дождь,0,3,Gleb I,@Надежда Nadi Сказать Нет проекту можно только массовым митингом. Остальное  бесполезно,2020-06-01T08:02:15Z,1
170,UgzxlYMafXOY3HemyIN4AaABAg.99Jp6AhPFZV99L1hh6ufy0,rroUrlGfY40,Телеканал Дождь,0,1,Надежда Nadi,Сказать Нет проекту - http://helparh.ru/,2020-05-31T21:39:23Z,1
171,UgxOmnIQ-36O6GgDnJZ4AaABAg,rroUrlGfY40,Телеканал Дождь,0,8,Shara,Пусть в Сибирь едут и гуляет сколько угодно,2020-05-31T10:19:21Z,0
172,UgyxQHMaeMUnTIwSa3R4AaABAg,rroUrlGfY40,Телеканал Дождь,26,77,Maxim Vogel,"Господи, за что все это???? Почему они так ненавидят культуру ???!!! Почему нельзя отреставрировать ! Просто отвратительно !",2020-05-31T10:19:11Z,0
173,UgyJL-Aws2m_kDFyGox4AaABAg,rroUrlGfY40,Телеканал Дождь,5,44,Дмитрий Ильченко,"Конечно, а зачем лобировать интересы бомжей , если можно лобировать интересы крупного бизнеса.",2020-05-31T10:18:18Z,0
174,UgyJL-Aws2m_kDFyGox4AaABAg.99JolEmI9eY99LbyuGhzQQ,rroUrlGfY40,Телеканал Дождь,0,0,Тина Кляйн,"Бомжи и за бутылку как надо проголосуют, даже если будут уже сидеть на предыдущей",2020-06-01T03:05:03Z,1
175,UgyJL-Aws2m_kDFyGox4AaABAg.99JolEmI9eY99L1vT2x37u,rroUrlGfY40,Телеканал Дождь,0,0,Надежда Nadi,Сказать Нет проекту - http://helparh.ru/ 🙏,2020-05-31T21:41:16Z,1
176,UgyJL-Aws2m_kDFyGox4AaABAg.99JolEmI9eY99KHtJQRBHw,rroUrlGfY40,Телеканал Дождь,0,0,Дмитрий Ильченко,@Оксана Горностаева для них это бомжи.,2020-05-31T14:41:33Z,1
177,UgyJL-Aws2m_kDFyGox4AaABAg.99JolEmI9eY99KCOwbBsQ-,rroUrlGfY40,Телеканал Дождь,0,1,Оксана Горностаева,"Почему бомжей, собственников жилья.",2020-05-31T13:53:34Z,1
178,UgyJL-Aws2m_kDFyGox4AaABAg.99JolEmI9eY99Jrwu0KKOm,rroUrlGfY40,Телеканал Дождь,0,1,trolo llooo,ТОЕСТЬ...СВОИ..,2020-05-31T10:46:06Z,1
179,UgwrQJMYRARmme9_hqx4AaABAg,rroUrlGfY40,Телеканал Дождь,6,60,Анатолий Белявский,Очередное безобразие власти. Снять министра.,2020-05-31T10:17:05Z,0
180,UgxyNlsNO0ASrQAJxVR4AaABAg,rroUrlGfY40,Телеканал Дождь,0,66,мих воздам,Все надо уничтожить  В карман набить.,2020-05-31T10:14:49Z,0
181,Ugw3JJ6EUcXldXyf97x4AaABAg,rroUrlGfY40,Телеканал Дождь,2,7,ЗАКОН МЕРФИ,"Просмотров нет,а лайков 10,как так? И комент первый от меня.",2020-05-31T10:13:57Z,0
182,Ugw3JJ6EUcXldXyf97x4AaABAg.99JoGQeSPfe99K8piOdYGz,rroUrlGfY40,Телеканал Дождь,0,1,Мадина Шахаева,"Потому что сначала лайк и дальше просмотр, я тоже часто так делаю.",2020-05-31T13:22:25Z,1
183,Ugw3JJ6EUcXldXyf97x4AaABAg.99JoGQeSPfe99JoTIPZa4k,rroUrlGfY40,Телеканал Дождь,0,4,Николай Соколов,просмотры обновляются не сразу,2020-05-31T10:15:43Z,1
184,UgxuJFjXW66GaihIyt54AaABAg.99JqYLG__KA99LQRHSzXPR,rroUrlGfY40,Телеканал Дождь,0,0,max master,Ну да.это же все изменит,2020-06-01T01:15:28Z,1
185,UgxuJFjXW66GaihIyt54AaABAg.99JqYLG__KA99L1li2UK2e,rroUrlGfY40,Телеканал Дождь,0,1,Надежда Nadi,@Андрей Светковский Сказать Нет проекту - http://helparh.ru/,2020-05-31T21:39:56Z,1
186,UgxuJFjXW66GaihIyt54AaABAg.99JqYLG__KA99L1kn_sl8M,rroUrlGfY40,Телеканал Дождь,0,1,Надежда Nadi,@Ерофей Устинов Сказать Нет проекту - http://helparh.ru/,2020-05-31T21:39:49Z,1
187,UgxuJFjXW66GaihIyt54AaABAg.99JqYLG__KA99L1jKrqZP1,rroUrlGfY40,Телеканал Дождь,0,0,Надежда Nadi,Сказать Нет проекту - http://helparh.ru/,2020-05-31T21:39:37Z,1
188,UgxuJFjXW66GaihIyt54AaABAg.99JqYLG__KA99KZToskcZL,rroUrlGfY40,Телеканал Дождь,0,2,Андрей Светковский,А главарь пусть остаётся?,2020-05-31T17:15:13Z,1
189,UgxuJFjXW66GaihIyt54AaABAg.99JqYLG__KA99KR31U0Xjo,rroUrlGfY40,Телеканал Дождь,0,0,Ерофей Устинов,капец!!,2020-05-31T16:01:39Z,1
190,UgyxQHMaeMUnTIwSa3R4AaABAg.99JorflIhQ299SqDgm9hEk,rroUrlGfY40,Телеканал Дождь,0,0,Тина Кляйн,"@Иван Симоненко а как мировое сообщество вообще назовет голосование в масках, паспорт на расстоянии 2 метров. Явка будет хорошая, вот только кто туда явится и сколько раз неопозноваемо. К тому же надомное голосование, досрочное, электронное, наблюдатели только от общественных палат . Это вообще какое-то странное голосование.",2020-06-03T22:24:13Z,1
191,UgyxQHMaeMUnTIwSa3R4AaABAg.99JorflIhQ299S-nzxMZcM,rroUrlGfY40,Телеканал Дождь,0,0,Иван Симоненко,"@Тина Кляйн сейчас уже панфилова паникует, явка прогнозируется на уровне 5-7 процентов, ни какое мировое сообщество не признает эти ""выборы"". Сейчас нужен игнор их потугам протащить вечное правление для путина. ""пусть поменяют себе мозги а не конституцию"" (в в путин 2008год). У лжеца руки по локоть в крови, потеря власти это неминуемое наказание",2020-06-03T14:37:27Z,1
192,UgyxQHMaeMUnTIwSa3R4AaABAg.99JorflIhQ299RzLywJiQ_,rroUrlGfY40,Телеканал Дождь,0,0,Тина Кляйн,"@Иван Симоненко ну в начала 2000, такая поддержка была у этой системы, а уж как гоооол кричали. А как бандитский Петербург и улицы красных фонарей. Я не говорю, что поголовно все очень были счастливы, но то, что многие совершенно точно. И фальсификации не сразу начались, поначалу многие вообще на выборы не ходили, все равно будет так то и так то. Как говорится у бурных чувств неистовый конец.",2020-06-03T14:24:45Z,1
193,UgyxQHMaeMUnTIwSa3R4AaABAg.99JorflIhQ299Rsh03z9lG,rroUrlGfY40,Телеканал Дождь,0,0,Иван Симоненко,"@Тина Кляйн нравилось тем кто ""грел руки на этом"" остальных просто гнобили силовым и адм ресурсом. А выборов просто нет, есть фальсификации которые осуществляет этот самый рессурс. Поэтому нужно подниматся и сметать этих уродов а не очередной раз садится играть с наперсточниками",2020-06-03T13:26:36Z,1
194,UgyxQHMaeMUnTIwSa3R4AaABAg.99JorflIhQ299RscIxi4NE,rroUrlGfY40,Телеканал Дождь,0,0,Тина Кляйн,"@Иван Симоненко и при такой системе других и быть не может. Все по понятиям, какие уж тут законы. Вопрос что делать? Заметьте, у нас множество бюджетников, огромная силовая структура. И эта структура будет охранять руку, которая даёт им еду",2020-06-03T13:25:57Z,1
195,UgyxQHMaeMUnTIwSa3R4AaABAg.99JorflIhQ299Rs8ZOsELl,rroUrlGfY40,Телеканал Дождь,0,1,Иван Симоненко,"@Тина Кляйн а полагать что они погрязли все есть основание, глава департамента по надзору (Днсск) Егоров его первый зам Коробкина (это как раз ответственные за контроль строительства в крае) написали по ""по собственному желанию"", как оказалось радость наша была недолгой они всплыли на повышении в минстрое (Москва). А губернатор пойдёт на второй срок, хотя при нем количество проблемных строек увеличилось в 10!!!раз (с 30 до трёхсот). И это я взял только строительную сферу, где столкнулся непосредственно с беззаконием и коррупцией",2020-06-03T13:21:45Z,1
196,UgyxQHMaeMUnTIwSa3R4AaABAg.99JorflIhQ299RrnClwl2-,rroUrlGfY40,Телеканал Дождь,0,0,Тина Кляйн,"@Иван Симоненко вертикаль Не сгнила, она хорошая такая мафиозная вертикаль. Просто, то, как управляется территория РФ называется кажется мафия . Это давно было понятно, но людям почему-то нравилось.",2020-06-03T13:18:42Z,1
197,UgyxQHMaeMUnTIwSa3R4AaABAg.99JorflIhQ299RqD3JF_Di,rroUrlGfY40,Телеканал Дождь,0,0,Иван Симоненко,"@Тина Кляйн являюсь обманутым дольщиком, Краснодар жск ""мередиан"" по уд проходят 750чел потерпевших и 9чел группа лиц по 159ч4. Администрация имея разрешительные и контролирующие функции на протяжении 7лет крышевала мощенников, так же и МВД (по нашим заявлениям были отказы в возб УД (неоднократно). После кучи отписок и заявлений в Ск, генпрокуратуру, ФСБ, приёмную президента, гос думу УД возбудили, спросите почему, отвечу резонанс! Взяточничество и воровство, вертикаль сгнила, и в то же время путин выдвигает Кондратьева на след срок странно? Да нет они все там сверху донизу такие",2020-06-03T13:04:54Z,1
198,UgyxQHMaeMUnTIwSa3R4AaABAg.99JorflIhQ299RoH6to9T4,rroUrlGfY40,Телеканал Дождь,0,0,Тина Кляйн,"@Иван Симоненко опять власти, какие конкретно власти? Что вы считаете властью. Власть понятие растяжимое. Вы говорите ни о чем",2020-06-03T12:47:58Z,1
199,UgyxQHMaeMUnTIwSa3R4AaABAg.99JorflIhQ299RnJANmFRK,rroUrlGfY40,Телеканал Дождь,0,0,Иван Симоненко,"@Тина Кляйн я сравнил, чем среда обитания людей отличается от зверей. В России беззаконие власти, они живут по инстинктам создавая проблемы остальным. Всего доброго",2020-06-03T12:39:31Z,1
200,UgyxQHMaeMUnTIwSa3R4AaABAg.99JorflIhQ299Rltna2P6k,rroUrlGfY40,Телеканал Дождь,0,0,Тина Кляйн,"@Иван Симоненко вы про джунгли говорили, и тут же на социум перепрыгнули, вам делать просто нечего?",2020-06-03T12:27:10Z,1
201,UgyxQHMaeMUnTIwSa3R4AaABAg.99JorflIhQ299RlP7erqik,rroUrlGfY40,Телеканал Дождь,0,0,Иван Симоненко,"@Тина Кляйн странный вы человек, в цивилизовоном мире жизнедельность социума регламентируют законы, соблюдай и что не запрещено значит разрешено. К чему приспосабливатся?",2020-06-03T12:22:51Z,1
202,UgyxQHMaeMUnTIwSa3R4AaABAg.99JorflIhQ299Rhn6VuBow,rroUrlGfY40,Телеканал Дождь,0,0,Тина Кляйн,"@Иван Симоненко выживает не тот, кто сильнее, а тот, кто лучше приспосабливается",2020-06-03T11:51:18Z,1
203,UgyxQHMaeMUnTIwSa3R4AaABAg.99JorflIhQ299RYeAh9Fgv,rroUrlGfY40,Телеканал Дождь,0,1,Иван Симоненко,"@Тина Кляйн в джунглях местную среду формируют звери, по праву сильного.",2020-06-03T10:22:42Z,1
204,UgyxQHMaeMUnTIwSa3R4AaABAg.99JorflIhQ299RY3-JUEmP,rroUrlGfY40,Телеканал Дождь,0,0,Тина Кляйн,"@Иван Симоненко среду обитания формируют люди, местные, свои, доморощенные. Власть это понятие очень растяжимое, если не можете называть вещи своими именами , то зачем и говорить то?",2020-06-03T10:17:30Z,1
205,UgyxQHMaeMUnTIwSa3R4AaABAg.99JorflIhQ299RRbP1VoYX,rroUrlGfY40,Телеканал Дождь,0,1,Иван Симоненко,"@Тина Кляйн а вы не задумывались что среду обитания формирует государство-власть, а если у власти ворье, коррупционеры, криминал то и результат ожидаемый.",2020-06-03T09:21:09Z,1
206,UgyxQHMaeMUnTIwSa3R4AaABAg.99JorflIhQ299MytwgQ6t5,rroUrlGfY40,Телеканал Дождь,0,0,Тина Кляйн,"@Maxim Vogel ну если уж это не понятно, тогда вообще говорить не о чем.",2020-06-01T15:44:35Z,1
207,UgyxQHMaeMUnTIwSa3R4AaABAg.99JorflIhQ299MVwWRnefT,rroUrlGfY40,Телеканал Дождь,0,1,Maxim Vogel,Тина Кляйн это к чему?,2020-06-01T11:22:48Z,1
208,UgyxQHMaeMUnTIwSa3R4AaABAg.99JorflIhQ299Lc7Bwi2-5,rroUrlGfY40,Телеканал Дождь,0,0,Тина Кляйн,"За тупость, за инертность, за наивность, за зависть, за пьянство.",2020-06-01T03:06:19Z,1
209,UgyxQHMaeMUnTIwSa3R4AaABAg.99JorflIhQ299L1uIgLOzs,rroUrlGfY40,Телеканал Дождь,0,1,Надежда Nadi,@Сергей Осадчий Сказать Нет проекту - http://helparh.ru/ 🙏,2020-05-31T21:41:06Z,1
210,UgyxQHMaeMUnTIwSa3R4AaABAg.99JorflIhQ299L1tXJ81nZ,rroUrlGfY40,Телеканал Дождь,0,2,Надежда Nadi,@Ааа Ппп Сказать Нет проекту - http://helparh.ru/ 🙏,2020-05-31T21:41:00Z,1
211,UgyxQHMaeMUnTIwSa3R4AaABAg.99JorflIhQ299L1sgYn-GU,rroUrlGfY40,Телеканал Дождь,0,2,Надежда Nadi,@Олег Семеновых Сказать Нет проекту - http://helparh.ru/ 🙏,2020-05-31T21:40:53Z,1
212,UgyxQHMaeMUnTIwSa3R4AaABAg.99JorflIhQ299L1rv94EVZ,rroUrlGfY40,Телеканал Дождь,0,1,Надежда Nadi,Сказать Нет проекту - http://helparh.ru/ 🙏,2020-05-31T21:40:47Z,1
213,UgyxQHMaeMUnTIwSa3R4AaABAg.99JorflIhQ299Jy_LX72g1,rroUrlGfY40,Телеканал Дождь,0,1,Сергей Осадчий,@Олег Семеновых 🤔 Людей любить ... особо не за что... 😉 - а вот природу нужно беречь! 😅,2020-05-31T11:44:03Z,1
214,UgyxQHMaeMUnTIwSa3R4AaABAg.99JorflIhQ299JqO68ztJy,rroUrlGfY40,Телеканал Дождь,0,1,Ааа Ппп,Maxim Vogel     для вас  что новость что у власти сидят исполнители того что им диктуют хозяева  поэтому  идёт уничтожение всего и культура в первую очередь,2020-05-31T10:32:29Z,1
215,UgyxQHMaeMUnTIwSa3R4AaABAg.99JorflIhQ299Jpsm7eOEZ,rroUrlGfY40,Телеканал Дождь,0,5,Олег Семеновых,Они и людей не очень то любят.,2020-05-31T10:28:04Z,1
216,UgwrQJMYRARmme9_hqx4AaABAg.99JocLRuFgF99OP08T_nsR,rroUrlGfY40,Телеканал Дождь,0,0,Андрей Светковский,@Анатолий Белявский а больше то и надеяться не на что.,2020-06-02T05:00:44Z,1
217,UgwrQJMYRARmme9_hqx4AaABAg.99JocLRuFgF99Md7zryl6l,rroUrlGfY40,Телеканал Дождь,0,1,Гетафакаут всем,"Анатолий Белявский и я том же, при том она сама же говорит что она бескультурный и не интересующийся культурой человек. Каких решений можно от такого «эффективного» менеджера ждать?",2020-06-01T12:34:24Z,1
218,UgwrQJMYRARmme9_hqx4AaABAg.99JocLRuFgF99M_5rjlgaC,rroUrlGfY40,Телеканал Дождь,0,0,Анатолий Белявский,"@Гетафакаут всем Посмотрел, но ничего порядочного не увидел. Унылое говно.",2020-06-01T11:59:10Z,1
219,UgwrQJMYRARmme9_hqx4AaABAg.99JocLRuFgF99MUOTSclZO,rroUrlGfY40,Телеканал Дождь,0,0,Гетафакаут всем,Анатолий Белявский вы посмотрите на этого министра,2020-06-01T11:09:16Z,1
220,UgwrQJMYRARmme9_hqx4AaABAg.99JocLRuFgF99Kh4FQ3fs2,rroUrlGfY40,Телеканал Дождь,0,0,Анатолий Белявский,@Андрей Светковский По намеками профессора В. Соловья у него большие проблемы со здоровьем и следующий год будет последним.,2020-05-31T18:30:22Z,1
221,UgwrQJMYRARmme9_hqx4AaABAg.99JocLRuFgF99KZgMFTrho,rroUrlGfY40,Телеканал Дождь,0,1,Андрей Светковский,а главарь пусть остаётся,2020-05-31T17:17:04Z,1
