,id,videoId,authorVideoName,totalReplyCount,likeCount,authorDisplayName,textDisplay,publishedAt,isReply
491,UgwYUURFRnydCh1M6Hh4AaABAg,vTZ-8ltj7aM,Телеканал Дождь,0,0,Алена Казанцева,"Если снимают ограничения - это не значит, что надо расслабиться",2020-06-08T21:46:27Z,0
492,Ugx_JVokkt3S-1mTcUZ4AaABAg,vTZ-8ltj7aM,Телеканал Дождь,0,0,Sunlion Папинсын,Спасибо за ваши труды.,2020-06-08T21:45:53Z,0
493,UgxaJKhgxOaoRHxNKlx4AaABAg,vTZ-8ltj7aM,Телеканал Дождь,1,0,Алексей Борисов,"Подождите это до парада, после парада  все и всех посадят на жесткий карантин чтобы никто не вякал.",2020-06-08T21:45:21Z,0
494,UgxaJKhgxOaoRHxNKlx4AaABAg.99edkPJcWsH99edpUmGKwu,vTZ-8ltj7aM,Телеканал Дождь,0,0,Алена Казанцева,Если опять будет повышение количества заболевших - посадят и правильно сделают,2020-06-08T21:46:03Z,1
495,Ugw9GFctREE9-GNyre14AaABAg,vTZ-8ltj7aM,Телеканал Дождь,0,0,Мария Степанова,"пришло время снимать ограничения, а там посмотрим",2020-06-08T21:45:17Z,0
496,UgxSPOpwY-Dmm3cAxeh4AaABAg,vTZ-8ltj7aM,Телеканал Дождь,0,3,Иван Север,"Они же предупредили, осенью сделают вторую волну))",2020-06-08T21:45:12Z,0
497,UgxeMKuS9HFAuG9KVc14AaABAg,vTZ-8ltj7aM,Телеканал Дождь,0,7,Мария Степанова,"многие переболели, выработали антитела и даже не знают об этом",2020-06-08T21:45:04Z,0
498,UgzgkAMmodFAG4tbPHZ4AaABAg,vTZ-8ltj7aM,Телеканал Дождь,0,1,Vladimir B,"💥ДТП Ефремов💥 - не хотите рассказать? Или вновь подтвердите статус продажной ""подстилки"" Запада? 🤬🤦‍♂️🇺🇲💲‼️",2020-06-08T21:42:52Z,0
499,UgyJwiJ-YrC-DpYiaFp4AaABAg,vTZ-8ltj7aM,Телеканал Дождь,0,0,AKVAEL,Собранную информацию удалили уже?),2020-06-08T21:38:52Z,0
500,Ugw7uDvE7VoZe8VhmpZ4AaABAg,vTZ-8ltj7aM,Телеканал Дождь,0,0,Slabыi Pёs,"Смотрели ""Клан сопрано""? Так вот,я Дядюшка Джуниор с его гениальной фразой про бессмысленность бытия)",2020-06-08T21:36:39Z,0
501,Ugyp1hoICedMVahAPJx4AaABAg,vTZ-8ltj7aM,Телеканал Дождь,0,2,Svetlana Baikova,"Проценты заражения и смертности накрученны и все уже знают как это делают , от этого и не последованность ...до смешного дошло с этим вирусом . Вирус в мозгу у нашего правительства !!! По возрасту уже понятно что мыслить аднкватно они уже не могут !!! Старческий маразм и все что связанно с их возрастом . Пенсия даеться с возрастом ( вроди как бы организм за время использования требует отдыха )  это говорит о том что человек стар и мыслить здраво не может в 70 лет ,  А тут уже не специалисту понятно что эти товарищи подошли к той черте при которой мозг уже здраво не работает . Издерки профессии . Идите уже на отдых что ли !!!! А они пытаються все еще править нашей страной , цирк да и только .",2020-06-08T21:35:38Z,0
502,UgymmQDEjOLQu0m3TUR4AaABAg,vTZ-8ltj7aM,Телеканал Дождь,0,0,Sweta Dr,"Немножко удивляет непоследовательность. Да пожалуй, ненемножко",2020-06-08T21:33:05Z,0
503,Ugz1X6D-OJjgTMN1ljJ4AaABAg,vTZ-8ltj7aM,Телеканал Дождь,0,0,Вера Бакшева,"Зачем нам эта власть , если мы ей не нужны?",2020-06-08T21:29:33Z,0
504,UgxJQPZ3Zy6STRI0yE54AaABAg,vTZ-8ltj7aM,Телеканал Дождь,0,0,Alsn,очень деликатненько ...... ),2020-06-08T21:27:57Z,0
505,Ugx1YojAE7ouxkLE95p4AaABAg,vTZ-8ltj7aM,Телеканал Дождь,0,1,Сергей Калашников,Кто смотрел видео сообщение на канале ПРАВОВЕД от 08.06.2020 чтобы люди не выходили на митинг? Для меня это полный абсурд!,2020-06-08T21:27:39Z,0
506,UgxNFvIyYXA4RveCjOh4AaABAg,vTZ-8ltj7aM,Телеканал Дождь,0,4,St R,Все? Насморк теперь не грозит?,2020-06-08T21:26:03Z,0
507,UgyBtV-79dpRvDPxIUx4AaABAg,vTZ-8ltj7aM,Телеканал Дождь,0,1,rekruter,9 Июня 240 к зараженных. 16 июня 300 к зараженных,2020-06-08T21:25:26Z,0
508,UgxogfytC9BI5ZIgoyp4AaABAg,vTZ-8ltj7aM,Телеканал Дождь,1,8,Moscow district Дистрикт Москва,кто то  верит что Собянин ходит непрерывно в маске и перчатках?,2020-06-08T21:22:19Z,0
509,UgxogfytC9BI5ZIgoyp4AaABAg.99eb6ewaAho99fqUjfpEzc,vTZ-8ltj7aM,Телеканал Дождь,0,2,Марина Лобачева,"А кто-то верит, что Собянин заботится о народе?",2020-06-09T08:55:55Z,1
510,Ugw93sYhAHphKHszgh54AaABAg,vTZ-8ltj7aM,Телеканал Дождь,0,44,Moscow district Дистрикт Москва,Заводик то масочный  не отбил еще мэр-так что никто вам маски и перчатки не отменит,2020-06-08T21:19:06Z,0
511,UgyhKX9u91ynljuW34N4AaABAg,vTZ-8ltj7aM,Телеканал Дождь,12,35,Виталий Бородин,Этого путина уже вся страна ненавидит. Мне не понятно как ему самому то не стрёмно себя президентом называть!?,2020-06-08T21:18:00Z,0
512,UgyqynUO_eLMx9ZRthl4AaABAg,vTZ-8ltj7aM,Телеканал Дождь,1,39,Ирина Соловьянова,"Как все надоело, одна ложь и обман.Кручу верчу что хочу то наворочу.",2020-06-08T21:15:59Z,0
513,UgyqynUO_eLMx9ZRthl4AaABAg.99eaOEysOOK99jg4l8yzna,vTZ-8ltj7aM,Телеканал Дождь,0,0,Ольга Шевченко,"Надоело? Вставай страна огромная, вставай на смертный бой!!!",2020-06-10T20:41:57Z,1
514,Ugy6ForQaOGZ5NRuXoh4AaABAg,vTZ-8ltj7aM,Телеканал Дождь,2,1,Sergey V,"Честное слово,вас не поймешь - не вводят ограничения - плохо, мол, жулики во власти все скрывают,ничего не делают! Вводят ограничения - опять плохо,жулики во власти душат бизнес, людям гулять не дают. Отменяют ограничения - опять плохо,жулики не думают о людях! Да что ж такое...))) Как правильно по вашему должно быть?",2020-06-08T21:14:39Z,0
515,Ugy6ForQaOGZ5NRuXoh4AaABAg.99eaERa6IYV99ehJk6Y9GQ,vTZ-8ltj7aM,Телеканал Дождь,0,0,Seryoga Gems,@Андрей Дерябин У стадной либерды.,2020-06-08T22:16:32Z,1
516,Ugy6ForQaOGZ5NRuXoh4AaABAg.99eaERa6IYV99ebVIz-hUP,vTZ-8ltj7aM,Телеканал Дождь,0,0,Андрей Дерябин,У либерды всегда так...,2020-06-08T21:25:41Z,1
517,UgwTVnka5QxqPtdZs5R4AaABAg,vTZ-8ltj7aM,Телеканал Дождь,1,12,Галина Сенченко,Ребята  отменяеться   временно   прйдет   парад  выборы   и снова   скажут  одеть   паранжу !!,2020-06-08T21:09:01Z,0
518,UgwTVnka5QxqPtdZs5R4AaABAg.99e_aHwtiR_99j6nMW0jvO,vTZ-8ltj7aM,Телеканал Дождь,0,0,Нина Столярова,"Нет, такое невозможно. Сейчас лето, жара, такие вирусы сами дохнут. Если Бордюрыч считает нас дураками, то надо показать ему, что мы не дураки. Нельзя изолировать огромный город, если люди уже все понимают.",2020-06-10T15:24:52Z,1
519,UgxznV7hh_Ou3lM7oJ14AaABAg,vTZ-8ltj7aM,Телеканал Дождь,0,1,Галина Галина,Повлиял СКР России!!!!Спасибо!Вынас защитили!,2020-06-08T21:08:21Z,0
520,Ugxb4pe2DZlhViecdOp4AaABAg,vTZ-8ltj7aM,Телеканал Дождь,0,2,Юзета Ворокова,"Какой у этого Собянина противный голос, фу противно слышать не то что слушать",2020-06-08T21:07:27Z,0
521,Ugzist3aV5br5YA7u1t4AaABAg,vTZ-8ltj7aM,Телеканал Дождь,0,12,Татьяна Валянская,"Собянин объявил новый режим ""самосохранения"" , после поправок будет режим ""самоуничтожения""",2020-06-08T21:05:00Z,0
522,UgxadGZwF6wpOyPNMmt4AaABAg,vTZ-8ltj7aM,Телеканал Дождь,1,19,Igor Petrov,Идите  и голосуйте  за Вована    вы что не слышали  кладбища будут открытыми,2020-06-08T21:04:22Z,0
523,UgxadGZwF6wpOyPNMmt4AaABAg.99e_3EEmKdz99l6n_WEGnU,vTZ-8ltj7aM,Телеканал Дождь,0,1,Татьяна Савенкова,👍👍👍👋👋👋🤣🤣🤣,2020-06-11T10:03:22Z,1
524,UgxE0hI1CWt4weUVHzN4AaABAg,vTZ-8ltj7aM,Телеканал Дождь,0,0,Александр,"Сами вы прорвал, лишь бы повод найти 😂",2020-06-08T21:01:58Z,0
525,UgyabaFpGdw3ru7CzEN4AaABAg,vTZ-8ltj7aM,Телеканал Дождь,4,25,vonKite,"1 июля - все на избирательные участки: несите с собой фиги, дули, кукиши, факъюши и киссимайэссы!",2020-06-08T21:01:46Z,0
526,UgyabaFpGdw3ru7CzEN4AaABAg.99eZl7Aib4B99lYStanfvp,vTZ-8ltj7aM,Телеканал Дождь,0,0,Leva Truskavec,"@vonKite не нужно ходить туда, так как и так будет нужный процент, нарисуют.",2020-06-11T14:05:05Z,1
527,UgyabaFpGdw3ru7CzEN4AaABAg.99eZl7Aib4B99lGQiAKu-g,vTZ-8ltj7aM,Телеканал Дождь,0,0,vonKite,"@Leva Truskavec Кто не придёт, по их  бумагам будет засчитан как пришедший и проголосовавший ""за""",2020-06-11T11:27:30Z,1
528,UgyabaFpGdw3ru7CzEN4AaABAg.99eZl7Aib4B99lG2oVtEun,vTZ-8ltj7aM,Телеканал Дождь,0,0,vonKite,"@Leva Truskavec Чиновники, бюджетники, силовики... - все придут, и все расцелуют обнулёнуша в очко. он так и останется в уверенности, что мы и вправду ""за""",2020-06-11T11:24:14Z,1
529,UgyabaFpGdw3ru7CzEN4AaABAg.99eZl7Aib4B99kmQDXKv3a,vTZ-8ltj7aM,Телеканал Дождь,0,1,Leva Truskavec,просто не нужно никуда ходить - это будет самый лучший кукиш,2020-06-11T06:56:33Z,1
530,UgwwOm93B8c8Q5AryOp4AaABAg,vTZ-8ltj7aM,Телеканал Дождь,1,5,Alexandro Aleks,"Обнуленыш обнулится. Режим концлагеря вернут обратно. Только штрафов будет на порядок больше. Ну и кого нибудь пристрелят, за хождение без маски.",2020-06-08T21:01:03Z,0
531,UgwwOm93B8c8Q5AryOp4AaABAg.99eZfusvggm99j81VqxWkp,vTZ-8ltj7aM,Телеканал Дождь,0,1,Нина Столярова,"Разве не ясно, что когда люди ""на воле"", то такой идиотизм культивировать невозможно. Значит, теперь надо очень ценить свободный режим и использовать его для того, чтобы сделать необратимыми. Чтобы пропуска, штрафы и гуляний домами больше никогда не вернулись.",2020-06-10T15:35:40Z,1
532,UgxokTjBJa61x-5pgdJ4AaABAg,vTZ-8ltj7aM,Телеканал Дождь,0,1,Григорий Лютый,да ему совсем поплохело то одно плетет  то  другое  вот и вируса уже нет видать он в него вселился послать бы его к любимым оленям  может легче станет в родной стихии,2020-06-08T21:00:40Z,0
533,Ugxk4hPzXHr59MKiHod4AaABAg,vTZ-8ltj7aM,Телеканал Дождь,1,3,Борис Дончак,"А можно специально для меня ткнуть пальцем в хотя бы одного больного каронавирусом. Страстно мечтаю познакомиться хотя бы с одним больным или переболевшим. Кстати, сегодня был в Ленинском мировом суде г. Ростова-на-Дону, в который меня без перчаток не пустил охранник. Так вот внутри я не встретил ни одного сотрудника в маске или перчатках, почему-то это правило действует только на посетителей.",2020-06-08T21:00:28Z,0
534,Ugxk4hPzXHr59MKiHod4AaABAg.99eZb_UVQQ699f1UcG5JXc,vTZ-8ltj7aM,Телеканал Дождь,0,0,Дмитрий Плащенков,Мишустин болел. Песков болел. Ну это из тех кого вы знаете. Про своих знакомых говорить не буду. Некорректно это.,2020-06-09T01:21:31Z,1
535,UgxeLGIl2vnfMfjdnVR4AaABAg,vTZ-8ltj7aM,Телеканал Дождь,0,0,андрей кости,Путин негодяй напоил  актёра Ефремова!!!! Как так???,2020-06-08T21:00:02Z,0
536,Ugw1x_kLrNuULGUBdDl4AaABAg,vTZ-8ltj7aM,Телеканал Дождь,0,12,descendant of the ottoman ЕMPIRE,самое тупое насиления мира это политики (Жак Фресско),2020-06-08T20:59:33Z,0
537,UgwwNMmlFJJR52OZ2FJ4AaABAg,vTZ-8ltj7aM,Телеканал Дождь,0,5,Любовь Самсонова,гады путинцы!,2020-06-08T20:58:50Z,0
538,Ugw2CmN43L3QT-dEAxp4AaABAg,vTZ-8ltj7aM,Телеканал Дождь,2,20,Marina Cvetohek,"Вирус гриппа есть ,но не в таком количестве заболевших. Врут как дышат.",2020-06-08T20:58:27Z,0
539,Ugw2CmN43L3QT-dEAxp4AaABAg.99eZNqyuZ0U99h1fJkD5P7,vTZ-8ltj7aM,Телеканал Дождь,0,1,Marina Cvetohek,"@Широкий Путин, идущий по коридору да я знаю это вирусное воспаление лёгких,мне уже объяснили. Жаль только тех кто умер,а всем кто заболел надо выздороветь.",2020-06-09T20:01:36Z,1
540,Ugw2CmN43L3QT-dEAxp4AaABAg.99eZNqyuZ0U99fyfOVIqR-,vTZ-8ltj7aM,Телеканал Дождь,0,1,"Широкий Путин, идущий по коридору","Это не грипп, а COVID-19.",2020-06-09T10:07:25Z,1
541,Ugxf90FILEmXMusPnmR4AaABAg,vTZ-8ltj7aM,Телеканал Дождь,0,12,Protivogad,"Ну конечно, за плешивого вора надо же проголосовать.",2020-06-08T20:58:02Z,0
542,UgxH4vQvuhk7z_ayjNh4AaABAg,vTZ-8ltj7aM,Телеканал Дождь,0,0,Resident Evil,Всю власть в Чёрный Дельфин,2020-06-08T20:56:19Z,0
543,UgyiQoJWfnSTWf_oS5d4AaABAg,vTZ-8ltj7aM,Телеканал Дождь,0,0,vonKite,"И на йух сели, и рыбки не съели",2020-06-08T20:56:12Z,0
544,UgxiL4C0ThtD_Kqysgt4AaABAg,vTZ-8ltj7aM,Телеканал Дождь,0,1,Ирина Сердюк,Цирк какой то!!!,2020-06-08T20:53:11Z,0
545,Ugx7kK7DEMMOAChyoqp4AaABAg,vTZ-8ltj7aM,Телеканал Дождь,0,0,Иван Васкевич,.Tyler Durden..... Только он может спасти.....,2020-06-08T20:52:26Z,0
546,Ugx8HmPgEfl6c9g5uXh4AaABAg,vTZ-8ltj7aM,Телеканал Дождь,0,3,Анна Фатрутдинова,Собякин что то в роте катает походу или подсасывает...,2020-06-08T20:52:11Z,0
547,UgwvohrYNlVNQyG4y-h4AaABAg,vTZ-8ltj7aM,Телеканал Дождь,0,1,Алекс Новик,Собянинский масочный бизнес рухнул 😂😂😂,2020-06-08T20:49:33Z,0
548,UgzND_Ps283fBYZ_-Lh4AaABAg,vTZ-8ltj7aM,Телеканал Дождь,0,1,Ирина Сердюк,Клоун,2020-06-08T20:49:14Z,0
549,UgzLTJ2d67LlPKzkIk54AaABAg,vTZ-8ltj7aM,Телеканал Дождь,0,2,Анна Фатрутдинова,"Дааа хитровыкрученые
То сзади то спереди
Бля.ь умора!",2020-06-08T20:49:08Z,0
550,UgxaH-zyVSKgIBrK9gJ4AaABAg,vTZ-8ltj7aM,Телеканал Дождь,0,2,Сергей Романович,Ковид  обнулился.,2020-06-08T20:48:22Z,0
551,UgyIfrEzaDeiUTBMbYd4AaABAg,vTZ-8ltj7aM,Телеканал Дождь,0,15,Dmittry,"Как же мы без поправок в Конституцию то до июля доживём-то? Сколько ещё людей погибнет из-за не принятых поправок? Сколько предприятий закроется? Дети уже просят, ну примите их наконец-то, чтобы зажила Россия-матушка! Чтобы закончилась зараза коронавирусная. Чтобы не смели больше печенеги и геи порочить память ветеранов Великой Отечественной!",2020-06-08T20:45:09Z,0
552,UgwOlR2ei8BDx_VRSS14AaABAg,vTZ-8ltj7aM,Телеканал Дождь,0,5,Рожденный в СССР,какая спешка цифры от фанаря все нормально и нет уже вируса,2020-06-08T20:42:28Z,0
553,UgznyIU7juv9l92avOx4AaABAg,vTZ-8ltj7aM,Телеканал Дождь,0,3,Айрат Галлямов,22 июня все на митинг во вмех городах России .,2020-06-08T20:42:15Z,0
554,Ugzp9Dtec6M1MwRcJRN4AaABAg,vTZ-8ltj7aM,Телеканал Дождь,0,0,Сто За Сто,УБЕРИТЕ ПОЖАЛУЙСА  ЭТО  ПОДОБИЕ  СПЕЦКОРА      ТОШНО  ВСЕМ  ОТ  ЕГО  РОЖЫ!!!!!!!!!!!!!!!!,2020-06-08T20:41:37Z,0
555,Ugy_0O_Dmd5YYmazHml4AaABAg,vTZ-8ltj7aM,Телеканал Дождь,1,8,Porsche_Carrera_GT,Сказочная страна кто мне подскажет кто покажет где она где она ))),2020-06-08T20:41:27Z,0
556,Ugy_0O_Dmd5YYmazHml4AaABAg.99eXRLpiK6k99ekEk93BqE,vTZ-8ltj7aM,Телеканал Дождь,0,0,Надежа Павлова,"эта страна с народом многомиллионном превратилась в г,,,,о,!!!!!!!!!!!!Алло людиииииии,,,где вы?",2020-06-08T22:42:04Z,1
557,UgwcO_GQzYpUUrkS8ZZ4AaABAg,vTZ-8ltj7aM,Телеканал Дождь,0,6,RUSLAN ZUK,Подождите ) сейчас они вкус штрафных денег почувствуют и придумают вторую волну,2020-06-08T20:40:20Z,0
558,UgyYjL-Q_6n6A2Yr9zJ4AaABAg,vTZ-8ltj7aM,Телеканал Дождь,0,6,Матильда Ив,Как раз 1 июля будет полно новых случаев заболевания. Объявят только электронное голосования и нарисуют любой результат,2020-06-08T20:39:03Z,0
559,UgyCrizpms9yfu4Hp5J4AaABAg,vTZ-8ltj7aM,Телеканал Дождь,0,0,giveMeMana,"В отставку всех этих уебков, жуликов.",2020-06-08T20:37:33Z,0
560,UgwxwrEriimDiQvYQLx4AaABAg,vTZ-8ltj7aM,Телеканал Дождь,0,2,Your Motherfucker,Собакин КЛОУН🤣,2020-06-08T20:37:25Z,0
561,UgyTK5olbpbd3cMItwd4AaABAg,vTZ-8ltj7aM,Телеканал Дождь,0,3,Vosem Tri,Рабам кинули кусок хлеба,2020-06-08T20:32:04Z,0
562,UgwtU-XEjdl5OE6X3r54AaABAg,vTZ-8ltj7aM,Телеканал Дождь,0,0,михась фамин,"после обнуления введут налог на роскошь, и еще черт знает какие,но у россиян порвут жофу налогами, 0 нужен чтоб смело рвать",2020-06-08T20:31:00Z,0
563,UgxV8Ty-bBw4K6Nb-Lt4AaABAg,vTZ-8ltj7aM,Телеканал Дождь,0,2,krot krot,Госслужащих принуждают голосовать,2020-06-08T20:28:18Z,0
564,Ugxc5Q-2LG1qcuDrO2Z4AaABAg,vTZ-8ltj7aM,Телеканал Дождь,0,1,Алексей Рыбаков,"Готовимся ко второй волне. Политиканы играют в игру,где Мы(народ) в ней боты и обороняемся,а они атакуют",2020-06-08T20:28:04Z,0
565,UgxOp4hDn_iZ9I_4ubZ4AaABAg,vTZ-8ltj7aM,Телеканал Дождь,1,2,Наталья Ковалева,"НЕУЖЕЛИ ЭТИ ИДИОТЫ НЕ ПОНИМАЮТ, ЧТО НАД НИМИ НАРОД ДАВНО СМЕЕТСЯ И НЕ ХОЧЕТ ИХ ПРИСУТСТВИЯ У РУКОВОДСТВА СТРАНЫ?! ОНИ СЕБЯ СО СТОРОНЫ-ТО ВИДЯТ?! ГАЛКИН ВСЁ ИМ ПОКАЗАЛ...МАЛОВАТО! НАДО БОЛЬШЕ ПОКАЗЫВАТЬ, ЧТО ОНИ НАТВОРИЛИ В СТРАНЕ, ГОРОДАХ И ПРОДОЛЖАЮТ ВЫТВОРЯТЬ С ЛЮДСКИМИ ЖИЗНЯМИ!!!",2020-06-08T20:27:12Z,0
566,UgxOp4hDn_iZ9I_4ubZ4AaABAg.99eVo0E6xd499elzyJEVv4,vTZ-8ltj7aM,Телеканал Дождь,0,0,Надежа Павлова,Наталья!!А вы бы ушли оттуда??получая миллионы и миллиарды??????????по честному?,2020-06-08T22:57:23Z,1
567,UgxKRCHFIc9vgv2ZTdV4AaABAg,vTZ-8ltj7aM,Телеканал Дождь,0,4,Stefania Shmidt,"Все болеющие обнаружат себя проголосовавшими
И все умершие, умрут ровно после голосования, а присмерти успеют проголосовать как нужно",2020-06-08T20:27:00Z,0
568,UgxSV9LYFbKvOhjvkT14AaABAg,vTZ-8ltj7aM,Телеканал Дождь,0,0,СССР 2025,Ссс ты проиграл.....,2020-06-08T20:27:00Z,0
569,UgzZACMDUtB7ZLPARjZ4AaABAg,vTZ-8ltj7aM,Телеканал Дождь,0,1,doomer,ВИРУС ОТМЕНИЛИ?,2020-06-08T20:26:27Z,0
570,UgwH3uSz6IBuc5-U6Gx4AaABAg,vTZ-8ltj7aM,Телеканал Дождь,0,1,фафаня фафаня,Собянин тупой бабока мычалка говорит как колхоз,2020-06-08T20:26:21Z,0
571,UgxSk2a0Z5d31ezZsLd4AaABAg,vTZ-8ltj7aM,Телеканал Дождь,0,3,krot krot,Судить,2020-06-08T20:25:58Z,0
572,UgzB-4ol70cYe3lnMpR4AaABAg,vTZ-8ltj7aM,Телеканал Дождь,0,16,Алексей Мишанин,Народ это расходный материал...Власть относится к народу как сутенёр к проститутке...,2020-06-08T20:25:28Z,0
573,Ugz4xZyBiPYK1BlKfMR4AaABAg,vTZ-8ltj7aM,Телеканал Дождь,0,0,Люся Люсева,"Ну вот как можно относиться серьёзно к таким ""специалистам""???здоровье людей подвергают опасности из-за чьих то завихов.",2020-06-08T20:24:54Z,0
574,UgzX8ObUthsyKkC9d2t4AaABAg,vTZ-8ltj7aM,Телеканал Дождь,0,4,NAVI AK,Что курит этот маразматик?,2020-06-08T20:24:04Z,0
575,UgzJmfWWA1LwbxqbolJ4AaABAg,vTZ-8ltj7aM,Телеканал Дождь,0,0,Юрий Гарников,"Запретили гулять -плохо ,разрешили- опять плохо!?",2020-06-08T20:23:24Z,0
576,UgzkEqxwjRpfSinWyPV4AaABAg,vTZ-8ltj7aM,Телеканал Дождь,0,6,Юрий Седов,"Удивляет не последовательность... Вас, девушка, все еще что-то удивляет?",2020-06-08T20:22:45Z,0
577,UgzrEKPf1Fg2n6FMF254AaABAg,vTZ-8ltj7aM,Телеканал Дождь,0,1,Наталья Ковалева,"А САМОЛЕТЫ БУДУТ ЛЕТАТЬ?! КУДА И КОГДА ЛЕТЕТЬ ОТДЫХАТЬ-ТО?! ЧТО С КРЫМОМ, МОСТ ОТГРОХАЛИ И ЧТО?! КАК С ПОЕЗДАМИ-ТО, ПОЕДУТ?!",2020-06-08T20:22:19Z,0
578,UgydZoSRJ1u6mcx3Xqx4AaABAg,vTZ-8ltj7aM,Телеканал Дождь,2,36,Maria Tretyakova,Какой же неприятный голос и манера речи у ССС..,2020-06-08T20:21:37Z,0
579,UgydZoSRJ1u6mcx3Xqx4AaABAg.99eVA5bgtnN99kvxBirj4x,vTZ-8ltj7aM,Телеканал Дождь,0,0,Лариса Курцхалидзе,Оленевод,2020-06-11T08:19:50Z,1
580,UgydZoSRJ1u6mcx3Xqx4AaABAg.99eVA5bgtnN99gb1GGs3t8,vTZ-8ltj7aM,Телеканал Дождь,0,0,Anna Panivan,А он профессиональный диктор? )),2020-06-09T16:00:04Z,1
