,id,videoId,authorVideoName,totalReplyCount,likeCount,authorDisplayName,textDisplay,publishedAt,isReply
243,UgxZV_j692qpi64R3pN4AaABAg,vTZ-8ltj7aM,Телеканал Дождь,0,0,Лариса Фролина,Какой изощрённый план сатаны. Сняли перед голосованием. А дальше...,2020-06-09T19:42:40Z,0
244,UgydYfbah0ru_qqDhGx4AaABAg,vTZ-8ltj7aM,Телеканал Дождь,0,0,Владимир Харламов,Надо же как выслужился !Но я верю Собякину и на выборы не пойду !!!!,2020-06-09T19:35:48Z,0
245,UgxxjadNdOdzELkioch4AaABAg,vTZ-8ltj7aM,Телеканал Дождь,0,0,Влад Мельников,Студии звукозаписи не закрывались,2020-06-09T19:31:04Z,0
246,Ugx4RQYzk8cVVzhtMGd4AaABAg,vTZ-8ltj7aM,Телеканал Дождь,0,0,John Rambo,"Постепенный выход из самоизоляции, ага.",2020-06-09T19:27:36Z,0
247,UgyAz8KJ0NzYY8I78i94AaABAg,vTZ-8ltj7aM,Телеканал Дождь,0,0,Лариса Чупрун,"Такое ощущение что подачку дал этот собякин. Чё то явно задумал ф....т??? Затишье перед бурей. Люди,будьте бдительны. Что тут не так... Сколько тестов, столько и заразившихся, не парадокс ли??? У нас на 2000 тестов ни одного с ковидом ( если что это Прибалтика) ,а у него из 1000 - 999,9,а 0,1 - это он . Как так то???ну что дальше? Точно капецццццц.... Или ещё повоюем с этим беспределом???",2020-06-09T19:27:18Z,0
248,UgxKn5V_7YDqueSu8tB4AaABAg,vTZ-8ltj7aM,Телеканал Дождь,0,1,WIL JAS,"3:45 брехня , до появления вакцины он обещал сохранить не самоизоляцию , а санитарные меры , а именно масочный режим",2020-06-09T19:18:32Z,0
249,Ugyj91dVJYmMRJoEXlp4AaABAg,vTZ-8ltj7aM,Телеканал Дождь,0,0,Lian Turc Channel,Сделайте уже звук нормальный.,2020-06-09T19:15:26Z,0
250,UgzOax99I6Hdrn93K3h4AaABAg,vTZ-8ltj7aM,Телеканал Дождь,0,5,Мелана Калинина,Когда намордник отменят ....? Рекомендательный характер 🤷‍♀️а носить под страхом штрафа!  Что за фигня работать в наморднике...🤦‍♀️бред..,2020-06-09T19:12:16Z,0
251,UgxwUFvMTdZamppkFM14AaABAg,vTZ-8ltj7aM,Телеканал Дождь,0,0,Оксана,За@бали уже всех эти тупорылые суки,2020-06-09T19:02:16Z,0
252,UgzoAnq9cy8fQhhfiox4AaABAg,vTZ-8ltj7aM,Телеканал Дождь,0,3,Печенег Половцев,Главное обнуление провести а там снова ввести график ходить против часовой стрелки гулять,2020-06-09T18:48:15Z,0
253,Ugy0J73ApJiRMJ7eSbJ4AaABAg,vTZ-8ltj7aM,Телеканал Дождь,0,0,iv zin,"подать в суд на всю кремлядь включая ""гаранта конституции РФ""!",2020-06-09T18:44:52Z,0
254,UgxNRQF4XZxwbSDixwx4AaABAg,vTZ-8ltj7aM,Телеканал Дождь,0,1,El Macho,Ждём вторую волну. Масок наклепали то составами...,2020-06-09T18:39:19Z,0
255,Ugy-g43mLB81A8Qp7a94AaABAg,vTZ-8ltj7aM,Телеканал Дождь,0,0,Галина Борисовна,"Нормально,поиграли в игру хороший полицейский,злой полицейский,пришёл хороший и сейчас все разрулит",2020-06-09T18:36:49Z,0
256,Ugw8JPIdRU7p56oAGr94AaABAg,vTZ-8ltj7aM,Телеканал Дождь,0,2,Галина Борисовна,"Роспотребнадзор тоже к ответу,подать и на них в суд",2020-06-09T18:34:17Z,0
257,UgyhP-hUMdd_Hkt4vRx4AaABAg,vTZ-8ltj7aM,Телеканал Дождь,0,0,Галина Борисовна,"Ладно если бы один маразматик, но Питер???,по ходу не думают",2020-06-09T18:33:05Z,0
258,Ugx8jiB_VDZ3Lh1cvTx4AaABAg,vTZ-8ltj7aM,Телеканал Дождь,0,0,Andrey Andreychuk,Последовательная непоследовательность удивляет. Вирус обнулён.,2020-06-09T18:31:47Z,0
259,UgzkwSEHW_ul1rpuLLt4AaABAg,vTZ-8ltj7aM,Телеканал Дождь,0,0,PavlPlay,"Ох ни//уя себе! У них так сняли,а в регионах продлевают хз до какого,низкий поклон 🙇‍♂️",2020-06-09T18:31:23Z,0
260,UgzWtl6qfR9to_CUHlZ4AaABAg,vTZ-8ltj7aM,Телеканал Дождь,0,0,Джон Конор,"Смерть путину!
Смерть собаке (Собянину) сс!",2020-06-09T18:15:13Z,0
261,UgyWAlIW5DivzbaYKwh4AaABAg,vTZ-8ltj7aM,Телеканал Дождь,0,1,DOTA 2 ZADROTA,Я один смотрел на жестикуляцию ртом?,2020-06-09T17:24:40Z,0
262,UgwtdA_FNpEVrhHRv_J4AaABAg,vTZ-8ltj7aM,Телеканал Дождь,0,3,Татьяна Горягина,"Вам не стыдно?Живем как в тюрьме ,хожу в обносках,дети растут а одевать им извините что?Все закрыли вы нормальные???или как придумали бреееед для людей и забыла как улица выглядит",2020-06-09T17:16:13Z,0
263,UgzvwB_UgO5v9HuSoFV4AaABAg,vTZ-8ltj7aM,Телеканал Дождь,0,0,Simon789,Это же надо таким дибилом быть,2020-06-09T17:10:30Z,0
264,UgwxdqqDUGPLEWL5EMR4AaABAg,vTZ-8ltj7aM,Телеканал Дождь,0,0,Retro Exzotika,"Только революция,может спасти мир.",2020-06-09T17:02:13Z,0
265,UgxdGOHgFYb1654T7Hx4AaABAg,vTZ-8ltj7aM,Телеканал Дождь,0,0,Gans Mein Igel,"Давно пора это сраное население бульдозерами давить, как сыр с апельсинами. Одни проблемы от них: то митингуют, то голосовать не хотят, то гулять просятся.",2020-06-09T16:34:30Z,0
266,UgwpySnfdOtH7TJ1V3Z4AaABAg,vTZ-8ltj7aM,Телеканал Дождь,0,0,Тимур Исаев,Я работал в грязной зоне и знаю истинное положение дел. Это просто кошмар какй то просто преступление. Будет такой рост заболевания,2020-06-09T16:31:27Z,0
267,UgwaIJRmNpndu5qWm0h4AaABAg,vTZ-8ltj7aM,Телеканал Дождь,0,0,Tamaz Gvaramia,"Это трагедия,оправдание нет. Разница в том кто совершил, справедливости ждать не приходится зависит от лояльность к власти. Этот случай раскрутят на полную котушк. Приношу соболезнования семе иблиским.",2020-06-09T16:27:43Z,0
268,UgxdAq0o_jVroyoAvz94AaABAg,vTZ-8ltj7aM,Телеканал Дождь,0,0,Матуба Матубович,МОСКВА   ВОТ ГДЕ ВСЯ ЗАРАЗА И ОНА РАСПРОСТРАНИЛАСЬ ПО ВСЕЙ РОССИИ И ПОЖИРАЕТ НАС  ГИДРА СВОЁ ДЕЛО ЗДЕЛАЛА .НАС УЖЕ ПЕРЕВАРИЛО В ЕЁ КИШКЕ И МЫ ВЫПАЛИ В ОСАДОК        ЧУВСТВУЕТЕ КАКАЯ ВОНЬ ?,2020-06-09T16:21:01Z,0
269,UgxNUhrCyF6ZP7mZdOp4AaABAg,vTZ-8ltj7aM,Телеканал Дождь,0,0,Сергей Сармат,"К осени эти уроды ещё что-нибудь придумают,а продажное телевидение только раздувается весь этот бред",2020-06-09T16:18:23Z,0
270,UgwqkpQW5e_ena9TCL54AaABAg,vTZ-8ltj7aM,Телеканал Дождь,0,6,Sabrina,"После голосования, мне кажется закроют нас опять🤭  типа все вышли заразились",2020-06-09T16:13:33Z,0
271,UgzI3IWAHgffS_NpacF4AaABAg,vTZ-8ltj7aM,Телеканал Дождь,0,0,Игорь Новоселов,"Все вируса нет ?  Да , как скажет этим холуям царёк из бункера , так  оленевод и будет делать , обнуление важней вируса",2020-06-09T16:08:03Z,0
272,UgyyVtkEY9zlC6CrmUV4AaABAg,vTZ-8ltj7aM,Телеканал Дождь,0,1,Сергей Мартынов,"Вечер в хату))
С амнистией Вас граждане)))
Или это только УДО?)",2020-06-09T16:06:13Z,0
273,UgwwoWzBsgsrvyvYFxZ4AaABAg,vTZ-8ltj7aM,Телеканал Дождь,0,0,МИНА АДЖИМУРЗАЕВА,А то Собянина изолируем.,2020-06-09T16:01:59Z,0
274,Ugx4J_OB0W3ZYkZDy9x4AaABAg,vTZ-8ltj7aM,Телеканал Дождь,0,0,МИНА АДЖИМУРЗАЕВА,"Маски уберите, и силовики на улицах бесятся от абсурда с масками и перчатками. Хватит.",2020-06-09T16:01:01Z,0
275,Ugy9Vw8N-KfSsw5adfx4AaABAg,vTZ-8ltj7aM,Телеканал Дождь,0,0,styopoch,Путина вам припихнуть надо!!! идиоты,2020-06-09T15:57:09Z,0
276,Ugxx7z9LMLzg-FNPL3R4AaABAg,vTZ-8ltj7aM,Телеканал Дождь,0,0,Владимир Севрюков,Акак гулять без расписания непойму как жить,2020-06-09T15:57:07Z,0
277,UgzyWNHEHY96cyW1VCR4AaABAg,vTZ-8ltj7aM,Телеканал Дождь,0,1,Дядя Серж,Надо отдать жизнь за выборы ЦАРЯ,2020-06-09T15:56:35Z,0
278,Ugw1Z8AG1CiJgH9ucJ94AaABAg,vTZ-8ltj7aM,Телеканал Дождь,0,0,Vladimir10040,Маразматик предатель,2020-06-09T15:54:23Z,0
279,UgxSFgKz8NRNeaGCkwd4AaABAg,vTZ-8ltj7aM,Телеканал Дождь,0,2,Виталий Гражданин СССР,Короче в Москве выключили барановирус!,2020-06-09T15:52:58Z,0
280,UgxYGOOqZiz0s3RK9eV4AaABAg,vTZ-8ltj7aM,Телеканал Дождь,0,0,людмила бессольцева,платошкина изолировали  теперь можно снимать самоизоляцию,2020-06-09T15:51:50Z,0
281,Ugwn9X19dNYPNWh_fI94AaABAg,vTZ-8ltj7aM,Телеканал Дождь,0,0,Руха,Все это шляпа они  поняли что если не отменить  режим изоляции то народ поднимется как в Америке и в Европе,2020-06-09T15:45:19Z,0
282,Ugw2c_rVr-vR1yNlXgV4AaABAg,vTZ-8ltj7aM,Телеканал Дождь,0,0,Виктор Сосков,"Мэр-оленевод ведёт преступную деятельность по всем параметрам ни перед КЕМ""Народом"" не отчитывается .Тварит всё что ему в башку придёт.это реальный ВРЕДИТЕЛЬ.сам в перчатках,в маске! Маска ни от чего не спасает !Зачем вся эта клоунада!?",2020-06-09T15:23:22Z,0
283,UgxtAx-DpqKdsW_Aog94AaABAg,vTZ-8ltj7aM,Телеканал Дождь,0,0,Асан Каримов,Совсем уже с ума выжили .  Врут и глазом моргнут .,2020-06-09T15:10:54Z,0
284,UgyH4MNI5jCMtiSzFvp4AaABAg,vTZ-8ltj7aM,Телеканал Дождь,0,0,Николай Корнеев,"Себянин не о народе волнуется и его здоровье, а о своем кармане и своих подельниках.",2020-06-09T15:08:20Z,0
285,UgzU9VSL2qiBGEA5wxt4AaABAg,vTZ-8ltj7aM,Телеканал Дождь,0,0,Sergant GRU,Хаха это не надолго до соvld - 666,2020-06-09T15:06:47Z,0
286,UgyZZbGGLhZxEHpERLp4AaABAg,vTZ-8ltj7aM,Телеканал Дождь,0,0,РашЮтуб Подтиркин,"Собянин, тебя это не спасет от ответсвенности.",2020-06-09T15:03:03Z,0
287,Ugx7jrQTTs8VHPo-esp4AaABAg,vTZ-8ltj7aM,Телеканал Дождь,0,0,MsHappyDemon,"Не принятые решения? Да их приняли уже, народное голосование - это фейк.",2020-06-09T15:02:16Z,0
288,Ugzf0PYM9xY2G21-nlt4AaABAg,vTZ-8ltj7aM,Телеканал Дождь,0,0,Привет Ииимитр,"Сабянин,не старайтесь,все равно не быть Вам президентом!",2020-06-09T14:52:56Z,0
289,UgxIh6XvEZOmzNFsoQ14AaABAg,vTZ-8ltj7aM,Телеканал Дождь,0,0,Любовь Дубовик,Резко обкакались,2020-06-09T14:43:39Z,0
290,UgzLsnB5bONnNfXpEj94AaABAg,vTZ-8ltj7aM,Телеканал Дождь,0,0,Я Ярадзаре,Собянин. С. С.ру  Самое главное сохррранять грррафик пррродаж масок и самоизоляции. Как жаль что выборрры и как же я буду пррродавать маски. Скоррро я уничтожу В. В. Путина и буду дальше пррррродавать маски в своей Москве... РРР,2020-06-09T14:42:18Z,0
291,Ugzaq1PnpCLW7JFieBZ4AaABAg,vTZ-8ltj7aM,Телеканал Дождь,0,0,You Tuber,"ерунда все это главное в чечне деньги дают что бы невесту купить. холостяки бегом в чечню, прописывайтесь и вам денег дадут, невесту сможите купить.))))",2020-06-09T14:31:13Z,0
292,UgwFDu7Esu6zkKDenfZ4AaABAg,vTZ-8ltj7aM,Телеканал Дождь,0,0,Ольга Симеониди,снимаются ограничительные меры потому что надо проголосовать за поправки а потом снова загоняют народ наша власть делает как ей выгодно хватит дурить народ надоело аферисты,2020-06-09T14:24:32Z,0
293,UgxMsXq9h4LsfWo9CxJ4AaABAg,vTZ-8ltj7aM,Телеканал Дождь,0,0,су сс,а почему другие мэры других регионах не зделали самоизоляцию . а продолжали и работать и гулять своим гражданам ..  а москва особенная - эксперементальная ...,2020-06-09T14:23:28Z,0
294,UgyjytlJGLLgWuUW36x4AaABAg,vTZ-8ltj7aM,Телеканал Дождь,0,0,Alina Kim,"Это просто удивительно, как наши правдорубы рассказывая о событиях дня за 8.06.20 ни слова не сказали о важнейших событиях в стране, подписании путиным закона о едином реестре и подписании закона о дистанционном образовании для детей 😡",2020-06-09T14:06:41Z,0
295,UgzgxQXXBdFSc-lwlsl4AaABAg,vTZ-8ltj7aM,Телеканал Дождь,0,4,Svetoslava Greedneva,Вся самоизоляция была не нужна,2020-06-09T14:01:16Z,0
296,UgzHLCisWcIjwLu7vpV4AaABAg,vTZ-8ltj7aM,Телеканал Дождь,0,0,Valli Степанова,Нам не нужен просроченный президент!,2020-06-09T13:53:13Z,0
297,Ugw2D56CDvxl96lPn4l4AaABAg,vTZ-8ltj7aM,Телеканал Дождь,0,1,Vladis Red,тут уже речь идет не о том будет ли дальше существовать путиноидная власть а о том смогут ли они выскочить из России живыми,2020-06-09T13:38:46Z,0
298,UgzvoGiOi5joOinKzw14AaABAg,vTZ-8ltj7aM,Телеканал Дождь,0,0,IRINA LUIZA,Кого то ещё что то удивляет....???? По-моему театр бабы фисы на лицо. ОГОНИЯ🤣🤣🤣🤣🤣🤣🤣,2020-06-09T13:31:19Z,0
299,UgyLWSM3zdRAeu-fZ1t4AaABAg,vTZ-8ltj7aM,Телеканал Дождь,0,0,Den Den,"У Собяни ОЧКО Жим-Жим- еще раз ЖИМММ), проверка Мишусти рядом)",2020-06-09T13:15:57Z,0
300,UgwzYPC95KA_QfYZLkp4AaABAg,vTZ-8ltj7aM,Телеканал Дождь,0,3,Ольга Евстигнеева,Снова пора менять дорожки-тратуары...,2020-06-09T13:01:55Z,0
301,UgxREhSDei6k5yOiZxF4AaABAg,vTZ-8ltj7aM,Телеканал Дождь,0,0,Андрей Якушев,"Москва, Москва как я за тебя болею.",2020-06-09T12:49:41Z,0
302,Ugzx17KHdUkL2kAcFVV4AaABAg,vTZ-8ltj7aM,Телеканал Дождь,0,1,Albina Korogodova,Бойкот псевдовыборам и параду ‼️,2020-06-09T12:46:41Z,0
303,Ugyq7uongmizoTfuH0p4AaABAg,vTZ-8ltj7aM,Телеканал Дождь,0,0,Marina Voskoboeva,"Ничего не удивляет! Наша страна - это театр абсурда! Решения управленцев лишены здравого смысла! Понятно, что на Собянина надавили, потому что запланировали репетиции, парад, голосовалку. Несомненно, эти действия повлекут непредсказуемые последствия!!!...",2020-06-09T12:40:17Z,0
304,UgzBUxDNYTysBH281d94AaABAg,vTZ-8ltj7aM,Телеканал Дождь,0,0,Ольга Артамонова,"Испугался Сабянин... Ведь, всё его действия не законны.",2020-06-09T12:21:44Z,0
305,UgwIFcGV7yIdTyBpCL54AaABAg,vTZ-8ltj7aM,Телеканал Дождь,0,0,Галина С,"Чего тут удивляться,как им нравится так и делают.",2020-06-09T12:01:14Z,0
306,Ugyeh9GnuS6Dv0tEIZh4AaABAg,vTZ-8ltj7aM,Телеканал Дождь,0,8,Алекс Свобода,После 1 июля придёт вторая волна корона вируса.100%.. ПОЗОРИЩЕ!!!!! В какой стране мы живём?????,2020-06-09T11:49:33Z,0
307,Ugx6Vx4dplz1JDrr5Tl4AaABAg,vTZ-8ltj7aM,Телеканал Дождь,0,1,Forget-me- Not,"нужно правительства всего мира (включая тех кто рвутся сейчас к власти) отправить в бункер и мы будем их постоянно пугать, что на поверхности кошмарная эпидемия и им не в коем случае выходить нельзя, вот ""скоро"" будет готова вакцина и вот тогда они спасутся. и тогда мы хоть поживём нормально.. эх.. мечты, мечты.. надо комедию снять на эту тему ))",2020-06-09T11:46:18Z,0
308,Ugzh996AnRQTDsG16yh4AaABAg,vTZ-8ltj7aM,Телеканал Дождь,0,0,Stint с друзьями,ВСЕ ХОДЯТ БЕЗ МАСОК !!! ОЧЕРЕДИ В МАГАЗИНАХ!!! МОЕ МНЕНИЕ СКОРО НАЧНЕТСЯ ШВАХ!!! НО ОБНУЛЕНЫЙ УЖЕ БУДЕТ НА ТРОНЕ СИДЕТЬ И РУКИ ПОТИРАТЬ,2020-06-09T11:20:24Z,0
309,UgxWgO7n1J405bYiz3t4AaABAg,vTZ-8ltj7aM,Телеканал Дождь,0,1,Елена Елена,"А никого не смущает, что с конца прошлого года и до февраля-марта этого года у нас был пик «гриппа» 🤔 очень много людей болело в феврале. А грипп ли это был? Сама болела в феврале, никогда так сильно не болела, температура 39 и боль в теле. А потом , через неделю оп и 36, хотя за сутки была температура 38 и слабость",2020-06-09T11:18:07Z,0
310,Ugx440KApkuK5wFo5-p4AaABAg,vTZ-8ltj7aM,Телеканал Дождь,0,9,Alexandr Kozyev,"Ввели при 500 чел, а сняли при +9000! Что происходит?!))))",2020-06-09T11:14:38Z,0
311,Ugw2xse7UAa3dHAzS6h4AaABAg,vTZ-8ltj7aM,Телеканал Дождь,0,0,Alexandr Kozyev,Легко поддаются дрессировки,2020-06-09T11:11:13Z,0
312,Ugwf8mBGWPBFWL-FWq54AaABAg,vTZ-8ltj7aM,Телеканал Дождь,0,0,koly lohov,А почему  менты  ещё  в  масках?,2020-06-09T11:06:49Z,0
313,Ugx3ahAlsNqayHdUj3R4AaABAg,vTZ-8ltj7aM,Телеканал Дождь,0,0,Андрей Шадрунов,"Сегодня уже 1500. Ну может небольшой всплеск будет, потом опять пойдет вниз. В Москве в последнее время все так: сначала на месте постоит, потом резко обвалится. В области более плавно. В области все более плавно и медленно. Сняли кучу ограничений - немного возросло, постояло на месте, и опять вниз, так что скоро еще снимут. Не тревожтесь, эпидемия к концу близится, а не к началу. Вирус уже не тот что в начале.",2020-06-09T11:02:52Z,0
314,Ugx-SyH6xyqg1Ez9jyt4AaABAg,vTZ-8ltj7aM,Телеканал Дождь,0,0,Alex RU,Это Они так научились управлять ВИРУСОМ .  🤘🤘🤘,2020-06-09T10:57:59Z,0
315,Ugze7WNsG2iLhgCdgHt4AaABAg,vTZ-8ltj7aM,Телеканал Дождь,0,0,Galina Smagina,"Вам то плохо, что гайки вкручивают и все запрещают. Теперь плохо, что все отменяют... Опять не так.  Загадочные люди....",2020-06-09T10:57:15Z,0
316,UgyaM_KCVD77xN1SuoZ4AaABAg,vTZ-8ltj7aM,Телеканал Дождь,0,0,mr. triniti neo,"Тухлодырый собянин еврей вам приказал расстреливать русских (носить маски) в рекомендательном характере (нет закона нет и штрафа ) . Ваши действия мвд, фсб на подсосе у  мосад! ? 
Кто уничтожит журналистов , терроризировавших население россии в течении з месяцев ?",2020-06-09T10:47:35Z,0
317,UgyAUoisf5qHKKXTr4l4AaABAg,vTZ-8ltj7aM,Телеканал Дождь,0,1,Юлия Горбылева,"Так отлично,что ограничения начинают снимать ,там же ситуация заметно улучшилась ...че никто не хочет нормальное лето?? или что,я не очень понимаю ??",2020-06-09T10:35:34Z,0
318,UgwU2Znf0oAQGHn_n6R4AaABAg,vTZ-8ltj7aM,Телеканал Дождь,0,1,Серега Серега,"Эй, золотой дождь, что вы за своего Ефремова молчите, а?)",2020-06-09T10:32:05Z,0
319,UgxSu9GQg19xpWb8E_V4AaABAg,vTZ-8ltj7aM,Телеканал Дождь,0,0,Борис Петров,Собянину дали указание из Администрации Президента,2020-06-09T10:24:49Z,0
320,Ugyb0lLXD8k8TPPfogZ4AaABAg,vTZ-8ltj7aM,Телеканал Дождь,0,0,galina chistyakova,"да просто засрал,потому что вал недовольства пошёл.",2020-06-09T10:21:10Z,0
321,Ugx7z9UrwHR9WGkhxih4AaABAg,vTZ-8ltj7aM,Телеканал Дождь,0,0,Андрюха Бабар,"Вот щас толпа, засидевшаяся на самоизоляции вывалит из домов и обменяется микрофлорой =)
И такое, ребята, начнётся! И диарея, и сопли до колен, и куча всяческой аллергии, и хрен его знает, чего еще... И уйдут все на больничный, только уже реальный.",2020-06-09T10:14:47Z,0
322,UgwmU49RX62xkVnedvd4AaABAg,vTZ-8ltj7aM,Телеканал Дождь,0,0,Виктор Иванович,"Одни нытики здесь, не нравится уезжай 
Я же уехал и понял хрен редьки не слаще 
Вперёд нытики 😭",2020-06-09T10:10:54Z,0
323,UgybilI11qYuMDLWW9h4AaABAg,vTZ-8ltj7aM,Телеканал Дождь,0,1,Владимир Тихонов Тихонов,"Это,что?!!Открывается стойло для рабов.Проталкивают проституцию.",2020-06-09T10:01:53Z,0
324,Ugz63p5pdCYZHmhJ0wh4AaABAg,vTZ-8ltj7aM,Телеканал Дождь,0,0,Владимир Федюков,"Ещё бы скафандр одел долбо.б, в карантин их всех.",2020-06-09T09:48:50Z,0
325,UgwEVTcHjtaZlKh2HIp4AaABAg,vTZ-8ltj7aM,Телеканал Дождь,0,0,Личное Мнение,"Так у нас пол страны без интернета  , а они уроды делают голосование онлайн. Если отменяют пароизоляцию то и голосование оставляйте по старому.. Но только Вам спасибо уже не скажут . Я лично как человек которого уже задолбал эта клоунада, буду мониторить и следить за голосованием . Как увижу что единоросы где-то лазиют и кипятяться за поправки  в конситуцию 1 июля отпизжу.",2020-06-09T09:29:39Z,0
