,id,videoId,authorVideoName,totalReplyCount,likeCount,authorDisplayName,textDisplay,publishedAt,isReply
439,Ugzf_v-OG8uaMs9uVqF4AaABAg,vy7Wi0Ts7PQ,Максим Кац,0,0,rotozeev,"«Зато традиционное общество исключительно хрупко и беззащитно против таких воздействий, к каким совершенно нечувствительно общество гражданское. Достаточно заронить в массовое сознание сомнение в праведности жизни, организованной в идеократическом обществе, или праведности власти в государстве, все устои политического порядка могут зашататься и рухнуть в одночасье. Об этом – «Борис Годунов» Пушкина. Об этом писали в «Вехах» раскаявшиеся либеральные философы после опыта революции 1905 года. Да и вся драма второго акта убийства Российской империи, уже в облике СССР, у нас перед глазами.

Идеократическое общество – сложная, иерархически построенная конструкция, которая держится на нескольких священных, незыблемых идеях-символах и на отношениях авторитета. Утрата уважения к авторитетам и символам – гибель. Если противнику удаётся встроить в эти идеи разрушающие их вирусы, то победа обеспечена. Отношения господства с помощью насилия спасти не могут, ибо насилие должно быть легитимировано теми же самими идеями-символами.

Гражданское общество, состоящее из атомов-индивидуумов, связано бесчисленными ниточками их интересов. Это общество просто и неразрывно, как плесень, как колония бактерий. Удары по каким-то точкам (идеям, смыслам) большого ущерба для целого не производят, образуются лишь локальные дырки и разрывы. Зато эта ткань трудно переносит «молекулярные» удары по интересам каждого (например, экономические трудности). Для внутренней стабильности нужно лишь контролировать «веер желаний» всей колонии таким образом, чтобы не возникало больших социальных блоков с несовместимыми, противоположными желаниями. С этой задачей технология манипуляции сознанием справляется. А борьба по поводу степени удовлетворения желаний вполне допустима, она суть общества не подрывает».  С. Г. Кара-Мурза, Манипуляция сознанием, Алгоритм, 2000",2020-06-11T16:24:07Z,0
440,Ugy97RZOSSU1Tgqwg4R4AaABAg,vy7Wi0Ts7PQ,Максим Кац,0,0,zanzak312,"Кто за то, что нужны дебаты между всеми оппозиционными лидерами мнений на тему ""против"" vs ""бойкот""?
Пока оппозиция так разрознена, она смехотворна в воплощении своем. Надо объединять крупные силы, иначе ничего не изменится)",2020-06-11T16:22:03Z,0
441,Ugz_RYA2hz4X9zceAT54AaABAg,vy7Wi0Ts7PQ,Максим Кац,0,0,The SOLO MAN,Эх,2020-06-11T16:20:52Z,0
442,UgxJRWNIm0cRH_EHY-F4AaABAg,vy7Wi0Ts7PQ,Максим Кац,0,6,Ярик Абрамов,"Кажется, нужно культивировать в окружающих Осознанный Оптимизм, чтобы они знали, что они могут делать с ситуацией, чтобы были готовы эффективно протестовать.",2020-06-11T16:17:56Z,0
443,UgwUSfMrtpIDnCyrT5x4AaABAg,vy7Wi0Ts7PQ,Максим Кац,0,2,Аmira Sr,"Если вы хотите больше узнать о пражской весне, (а это очень интересный феномен!) рекомендую отличное видео на канале Redroom
 https://youtu.be/Mvn3tBvUKHY",2020-06-11T16:17:08Z,0
444,UgwLOTLTXzWbviD03El4AaABAg,vy7Wi0Ts7PQ,Максим Кац,0,0,Tanita Tikaram,"Какая удивительная судьба у В.Гавела. Счастливый человек, боролся и при жизни увидел плоды.",2020-06-11T16:16:20Z,0
445,Ugzr9HoSzazDCcJT2Ft4AaABAg,vy7Wi0Ts7PQ,Максим Кац,0,0,ziq qez,надо делать роли о клептократий,2020-06-11T16:16:05Z,0
446,UgynpDgQPqjNgL6LJil4AaABAg,vy7Wi0Ts7PQ,Максим Кац,0,0,PaLbI4,Большое спасибо. До завтра!,2020-06-11T16:15:23Z,0
447,UgxdESjx1figeZ0rLSx4AaABAg,vy7Wi0Ts7PQ,Максим Кац,0,0,Александр Зверев,Шаман Габышев-российский Гавел.,2020-06-11T16:14:34Z,0
448,Ugx0sjBzK3GKIwGDboh4AaABAg,vy7Wi0Ts7PQ,Максим Кац,0,0,Николай Кузьмин,Отличный кейс!,2020-06-11T16:14:30Z,0
449,Ugzg3sEovV_GjOOfkjR4AaABAg,vy7Wi0Ts7PQ,Максим Кац,0,0,Übermensch 666,"Максим, отличный ролик! Со всех сторон осветили происходившие события в стране, которая, по идее, может стать примером и для России а некоторых областях. Вы и особенности характера личности указываете, и вопросы, связанные с литературой, и дополнительные интересные исторические вопросы. В общем, хвалю! Подписалась сразу на ваш канал)",2020-06-11T16:14:12Z,0
450,UgwwThAmx7mwoXVHiCp4AaABAg,vy7Wi0Ts7PQ,Максим Кац,0,0,Olga Kessel,"Власти всячески призывают идти на голосование, 10 млрд  руб. призов выделил Собянин, другие мэры квартиры обещают разыграть и т. д. Значит надо делать наоборот - ни в коем случае не идти голосовать.",2020-06-11T16:12:22Z,0
451,Ugzsbm1r6vTkqg6oBjB4AaABAg,vy7Wi0Ts7PQ,Максим Кац,0,0,Елена Смирнова,"Только я не понимаю, как деньги перевести?",2020-06-11T16:10:41Z,0
452,UgzACKM3DGugoUw8p3x4AaABAg,vy7Wi0Ts7PQ,Максим Кац,0,0,BuTer Brot,"настолько информативно, что с потом на лице боюсь какой-то ролик пропустить и тем самым в перспективе упустить знания)",2020-06-11T16:08:58Z,0
453,UgzEWy7krluFOaKBG8F4AaABAg,vy7Wi0Ts7PQ,Максим Кац,0,0,PSHTD Poker Online,"Спасибо за материал, у нас в городе есть улица в честь него, а я ранее даже не интересовался кто это",2020-06-11T16:08:04Z,0
454,UgyKee9eN0Mhm9ezhZR4AaABAg,vy7Wi0Ts7PQ,Максим Кац,0,0,Variag,Вацлав про Россию все верно сказал,2020-06-11T16:08:01Z,0
455,UgxkdCBiHTBN0JDH07R4AaABAg,vy7Wi0Ts7PQ,Максим Кац,0,0,Илья Наумов,"Макс, расскажи в одном из следующих видео про польскую Солидарность, плиз. Очень интересно тоже послушать.",2020-06-11T16:07:50Z,0
456,UgzjVYDAE8xyF53XNKR4AaABAg,vy7Wi0Ts7PQ,Максим Кац,0,1,Kate92429,Спасибо вам ещё раз! Каждый день открываю для себя что-то интересное и очень важное!,2020-06-11T16:07:33Z,0
457,UgydZHQuUJesghYeJkt4AaABAg,vy7Wi0Ts7PQ,Максим Кац,0,0,HevnHevn,"Чехия топ, очень комфортно!",2020-06-11T16:05:37Z,0
458,UgzKGA7BChPk-Zz64vx4AaABAg,vy7Wi0Ts7PQ,Максим Кац,0,0,Руслан Садыков,"Максим, я уже дни считал, когда же вы про революцию в Чехословакии напишете. Вы очень последовательны в своих мыслях и высказываниях. Так держать!",2020-06-11T16:05:03Z,0
459,Ugw2QIOZE2KMJyv-o1V4AaABAg,vy7Wi0Ts7PQ,Максим Кац,0,0,солнечный зайчик,"Спасибо, Максим. Просто спасибо",2020-06-11T16:02:54Z,0
460,UgxOHaIlu3unFWy_pUB4AaABAg,vy7Wi0Ts7PQ,Максим Кац,0,0,Галина Кравченко,Максима Каца в президенты!,2020-06-11T16:02:07Z,0
461,Ugx6GH2RKIlvc_0qX9R4AaABAg,vy7Wi0Ts7PQ,Максим Кац,0,1,Pavel Patrin,А где кот?,2020-06-11T16:01:39Z,0
462,Ugx7Ns33_LIm_borC3p4AaABAg,vy7Wi0Ts7PQ,Максим Кац,7,64,Serge Troitskiy,"Отличное видео! Только он густав гУсак. 😁
К сожалению, путь прибалтов, чехов и поляков в России не прокатит. У них был один невероятный козырь – они всем народом воспринимали советский тоталитаризм как внешнюю оккупацию, а у нас это собственное изобретение для самих себя. Поэтому любой критик тоталитарный машины будет обвинён в предательстве родины, причём увы, искреннее и очень многими из народа. Кроме того, к ним социализм пришел в полном объеме только после войны, и при демонтаже этой системы в девяностые годы были ещё живы многие из тех, кто застал старую страну. У нас физически нет живых людей, кто в 1991 помнил хотя бы свободный НЭП, из-за репрессий у многих свободных людей досоветского периода не осталось даже потомков. Гавел был сыном богатых людей эпохи свободной Чехословакии, такие люди в СССР либо сгинули в гулаге, либо всю жизнь молчали в тряпочку и даже детям не говорили, кто были предки. Как ни грустно это осознавать, но нынешняя Россия – плоть от плоти советский народ. Неудивительно, что идеи либерализма и демократии они воспринимают как чуждые иностранные веяния.",2020-06-11T16:00:22Z,0
463,Ugy7gj-ec634LwfAskJ4AaABAg,vy7Wi0Ts7PQ,Максим Кац,0,0,Андрей Рябинин,СССР своей оккупацией Европы по ходу жёстко прогресс тормозило...в 68 году могла Чехия на поправку пойти,2020-06-11T15:59:53Z,0
464,UgwyKLEkFyCgDECS3hB4AaABAg,vy7Wi0Ts7PQ,Максим Кац,0,0,Variag,"Чехи молодцы, сбросили эту заразу  и стали нормальной страной",2020-06-11T15:59:49Z,0
465,UgxOreBuDJ4x0to7b7B4AaABAg,vy7Wi0Ts7PQ,Максим Кац,0,0,Артемий Сальников,"Сейчас все России обожествляют Навального, как тогда в Чехии восхваляли Гавалла!",2020-06-11T15:59:29Z,0
466,UgwmsnsdIttXubqEgv94AaABAg,vy7Wi0Ts7PQ,Максим Кац,0,0,Олег Шишкин,"Не понял, а какого хрена СССР ввёл свои войска в чужую страну? Это как так?",2020-06-11T15:59:09Z,0
467,UgwACZQNjgp8UMGJoA54AaABAg,vy7Wi0Ts7PQ,Максим Кац,0,0,Города и переезды. Где лучше жить?,"Во время ""Пражской весны""были введени в Чехословакию войска не только СССР, но и других стран Варшавского договора, мне кажется это важная деталь!",2020-06-11T15:59:05Z,0
468,UgxAgU7JPEZrE9Yjyw54AaABAg,vy7Wi0Ts7PQ,Максим Кац,0,1,esen cool,Ведь этот ролик тоже считается пропагандистским?? Хоть и изящно завуалирован,2020-06-11T15:58:25Z,0
469,UgyIeaY0MMwBoiCj5up4AaABAg,vy7Wi0Ts7PQ,Максим Кац,0,0,mark mark,"Сними видео про Балтийскую цепь,будет информативно",2020-06-11T15:56:38Z,0
470,UgzWVZ1XxtUFD6XQswx4AaABAg,vy7Wi0Ts7PQ,Максим Кац,1,0,vampir35rusify,"Может свержение коммунизма, а не тоталитаризма и тем более социализма?
Сегодня президент Чехии из левой партии) один из основателей кстати социалистической партии. Значит с социализмом в Чехии не всё так плохо)",2020-06-11T15:54:09Z,0
471,UgzWVZ1XxtUFD6XQswx4AaABAg.99ljwjJZAzt99lpTihUo82,vy7Wi0Ts7PQ,Максим Кац,0,1,shtempel,Социализм здорового человека),2020-06-11T16:42:29Z,1
472,UgzI2V3PBs6Ze2uB0PN4AaABAg,vy7Wi0Ts7PQ,Максим Кац,0,1,Илья Марко,"Эх, жаль, а могла бы быть ещё одним субъектом Российской Федерации. И были бы у неё скрепы, духовность и стабильноть. Владимир Владимирович, надо бы исправить! Не соизволите ли ввести танки в Чехию? А то они там совсем загнивают без Вашего Императорского Величества. Можем повторить?",2020-06-11T15:53:37Z,0
473,UgyV5yg46mDreGfQoO94AaABAg,vy7Wi0Ts7PQ,Максим Кац,0,2,Ivan Meen,"Я год работал на улице Вацлава Гавела, но только благодаря Вашему видео я узнал что-то от этом человеке.",2020-06-11T15:52:42Z,0
474,UgxeNl1oSJxHTeLrM9t4AaABAg,vy7Wi0Ts7PQ,Максим Кац,1,1,Варвар Элитный,"я все-равно не пойму че все так на эту демократию дрочат, человечество тысячелетиями жило при абсолютных монархах и норм было",2020-06-11T15:51:45Z,0
475,UgxeNl1oSJxHTeLrM9t4AaABAg.99ljf78gf5a99lugr2TuCt,vy7Wi0Ts7PQ,Максим Кац,0,0,Player Martian,"Норм было)))) Смотря кем родился- если барином, то норм, а вот бесправным крестьянином не очень.",2020-06-11T17:28:06Z,1
476,Ugwaw_Y1Xlk9Eei28vB4AaABAg,vy7Wi0Ts7PQ,Максим Кац,0,0,Constantin Fedorov,Великолепный выпуск! Спасибо!,2020-06-11T15:47:01Z,0
477,UgzFXYGrMnKyCXpZVIt4AaABAg,vy7Wi0Ts7PQ,Максим Кац,0,0,Alexey,Так вот в честь кого назван пражский аэропорт,2020-06-11T15:45:30Z,0
478,UgyL3QSoqy7Kp6x1ORR4AaABAg,vy7Wi0Ts7PQ,Максим Кац,0,1,dima vytov,"Спасибо, история очень вдохновляющая",2020-06-11T15:44:03Z,0
479,UgxX6hELAkJ2em3X4zh4AaABAg,vy7Wi0Ts7PQ,Максим Кац,0,0,Илья Аралин,Спасибо Максим,2020-06-11T15:43:41Z,0
480,UgxKWSC8IHEZSuNhFix4AaABAg,vy7Wi0Ts7PQ,Максим Кац,0,0,sunoptek,какая же дичь а не видео мы не чехия и револююция по свержениюю власти и революция по отделению от этойй власти немного разное. ну да ладно мирному оппозиционеру при мертвой политике понять что такое охуевшая власть будет сложно,2020-06-11T15:42:45Z,0
481,Ugz3SLg-1gasArLEmWR4AaABAg,vy7Wi0Ts7PQ,Максим Кац,0,0,Serg,у Навального еще есть шансы,2020-06-11T15:41:39Z,0
482,UgwVIpndFAn-rIjFH414AaABAg,vy7Wi0Ts7PQ,Максим Кац,0,0,Andriy Kovtunets,Интиресно услышать мнение о Майдане на Украине,2020-06-11T15:41:30Z,0
483,UgxpwVv4wc_HKhd4dyN4AaABAg,vy7Wi0Ts7PQ,Максим Кац,0,0,Андрей Максимов,"Максим, отличное видео! Расскажите пожалуйста про про движение «солидарность» в Польше.",2020-06-11T15:41:21Z,0
484,Ugyo5qVlV43jpp9rgVt4AaABAg,vy7Wi0Ts7PQ,Максим Кац,0,0,vv,"Охуенное позитивное видео, спасибо! Навеяло мысли о свободной России будущего",2020-06-11T15:41:01Z,0
485,Ugy8nqzKgkXyoLVvye14AaABAg,vy7Wi0Ts7PQ,Максим Кац,0,1,Nerevar Indoril,Можно ролик о протестах 2011 года и почему они провалились?,2020-06-11T15:40:43Z,0
486,UgxbNC3wgTEw_TfLS-R4AaABAg,vy7Wi0Ts7PQ,Максим Кац,0,2,Andrei Telitsin,"приятно посмотреть ролик про хорошего человека. спасибо, Максим Кац!",2020-06-11T15:40:31Z,0
487,UgwMSNZxRr7pQUNJekx4AaABAg,vy7Wi0Ts7PQ,Максим Кац,0,0,King Landish,"пришли какие-то люди и сказали что они главные. Выход есть, эмиграция👍",2020-06-11T15:39:39Z,0
488,Ugw0pKgLSFwM6mNjTYV4AaABAg,vy7Wi0Ts7PQ,Максим Кац,0,0,Andec Key,"Заповедное место, эта ваша Россия. Я не настолько богат знаниями, чтобы ответить, было ли когда кардинально иначе? Чтобы эти люди поменялись, им нужно чуять под собою страну, не страну - землю. 
Благородство и достоинство есть только у кого есть дом. А здесь тайга, пилигриммы-алконавты самые честные люди в стране, искренне радеющие за будущее детей, умнее и добрее любого из нас, это именно они бухие убьют экспедитора.",2020-06-11T15:38:44Z,0
489,UgwjYTumuaVYFoO9uRB4AaABAg,vy7Wi0Ts7PQ,Максим Кац,0,1,Тупой Стив,"Уууу сациализма=тоталитаризм как страшно и ещё правительство у каммунистов назывался дектатурой пралеториата, представьте ДЕКТАТУРОЙ уууу",2020-06-11T15:38:41Z,0
490,UgxCRKor4Wy_38AVGXJ4AaABAg,vy7Wi0Ts7PQ,Максим Кац,0,0,Фёдор Поцелуев,"Это был положительный пример бархатной революции. 

Хотелось бы разборать отрицательный пример. 

Украина. Две «революции достойнства» за 10 лет. 
Результат: беднейшая экономика Европы, потеря территории и гражданская война. 

Почему две украинские бархатные революции окончились провалом, а российская должна увенчаться успехом? 

Без ответа на этот вопрос вы никогда не выведете в России людей на улицу. По крайней мере, за себя могу говорить точно.",2020-06-11T15:37:41Z,0
491,UgwXfhUhEIEs-qH2So54AaABAg,vy7Wi0Ts7PQ,Максим Кац,0,0,Александр Трусов,"Максим ответьте, я как то наткнулся на ролик Варламова годовой давности , где он говорил что вы будете кандидатом 2024, что вы думаете об этом? Я буду только за",2020-06-11T15:37:23Z,0
492,UgztKxnXbH38abDIzFR4AaABAg,vy7Wi0Ts7PQ,Максим Кац,0,1,Risok,"Пожалуйста не читай с суфлера, зрачки дергаются по строкам.",2020-06-11T15:37:01Z,0
493,UgzCffw5qIH3Sce7u6R4AaABAg,vy7Wi0Ts7PQ,Максим Кац,0,0,Скотина Ненужная,"Следующие на очереди - Оливер Кромвель, как мы победили монархию, Жак Дессалин, как мы победили колониализм, Мао Цзе Дун, как мы победили коммунизм, Ким Ир Сен, как мы победили вообще все...  Всякая мелочь типа Чаушеску и Гитлера даже не рассматривается...",2020-06-11T15:36:20Z,0
494,UgwNr1beLTOPN7blKO94AaABAg,vy7Wi0Ts7PQ,Максим Кац,0,0,Алина Репина,Почему можно только один лайк поставить??:(,2020-06-11T15:35:23Z,0
495,UgxMlj2oR7LT1SjwUf94AaABAg,vy7Wi0Ts7PQ,Максим Кац,0,0,Alex Bogdan,Впечатляет рост подписчиков. Вчера помню было на 4 тысячи меньше. Всем добро пожаловать! ☺️ Спасибо автору за труд,2020-06-11T15:34:46Z,0
496,UgzDXN27rNDgj_V0B-h4AaABAg,vy7Wi0Ts7PQ,Максим Кац,0,0,Юрий Бережной,"В Чехии тоталитарного режима не было,был авторитарный.И не самый жёсткий среди режимов ОВД",2020-06-11T15:31:44Z,0
497,Ugw7I1TAHvWg8tqhWc94AaABAg,vy7Wi0Ts7PQ,Максим Кац,0,10,Центрист,Как всегда спасибо за видео! Хотелось бы увидеть выпуск на тему бесполезности и устарелости призывной армии в 21 веке,2020-06-11T15:31:15Z,0
498,Ugx3GRx8VldV_nNUWxB4AaABAg,vy7Wi0Ts7PQ,Максим Кац,0,0,Андрей Лабутин,"Про апатию очень верно сказано. Пожалуй, это и правда сейчас самая главная проблема наших граждан.",2020-06-11T15:30:55Z,0
499,Ugx0kSvYUixXY-sPxNx4AaABAg,vy7Wi0Ts7PQ,Максим Кац,0,0,Elena,"Максим снимает самые понятные и доступные для понимания ролики. Наконец то начинаю понимать нашу историю, хотя и была свидетелем многих событий. Иногда на расстоянии виднее.",2020-06-11T15:30:43Z,0
500,UgzXyYG3sf4FzXwYR5R4AaABAg,vy7Wi0Ts7PQ,Максим Кац,0,0,Psyhros,"Фоновая музыка очень напоминает будильник на телефоне, несколько раз паузил видео, чтобы прислушаться",2020-06-11T15:30:30Z,0
501,UgxtCiQ5LjgSjF4vpEV4AaABAg,vy7Wi0Ts7PQ,Максим Кац,0,0,Ufimec mikki,Спасибо! Респект! Успеха Вам во всём! ))),2020-06-11T15:29:36Z,0
502,UgzmzXadXXVfX3VWgLx4AaABAg,vy7Wi0Ts7PQ,Максим Кац,0,0,Ryuji Takayama,Славный парень был этот чехословак.,2020-06-11T15:25:53Z,0
503,Ugy8r7jVuLvK2DoZsEJ4AaABAg,vy7Wi0Ts7PQ,Максим Кац,0,3,Neutral Good Human,Děkuji Vám moc za video. Было очень интересно послушать об этой выдающейся личности 20 века.,2020-06-11T15:23:25Z,0
504,UgzkP5O206iXZ028I0d4AaABAg,vy7Wi0Ts7PQ,Максим Кац,0,1,January May,Maxim Yevgenyevich is The GOAT!,2020-06-11T15:22:56Z,0
505,UgwUl0A-FwcBHn2C6ct4AaABAg,vy7Wi0Ts7PQ,Максим Кац,0,0,Андрей Кутняк,Поздравляю с 250 к подписчиков!!! Желаю миллион!,2020-06-11T15:22:36Z,0
506,UgzE2jbN7E1sLET56Dh4AaABAg,vy7Wi0Ts7PQ,Максим Кац,4,4,25% Name,"6:40 Украина, 2013 год все аналогично, когда беркутня избила  студентов.",2020-06-11T15:22:07Z,0
