,id,videoId,authorVideoName,totalReplyCount,likeCount,authorDisplayName,textDisplay,publishedAt,isReply
1192,Ugxtrq4AJS-xqHmeJqJ4AaABAg.99lVttj_q9z99lWghea4m7,vy7Wi0Ts7PQ,Максим Кац,0,2,Віктор Хомишак,"шкода принадлежит фолксвагену, так и в России полно автозаводов мировых брендов, ауди в Калуге собирают, мерседес в Солнечногорске, бмв в Калининграде, мазду во Владивостоке, киа и хюндай в Питере, и много много других ...",2020-06-11T13:49:38Z,1
1193,UgxorlWAfZ8mfkofELd4AaABAg.99lVn8Ww1_799sezAeoaA1,vy7Wi0Ts7PQ,Максим Кац,0,0,aktap ius,"@Igor Maffin  ""В данном дискурсе значение слова ""догма"" к церкви не относится"" - так и есть и поэтому я уточнил что может относится не только ""...утверждённое церковью положение вероучения (ну или системы ценностей),..."" хотя может вы читали до того когда я уточнил ну тогда моя вина.
Догмы критикую к примеру законодательство по факту сборник догм(в некоторых случаях  даже религиозных)
утвержденных государство по которым мы обязаны жить иначе попадем в ""гиену огненную""(тюрьму) и его критикуют иногда заслуженно, иногда нет.
Догмы могут меняться даже религиозные к примеру вселенские соборы с их символами веры неоднократно менялись и критиковались внутри церкви но это не отменяет того факта что они догмы",2020-06-14T08:25:29Z,1
1194,UgxorlWAfZ8mfkofELd4AaABAg.99lVn8Ww1_799sa6M_fyh-,vy7Wi0Ts7PQ,Максим Кац,0,0,aktap ius,@Андрей Захаров и в правду..,2020-06-14T07:42:54Z,1
1195,UgxorlWAfZ8mfkofELd4AaABAg.99lVn8Ww1_799m38gF0s9t,vy7Wi0Ts7PQ,Максим Кац,0,0,Igor Maffin,"@aktap ius В данном дискурсе значение слова ""догма"" к церкви не относится. И не знаю, кто вас там закидает, но права человека критикуют и не прекратят критиковать, они менялись и будут меняться, так что у вас ложные выводы из ложных предпосылок.",2020-06-11T18:50:41Z,1
1196,UgxorlWAfZ8mfkofELd4AaABAg.99lVn8Ww1_799m1fd3ElXm,vy7Wi0Ts7PQ,Максим Кац,0,0,aktap ius,"@Igor Maffin  До́гма́т, или до́гма (др. -греч. δόγμα, δόγματος «мнение, решение, постановление») — утверждённое церковью положение вероучения (ну или системы ценностей), объявленное обязательной и истиной, не подлежащей критике или сомнению.
А догмати́зм (от др.-греч. δόγμα «мнение, учение; решение») — способ мышления, оперирующий догмами (считающимися неизменными вечными положениями, не подвергаемыми критике) и опирающийся на них.
так как права человека не могут быть подвергнуты критики ибо вас закидают чем только можно то  следовательно права человека являются догматом :)
нормальные люди опираются на догмат следовательно они  догматичны а догматизм порождает мракобесие  следовательно нормальные люди = мракобесы , а у мракобесов диалектика и классовое мышление(и насилие).
следовательно у нормальных людей права человека диалектика и классовое мышление и насилие.

(P.S Короче все нормальные люди мракобесы. =))",2020-06-11T18:37:50Z,1
1197,UgxorlWAfZ8mfkofELd4AaABAg.99lVn8Ww1_799l_tvztudW,vy7Wi0Ts7PQ,Максим Кац,0,1,Igor Maffin,"Догматизм порождает мракобесие, а мракобесие порождает насилие. У нормальных людей права человека, а у мракобесов до сих пор диалектика и ""классовое мышление""",2020-06-11T14:26:23Z,1
1198,UgxorlWAfZ8mfkofELd4AaABAg.99lVn8Ww1_799lZ6vVlIp0,vy7Wi0Ts7PQ,Максим Кац,0,1,Андрей Захаров,"Звучит как диалектика. Хотя, с учётом дуализма это и есть диамат.",2020-06-11T14:10:49Z,1
1199,UgztZNuASToTng-bvs54AaABAg.99lVM2ljRQF99stAiTHBpC,vy7Wi0Ts7PQ,Максим Кац,0,0,worldoftancraft,"Ну и давно Свабодные Люди переизбрали где-то компрадора на ""нормальных"" буржуев, не расскажешь? Привычечник херов",2020-06-14T10:29:31Z,1
1200,UgztZNuASToTng-bvs54AaABAg.99lVM2ljRQF99sUTcCQ3Nj,vy7Wi0Ts7PQ,Максим Кац,0,2,Федор Ковригин,"@Александр Иванов Вася, умеет производить скрипки. Он мастер в этом деле, и не один забугорный спец, ему не ровня. Он хочет наладить производство своих изделий во все страны мира, тем самым подняв Россию в экономическом плане. Но как только он начинает продавать, он сталкивается с проблемами, которые присутствуют конкретно в России. Некому не нужны его скрипки, ведь у всех бюджетников ЗП не больше 20к, им нужно выжить, а не покупать такие вещи, как картины и музыкальные инструменты. Из-за этого и концерты, которые будут проходить с участием этой скрипки, будут смотреть 50чел. Васе придётся идти на рынок первой необходимости и продовать хлеб, а там его уничтожат манаполисты. Теперь Вася живёт в Германии, где его скрипки сразу нашли огромный спрос и поддержку. Германия теперь знаменита лучшими скрипками планеты, все остальные страны закупают у них скрипки.
P. S история выдуманная, но все сюжетные повороты обоснованны",2020-06-14T06:44:55Z,1
1201,UgztZNuASToTng-bvs54AaABAg.99lVM2ljRQF99rEqr3SOHx,vy7Wi0Ts7PQ,Максим Кац,0,0,Pierre Le Bourreau,@Александр Курбатов  Говори прямо - друзей Путина. Олигархов больше нет. Олигархи должны иметь возможность влиять на политику. Видишь что-то похожее? Не путай капитализм с поздним феодализмом,2020-06-13T19:09:10Z,1
1202,UgztZNuASToTng-bvs54AaABAg.99lVM2ljRQF99rD1tbNbwU,vy7Wi0Ts7PQ,Максим Кац,0,1,Pierre Le Bourreau,"@Александр Курбатов  Ну, вот роснефть и роскосмос в государственных руках. ИП вскорости действительно останутся без наёмных рабочих из-за кризиса. Доходы делают прозрачными некоторые расследователи. Ты чувствуешь приближение своего идеала?",2020-06-13T18:53:20Z,1
1203,UgztZNuASToTng-bvs54AaABAg.99lVM2ljRQF99r3NqEggLN,vy7Wi0Ts7PQ,Максим Кац,0,1,Pierre Le Bourreau,@Александр Курбатов  То есть ты готов снова продать свой выбор за гарантированное место в стойле. Поздравляю. Тут всё,2020-06-13T17:28:57Z,1
1204,UgztZNuASToTng-bvs54AaABAg.99lVM2ljRQF99qxT0SDatv,vy7Wi0Ts7PQ,Максим Кац,0,1,Pierre Le Bourreau,"@Александр Курбатов Задача нынешнего режима - убедить народ, что выборы не решают ничего. Чтобы как при совке - выигрывал только один кандидит",2020-06-13T16:28:30Z,1
1205,UgztZNuASToTng-bvs54AaABAg.99lVM2ljRQF99qNh02Yncf,vy7Wi0Ts7PQ,Максим Кац,0,0,Pierre Le Bourreau,@Мариан Ангелов  О том и речь,2020-06-13T11:07:12Z,1
1206,UgztZNuASToTng-bvs54AaABAg.99lVM2ljRQF99qLmFVyl5u,vy7Wi0Ts7PQ,Максим Кац,0,0,Сергей Савченко,"@Michael B какое качество? Причём здесь  количество? Мы , альфа и омега, вы , пыль на наших сапогах. Мы , режиссеры спектакля, мы же и зрители, созерцающие очередную комедию, вы статисты нашей комедии, под названием ""выборы"". Мы господа, вы , нам принадлежащая чернь - хамово отродье. Так, я думаю покороче? Так, вам понятнее?))))",2020-06-13T10:50:28Z,1
1207,UgztZNuASToTng-bvs54AaABAg.99lVM2ljRQF99qDm5zB-6C,vy7Wi0Ts7PQ,Максим Кац,0,1,latechik,"Вспоминается серия Южного парка про выборы в которой участвуют клизма и сендвичь с дерьмом, ахахах",2020-06-13T09:40:33Z,1
1208,UgztZNuASToTng-bvs54AaABAg.99lVM2ljRQF99qDAgp7S6m,vy7Wi0Ts7PQ,Максим Кац,0,3,Мариан Ангелов,@Pierre Le Bourreau убери диктатора - система лопнет.,2020-06-13T09:35:18Z,1
1209,UgztZNuASToTng-bvs54AaABAg.99lVM2ljRQF99qD58TRkne,vy7Wi0Ts7PQ,Максим Кац,0,1,Мариан Ангелов,"В смысле кто? Я отвечаю - Жуков, Шульман, Кац, Навальный. За Ходора люди не проголосуют, так что отпадает. Более того, наверняка появятся ещё имена",2020-06-13T09:34:32Z,1
1210,UgztZNuASToTng-bvs54AaABAg.99lVM2ljRQF99q1Hh5fcBM,vy7Wi0Ts7PQ,Максим Кац,0,1,Michael B,"Сергей Савченко, количество не всегда переходит в качество. Справьтесь со своим волнением, и выражайте свои мысли кратко и понятно. Пессимисты тоже могут и даже должны, для начала, проголосовать против поправок. :)",2020-06-13T07:51:24Z,1
1211,UgztZNuASToTng-bvs54AaABAg.99lVM2ljRQF99ppc3cHiCr,vy7Wi0Ts7PQ,Максим Кац,0,0,Сергей Савченко,"Кудонечно другой и обязательн лючшьий! Тебе дадут выбрать кандидатовет , где каждый, будет лучше, чем все остальные, вместе взятые. И ты обязан будешь выбрать, самого лучшего. Или ты надеешся, что ты, и твои единомышленники, предоставите СВОЕГО кандидата? Серьёзно? А деньги, у вас есть? А нищеброды? Слава создателю, что мы живём в капиталистической стране, а потому, вы оборванцы, будете голосовать за тех, за кого мы вам позволим. Власть, сила и право, право применять силу, есть  только у нас. И ваш президент, будет только нашей марионеткой. Основная наша задача, что бы вы, проголосовали. Проголосуете, значит сделаете , нашу куклу , легитимной, ну а дальше, ваши карманы, в наших руках, посредством законов, которые примет наша кукла. Грязные скоты, вы хотели демократии??? Так вот же она! Это наша демократия, наша и для нас, но вы, скоты, всего лишь налогоблагаемая база, субстрат, на котором произрастает наше благосостояние, навоз, удобрение. Вы действительно поверили, что у навоза, может быть демократия?!!!! Хвала небесам, что вы , и такие как аффтар, есть на этой земле! Вы даже не представляете, как вас, тупое было, просто держать в узде, при таком положении вещей. Кац, жги! Больше роликов! Капитализм! Счастье! Заэпписсс!!!!",2020-06-13T06:00:43Z,1
1212,UgztZNuASToTng-bvs54AaABAg.99lVM2ljRQF99ogMFM8bbn,vy7Wi0Ts7PQ,Максим Кац,0,0,Michael B,"Artur Nilin, вы правы. В России нужен ровно такой мужик, который не будет гнобить инакомыслящих, для начала.",2020-06-12T19:20:32Z,1
1213,UgztZNuASToTng-bvs54AaABAg.99lVM2ljRQF99oeKkZYV2o,vy7Wi0Ts7PQ,Максим Кац,0,0,Artur Nilin,"Вот эти темы о надежде на хорошего мужика не подходят. Вот был Гавел, был Сталин, но это не работает, т.к. если у вас все держится не на системе общественных отношений, а на хорошем мужике, или на субъективных качествах отдельных людей, то такая система никуда не годится.",2020-06-12T19:02:52Z,1
1214,UgztZNuASToTng-bvs54AaABAg.99lVM2ljRQF99odpEJt3tR,vy7Wi0Ts7PQ,Максим Кац,0,0,Artur Nilin,"Вот в США избирали и негров и демократов и прочих - че то не помогает. Все зависит от того, на каких условиях вы встроились в капсистему. РФ встроилась на правах сырьевого придатка.",2020-06-12T18:58:25Z,1
1215,UgztZNuASToTng-bvs54AaABAg.99lVM2ljRQF99odewhPCPz,vy7Wi0Ts7PQ,Максим Кац,0,0,Артем Дорохин,"А я говорю, что любой из 50000 сотрудников ФСБ",2020-06-12T18:57:01Z,1
1216,UgztZNuASToTng-bvs54AaABAg.99lVM2ljRQF99o1Q0SBJrO,vy7Wi0Ts7PQ,Максим Кац,0,0,Магомед-Али Товсултанов,"@LEGO man К сожалению, так.",2020-06-12T13:14:03Z,1
1217,UgztZNuASToTng-bvs54AaABAg.99lVM2ljRQF99nxl7sASBd,vy7Wi0Ts7PQ,Максим Кац,0,1,Michael B,"LEGO man , по тому кто лучше противостоит настоящим Российским проблемам: коррупции и беззакония.",2020-06-12T12:33:23Z,1
1218,UgztZNuASToTng-bvs54AaABAg.99lVM2ljRQF99nxRUenQ94,vy7Wi0Ts7PQ,Максим Кац,0,2,Michael B,"Алина Китаева, для будущего России принцип сменяемости власти важнее чем отдельно взятый кандидат, даже если это Путин.",2020-06-12T12:30:34Z,1
1219,UgztZNuASToTng-bvs54AaABAg.99lVM2ljRQF99noCUlvgWE,vy7Wi0Ts7PQ,Максим Кац,0,0,LEGO man,@Магомед-Али Товсултанов прям всё население такое?),2020-06-12T11:09:52Z,1
1220,UgztZNuASToTng-bvs54AaABAg.99lVM2ljRQF99nmH28npzR,vy7Wi0Ts7PQ,Максим Кац,0,2,Магомед-Али Товсултанов,"@LEGO man Кто лучший кандидат, можно понять по населению которое: а)жаждет искать халявы; б)ведет себя лениво и невежественно; в)поддерживает оккупацию чужих территорий.",2020-06-12T10:53:01Z,1
1221,UgztZNuASToTng-bvs54AaABAg.99lVM2ljRQF99nlBf0LTDU,vy7Wi0Ts7PQ,Максим Кац,0,0,LEGO man,А как понять кто лучший?),2020-06-12T10:43:33Z,1
1222,UgztZNuASToTng-bvs54AaABAg.99lVM2ljRQF99nckULG1jQ,vy7Wi0Ts7PQ,Максим Кац,0,0,Магомед-Али Товсултанов,"@Алина Китаева Он останется до тех пор, пока: а) не сыщет своего преемника и б) пока не помрет сам. Третьего не дано!",2020-06-12T09:29:48Z,1
1223,UgztZNuASToTng-bvs54AaABAg.99lVM2ljRQF99ncaVHFB61,vy7Wi0Ts7PQ,Максим Кац,0,1,Александр Иванов,"@Федор Ковригин нет, мы живём в говне потому что мы ленивые нихренанеделатели, которые не умеют ничего производить. Разруха не в сортирах, а в головах.",2020-06-12T09:28:26Z,1
1224,UgztZNuASToTng-bvs54AaABAg.99lVM2ljRQF99nc9l-7ovU,vy7Wi0Ts7PQ,Максим Кац,0,0,Алина Китаева,каждый может придти во власть. Но в нынешнее время Путин лучший кандидат,2020-06-12T09:24:38Z,1
1225,UgztZNuASToTng-bvs54AaABAg.99lVM2ljRQF99m2W0eEw5R,vy7Wi0Ts7PQ,Максим Кац,0,2,Магомед-Али Товсултанов,"@Федор Ковригин Ах вот ты какой ""оппозиционер""?))) Да ты хуже путиноидов😂😂😂",2020-06-11T18:45:08Z,1
1226,UgztZNuASToTng-bvs54AaABAg.99lVM2ljRQF99m-CDM834U,vy7Wi0Ts7PQ,Максим Кац,0,0,Федор Ковригин,"@Магомед-Али Товсултанов  идите нахрен со своей некому не нужной информацией, которой вы напичкались, становясь ""адекватным"", а на деле напились воды, с которой любой школ ник знаком",2020-06-11T18:16:13Z,1
1227,UgztZNuASToTng-bvs54AaABAg.99lVM2ljRQF99lwjLGnNIL,vy7Wi0Ts7PQ,Максим Кац,0,6,AlexTheUnknown90,"Я тут с Шульман солидарен: любой кандидат (и его команда), победивший на честных и конкурентных выборах, способен управлять государством.",2020-06-11T17:45:55Z,1
1228,UgztZNuASToTng-bvs54AaABAg.99lVM2ljRQF99lq43TgcbP,vy7Wi0Ts7PQ,Максим Кац,0,2,Prokhor,Даже рулон линолеума будет лучше путина.,2020-06-11T16:47:43Z,1
1229,UgztZNuASToTng-bvs54AaABAg.99lVM2ljRQF99lhr8786zB,vy7Wi0Ts7PQ,Максим Кац,0,1,Магомед-Али Товсултанов,"@Федор Ковригин Услышите. Не пожалеете. Для вас - оно новое. А для адекватных людей, которые осознали механизм правительственной системы - новым перестало быть.",2020-06-11T15:35:55Z,1
1230,UgztZNuASToTng-bvs54AaABAg.99lVM2ljRQF99lh2-7bW3V,vy7Wi0Ts7PQ,Максим Кац,0,0,Федор Ковригин,@Магомед-Али Товсултанов я его вообще не смотрел. Что-то новое я там врятле услышу,2020-06-11T15:28:47Z,1
1231,UgztZNuASToTng-bvs54AaABAg.99lVM2ljRQF99lgbmbimax,vy7Wi0Ts7PQ,Максим Кац,0,0,Магомед-Али Товсултанов,@Федор Ковригин Вы полностью досмотрели видео?,2020-06-11T15:25:05Z,1
1232,UgztZNuASToTng-bvs54AaABAg.99lVM2ljRQF99lgQHOuZOO,vy7Wi0Ts7PQ,Максим Кац,0,1,Федор Ковригин,"@Магомед-Али Товсултанов это видео куплено и пропитано ""да плохо, но могло быть хуже"" терпите, терпите и пахайте на чиновников",2020-06-11T15:23:22Z,1
1233,UgztZNuASToTng-bvs54AaABAg.99lVM2ljRQF99lgCS_x9ic,vy7Wi0Ts7PQ,Максим Кац,0,13,Инак Черновцев,"Кто, если не Путин? Да никто. Не должно быть поста с таким уровнем полномочий.",2020-06-11T15:21:29Z,1
1234,UgztZNuASToTng-bvs54AaABAg.99lVM2ljRQF99lg7W5HTt8,vy7Wi0Ts7PQ,Максим Кац,0,7,Федор Ковригин,"@Магомед-Али Товсултанов из-за функций предшественника, мы и живём в говне. Если ты не из регионального центра конечно, в котором чтобы квартиру купить, придётся 30 лет в мухосранске пахать, отказывая себе во всём и питаясь исключительно манкой с водой",2020-06-11T15:20:48Z,1
1235,UgztZNuASToTng-bvs54AaABAg.99lVM2ljRQF99lg3ovwjK7,vy7Wi0Ts7PQ,Максим Кац,0,0,Магомед-Али Товсултанов,@Сергей Чернышев https://youtu.be/K9mQamBauZ8,2020-06-11T15:20:18Z,1
1236,UgztZNuASToTng-bvs54AaABAg.99lVM2ljRQF99lfZ6quPSS,vy7Wi0Ts7PQ,Максим Кац,0,0,Магомед-Али Товсултанов,@Сергей Чернышев Правда я не кремле- а порохобот 😂😂😂,2020-06-11T15:15:50Z,1
1237,UgztZNuASToTng-bvs54AaABAg.99lVM2ljRQF99lfTxD7JpY,vy7Wi0Ts7PQ,Максим Кац,0,0,Магомед-Али Товсултанов,"@Федор Ковригин ""Достойным преемником"" может быть любой, даже Навальный, который будет соблюдать функции предшественника.",2020-06-11T15:15:08Z,1
1238,UgztZNuASToTng-bvs54AaABAg.99lVM2ljRQF99lfMO8E1YF,vy7Wi0Ts7PQ,Максим Кац,0,0,Магомед-Али Товсултанов,"@Сергей Чернышев Вы меня неправильно поняли. Я сказал что вам не удастся свергнуть его ни мирным, ни даже силой.",2020-06-11T15:14:06Z,1
1239,UgztZNuASToTng-bvs54AaABAg.99lVM2ljRQF99lep_-adMX,vy7Wi0Ts7PQ,Максим Кац,0,7,Сергей Чернышев,"@Магомед-Али Товсултанов ловите бота!... Передайте ему 15шку, пожалуйста",2020-06-11T15:09:29Z,1
1240,UgztZNuASToTng-bvs54AaABAg.99lVM2ljRQF99ldl0DUpwF,vy7Wi0Ts7PQ,Максим Кац,0,33,Федор Ковригин,"@Магомед-Али Товсултанов а зачем нам ""достойный преемник"", который будет просто вторым путиным? Путин и так преемник Ельцина...",2020-06-11T15:00:07Z,1
1241,UgztZNuASToTng-bvs54AaABAg.99lVM2ljRQF99lcrMMQZDA,vy7Wi0Ts7PQ,Максим Кац,0,4,Магомед-Али Товсултанов,"Кто, если не Путин? Да кто угодно, лишь бы Путин. Потому что у него достойного преемника нет. Посмотрите видео Василия Солодова под названием ""Когда уйдет Путин?"".",2020-06-11T14:52:15Z,1
1242,UgztZNuASToTng-bvs54AaABAg.99lVM2ljRQF99l_gIkVdNy,vy7Wi0Ts7PQ,Максим Кац,0,11,Pierre Le Bourreau,Только диктаторы и диктатуры незаменимы. Разве это не не странно?,2020-06-11T14:24:32Z,1
1243,UgztZNuASToTng-bvs54AaABAg.99lVM2ljRQF99l_evWDxTF,vy7Wi0Ts7PQ,Максим Кац,0,27,wasting the dawn,"если не Путин, то Кац....",2020-06-11T14:24:20Z,1
1244,UgwzgW7TkbigyJl2Rpd4AaABAg.99lV9rgG8QS9A9eRkhzZ6h,vy7Wi0Ts7PQ,Максим Кац,0,0,images,"получается Гавел ничего не добился, раз в 89ом судили его опять, это ж дострадался до Ельцина, без особого результата",2020-06-21T08:07:06Z,1
1245,UgwzgW7TkbigyJl2Rpd4AaABAg.99lV9rgG8QS99wCe4BSC1j,vy7Wi0Ts7PQ,Максим Кац,0,1,Даниїл Мавриненко,Привіт із Луцька!),2020-06-15T17:26:09Z,1
1246,UgwzgW7TkbigyJl2Rpd4AaABAg.99lV9rgG8QS99v75PS7uIm,vy7Wi0Ts7PQ,Максим Кац,0,0,Єлена К.,"@frugtik, 🌺",2020-06-15T07:18:21Z,1
1247,UgwzgW7TkbigyJl2Rpd4AaABAg.99lV9rgG8QS99uyx7jz7nZ,vy7Wi0Ts7PQ,Максим Кац,0,2,frugtik,@Єлена К. привет любимому Киеву с Вацлавской площади (Прага)!,2020-06-15T05:58:27Z,1
1248,UgwzgW7TkbigyJl2Rpd4AaABAg.99lV9rgG8QS99nbmPEQbM7,vy7Wi0Ts7PQ,Максим Кац,0,1,Алина Китаева,Как все совпало то у Вас,2020-06-12T09:21:19Z,1
