,id,videoId,authorVideoName,totalReplyCount,likeCount,authorDisplayName,textDisplay,publishedAt,isReply
0,UgycnVxcXCiXSd7VklR4AaABAg,xYltzmQoiL4,Телеканал Дождь,0,0,Любовь Катлеренко,"Корреспондннты едут уже не по Сочи! 29 февраля 2020 года вся эта территория вместе со всеми олимпийскими обьектами была от Сочи отчуждена! Создана новая административно-территориальная единица - город Сириус! Даже многие сочинцы об этой тайной акции не знают. Живут в одном, а работают уже в другом городе!!!!!!",2020-06-30T14:42:23Z,0
1,UgwHSEBQIvnZhfCM6Hp4AaABAg,xYltzmQoiL4,Телеканал Дождь,0,0,Мозяка Мозякин,А что вы хотели? Приехать и жить за 200 рублей чтоб все включено было? В нашей стране уже давно нет таких цен! Где есть прибыль тут же появляются халявщики готовые задушить твой бизнес если не дашь на лапу! Вот и по этому цены такие у нас в стране! Вы же голосовали за такую жизнь так что не нойте!,2020-06-29T18:17:11Z,0
2,UgyYR1DEzSaMdrXFqOB4AaABAg,xYltzmQoiL4,Телеканал Дождь,0,0,Gugo Poitie,"Нет, объясните мне, если весь краснодарский край настолько заинтересован в окончании пандемии, почему все без масок? Почему все пренебрегают  санитайзерами  и социальной дистанцией? Почему такое легкомысленное отношение к пандемии? Да вы преступники по отношению к народу и к своему бизнесу!",2020-06-28T21:44:22Z,0
3,UgyYtAfxnI5cHEF6IMl4AaABAg,xYltzmQoiL4,Телеканал Дождь,0,0,Дмитрий Чалый,"А Вы Мария, как и большинстао нынешних россиян, очень  ""добродушные"", умеете ""сочувствовать""!",2020-06-28T07:35:15Z,0
4,Ugyz8zoNyLoY0zuXxDp4AaABAg,xYltzmQoiL4,Телеканал Дождь,0,0,Оля Яло,"Это ВОЙНА,  бред, бред, бред... дожили...",2020-06-28T04:03:45Z,0
5,UgwqDglmdB1uk3DmuKp4AaABAg,xYltzmQoiL4,Телеканал Дождь,0,0,Pablito,"Какая нах Красная Поляна, если рядом душевная человеческая Грузия Гудаури",2020-06-27T15:01:41Z,0
6,UgwofGYz_7DCoQ8SPth4AaABAg,xYltzmQoiL4,Телеканал Дождь,0,0,малиновый зелёный клин,"Приедут, граница на замке",2020-06-27T10:30:08Z,0
7,UgynOCWSGfEVdNMywwN4AaABAg,xYltzmQoiL4,Телеканал Дождь,0,0,Ирина Зотова,ЦЕНЫ.ЗАОБЛАЧНЫЕ А СЕРВИС НИЗКОПАШИБНЫЙ ЭТО СРЕДНИЙ КЛАСС'    ' А ЗА ГРАНИЦЕЙ УРОВЕНЬ ПРИЕМА ГОСТЕЙ НАМНОГО ВЫШЕ А ЦЕНЫ НАМНОГО НИЖЕ!!!! А НАШИМ   ВСЕ МАЛО'''    ',2020-06-27T09:55:15Z,0
8,UgxDA7KSmodSK4Z5Jzt4AaABAg,xYltzmQoiL4,Телеканал Дождь,0,1,Артем Юрьев,Летали вдвоем!Один перелет что стоит) В 2019 Москва Сочи Сочи Москва авиакомпанией победа 37т.р проживание на 14 календарных дней составило 73т.р потратили на себя 40т.р Не дешево далеко не дешево,2020-06-26T12:41:56Z,0
9,Ugyq2C202TCIJoxFaUl4AaABAg,xYltzmQoiL4,Телеканал Дождь,0,0,Алексей,Канал брехни !!!,2020-06-26T09:16:47Z,0
10,UgzJuJmMfgs9Pq66tpl4AaABAg,xYltzmQoiL4,Телеканал Дождь,0,1,Лейла Медведева,"Они цены задрали в 3 раза! Вот пусть думают, надо цены адекватные делать, что бы привлечь туристов. Пусть ждут своих иностранцев....",2020-06-26T06:54:01Z,0
11,UgyE9pOrt6XSRmEqw_h4AaABAg,xYltzmQoiL4,Телеканал Дождь,0,0,MrAmadey,А в Крыму нормалёк ;),2020-06-25T12:25:45Z,0
12,UgywmU9WOGRQaKf-LGZ4AaABAg,xYltzmQoiL4,Телеканал Дождь,0,0,Александр Борисов,"чепушила ты Андреев,а не предпринимтель",2020-06-24T18:45:44Z,0
13,Ugx7Gx-ILfFx9OoyJbJ4AaABAg,xYltzmQoiL4,Телеканал Дождь,0,0,О Г,"Чача🤣🤣🤣🤣сплошной суррогат, местные это говно не пьют, только бздвхам предлагают🤣🤣",2020-06-24T14:47:10Z,0
14,UgwsEYmFkjmzKNzo9Oh4AaABAg,xYltzmQoiL4,Телеканал Дождь,0,1,Дмитрий К,сочи фу!!!!!!!!!!!!!!!!,2020-06-24T12:41:18Z,0
15,UgwcJpQ2kJaPfJtmEhh4AaABAg,xYltzmQoiL4,Телеканал Дождь,0,1,Гоша Русский,"Нет у нас денег ехать отдыхать,не злите народ..",2020-06-24T06:51:59Z,0
16,UgzX8vnyk50WEfdD8P54AaABAg,xYltzmQoiL4,Телеканал Дождь,0,0,Lyudmila Boltneva,"Организованный ХАОС!!!Пишу из Италии,все как под копирку ситуация!Езжу в Венецию., очень медленно люди приходят в себя.Да мозги надо включить и повернуть мозг как выжить.Поделюсь наблюдениями,очень многие Европе задумываются серьезно о ,, минимализме,,Кто любит путешествовать ищут очень дешёвые отельчики или частный сектор,(БНБ)Главное не ныть.На сегодня туризм в Италии отброшен на 20 лет назад. Ну да открыли Венецию,а народу мало очень,налоги все равно надо платить,за квартиру,свет,газ и т. д.Короче.......опустили ниже плинтуса весь мир!",2020-06-23T16:26:36Z,0
17,UgwKwsNmIpjZvwlh14p4AaABAg,xYltzmQoiL4,Телеканал Дождь,0,0,Гульнара Яхина,Когда же вас закроют?,2020-06-23T16:03:31Z,0
18,UgxHmt2vEsmE0tNOcwJ4AaABAg,xYltzmQoiL4,Телеканал Дождь,0,1,алекс новиков,чихал я на вашу сочи,2020-06-23T14:34:09Z,0
19,UgwWOvXvBLvXZfcgjnF4AaABAg,xYltzmQoiL4,Телеканал Дождь,0,0,Наталья Мамонова,"Самый крупный налогоплательщик края-Новороссийск, с портом и лукойлом, ни то, ни другое не остановили, но закрыли всю торглвлю, кроме прод.товаров. Так как мы не живем за счет сдачи койко-мест на сезон, мы доедаем последний хрен без соли)))))) торговлю открыли в начале июня, центры в 20х числах... Вот будем работать и рассчитываться с долгами по жкх, за 2.5 месяца сидения дома. Надеюсь к концу лета заработаем) Всем добра!!!!!!!!",2020-06-23T14:22:50Z,0
20,Ugx0p1C7FyjXlAmr1b14AaABAg,xYltzmQoiL4,Телеканал Дождь,0,0,redbullredbulls,"был проездом  в Сочи и мне хватило чтобы в этот ""город"" не приезжать и не собираюсь.",2020-06-22T17:07:22Z,0
21,UgzSCK4qX4nUQR2oIxB4AaABAg,xYltzmQoiL4,Телеканал Дождь,0,0,Suzzi Flekks,Ну теперь то край ваш с небес то спустится .,2020-06-22T16:18:30Z,0
22,UgyKA5wKQU3R5w3o8v54AaABAg,xYltzmQoiL4,Телеканал Дождь,0,0,Suzzi Flekks,"Больше на море ни кто не поедет ,  средний клас с зарплатами в 17 тысяч на Мальдивы рванул.",2020-06-22T16:12:04Z,0
23,Ugw8_T9gfc7bF4HnlEd4AaABAg,xYltzmQoiL4,Телеканал Дождь,0,0,zhdant,"Ставить под удар свой единственный отпуск тем, что после открытия сразу лететь в Сочи или Геленджик - это безумие. Находиться постоянно в переживаниях, что на этаже в гостинице выявят заболевшего и тебя принудительно закроют на этом этаже до окончания оплаченного тобой периода (это официально заявлено, а не мои придумки). Нафиг вообще такой отпуск? Без концертов, без фестивалей, а с масками и перчатками? 
Лучше уж не сорить деньгами не обдуманно, а подождать открытия Турляндии. С сентября они 100% начнут пускать, а возможно и раньше. И представьте, как дешево можно будет отдохнуть в Турции или даже Испании после запуска их курортов? А летом и в Москве норм, вон на Варшавке недавно можно было SUP-бордингом спокойно заниматься.))",2020-06-22T10:34:33Z,0
24,Ugwp0gF2NnA3uRisy2V4AaABAg,xYltzmQoiL4,Телеканал Дождь,0,0,Andrey Zelenin,АУУУ СОЧИ   ПОЧИТАЙТЕ КОММЕНТЫ О СЕБЕ ВНИЗУ  НАРОДА,2020-06-22T05:29:03Z,0
25,UgyotIH1ePJfDX9fubN4AaABAg,xYltzmQoiL4,Телеканал Дождь,0,0,vladimir groos,"я искрини рад ,что это происходит с этими ,,типо,,курортным бизнесом !!там всё равно нехрен делать с этими рвачами!",2020-06-22T02:38:17Z,0
26,Ugz5vo080uEiV1wvjmB4AaABAg,xYltzmQoiL4,Телеканал Дождь,0,0,Екатерина Александровна,Комментарии просто огонь! Все сказано...,2020-06-21T22:17:48Z,0
27,UgzR9Aa15qGrCmbBfgl4AaABAg,xYltzmQoiL4,Телеканал Дождь,0,0,Garry Gold,Что там делать в Красной поляне летом ? Посмотреть на новодел ?,2020-06-21T18:27:19Z,0
28,UgytW654uy1eC2i-aL54AaABAg,xYltzmQoiL4,Телеканал Дождь,0,0,Dan Ch,"Сочи и Крым - это две дыры - сервиса нет, цены заоблачные...",2020-06-21T17:33:25Z,0
29,UgxKtMf8y_Tu4K47DQV4AaABAg,xYltzmQoiL4,Телеканал Дождь,0,0,Ветер Ветров,"Мусорилло красавец кубанойд, муж будет давать! Еще б напиздил ей, что б не ахуевала, звезда.",2020-06-21T13:29:51Z,0
30,Ugw8H6KQO8OP8igACI14AaABAg,xYltzmQoiL4,Телеканал Дождь,0,0,Гранитная мастерская Мочалов А.Н.,"Ну, что наступило то время, когда без туристов стало плохо? Помню как сочинцы кидались словами- понаехали, все засрали, без вас выживем. Вот и выживайте, у вас же много производств, заводов, сельского хозяйства. Или все к нам в Москву на заработки?",2020-06-21T13:06:37Z,0
31,Ugx6CQV6m54aIAW2QC14AaABAg,xYltzmQoiL4,Телеканал Дождь,0,0,Лариса Нестерова,"Алексей, спасибо за репортаж из Сочи! У меня в этом году тоже пропала бронь в г. Сочи.., к сожалению",2020-06-21T12:57:29Z,0
32,UgwQqmRMT9POY6hHGKJ4AaABAg,xYltzmQoiL4,Телеканал Дождь,0,0,Gala Gala,"Ребята, тут не про это разговор. Властям наплевать на людей и бедных и не очень. Нас всех зовут активно принимать поправки, и голосовать за  президента и нынешнюю власть. Сейчас всем трудно и не нужно злорадствовать. А нужно объединиться и подумать о нашем будущем.",2020-06-21T12:25:48Z,0
33,Ugw_E3HBkrl9zJb_QiR4AaABAg,xYltzmQoiL4,Телеканал Дождь,0,0,Kokosya Aziya,👍👍👍,2020-06-21T10:06:18Z,0
34,UgxOX8B0nW0w2Ci8mIZ4AaABAg,xYltzmQoiL4,Телеканал Дождь,0,0,Альвина Литвин,"Все в Карелию! Недалеко, бюджетно, чистый воздух, много зелени и водные просторы. Июнь, июль-жара!",2020-06-21T09:28:27Z,0
35,UgxbPktKS_LCs-9yz5l4AaABAg,xYltzmQoiL4,Телеканал Дождь,0,0,Иван П,"Только приехал из Сочи. Сам Сочи обычный туристический приморский город, ничего особенного не увидел. Народа да, довольно мало, всё свободно, просторно, и от этого такой кайф. Пляжи вообще отстой, тем более был в Дубае в марте, там назагорался. Но природа вокруг Сочи и Адлера просто нереальная, горы, каньены, реки, леса, честно я был в шоке. Обязательно вернусь!",2020-06-21T09:14:14Z,0
36,UgzV81r0BMOZ1hdOs-p4AaABAg,xYltzmQoiL4,Телеканал Дождь,0,0,Инна Инна,По сравнению с заграницей --какраз дорого !!! А сервис продукты и все прочее в разы хуже !,2020-06-21T07:26:16Z,0
37,UgzZhIQ7reUxmjpqDJ94AaABAg,xYltzmQoiL4,Телеканал Дождь,0,0,oleg zolkin,РОБЕРТ ГРИГОРЬЕВ ))) ГРИГОРЯН  100%,2020-06-21T06:31:39Z,0
38,UgwjzhO31F-37MHpJiF4AaABAg,xYltzmQoiL4,Телеканал Дождь,0,0,Тамара Слабуш,Смотриш на эту красоту и думаеш для кого все это выстроено для прстого россиянина для простого повара для шофера металлурга нет конечно нет им не доступно,2020-06-21T06:02:27Z,0
39,UgwmXe86zG52r03Gxbt4AaABAg,xYltzmQoiL4,Телеканал Дождь,0,0,Poprygunka Светлана,"Не очень согласна с критикой курортов Сочи. Есть опыт отдыха в Турции и проч. странах Европейских и Восточных. В Сочи была в 2017 году, летом. Обошлось мне это дешевле, чем если бы я поехала на месяц в Турцию. Сервис - нормальный, меня никто не обижал и не хамил, все договоренности были соблюдены, услуги оказаны. Пожалуй, небольшая претензия к сервису аренды машины, но и то, в пределах. По поводу ""жадные до денег"", т.к. я была в путешествии по Египту, Иордании и даже путешествовала немножко по Турции - там тоже часто появляется ощущение, будто в тебе видят ""кошелек на ножках"".",2020-06-20T23:12:24Z,0
40,Ugzo9GcLHPtb1JNG0eN4AaABAg,xYltzmQoiL4,Телеканал Дождь,0,0,костя новиков,ага копейки))),2020-06-20T22:58:00Z,0
41,UgybaI7uzi1If2RlDhJ4AaABAg,xYltzmQoiL4,Телеканал Дождь,0,0,Олег Бузукин,"По поводу среднего класса это зашквар, средний клас уже давно опустили ниже плинтуса, и доят кок дойную корову, кредитами, уроды, , туда прут всякие начальники, и дебилы которым денег, нежалко, либо люди которые плохо знаютщие побережье чёрного моря, в любом случае мне их всех  очень сильно жаллко",2020-06-20T22:49:17Z,0
42,UgzWKUBg9ORtPkKgLt54AaABAg,xYltzmQoiL4,Телеканал Дождь,0,0,Олег Бузукин,"Тундру до северо ледовитого океана закрыли, где людей на 100 км если повезёт один встретится а вы про пляж,",2020-06-20T22:45:06Z,0
43,UgwyKxibAAkIFKyfxbB4AaABAg,xYltzmQoiL4,Телеканал Дождь,0,0,Любовь Нефёдова,"А я уж лучше на свою дачу поеду ,чем к ним в этот колхоз 😩😛",2020-06-20T22:11:07Z,0
44,UgwW5NixItGLbjO205F4AaABAg,xYltzmQoiL4,Телеканал Дождь,0,0,ivalo 1972,"страна продана, не будет ни какого курорта, как скот людей загнали в стойло",2020-06-20T21:08:00Z,0
45,UgxjpgzpXNlyX8X8gjx4AaABAg,xYltzmQoiL4,Телеканал Дождь,0,0,Алекс Foma,Вопрос на что????  Печатная Машинка  сломалась..,2020-06-20T21:07:43Z,0
46,Ugx_hjbjrnUE1KHyYQh4AaABAg,xYltzmQoiL4,Телеканал Дождь,0,0,Aleksey,"Бывали у вас как - то, хочу вам сказать идите ка Вы товарищи в *ад со своими ценниками!!!
что бы отдохнуть, реально отдохнуть! А не волочить существование у Вас там, семье из 3х человек, нужно тысяч 100-150 на пару недель, не менее!
Про обслуживание и прочее молчу....",2020-06-20T18:51:50Z,0
47,Ugzoox8t3dkjzeY_uX94AaABAg,xYltzmQoiL4,Телеканал Дождь,0,0,Дензо Парадензо,"Эти, мляяяяяя, рашистские курорты привыкли наЁОбывать и обдирать турЫстов-отпускников. Ну вот, мляяяяя, халява и кончилась. Пусть прочувствуют на своей шкуре, что такое отсосиновик.",2020-06-20T16:52:06Z,0
48,UgxOtECqskvsDiCYxGF4AaABAg,xYltzmQoiL4,Телеканал Дождь,0,0,Ірина Левконь,Сочи это не Россия это Грузия.,2020-06-20T11:19:03Z,0
49,Ugz1-5JpP_oMBHCexPx4AaABAg,xYltzmQoiL4,Телеканал Дождь,0,1,Владимир Михеев,"Никогда не поедем в СОЧИ, потому что на отдыхающих смотрят как на ДОБЫЧУ!! УРВАТЬ деньги и всё!!! Позорище!!",2020-06-20T10:03:24Z,0
50,UgxLrATB7Noptax912J4AaABAg,xYltzmQoiL4,Телеканал Дождь,0,0,Андрей Моисеев,Что нормального качества видео нельзя выложить???,2020-06-20T09:55:53Z,0
51,UgwNigdGjK6H1EFRQiB4AaABAg,xYltzmQoiL4,Телеканал Дождь,0,0,Мужчина -,"Cпасибо глубокое ПУКИНУ и его собачке СОБЯШКЕ. За ""проплаченные"" 2 месяца безработицы. За МЁРТВУЮ экономиру России. За УБИТУЮ Россию, по факту после ""эпидемии"".

Непонятно другое, неужели люди даже сидящие у ТВ не могут посчитать на пальцах те невообразимые убытки, которые принёс собой глупый карантин? Сравните на листочке бумажки, что больше, какие последствия хуже для страны в целом? Небольшая в масштабах России смертность людей, или поголовная безработица и нищета? Не надо иметь высшее образование, чтобы сделать эти простые приблизительные вычисления.",2020-06-20T09:12:26Z,0
52,UgyVkn8npceYc8_dX3Z4AaABAg,xYltzmQoiL4,Телеканал Дождь,0,1,Юля Левченко,"Мир не будет прежним.Глупо  верить ,что всё будет по старому.Идёт к концлагерю.Скоро придёт антихрист и ему очищают путь и т.д.Примите Христа и покайтесь.Молитесь и надейтесь на Господа.Везде будет одинаково на земле.Так,что только Господь поможет и помилует и больше никто не поможет.Но не будет не какого отдыха и страшно куда ехать.Неизвестно,что дальше будет,но хорошего ждать не приходится.Надеимся на Господа.Наивные слов нет.Вас спецом разоряют и не дают жить ...и работать на курортах.Мы тоже хотели стороить дом и отель на море и хорошо Бог отвёл.Слава Богу за всё.Правда говорят,что Бог не делает то к лучшему.А так бы мы б пролетели.Жаль людей,что у них забрали их дело.Но на людей плевать .Поймите не кому вы не нужны.Этот мир пал.Теперь только уповайте на Бога.",2020-06-20T09:11:46Z,0
53,Ugykto5tAKc5iqbYT1x4AaABAg,xYltzmQoiL4,Телеканал Дождь,0,0,Наталья Исламова,"Всем  предпринимателям  в сфере  курортного бизнеса как раз есть время подумать, поучиться у заграничных коллег как "" нужно"" работать качественно, красиво, правильно. Потому что ну просто правда, за державу обидно. Роскошная природа и это не ваша заслуга, сделайте все конкурентоспособности. Чтобы к вам хотелось возвращаться снова и снова. Тупо смотрите ролики с ютюба  обучающие про то как развить успешный курортный бизнес , учитесь, применяйте, хватит ныть... )))",2020-06-20T08:44:38Z,0
54,UgxpskAgx77YLoLNIhp4AaABAg,xYltzmQoiL4,Телеканал Дождь,0,0,Марина Лобачева,"В основном, на море поедут упыри, насосавшиеся народной крови во время карантина, штрафовавшие людей за их отказ подчиняться тюремным правилам. 
И небольшая кучка трудящихся, кому удалось удержаться на плаву. Остальные будут сидеть дома, пытаясь хоть как-то прокормить свои семьи.",2020-06-20T08:16:44Z,0
55,UgyIk_U8PUzcbjhsfT54AaABAg,xYltzmQoiL4,Телеканал Дождь,0,1,Иван Иванов,"Владельцы туристического ""бизнесса"" двух слов связать не могут... как они экскурсии ведут? Хрю-Му?",2020-06-20T07:40:10Z,0
56,Ugw_GyXeQLiGkMjW7Rd4AaABAg,xYltzmQoiL4,Телеканал Дождь,0,0,Михаил Фишелевич,"Страна в жутком дефолте из которого не выбраться, оставаясь в капитализме. Забудьте про туризм в России на ближайшие лет 5-10!!!
Власти полностью уничтожили производства и остаются в капиталистической системе, где у нас нет шансов в плане конкуренции, ибо сложные условия. В Германии даже отапливать дома особо не надо, не говоря уже о США, там 5-6 покоса травы в год, а у на 1-2, там логистика проще в разы из-за меньших расстояний, мы не можем конкурировать с Европой, а тем более с США и Китаем, мы физически сдохнем, если не откажемся от капиталистической конкуренции.",2020-06-20T06:38:57Z,0
57,UgzsnG9H2G-gcinBwRB4AaABAg,xYltzmQoiL4,Телеканал Дождь,0,0,NYUSHA Oktyabr,на черноморском побереже ОСОБЕННО Сочи цены выше европейских.... Сервиса никакого ........ А поиметь твой кошелек хочет любой начиная от директора отеля заканчивая таксистам . У людей денег на билеты на бензин НЕТ......................какие нахрен Сочи.,2020-06-20T06:08:53Z,0
