,id,videoId,authorVideoName,totalReplyCount,likeCount,authorDisplayName,textDisplay,publishedAt,isReply
1291,UgxXnJxLchuC342yuWx4AaABAg,xYltzmQoiL4,Телеканал Дождь,1,0,Valeriy R,"Это надо за всё ВОЗ ""благодарить"", которая навела такого истеричного шухера на весь мир. Команда старых пердунов и кретинов
эта Всемирная организация здравоохренения",2020-06-12T12:50:30Z,0
1292,UgxXnJxLchuC342yuWx4AaABAg.99nziVUM8Qc99o-oD_gwL-,xYltzmQoiL4,Телеканал Дождь,0,0,Roman Lisicyn,"дело не в пандемии, а в отсутствии поддержки со стороны государства",2020-06-12T13:00:01Z,1
1293,UgxWKec_BI7ONEtKEdd4AaABAg,xYltzmQoiL4,Телеканал Дождь,0,2,Елена Осадчая,Съемка старая,2020-06-12T12:49:52Z,0
1294,Ugzn-VxQru_Kpi4-CWJ4AaABAg,xYltzmQoiL4,Телеканал Дождь,5,9,Забей Коси,"Пандемию лживой статистикой не остановить!
Бойкот плебисцирку!",2020-06-12T12:49:25Z,0
1295,Ugzn-VxQru_Kpi4-CWJ4AaABAg.99nzab53wCq99o64VHVyl2,xYltzmQoiL4,Телеканал Дождь,0,2,Елена Цветкова,Согласна с вами полностью . Только бойкот !!! 🤝🤝🤝,2020-06-12T13:54:48Z,1
1296,Ugzn-VxQru_Kpi4-CWJ4AaABAg.99nzab53wCq99o5bbQTYaS,xYltzmQoiL4,Телеканал Дождь,0,1,Забей Коси,"@Алина Репина я не клоун,что бы участвовать в цирке!",2020-06-12T13:50:43Z,1
1297,Ugzn-VxQru_Kpi4-CWJ4AaABAg.99nzab53wCq99o38BrdsYK,xYltzmQoiL4,Телеканал Дождь,0,0,Алина Репина,"@Забей Коси а что ваш бойкот даст? Они обидятся на вас? Или это вдруг станет нелегитимно, учитывая, что порога явки нет? Как они вообще узнают, что вы бойкотируете, а не заболели, например? Или может, вам не интересна политика? Или вы не определились, как голосовать?? Кто и зачем будет выяснять, почему вы промолчали??",2020-06-12T13:29:06Z,1
1298,Ugzn-VxQru_Kpi4-CWJ4AaABAg.99nzab53wCq99o183L_wsM,xYltzmQoiL4,Телеканал Дождь,0,1,Забей Коси,"@Roman Lisicyn участник=соучастник!
Путин подписал,порога явки нету, против чего голосовать?",2020-06-12T13:11:36Z,1
1299,Ugzn-VxQru_Kpi4-CWJ4AaABAg.99nzab53wCq99o-edLhSzC,xYltzmQoiL4,Телеканал Дождь,0,1,Roman Lisicyn,"бойкот выгоден кремлю, т.к. пропутинские все равно приду. Нужно голосовать, хотя бы электронно",2020-06-12T12:58:43Z,1
1300,Ugyol2HD57Ji-u1XRzd4AaABAg,xYltzmQoiL4,Телеканал Дождь,1,1,Kyk 0_о,не стыдно 360 выкладывать?,2020-06-12T12:49:24Z,0
1301,Ugyol2HD57Ji-u1XRzd4AaABAg.99nzaSBXbvY99o6kXPD-qG,xYltzmQoiL4,Телеканал Дождь,0,0,BlueSky Old,"как есть, важно инфо!",2020-06-12T14:00:41Z,1
1302,UgyB6fGD_OB39zPzepl4AaABAg,xYltzmQoiL4,Телеканал Дождь,0,1,Вера Александрова,"Как здорово там,в том году мы были там,спасибо вам и терпения скоро все наладится",2020-06-12T12:49:22Z,0
1303,UgyQTsjsb7VQMmSWFTp4AaABAg,xYltzmQoiL4,Телеканал Дождь,0,5,Айвазян Аркадий,"Атмосфера ""Dead Island""",2020-06-12T12:49:12Z,0
1304,UgywTEco9_2ldF2myTR4AaABAg,xYltzmQoiL4,Телеканал Дождь,0,29,Vitalii,"Всё хорошо, все дистанцию соблюдают, всем шабад до следущего года))",2020-06-12T12:45:26Z,0
1305,Ugy8YXZN1exzQA7OkOl4AaABAg,xYltzmQoiL4,Телеканал Дождь,1,29,олег oleg,"Люди имели с туристов-теперь не имеют..о чем речь то...??...ну стучат...так это всегда было...придавили многих,..но ведь это Россия!!! так было и будет.....",2020-06-12T12:45:13Z,0
1306,Ugy8YXZN1exzQA7OkOl4AaABAg.99nz6pnUsmP99uBmCSfvb3,xYltzmQoiL4,Телеканал Дождь,0,1,Оксана Савельева,речь ни очем,2020-06-14T22:40:03Z,1
1307,UgwFNXU9JeuXaAattyt4AaABAg,xYltzmQoiL4,Телеканал Дождь,3,35,Denys Zharkov,"А ПРИКИНЬТЕ, ЧТО БУДЕТ В ВАШЕМ НАШЕМ КРЫМУ? 😂",2020-06-12T12:43:17Z,0
1308,UgwFNXU9JeuXaAattyt4AaABAg.99nytcg-ydk99q6onXfVgt,xYltzmQoiL4,Телеканал Дождь,0,6,Павел Войтов,"Не-не, увольте, это ваш Крым, мне он нах не нужен был!",2020-06-13T08:39:45Z,1
1309,UgwFNXU9JeuXaAattyt4AaABAg.99nytcg-ydk99o3AYJR3h4,xYltzmQoiL4,Телеканал Дождь,0,6,Неллия Рэм,"Интересно придумали ""ваш наш Крым"".",2020-06-12T13:29:25Z,1
1310,UgwFNXU9JeuXaAattyt4AaABAg.99nytcg-ydk99o2xX13dPi,xYltzmQoiL4,Телеканал Дождь,0,7,Дед Пихто,По уху на крым.,2020-06-12T13:27:30Z,1
1311,Ugx0Wy7Y9qroFIPyS8x4AaABAg,xYltzmQoiL4,Телеканал Дождь,0,0,Oleg Zimin,"Не наивные,а тупые...",2020-06-12T12:42:22Z,0
1312,UgxAM7Phq-tMlSyEb2p4AaABAg,xYltzmQoiL4,Телеканал Дождь,0,1,Serhii Urievich,наверное все поехали в крым...,2020-06-12T12:39:43Z,0
1313,UgzCB4pxxsmbnb4eipJ4AaABAg,xYltzmQoiL4,Телеканал Дождь,4,142,Алексей Смирнов,Лентяи так вам и нужно!!! Привыкли вытягивать деньги с отдыхающих и жить за счёт других загадили все вокруг,2020-06-12T12:39:12Z,0
1314,UgzCB4pxxsmbnb4eipJ4AaABAg.99nyQgI9MCA99q4UvutZSS,xYltzmQoiL4,Телеканал Дождь,0,1,Momo Omm,"@Моня Черноморский чувак, цены низкие и высокие! А товары дешевые, не обижайся...но надо купить словарь",2020-06-13T08:19:25Z,1
1315,UgzCB4pxxsmbnb4eipJ4AaABAg.99nyQgI9MCA99ol_z0SVV_,xYltzmQoiL4,Телеканал Дождь,0,2,Моня Черноморский,"Очень сожалею что вы не владеете гостиницей в Адлере.  Я непременно приезжал бы отдыхать только к вам.  Ведь, не подлежит сомнению,  у вас были бы самые дешевые цены на всём побережье.",2020-06-12T20:06:14Z,1
1316,UgzCB4pxxsmbnb4eipJ4AaABAg.99nyQgI9MCA99o6_vj0772,xYltzmQoiL4,Телеканал Дождь,0,4,XAHT XAHTe,El Ena бздыхами называют,2020-06-12T13:59:14Z,1
1317,UgzCB4pxxsmbnb4eipJ4AaABAg.99nyQgI9MCA99o52llwAsF,xYltzmQoiL4,Телеканал Дождь,0,7,El Ena,Сочинцы отдыхающих туристов называют - лохами инфа 100%,2020-06-12T13:45:50Z,1
1318,Ugw7t8eswO1gv4zJlaN4AaABAg,xYltzmQoiL4,Телеканал Дождь,2,108,A А,Начальство разрешит и вирус сразу пропадёт.,2020-06-12T12:38:54Z,0
1319,Ugw7t8eswO1gv4zJlaN4AaABAg.99nyOXceshb99t6mdG3JUi,xYltzmQoiL4,Телеканал Дождь,0,0,Дмитрий Овчинников,@Лиза Самохвалова массовый выпуск вакцины это вопрос ещё на год++,2020-06-14T12:37:10Z,1
1320,Ugw7t8eswO1gv4zJlaN4AaABAg.99nyOXceshb99qY4eLCFKN,xYltzmQoiL4,Телеканал Дождь,0,1,Лиза Самохвалова,"Вирус есть, пока делают вакцину,но говорят, что она на подходе",2020-06-13T12:37:58Z,1
1321,Ugw4re12twjCX7A7YEx4AaABAg,xYltzmQoiL4,Телеканал Дождь,0,10,вадим прОскурка,"Пахлаву медовую сожрал 
   Трупин с подельниками.",2020-06-12T12:38:27Z,0
1322,UgwhAof7iuYprUYWQIF4AaABAg,xYltzmQoiL4,Телеканал Дождь,0,2,Sergei Sirotjuk,"Россия, Щедрая Душа!",2020-06-12T12:36:57Z,0
1323,Ugwst0hYeFw-_Qnm5kB4AaABAg,xYltzmQoiL4,Телеканал Дождь,0,2,Evgeniy Weburg,"после чачи выключил, отстой!",2020-06-12T12:34:16Z,0
1324,UgwgGbi6MEzc2Wq1_m94AaABAg,xYltzmQoiL4,Телеканал Дождь,22,42,Александр Из краснодара,"Любой нормальный человек понимаетесь, что заразится на проветриваемом морском береге практически невозможно",2020-06-12T12:32:51Z,0
1325,UgySkgXq2JXSt_LL0Cd4AaABAg,xYltzmQoiL4,Телеканал Дождь,2,3,Allex Allex,"Стучат те, кто хают СССР и Сталина.",2020-06-12T12:32:45Z,0
1326,UgySkgXq2JXSt_LL0Cd4AaABAg.99nxgQxvx1_99o0nV_Sk7W,xYltzmQoiL4,Телеканал Дождь,0,0,Allex Allex,@Roman Lisicyn это позиция раба и прихвостня...,2020-06-12T13:08:39Z,1
1327,UgySkgXq2JXSt_LL0Cd4AaABAg.99nxgQxvx1_99o-47F5p4o,xYltzmQoiL4,Телеканал Дождь,0,0,Roman Lisicyn,"не ""стучат"", это из тюремного жаргона, а сообщают о нарушении закона. Это нормальная позиция ответственного гражданина, только законы при этом не должны быть людоедские.",2020-06-12T12:53:35Z,1
1328,UgwmY1lp_iobF9xZWdV4AaABAg,xYltzmQoiL4,Телеканал Дождь,2,5,Константин,"Сколько же людей обдирает казино,это жесть!",2020-06-12T12:31:13Z,0
1329,UgwmY1lp_iobF9xZWdV4AaABAg.99nxWDIvzjx99o0JDFS99U,xYltzmQoiL4,Телеканал Дождь,0,0,Константин,"@Tatiana Vlasowa я и не посещаю! Я в шоке от того, сколько всё-таки посещает!",2020-06-12T13:04:23Z,1
1330,UgwmY1lp_iobF9xZWdV4AaABAg.99nxWDIvzjx99o-jCehE05,xYltzmQoiL4,Телеканал Дождь,0,0,Tatiana Vlasowa,А вы не посещайте казино - и останетесь при своих.,2020-06-12T12:59:20Z,1
1331,Ugx5VkWZ1xdDiO4vmk54AaABAg,xYltzmQoiL4,Телеканал Дождь,39,152,сергей Петров,"Пенсии военной не хватает,в гостиничный бизнес сунулся,и плачется,а как без пенсий военных,людям выживать?",2020-06-12T12:31:10Z,0
1332,Ugx0JDTdtFFjsAAV8Jx4AaABAg,xYltzmQoiL4,Телеканал Дождь,6,20,Irina Samukova,А в Италии и Испании не бедствуют? Там прям прибыль....,2020-06-12T12:29:21Z,0
1333,Ugz8J7SdORuvS8GBXD54AaABAg,xYltzmQoiL4,Телеканал Дождь,2,17,Павел Кузнецов,"Денег у НАС нет, но ВЫ держитесь, нам ещё Крым поднимать! ""Яяяяяялта, где растёт золотой винограаааад...""",2020-06-12T12:28:51Z,0
1334,Ugz8J7SdORuvS8GBXD54AaABAg.99nxEuUw6JS99o01Tlu70i,xYltzmQoiL4,Телеканал Дождь,0,0,Roman Lisicyn,да-да! Отдыхать в Сочи? Вы что! Я патриот!! Я отдыхаю в Крыму))),2020-06-12T13:01:58Z,1
1335,Ugz8J7SdORuvS8GBXD54AaABAg.99nxEuUw6JS99o-WzsQ8zA,xYltzmQoiL4,Телеканал Дождь,0,2,Sema Dima,Да нам ещё и Сирию поднимать,2020-06-12T12:57:32Z,1
1336,Ugw93Up8VPz6T9KCxyF4AaABAg,xYltzmQoiL4,Телеканал Дождь,1,3,Константин Аман,"ВОЗ 9 июня обесценил пандемию, которой на самом деле и не было. Так, что народ хватить носить намордники, хватит себя унижать. Нужно жить нормальной жизнью, а не подчиняться этой власти. Выходите на улицу, без намордников,  в магазины тоже ходите без намордников, загарайте, гуляйте...нас не подчинить, ни собакиным, ни бегловым, ни пукиным...",2020-06-12T12:28:23Z,0
1337,Ugw93Up8VPz6T9KCxyF4AaABAg.99nxBVJ_5r699o2K6fyQtQ,xYltzmQoiL4,Телеканал Дождь,0,0,Tatiana Kuzmina,"И хватит смотреть передачи где с одной стороны говорят как все плохо из-за короновируса. А с другой внушают, да болезнь то страшная, надо потереть. :)",2020-06-12T13:21:59Z,1
1338,UgxF36XvRNmuUYOhS0F4AaABAg,xYltzmQoiL4,Телеканал Дождь,0,25,Забей Коси,"Где качество?
Видео на полароид снимали?",2020-06-12T12:24:37Z,0
1339,Ugwmavjs5BLru2Yghlt4AaABAg,xYltzmQoiL4,Телеканал Дождь,3,107,Evgenia Izmailova,"В Сочи отдыхать, дешевле чем заграницей?!  Чё?! Еще бы сказал, что сервиз у них такой же, как там...Если на номера, еще можно простому смертному нашкулять, то меею у этого класса людей одно... ""Магнит""",2020-06-12T12:24:24Z,0
1340,Ugwmavjs5BLru2Yghlt4AaABAg.99nwjNuP9qT99o2R-ekAmN,xYltzmQoiL4,Телеканал Дождь,0,7,Забей Коси,В Антальи сейчас клубника 60 руб а не 250 !,2020-06-12T13:22:56Z,1
1341,Ugwmavjs5BLru2Yghlt4AaABAg.99nwjNuP9qT99o2Giqr0DN,xYltzmQoiL4,Телеканал Дождь,0,2,Забей Коси,70% россиян не имеет загран. паспортов!,2020-06-12T13:21:31Z,1
1342,Ugwmavjs5BLru2Yghlt4AaABAg.99nwjNuP9qT99o1i2xy4Bg,xYltzmQoiL4,Телеканал Дождь,0,1,Ахмед Мамедов,В точку👍,2020-06-12T13:16:39Z,1
1343,UgxRiTgX8vxJ9kpvvnd4AaABAg,xYltzmQoiL4,Телеканал Дождь,18,483,Алла Шатская,"Цены в сочи офигеть! Это только для отдыха кремлевских депутатов, могут позволить!!!",2020-06-12T12:24:19Z,0
1344,UgwaHgn-YQvHsR2dwQd4AaABAg,xYltzmQoiL4,Телеканал Дождь,11,24,Руслан D,Как вы попали в Сочи без обсервации?,2020-06-12T12:24:18Z,0
1345,Ugyd34uDoq1MEYWJV8l4AaABAg,xYltzmQoiL4,Телеканал Дождь,1,0,Дмитрий Островский,Нахуй ваш савок и цены не упёрлись🤣,2020-06-12T12:21:00Z,0
1346,Ugyd34uDoq1MEYWJV8l4AaABAg.99nwLO2ge_J99nzSPt2jTq,xYltzmQoiL4,Телеканал Дождь,0,0,Елена Осадчая,Тебя сюда и не зовут))))Без тебя обсосов хватает😅😅😅😅😅,2020-06-12T12:48:10Z,1
1347,UgxgspVhxtLIgp_nw214AaABAg,xYltzmQoiL4,Телеканал Дождь,13,407,ЮТУБ ЮЮЮЛИЯ,ЦЕНЫ В СОЧИ ЗАОБЛАЧНЫЕ,2020-06-12T12:20:59Z,0
1348,Ugw8uDNir-MkX9JrQHF4AaABAg,xYltzmQoiL4,Телеканал Дождь,4,0,Елена Ермакова,"а что,так холодно сейчас в Сочи,люди в куртках!",2020-06-12T12:19:20Z,0
1349,Ugw8uDNir-MkX9JrQHF4AaABAg.99nw9EEqFoO99oDTSOxYzU,xYltzmQoiL4,Телеканал Дождь,0,2,Наташа Кузнецова,Я живу в Адлере. Уже недели две - пекло. Сегодня загарала. Народу на пляжах мало. Пляжи только начали готовить. Вода грязная. Песок на пляже грязный. Фуу. Но жара + 30,2020-06-12T14:59:23Z,1
1350,Ugw8uDNir-MkX9JrQHF4AaABAg.99nw9EEqFoO99o0zrEKqUl,xYltzmQoiL4,Телеканал Дождь,0,1,Виктория Д,"@Люба Карбащян Глупость не пишите.Девушка на велике в ботинках!Видео с самоизоляции смонтировали с новым,ни на ком нет масок.Сомнительное видео",2020-06-12T13:10:21Z,1
1351,Ugw8uDNir-MkX9JrQHF4AaABAg.99nw9EEqFoO99nya3lmQ3M,xYltzmQoiL4,Телеканал Дождь,0,1,Никита Ат,"@Виктория Д жарко в Сочи да, видимо раньше снимали",2020-06-12T12:40:37Z,1
1352,Ugw8uDNir-MkX9JrQHF4AaABAg.99nw9EEqFoO99nxiSP4hLc,xYltzmQoiL4,Телеканал Дождь,0,0,Виктория Д,"Да нет,в Краснодарском крае хорошая погода,живу ни в Сочи,у нас больше 30градусов,уних думаю тоже",2020-06-12T12:33:01Z,1
1353,UgwNNmYz1SPt_Ddpno54AaABAg,xYltzmQoiL4,Телеканал Дождь,1,0,Лариса Шандобрина,А почему в Сочи нельзя? В Крым-то с 15.06  уже разрешили.,2020-06-12T12:18:50Z,0
1354,UgwNNmYz1SPt_Ddpno54AaABAg.99nw5ZRR-Cm99nwsXYrZd6,xYltzmQoiL4,Телеканал Дождь,0,1,Виктория Д,Только для жителей края.Для других регионов вроде бы с 1 июля,2020-06-12T12:25:39Z,1
1355,UgwAx48lOqLONgCMiJd4AaABAg,xYltzmQoiL4,Телеканал Дождь,27,578,Забей Коси,"Я слишком беден,что бы отдыхать в России!
Ротовирус спутник туристов краснодарского края :-)",2020-06-12T12:18:32Z,0
1356,UgzvAGUGnw539WE66EN4AaABAg,xYltzmQoiL4,Телеканал Дождь,6,127,павел игнатьев,"А ЧЕГО ТАМ ДЕЛАТЬ?  ТАМ ВСЕ ЗАСРАЛИ - КУПАТЬСЯ НЕЛЬЗЯ,  СЕРВИС ГОВНО А ЦЕНЫ ДИКИЕ  - В ТУРЦИИ И ЛУЧШЕ И ДЕШЕВЛЕ",2020-06-12T12:18:08Z,0
1357,UgwA12bULC9rcoWnY8d4AaABAg,xYltzmQoiL4,Телеканал Дождь,3,7,Александр Романов,"27:05 У Арзамаса есть курс про Сталина, там они ссылаются на документы, из которых следует что миф про стукачество людей друг на друга, придумало правительство.",2020-06-12T12:17:45Z,0
1358,UgwA12bULC9rcoWnY8d4AaABAg.99nvydOB1Sc99puey8kAci,xYltzmQoiL4,Телеканал Дождь,0,1,Александр Романов,@Андрей Дубенко У Вас есть статистика по доносам? Сколько из 145 000 000 донесли на соседа?,2020-06-13T06:44:48Z,1
1359,UgwA12bULC9rcoWnY8d4AaABAg.99nvydOB1Sc99pbN8TfZ-3,xYltzmQoiL4,Телеканал Дождь,0,0,Андрей Дубенко,Стукачество есть особенно сейчас именно здесь и сейчас,2020-06-13T03:56:13Z,1
1360,UgwA12bULC9rcoWnY8d4AaABAg.99nvydOB1Sc99o-W-MDdkL,xYltzmQoiL4,Телеканал Дождь,0,0,Roman Lisicyn,"вы правы, автократам нужны разобщенные и не доверющие ни кому люди",2020-06-12T12:57:24Z,1
1361,Ugz9MY6JFO2xscYETO54AaABAg,xYltzmQoiL4,Телеканал Дождь,0,2,Светлана Гончаревич,"Это просто треш ,люди Сочи уже голодают  ,говопю не по наслышке ,шлю каждую неделю на хлебушек ,спасибо нашей Родине ,вообще на людей наплевать ,только  налоги просят ,а ,как выживать  ,",2020-06-12T12:16:45Z,0
1362,Ugw4PuGq7xzLLu_FX-V4AaABAg,xYltzmQoiL4,Телеканал Дождь,32,373,Ну Погоди,"У людей денег нет чтобы ехать отдыхать, круг замкнулся",2020-06-12T12:15:30Z,0
1363,UgwHHx2ePv5uz9XwhYN4AaABAg,xYltzmQoiL4,Телеканал Дождь,6,8,Алёна,"Ну ладно, в Сочи круглый год курорт-сезон. Лыжные трассы итп",2020-06-12T12:12:56Z,0
1364,UgziOffosPtD5mardP54AaABAg,xYltzmQoiL4,Телеканал Дождь,16,225,Иван Петров,"Если будем тихо сидеть дома - то также тихо сдохнем!
У дождя 1 млн подписчиков....
Каждый сделал репост про митинг на Тургеневской площади 22 числа?!?",2020-06-12T12:10:39Z,0
1365,UgxEOv_vOvwRYe9-_iZ4AaABAg,xYltzmQoiL4,Телеканал Дождь,0,2,chel v palto,Ухх РООССИИЯЯ,2020-06-12T12:10:18Z,0
1366,UgyIRiXwxrK1YWUGI814AaABAg,xYltzmQoiL4,Телеканал Дождь,0,0,Илья Игнатьев,"Вы ВСЕ НАХЕР ТУПИТЕ?
ХВАТИТ РАБотать РАБы!
Делайся как Я! -ГРОВЕРОМ.
Мусорам ёбну.тым не понять!
А вот Я!  (ГРОВЕР)
Только, что приехал с Царицино. (Казань ёптэ!) Вчера перевёл две Индики на цветение. Залил в субстрат Flora Bloom от GHE. Через четыре недели на сушку и пролечку БОШКИ пойдут. Две APOLLO 4 и две ЭСЛ по 115W работают хорошо.
В конце июля снова будут 120000 рублей ( минимум ) и кучка БОШЕК, чтобы не очень грустно было тратить деньги. А в этот момент будут расти пара автоцветов (им от 40 до 65 дней нужно до харвеста), а то я устал эти огромные фотопериодные 4 месяца растить. (Зато урожай обильный)",2020-06-12T12:09:04Z,0
1367,UgxVppMemc4RpgMIy1R4AaABAg,xYltzmQoiL4,Телеканал Дождь,12,71,Сергей Скрябин,Так пусть в Сибирь приезжают здесь работы полно,2020-06-12T12:08:17Z,0
1368,UgyJSWEroNBBtZmvuKN4AaABAg,xYltzmQoiL4,Телеканал Дождь,15,41,Allex Allex,"Вот сейчас крымчане ""благодарят"" власть российскую и пупкова в частности...",2020-06-12T12:06:10Z,0
1369,UgwSP9nKhSfNfkaHDlp4AaABAg,xYltzmQoiL4,Телеканал Дождь,1,8,Dekora,мы передумали ехать в РФ,2020-06-12T12:05:13Z,0
1370,UgwSP9nKhSfNfkaHDlp4AaABAg.99nuXt1Hf9_99o0Fv7lROB,xYltzmQoiL4,Телеканал Дождь,0,0,Irina Pest,"Вроде как с 1 июля границы закрывают , оставляют тем , кто учится и работает ,",2020-06-12T13:03:56Z,1
1371,UgzPQTDhmm3zYIgDBth4AaABAg,xYltzmQoiL4,Телеканал Дождь,9,89,Георгий Полетаев,Нужно как-то выкручиваться... Или таксовать – одна из главных фраз россиян на карантине.,2020-06-12T12:04:56Z,0
1372,Ugy9E0T2jjyK-DYfiI14AaABAg,xYltzmQoiL4,Телеканал Дождь,0,6,ByFilippov,россия 👍,2020-06-12T12:04:01Z,0
1373,Ugy3OXFzxfMWscv8oRN4AaABAg,xYltzmQoiL4,Телеканал Дождь,0,1,SkyVoker1,1,2020-06-12T12:02:53Z,0
1374,UgypynlQBhsZOjW_qxd4AaABAg.99r38zL_zGu9AVRpbrkEeu,xYltzmQoiL4,Телеканал Дождь,0,1,Alex Alex,@Мозяка Мозякин Посмотрите онлайн вебкамеры с пляжей. И не ездите тут по ушам. Пусто и не никого.,2020-06-29T19:11:28Z,1
1375,UgypynlQBhsZOjW_qxd4AaABAg.99r38zL_zGu9AVPxtvCDcO,xYltzmQoiL4,Телеканал Дождь,0,0,Мозяка Мозякин,Сейчас пляжы ещё не открыты а людей уже как буд то в нормальный сезон!,2020-06-29T18:55:07Z,1
1376,UgypynlQBhsZOjW_qxd4AaABAg.99r38zL_zGu9APY34K5zzC,xYltzmQoiL4,Телеканал Дождь,0,0,Я М,@Светлана Светлан вам Татьяна Румянцева это подтвердила.,2020-06-27T12:10:25Z,1
1377,UgypynlQBhsZOjW_qxd4AaABAg.99r38zL_zGu9APY-68QiBr,xYltzmQoiL4,Телеканал Дождь,0,0,Я М,"@Сергей петровус кто плохо живет? Я бы не сказал, что народ живет плохо, все при деньгах, питаются хорошо, отдыхают тоже хорошо, машины покупают новые, б/у меняет народ раз в 3-5 лет. Все только жалуются, плачутся, что денег нет, а денег у всех навалом и в Центробанке об этом знают, а именно сколько лежит денег на счетах у граждан.",2020-06-27T12:09:52Z,1
1378,UgypynlQBhsZOjW_qxd4AaABAg.99r38zL_zGu9APUsK_y6Tz,xYltzmQoiL4,Телеканал Дождь,0,0,Татьяна Румянцева,"У нас уже пляжи забиты, и что дома то не сиделось.",2020-06-27T11:42:36Z,1
1379,UgypynlQBhsZOjW_qxd4AaABAg.99r38zL_zGu99usNDhwBGy,xYltzmQoiL4,Телеканал Дождь,0,0,Светлана Светлан,@Я М ?????,2020-06-15T05:00:58Z,1
1380,UgypynlQBhsZOjW_qxd4AaABAg.99r38zL_zGu99u-Lx9RHLf,xYltzmQoiL4,Телеканал Дождь,0,1,Сергей петровус,@Я М А говорят плохо живем.Пора вводить налог на воздух и на солнечный свет .А то жируют,2020-06-14T20:51:28Z,1
1381,UgypynlQBhsZOjW_qxd4AaABAg.99r38zL_zGu99tqinHiqVC,xYltzmQoiL4,Телеканал Дождь,0,2,Я М,Поедут.У людей деньги есть.,2020-06-14T19:27:20Z,1
