,id,videoId,authorVideoName,totalReplyCount,likeCount,authorDisplayName,textDisplay,publishedAt,isReply
633,UgwU8VpXe_ZLPk-Uj9p4AaABAg.99rCCd9y5MC9A2YxMHa7qw,xYltzmQoiL4,Телеканал Дождь,0,0,Гасан Гасанов,В Китай только,2020-06-18T13:55:42Z,1
634,UgzUUmcr4cWlceSuCPt4AaABAg,xYltzmQoiL4,Телеканал Дождь,0,0,Anton Black vol,"Не вздумайте ехать! Черти совсем ошалели с ценами! Пускай сезон другой соснут там, а далее и пересмотрят свои расценки",2020-06-13T18:40:43Z,0
635,UgzpC1k69y6S6GfxY7t4AaABAg,xYltzmQoiL4,Телеканал Дождь,0,0,Артём Соколов,"Был последний раз в Сочи в 2012, помню там девушка на набережной сидела ""дрэды"" плела на 1 м.кв , дак она тогда платила аренду 100к в месяц(((",2020-06-13T18:25:35Z,0
636,UgznTV8orfrpPz9SeC54AaABAg,xYltzmQoiL4,Телеканал Дождь,0,0,Мой гараж - мои правила,"Местные пренебрежительно относятся к приезжим. Кто хоть раз был- знает что значит ""бздыхи"". А день города в долбанных масках. А респешн, который выгонял постояльцев. Менты наживаются на приезжих, ловушки и кормушки. Отношение как к быдлу. Полюбят людей и отношение к этому курорту изменится. А пока только невыездные в виду обстоятельств будут ездить, да иностранцы иногда, которые про бздыхов не понимают. А додуматься из отелей обсерватор сделать? Получите - распишитесь!",2020-06-13T18:11:21Z,0
637,Ugyb9gHUIlYXcrym3wV4AaABAg,xYltzmQoiL4,Телеканал Дождь,0,0,ЕВГЕНИЙ ПЕТРОВ,"блять!!! Какие маски, какие дистанции, какой вирус?! Люди! Вы ЕБАНУЛИСЬ?",2020-06-13T18:09:58Z,0
638,UgwQHAliP9e5_amlUqh4AaABAg,xYltzmQoiL4,Телеканал Дождь,0,1,Профессор Преображенский,"Скучал я по этому ""курорту""..... 😁 Предпочёл бы Алтайский край и много других мест, но не краснодарский край
  Настолько они скупердяи в этом бизнесе..... Пускай лучше идут работать",2020-06-13T17:56:41Z,0
639,Ugx4QUCPh9L8os_pntZ4AaABAg,xYltzmQoiL4,Телеканал Дождь,0,0,___Aramchik91 ___,"Для тех, кто не читал. Вся суть поправок за 2 минуты
Мы не читали поправки, за которые голосуем. Да что уж там. Большинство из нас не читало и конституции. Но мы исправим ситуацию. Информация без мишуры. Что поменяли и что это значит. Чтобы вы знали, за что мы голосуем.

Я НЕ говорю о поправках, которые ничего не меняют. Например, поправка о том, что госслужащие не могут иметь иностранного гражданства. Эта норма закреплена в ФЗ ""О государственной, гражданской службе РФ"" от 2004 г. и т.д.

1. Запретить отдавать территории (ст. 67)
""Действия направленные на отчуждение части территории Российской Федерации, а также призывы к таким действиям не допускаются.""

2. Конституция выше, чем международное право (ст. 79)
""Решения межгосударственных .... противоречащие Конституции Российской Федерации, не подлежат исполнению""

3. Создание Госсовета. Однако ничего о нем не сказано. Отсылка к ФЗ, который ещё не принят.
(Президент)"" формирует Государственный Совет Российской Федерации в целях ... определения основных направлениях внутренней и внешней политики Российской Федерации и приоритетных направлений социально-экономического развития государства; статус Государственного Совета Российской Федерации определяется федеральным законом""

4. Изменили положение президента.
Обнулили сроки нынешнего президента (Ст. 81)
Президентом можно быть только 2 раза (Ст.81)
Президент получает неприкосновенность (Ст. 92)
""Президент Российской Федерации, прекративший исполнение полномочий обладает неприкосновенностью"" 
+ Президент после отставки пожизненный член Совета Федерации (Ст. 95)

5. Президенту накинули полномочий в исполнительной власти (Ст. 82)
1) Утверждает структуру Фед. Органов.
2) Утверждает органы, которые будут подчиняться лично ему, а не премьеру.
3) Осуществляет общее руководство правительством РФ
4) Назначает половину аудиторов счётной палаты
... И т.д.

6. Измененили полномочия президента в судебной власти.
- Вносит представления в Совет Федерации об отставке председателя Конституционного суда, Верховного суда и их замов.

7. Совет Федерации
Каждый президент сможет назначать 7 пожизненных сенаторов (Ст. 95)

Суть поправок:
1)Президенту добавили полномочий.
2) Создали Госсовет. Что это такое, мы не знаем.
3) Пара статей на усиление суверенитета.
4) Создали условия для того, чтобы нынешний президент смог переизбраться

Ошибка, которую Вы можете совершить, будет стоить всем ещё 12 лет жизни с диктатором.
Делайте правильный выбор!",2020-06-13T17:53:52Z,0
640,UgxDd4HVRyoRr2lNEzV4AaABAg,xYltzmQoiL4,Телеканал Дождь,0,0,Юрий Мочиевский,И персонажи ролика искренние люди.,2020-06-13T17:51:19Z,0
641,UgwPIGOFLra18gURs6R4AaABAg,xYltzmQoiL4,Телеканал Дождь,0,1,Agnostic One,"С такими ценами как в Сочи пусть бедствуют дальше. Давно уже стало в Турцию дешевле поехать чем в Сочи, сами виноваты, зажрались вот и ""отдыхайте""",2020-06-13T17:44:58Z,0
642,UgzDUP7JIPMN2cxeKst4AaABAg,xYltzmQoiL4,Телеканал Дождь,0,0,Victor V.,"Любители Турляндии и прочей хуйни, вы так смешны со своим мышлением и банальным отдыхом, привыкшие ходить по протоптанным дорожкам. Понятное дело, что сервис не везде на должном уровне. Но курорты - это не только пляж с жратвой и попойкой. Всё потому что вы туристы, а не путешественники.",2020-06-13T17:34:03Z,0
643,UgypynlQBhsZOjW_qxd4AaABAg,xYltzmQoiL4,Телеканал Дождь,10,112,Alex Alex,"Даже если откроют - никто не приедет. У людей денег нет.
Круг замкнулся.",2020-06-13T17:26:56Z,0
644,UgzOUuZRX-m71jIaVl94AaABAg,xYltzmQoiL4,Телеканал Дождь,0,0,MrRuzzzlan,"Знаю, что не в тему, но LSDMAG - это название журнала для «фармацевтов», но уж точно не для туристов))",2020-06-13T17:25:24Z,0
645,Ugz7EM20RuUAxwQI7LF4AaABAg,xYltzmQoiL4,Телеканал Дождь,0,0,Александр Никоян,Может быть будут больше ценить туристов и лучше предоставлять услуги а не жрать семь шкур за не до сервис.,2020-06-13T17:20:31Z,0
646,Ugx1ISMR0glEURh4ZVt4AaABAg,xYltzmQoiL4,Телеканал Дождь,1,6,горный мед,"Ну давайте посмотрим, гостиница на трассе стоит столько же, сколько в Сочи, про гостиницы в Москве я вообще молчу, молчу и про зарплаты, медсестра, нянечка в санатории получает от 15000 р, кто в Москве стол лько получает?
Сезон в Сочи два, максимум три месяца, а поддержки от государства никакой, посмотрите цены на перелеты в ту же Турцию... 
Но если не нравится, демократия, сидите дома..., а мы к вам на работу поедем...",2020-06-13T17:17:18Z,0
647,Ugx1ISMR0glEURh4ZVt4AaABAg.99r22SZymIL9A15Hx9hF8s,xYltzmQoiL4,Телеканал Дождь,0,0,Люда Михайловская,"я вот тоже не понимаю криков ""дорого"" посмотрите цены у придорожных мотелей. в любых гостиницах уже дорого в любом месте",2020-06-18T00:17:16Z,1
648,UgzCBO92l8mYExmSjcZ4AaABAg,xYltzmQoiL4,Телеканал Дождь,0,0,Дмитрий Сафонов,"Денег нет, но вы держитесь))",2020-06-13T17:02:45Z,0
649,Ugw1DKjTim1MaiDefcl4AaABAg,xYltzmQoiL4,Телеканал Дождь,0,6,Роман Б,"Сами отдыхайте в своих апартаментах, я больше к вам ни ногой, лучше в Приморье поеду и люди лучше и море чище, не ваша ПОМОЙКА.",2020-06-13T16:58:18Z,0
650,Ugz8sEJgB5vBcS2U9zZ4AaABAg,xYltzmQoiL4,Телеканал Дождь,0,0,Calvo Valerro,надо сделать выездные визы для росиян.Время пришло...,2020-06-13T16:35:06Z,0
651,UgzLLGIQ2k1yEBMT_Dt4AaABAg,xYltzmQoiL4,Телеканал Дождь,0,0,Haron S,"Нафиг нафиг. Отдыхал, хватит. В Сочи больше не поеду.",2020-06-13T16:34:34Z,0
652,UgxxbnxPHbqbclmctHt4AaABAg,xYltzmQoiL4,Телеканал Дождь,0,1,Krisstina Naumova,почему такое плохое качество...,2020-06-13T16:25:17Z,0
653,UgyesTpNk1u_9_kHf8V4AaABAg,xYltzmQoiL4,Телеканал Дождь,0,3,Марат Хайруллин,"Ребята за бабки рубятся: хотим работать, ехайте к нам типа. Отлично! Сяду в поезд, духота, народу как гря... пардон, подхвачу заразу, и сдохну на берегу моря. Спасибо. Не хочу.",2020-06-13T16:19:55Z,0
654,Ugz4kEVev06QJuvAChB4AaABAg,xYltzmQoiL4,Телеканал Дождь,3,93,Пчеловодство от и до,"Народ сидит без денег по всей стране. И те деньги, которые откладывали на отпуск, скушали во время самоизоляции.",2020-06-13T16:06:03Z,0
655,Ugz4kEVev06QJuvAChB4AaABAg.99qutfSfapJ9A2LUFu8tIm,xYltzmQoiL4,Телеканал Дождь,0,0,Бонифаций,уже лет пять нечего не можем отложить,2020-06-18T11:58:00Z,1
656,Ugz4kEVev06QJuvAChB4AaABAg.99qutfSfapJ99zz3F0SGn3,xYltzmQoiL4,Телеканал Дождь,0,0,Марина Марина,"Пчеловодство от и до Скушали люди, а не чиновники и околочиновничья братия! Они поедут, многие ездят бесплатно, нахаляву, это их стиль жизни! Кормят те , кто зарабатывает с трудом, кто хочет  хоть на две недели, вывезти деток на солнышко и подышать морским воздухом, платят за все, еще сувениры покупают! Вот они не приедут! Берите с тех, кто приедет к вам!",2020-06-17T04:35:37Z,1
657,Ugz4kEVev06QJuvAChB4AaABAg.99qutfSfapJ99tlAbtgfhG,xYltzmQoiL4,Телеканал Дождь,0,1,Маковка Мультиковна,Точняк,2020-06-14T18:38:51Z,1
658,UgyMVhoifXRERidFVD14AaABAg,xYltzmQoiL4,Телеканал Дождь,0,0,Дарья Иванова,"В Сочи билеты стоят из Сибири как отдых с проживаем и питанием в Азии , смешно) нехуй задирать ценник и ещё и иметь сервис на нуле при всём этом! Я путешествовала везде по России, получалось  дороже, чем в цивилизованных местах за пределами страны !",2020-06-13T16:00:38Z,0
659,UgxdUHiSgtq6729zmgJ4AaABAg,xYltzmQoiL4,Телеканал Дождь,0,0,Дарья Иванова,"Снимите лучше про Красноярск и наш край! Самоизоляцию продлили до середины ИЮЛЯ! Всех поувольняли, денег не выплачивают, устроиться нереально, никуда пойти нельзя, просто ахуеть!",2020-06-13T15:57:59Z,0
660,Ugw0BaX4zNqpM8pupaF4AaABAg,xYltzmQoiL4,Телеканал Дождь,0,0,Алька,Природа отдыхает от людей,2020-06-13T15:54:49Z,0
661,UgyNbQcMMHlBwvUlu5t4AaABAg,xYltzmQoiL4,Телеканал Дождь,0,0,Aleksandr P,"360р разрешение, вы что ебанулись?",2020-06-13T15:49:44Z,0
662,UgzpiEFdovVOGceoS6Z4AaABAg,xYltzmQoiL4,Телеканал Дождь,1,0,Андрей Болденко,"Средний класс 17тыс.
В Сочи не отдыхают😂",2020-06-13T15:43:16Z,0
663,UgzpiEFdovVOGceoS6Z4AaABAg.99qsHiN5liF99qsOAAJE-i,xYltzmQoiL4,Телеканал Дождь,0,0,Michael Tyuflin,"17 тыщ не средний, а бедный класс.",2020-06-13T15:44:08Z,1
664,UgwPYmqB5PZ79YjUsjh4AaABAg,xYltzmQoiL4,Телеканал Дождь,0,0,ПЕРЕВАЛ ДЯТЛОВА.ХРОНОЛОГИЯ СОБЫТИЙ,"поклоняйтесь мабуту дальше,голосуйте",2020-06-13T15:42:43Z,0
665,Ugy_kGQ1cVqAVLezVPJ4AaABAg,xYltzmQoiL4,Телеканал Дождь,0,0,Сказочный мир аудиосказки слушать онлайн,"по существу увиденного пришёл к выводу: голосование 1 июля пройдёт, а с 8-го июля вирус полностью исчезнет с территории государства. Курортный сезон начнётся и те, у кого остались деньги, поедет отдыхать и все будут счастливы",2020-06-13T15:42:33Z,0
666,UgwPFfs670-l_i1I2mt4AaABAg,xYltzmQoiL4,Телеканал Дождь,0,0,Светлана Прекрасная,"Не надо туристическому бизнесу Путина поддерживать.
Он не заинтересован в Российском туризме , кремль хорошо на Вьетнаме и Турции зарабатывает.
К власти должен придти человек из бизнеса , не зависимый от кремлёвских старцев.",2020-06-13T15:41:58Z,0
667,Ugw0wXt9LQE1JX9HY_l4AaABAg,xYltzmQoiL4,Телеканал Дождь,0,0,Александр Карпухин,ну дэбилы..,2020-06-13T15:41:15Z,0
668,Ugwgcakfj0TxOdrf9vN4AaABAg,xYltzmQoiL4,Телеканал Дождь,0,0,Зафар Абдурахманов,в 10 году ездили в Сочи! Теперь ни ногой туда .. Цены атомные легче за границу съездить и сервис лучше и дешевле значительно.,2020-06-13T15:31:39Z,0
669,UgwQrG17Bp2IMkSayx54AaABAg,xYltzmQoiL4,Телеканал Дождь,0,1,Археоастрономия,а чего качество такое ужасное Дождь? 360р - кошмар докатились...,2020-06-13T15:28:51Z,0
670,Ugw5gPHlqnSaX30lH1d4AaABAg,xYltzmQoiL4,Телеканал Дождь,0,0,Александр Ремез,"ЛЮДИ ОЧЕНЬ ДОВОЛЬНЫ БЫЛИ,ТЫ БАТЕНЬКА ПИ*ДИШ,ПЕНСИИ НЕ ХВАТАЕТ",2020-06-13T15:28:19Z,0
671,Ugy28x_yJtsI43Gc8hl4AaABAg,xYltzmQoiL4,Телеканал Дождь,0,0,Ясный Пень,Кто не любит людей а любит деньги-тому лапу сосать.Не жалко.Да и мозги в других направлениях приварены.,2020-06-13T15:26:02Z,0
672,Ugw8Sj3b7whg-LFEnc54AaABAg,xYltzmQoiL4,Телеканал Дождь,0,17,Ирина Козлова,"Понастроили на наши деньги домины, пусть сами их обслуживают..",2020-06-13T15:25:01Z,0
673,UgwXHc-GMg_yp2O7qgJ4AaABAg,xYltzmQoiL4,Телеканал Дождь,0,0,earthling,"Смешно когда они рассказывают что у них дешевле чем за ""границей"", пздц на кого такое враньё расчитанно, да сочи это дорогущий курорт! Образно говоря : ""я не настолько богат чтобы ездить на жигулях и я не до такой степени богатый чтобы отдыхать на курортах РФ""!!! Увы",2020-06-13T15:19:20Z,0
674,UgyiU_HkzGkjuIRHoxV4AaABAg,xYltzmQoiL4,Телеканал Дождь,0,0,Роман Грустнов,"да так вам и надо, цены заоблачные, дерёте в втридорога,  сервис колхозный, одно жульё всё крышует рад буду если вы там побольше разоритесь.",2020-06-13T15:18:41Z,0
675,UgxVBOCcZKn6b6UyaT54AaABAg,xYltzmQoiL4,Телеканал Дождь,0,0,gadya pis,"помню 15 лет назад была в сочи,  на вопрос почему фрукты дороже чем в сибири, мне сказали: вот и отдыхайте у себя в сибири.. с тех пор для меня сочи умер) я знаете ли лучше за границей отдохну или у себя в сибири",2020-06-13T15:18:35Z,0
676,UgzFbCaua0tFZh5DcJ94AaABAg,xYltzmQoiL4,Телеканал Дождь,0,5,Николай Петров,"Один раз был в сочи, ни когда больше не поеду на российские курорты",2020-06-13T15:13:05Z,0
677,UgyBIhVHPTONj1mCalp4AaABAg,xYltzmQoiL4,Телеканал Дождь,0,0,Лариса Козыренко,"До голосования третировать людей на пляжах не будут, а потом опять начнётся",2020-06-13T15:10:38Z,0
678,Ugyud8fXCFhlt39yToZ4AaABAg,xYltzmQoiL4,Телеканал Дождь,0,0,Sergio Kostes,Покататься на лыжах с женой один раз обошлось почти в 10 рублей,2020-06-13T15:07:50Z,0
679,UgwHnc8fcwDSWBAoLtl4AaABAg,xYltzmQoiL4,Телеканал Дождь,0,0,Krasview !,сочи это помойка,2020-06-13T15:06:18Z,0
680,Ugx9Iyhyr89FkuFikiR4AaABAg,xYltzmQoiL4,Телеканал Дождь,0,3,Rimma Lauren,"В Россиюшке гражданин гражданину волк столько злобных комментариев , никому никого не жаль Таким народом управлять ни сложно  разделяй и властвуй Как же они могут объединиться ? На какой основе ? Ну разве что обсирать америку с Европой , короче опять злобствовать",2020-06-13T15:04:02Z,0
681,Ugz9sh7FXPS5_rAetMt4AaABAg,xYltzmQoiL4,Телеканал Дождь,0,1,Юлия Аристова,Спасибо! Прекрасный фильм!,2020-06-13T15:00:59Z,0
682,UgynuGP3RhAYtgO2afJ4AaABAg,xYltzmQoiL4,Телеканал Дождь,0,0,Mr Prooper,"Обдираловка не выдерживающая никакой критики. Качество отдыха никакое, а прайсы растут ежегодно. Любой русский конечно рефлективно скажет ""ну инфляция же, вот и растет все"", да только в Америке цены и тарифы по 20-30 лет не меняются, а инфляция там также есть, хоть и поменьше. Нас дурят, а мы хаваем.",2020-06-13T14:58:27Z,0
683,UgzpNzruaAHjgEMPBMx4AaABAg,xYltzmQoiL4,Телеканал Дождь,0,6,Andrey Andreychuk,"Росгвардия самое унылое, что могло произойти в стране.",2020-06-13T14:49:50Z,0
684,UgwW2MsklXyVdxAva5J4AaABAg,xYltzmQoiL4,Телеканал Дождь,0,0,Steven Khaidov,"Женщина, которая рисовала и не поднимала глаза..дура дурой..😂
(Киев❤️)",2020-06-13T14:42:00Z,0
685,Ugyjum15eOmknGp0waV4AaABAg,xYltzmQoiL4,Телеканал Дождь,0,0,ALEX61115,Пососите как большинство россиян . Привыкли бля .,2020-06-13T14:41:44Z,0
686,UgwfQyzljoTp4c3cqyN4AaABAg,xYltzmQoiL4,Телеканал Дождь,0,0,Евгений Лавринович,Завыли Барыги анальго края!,2020-06-13T14:41:42Z,0
687,UgzklH7JDhOLhuwfDG94AaABAg,xYltzmQoiL4,Телеканал Дождь,0,0,ioniy ion,ПУТИН УХОДИ УХОДИ УХОДИ,2020-06-13T14:38:01Z,0
688,Ugy7HVzgZWH5J4PgQEt4AaABAg,xYltzmQoiL4,Телеканал Дождь,0,0,Mego Vega,"Я ПРЕДСТАВЛЯЮ КАК НА ЗТУ S4KY ИЗ КРЕМЛЯ, РОДИТЕЛИ ИЗ АДА СМОТРЯТ И ВАРЯТСЯ В КОТЛЕ С КРИКАМИ УЖАСА ОТ ОСОЗНАНИЯ ТОГО, КАКОЕ ИСЧАДЬЕ АДА ОНИ ПОРОДИЛИ",2020-06-13T14:34:24Z,0
689,UgxyQqSBFTwlTp8KCPh4AaABAg,xYltzmQoiL4,Телеканал Дождь,0,0,IndieGO,"""последний богатырь"" полностью снят в Абхазии, где вы нашли этих ... экскурсоводов",2020-06-13T14:32:02Z,0
690,UgyVANf7_7avDhII30B4AaABAg,xYltzmQoiL4,Телеканал Дождь,0,0,Mego Vega,ПУТИН В.В. ТЫ УЖЕ ТАК 3А364Л!!!!,2020-06-13T14:30:50Z,0
691,Ugwa5pEhdUMyHJ7EPaB4AaABAg,xYltzmQoiL4,Телеканал Дождь,0,0,дмитрий елисеев,Откроют мощно и бесповоротно.,2020-06-13T14:27:08Z,0
692,UgwlbGsUGp2Mj0Zp0RJ4AaABAg,xYltzmQoiL4,Телеканал Дождь,0,0,дмитрий елисеев,Добротный фильм. Все от лица НАРОДА. Без фальшивых кукол на федеральном .,2020-06-13T14:25:19Z,0
693,Ugz9kct3Bg58g_-DHoF4AaABAg,xYltzmQoiL4,Телеканал Дождь,0,0,дмитрий елисеев,Два мира. Две жизни.,2020-06-13T14:23:18Z,0
694,Ugw1eKn6-_q9gbQoqSl4AaABAg,xYltzmQoiL4,Телеканал Дождь,0,0,Игорь G,срежний класс это 17к в месяц,2020-06-13T14:22:17Z,0
695,UgxZdG_UFtZ42okjOql4AaABAg,xYltzmQoiL4,Телеканал Дождь,0,1,Хохи хохи,Сочинском придётся выходить на работу)))),2020-06-13T14:18:00Z,0
696,UgxIU54qWArFrs-bJ1J4AaABAg,xYltzmQoiL4,Телеканал Дождь,0,3,юрий ветров,"Люди!!! Занимаюсь очистными, знаю эту проблему от и до... на Черноморском побережье от Адлера до  Армянска в Крыму нет очистных, соответственно все говно в море.. приятного отдыха",2020-06-13T14:16:07Z,0
697,UgyS0K8s4wzMerWxlnV4AaABAg,xYltzmQoiL4,Телеканал Дождь,1,0,Владимир Семин,"Россия не для Россиян, а для нескольких процентов воров, бандитов, проходимцев, пару лет туда не ездить и будет счастье местным",2020-06-13T14:14:11Z,0
